SF423925355,SLD,12,223 Clipper Street,,SANFRCISCO,9999,"$1,995,000","$2,351,000",DU,1935.0,3.0,2.0,0.0,,0.0,1900.0,0.0646,"2,814",,,"Gorgeous Victorian era home in the sought after row of similar Victorian beauties. Stunningly high ceilings and sumptuous detail. Kitchen and bathrooms recently remodeled. Recent system upgrades for electrical, plumbing, heat Pump/AC. Main floor is arranged as 2 bedrooms, formal living room, dining room and family room. Could be arranged as 3 bedrooms on this level. Lower level bonus/unwarranted rooms are arranged as another bedroom, family room and an additional office. This area has terrific potential for further expansion. Home next door sold for $3.45MM 10/2023. Expansive and gorgeous south facing back yard. Interior access to garage. Incredible location just a short stroll to the heart of Noe Valley and vibrant 24th Street, local restaurants and neighborhood stores. Excellent commuter location for access to the Peninsula & SFO. Tech bus routes close by. Terrific area for bicycle commuters. Enjoy all that this wonderful neighborhood has to offer. Welcome home!",,,,,,,,,,0.00,0,,,124.0,,,,6553-034,0,Contact Listing Agent,Datashare San Francisco,,,,01349379,1802283.0,0.00,,RESIDENTIAL,,2/1/2024,,,,,,,"Offer date 1/17/24 by noon. No early offers per seller request. Please make sure to use latest SFAR contract only. With the offer Include 1) fully approved disclosure package with the offer 2) proof of funds 3) Pre-Approval letter if your client is getting a loan. Terms should include wiring deposit to escrow within 24 hours of a ratified offer and Buyer's AVID to be submitted with 24 hours of a ratified offer. DISCLOSURES READY, PLEASE EMAIL ME A REQUEST. Rooms down are not warranted as permitted living space. This home is begging for an expansion on the lower level and could be even more amazing than the home next door at 221 Clipper I listed/sold in 10/2023. Square footage, # of bedrooms and bathrooms noted are not warranted by agent or the seller. Realist shows 4br/2baths, 1935 sqft. Buyer to verify square footage and any other information they would like to for themselves. UNBRANDED VIDEO AND TOUR LINKS ON MLS.",San Francisco,Sanchez,12,13,13,,,,,,,,,,,,1.0,,,,1/19/2024,,,No,,,,,,2/6/2024,,1/6/2024 4:00 PM,"$1,031",01220538,1/7/2024,,,818204.0,Full Service,Excl Right,Market Listing,,,,0.0,,,,Vacant,1/19/2024,,0,,,,,423925355,,"$1,995,000",,1/19/2024,,,,56,,,,,"$2,351,000",,"$1,214.99",,,,530710136.0,"Gorgeous Victorian era home in the sought after row of similar Victorian beauties. Stunningly high ceilings and sumptuous detail. Kitchen and bathrooms recently remodeled. Recent system upgrades for electrical, plumbing, heat Pump/AC. Main floor is arranged as 2 bedrooms, formal living room, dining room and family room. Could be arranged as 3 bedrooms on this level. Lower level bonus/unwarranted rooms are arranged as another bedroom, family room and an additional office. This area has terrific potential for further expansion. Home next door sold for $3.45MM 10/2023. Expansive and gorgeous south facing back yard. Interior access to garage. Incredible location just a short stroll to the heart of Noe Valley and vibrant 24th Street, local restaurants and neighborhood stores. Excellent commuter location for access to the Peninsula & SFO. Tech bus routes close by. Terrific area for bicycle commuters. Enjoy all that this wonderful neighborhood has to offer. Welcome home!",,9.0,"$1,214",,117.0,117.0,For Sale,,Appointment Only,,"$1,214.99",Assessor Auto-Fill,,CA,2/1/2024,,Noe Valley,,No,,,1.0,https://vimeo.com/900352979,,,2/6/2024,Yes,Yes,Yes,Yes,,,,,94114,
SF424031505,SLD,11,595 29th Street,,SANFRCISCO,9999,"$959,000","$1,250,000",DE,1675.0,3.0,2.0,0.0,,0.0,1904.0,0.0654,"2,850",,,"Incredible investment opportunity to own a semi-attached home with a large lot in a stellar Noe Valley location! The main level opens to a living/dining area, two bedrooms, a kitchen, and two bedrooms all showered with natural light. The lower-level living space has separate access and is currently configured as a one bedroom, one bath flat that overlooks the garden/backyard/patio area. The large basement has high ceilings and provides plenty of space for storage with separate access. This is a unique opportunity that offers many possibilities for future expansion potential and is graced with a large and private backyard presenting a gardener's paradise, or simply the perfect outdoor space for restful retreat. Do not miss this special property that is close to shopping, restaurants, cafes, playgrounds, Noe Valley recreation center, shuttles, public transportation, BART, HWY 101/280 and more!",,,,,,,,,,0.00,0,,,120.0,,,,6630-027,0,Contact Listing Agent,Datashare San Francisco,,,,01473880,1424435.0,0.00,,RESIDENTIAL,,7/1/2024,,,,,,,The disclosure packet is available on homelight/IO and here is the link: https://app.disclosures.io/link/595-29th-Street-252stqwp The tax records state a SFH one family dwelling and the 3R states present authorized occupancy or use as unknown. The buyer is advised to do their own investigation. Please do not disturb the occupants and email the listing agent to schedule showings.---OFFER DATE TUESDAY 5/21/24 BY 3:00PM---,San Francisco,Castro,11,12,12,,,,,,,,,,,,0.0,,,,5/21/2024,,,No,,,,,,7/2/2024,Other,5/9/2024 5:00 PM,$572,1501886,5/10/2024,,,625769.0,Full Service,Excl Right,Market Listing,,,,0.0,,,,Owner,5/21/2024,,0,,,,,424031505,,"$959,000",,5/21/2024,,,,96,,,,,"$1,250,000",,$746.27,Jeff Salgado,415-939-1039,,530775878.0,"Incredible investment opportunity to own a semi-attached home with a large lot in a stellar Noe Valley location! The main level opens to a living/dining area, two bedrooms, a kitchen, and two bedrooms all showered with natural light. The lower-level living space has separate access and is currently configured as a one bedroom, one bath flat that overlooks the garden/backyard/patio area. The large basement has high ceilings and provides plenty of space for storage with separate access. This is a unique opportunity that offers many possibilities for future expansion potential and is graced with a large and private backyard presenting a gardener's paradise, or simply the perfect outdoor space for restful retreat. Do not miss this special property that is close to shopping, restaurants, cafes, playgrounds, Noe Valley recreation center, shuttles, public transportation, BART, HWY 101/280 and more!",,8.0,$746,,130.0,130.0,For Sale,,Appointment Only,,$746.27,Graphic Artist,,CA,7/1/2024,,Noe Valley,,No,,,0.0,,,,7/2/2024,Yes,Yes,Yes,Yes,,,,,94131,
SF424038195,SLD,11,437 Day Street,,SANFRCISCO,9999,"$3,595,000","$3,750,000",DE,2405.0,3.0,2.0,1.0,,0.0,1924.0,0.0654,"2,850",,,"This exceptional home offers every feature a buyer desires: Ideal quiet Noe locale on a tree-lined street (not a steep hill), impeccable layout featuring 3 oversized bedrooms which are all on the same level - yet enjoy the privacy of having no shared walls, scenic outlooks, gorgeous office space on main level, a versatile bonus room which offers options for office, gym, play room or a guest suite (153 sq ft per graphic artist, not included in listed sq ft), abundant natural light throughout (big windows in all rooms + skylights), expansive en-suite primary bedroom with luxe upgraded walk-in closet, elegant hardwood floors throughout, an updated kitchen with gas range, eat-in bar, and flat access to the expansive South facing landscaped yard featuring fruit bearing trees and veggie garden, convenient laundry room on bedroom level, 2-car garage with interior access and luxury built-in storage system, ample additional storage, home security, solar panels system, double paned updated windows, and all copper wiring! Don't miss this spectacular space.",,,,,,,,,,0.00,0,,,100.0,,,,6640-013,0,Contact Listing Agent,Datashare San Francisco,,,,01886864,1738973.0,0.00,,RESIDENTIAL,,7/3/2024,,,,,,,"Offers due 6/12 at 12pm. Please use SFAR contract. Escrow held with Kelly Valadez, Old Republic Title. Showings easily available.",San Francisco,Noe,11,12,12,Please use Google Maps/GPS.,,,,,,,,,,,1.0,,,,6/12/2024,,,No,,,,,,7/5/2024,,5/31/2024 5:00 PM,"$1,494",01886864,6/1/2024,,,1738973.0,Full Service,Excl Right,Market Listing,,,,0.0,,,,Vacant,6/12/2024,,0,,,,,424038195,,"$3,595,000",,6/12/2024,,,,43,,No,,,"$3,750,000",,"$1,559.25",,,,530787990.0,"This exceptional home offers every feature a buyer desires: Ideal quiet Noe locale on a tree-lined street (not a steep hill), impeccable layout featuring 3 oversized bedrooms which are all on the same level - yet enjoy the privacy of having no shared walls, scenic outlooks, gorgeous office space on main level, a versatile bonus room which offers options for office, gym, play room or a guest suite (153 sq ft per graphic artist, not included in listed sq ft), abundant natural light throughout (big windows in all rooms + skylights), expansive en-suite primary bedroom with luxe upgraded walk-in closet, elegant hardwood floors throughout, an updated kitchen with gas range, eat-in bar, and flat access to the expansive South facing landscaped yard featuring fruit bearing trees and veggie garden, convenient laundry room on bedroom level, 2-car garage with interior access and luxury built-in storage system, ample additional storage, home security, solar panels system, double paned updated windows, and all copper wiring! Don't miss this spectacular space.",,,"$1,559",,104.0,104.0,For Sale,,Text Showing Contact,,"$1,559.25",Graphic Artist,,CA,7/3/2024,Two Story,Noe Valley,,No,,,2.0,,,,7/5/2024,Yes,Yes,Yes,Yes,,,,,94931,
SF423757031,SLD,44,20 Gold Mine Drive,,SANFRCISCO,9999,"$3,325,000","$3,200,000",DE,3710.0,5.0,4.0,0.0,,0.0,1988.0,0.070400,"3,065",,,"Grand scale, sparkling City views & the finest quality workmanship anchor this expansive custom home, set in a secluded, leafy cul-de-sac, the heart of the city. Warm classic detailing, generous proportions, a focus on quality & energy efficiency. The intelligent design of this pristine, 3 level home is as comfortable as it is flexible. Sky-lit, open plan living, as conducive to working at home as multigenerational living starts on the main floor: living & dining, custom granite & stainless eat-in kitchen,gleaming hardwood flooring, family room with private office/guest, wet bar, fireplace & deck, with glorious views of the Bay & Downtown. Upstairs are 3 beds & 2 baths, with ensuite, spa-like bath, custom walk-in closets & a massive sunny, south facing deck with views of mountains & water. Below is a custom suite, full KIT, serene bed & bath + access to the dazzling Zen Garden, fabulous office retreat, au pair or guest suite. The exquisite garden with koi pond & mature plantings is a serene backdrop for dynamic city & indoor/outdoor life. A+ city centrality: Glen Canyon, Walter Haas Playground, & Christopher Field & Diamond Heights shops, & Glen Park. Robust storage, laundry, huge",,,,,,,,,,0.00,0,,,35.0,,,,7520-010,0,,Datashare San Francisco,,,,1370731.0,625769.0,0.00,,RESIDENTIAL,,10/6/2023,1370737.0,1915418.0,,,,,"Contact Listing Agents, Wendy (415-519-6091) and/or Melissa (415-328-9808) for more information or showings. Disclosures:https://app.disclosures.io/link/20-Gold-Mine-Drive-gu2wwiqm",San Francisco,Diamond Heights,44,45,45,,,,,,,,,,,,0.0,,,,9/25/2023,,,No,,,,,,10/9/2023,Conventional,7/20/2023 5:00 PM,$896,1355516.0,7/21/2023,,,1407690.0,Full Service,Excl Right,Market Listing,,,,0.0,,,,Vacant,9/25/2023,,0,,,,,423757031,,"$3,325,000",,9/25/2023,,,,99,,,,,"$3,200,000",,$862.53,,,,530650430.0,"Grand scale, sparkling City views & the finest quality workmanship anchor this expansive custom home, set in a secluded, leafy cul-de-sac, the heart of the city. Warm classic detailing, generous proportions, a focus on quality & energy efficiency. The intelligent design of this pristine, 3 level home is as comfortable as it is flexible. Sky-lit, open plan living, as conducive to working at home as multigenerational living starts on the main floor: living & dining, custom granite & stainless eat-in kitchen,gleaming hardwood flooring, family room with private office/guest, wet bar, fireplace & deck, with glorious views of the Bay & Downtown. Upstairs are 3 beds & 2 baths, with ensuite, spa-like bath, custom walk-in closets & a massive sunny, south facing deck with views of mountains & water. Below is a custom suite, full KIT, serene bed & bath + access to the dazzling Zen Garden, fabulous office retreat, au pair or guest suite. The exquisite garden with koi pond & mature plantings is a serene backdrop for dynamic city & indoor/outdoor life. A+ city centrality: Glen Canyon, Walter Haas Playground, & Christopher Field & Diamond Heights shops, & Glen Park. Robust storage, laundry, huge garage. The impressive, thoughtfully designed residence offers the ultimate in enduring flexibilit",,9.0,$862,,96.0,96.0,For Sale,,See Remarks,,$862.53,Graphic Artist,,CA,10/6/2023,,Diamond Heights,,No,,,4.0,https://goldmineglamour.com/,,,10/10/2023,Yes,Yes,Yes,Yes,,,,,94131,
SF422711746,SLD,55,515 29th Street,,SANFRCISCO,9999,"$1,850,000","$1,850,000",CO,1871.0,3.0,2.0,1.0,,0.0,1999.0,0.065400,"2,848",315,M,"This stylish townhouse is a great alternative to a single family home. The dramatic living space has soaring ceilings, a double high wall of windows, a gas fireplace and custom modern lighting. The open plan is ideal for entertaining family and friends. The living, dining and kitchen spaces flow seamlessly from one area to another. Off the living room, the den is a fantastic place to watch a movie or enjoy a good book. A stylish half bath with mosaic tiles completes this level. The loft bedroom overlooking the dramatic living space is ideal for guests or as a home office. Laundry is also found on this level. On the top floor of the home are two additional bedrooms each with newly remodeled ensuite baths. The primary suite has a walk-in closet, gas fireplace and a view terrace. Accessible from both bedrooms, you can take in the view of St Pauls and across Noe Valley from the sheltered terrace. On the entry level is additional storage and direct access to the garage. This coveted location offers easy access to Noe Valley shops, restaurants and parks.",,,,,,,,,,0.00,0,,,24.0,,,,6630-047,0,Contact Listing Agent,Datashare San Francisco,,,,02078818,01417693,0.00,,RESIDENTIAL,,2/14/2023,,,,,,,,San Francisco,Noe,55,56,56,,,,,,,,,,,,2.0,,,,2/2/2023,,,Yes,,,,,,,Conventional,12/8/2022 4:00 PM,$988,1376767,12/9/2022,,,00625769,Full Service,Excl Right,Market Listing,,,,0.0,,,,Owner,2/2/2023,,0,,,,,422711746,,"$1,995,000",,2/2/2023,,,,45,,,,,"$1,850,000",,$988.78,,,,530561395.0,"This stylish townhouse is a great alternative to a single family home. The dramatic living space has soaring ceilings, a double high wall of windows, a gas fireplace and custom modern lighting. The open plan is ideal for entertaining family and friends. The living, dining and kitchen spaces flow seamlessly from one area to another. Off the living room, the den is a fantastic place to watch a movie or enjoy a good book. A stylish half bath with mosaic tiles completes this level. The loft bedroom overlooking the dramatic living space is ideal for guests or as a home office. Laundry is also found on this level. On the top floor of the home are two additional bedrooms each with newly remodeled ensuite baths. The primary suite has a walk-in closet, gas fireplace and a view terrace. Accessible from both bedrooms, you can take in the view of St Pauls and across Noe Valley from the sheltered terrace. On the entry level is additional storage and direct access to the garage. This coveted location offers easy access to Noe Valley shops, restaurants and parks.",,,$988,,100.0,92.0,For Sale,,Appointment Only,,$988.78,Graphic Artist,,CA,2/14/2023,Three or More Stories,Noe Valley,,No,,,1.0,,,2.0,2/24/2023,Yes,Yes,Yes,Yes,,,,,94131,
SF424003138,SLD,46,475 Valley Street,,SANFRCISCO,9999,"$1,159,000","$1,330,000",DU,2315.0,4.0,3.0,0.0,,0.0,1908.0,0.065400,"2,848",,,"Stately four-bedroom, three-bathroom home showcasing stunning southern views and spectacular outdoor space in a stellar Noe Valley location! The versatile floor plan offers three bedrooms and a living area on the top floor with the two back bedrooms overlooking the backyard and southern views. The main level has an additional bedroom, office space, bathroom, kitchen, and an open living/dining area that opens to a sun-drenched deck leading to the backyard/garden. The lower level of the home has an additional room, bathroom, and living space that offers many possibilities for potential expansion and ample storage space. This is a truly unique offering to own a large Noe Valley home that is close to shopping, cafes, restaurants, playgrounds, MUNI, HWY 101/280 and more!",,,,,,,,,,0.00,0,,,116.0,,,,6621-032,0,Contact Listing Agent,Datashare San Francisco,,,,01257759,01834648,0.00,,RESIDENTIAL,,3/22/2024,,,,,,,The disclosure packet is available on homelight/IO and here is the link: https://app.disclosures.io/link/475-Valley-Street-ifd90g0x Please email the listing agent to schedule appointments. The photos are from a previous listing period and the property is not currently staged. The lower level rooms are most likely unwarranted and installed without a permit.---OFFER DATE MONDAY 3/11/24 BY 1:00PM---,San Francisco,Castro/Noe,46,47,47,,,,,,,,,,,,1.0,,,,3/12/2024,,,No,,,,,,3/23/2024,Cash,1/25/2024 4:00 PM,$500,01501886,1/26/2024,,,00625769,Full Service,Excl Right,Market Listing,,,,0.0,,,,Owner,3/12/2024,,0,,,,,424003138,,"$1,459,000",,3/12/2024,,,,90,,No,,,"$1,330,000",,$574.51,Jeff Salgado,415-939-1039,,530724483.0,"Stately four-bedroom, three-bathroom home showcasing stunning southern views and spectacular outdoor space in a stellar Noe Valley location! The versatile floor plan offers three bedrooms and a living area on the top floor with the two back bedrooms overlooking the backyard and southern views. The main level has an additional bedroom, office space, bathroom, kitchen, and an open living/dining area that opens to a sun-drenched deck leading to the backyard/garden. The lower level of the home has an additional room, bathroom, and living space that offers many possibilities for potential expansion and ample storage space. This is a truly unique offering to own a large Noe Valley home that is close to shopping, cafes, restaurants, playgrounds, MUNI, HWY 101/280 and more!",,7.0,$574,,114.0,91.0,For Sale,,Appointment Only,,$574.51,Graphic Artist,,CA,3/22/2024,,Noe Valley,,No,,,0.0,https://my.matterport.com/show/?m=A8RyKjSpx8X,,,3/23/2024,Yes,Yes,Yes,Yes,,,,,94131,
SF424050751,SLD,14,425 Valley Street,,SANFRCISCO,9999,"$2,150,000","$2,510,000",DU,2145.0,3.0,2.0,0.0,,1.0,1930.0,0.0654,"2,850",,,"Discover your dream home in this beautifully updated Craftsman-era residence nestled in a tranquil setting with sprawling views East, West and South. Enjoy cooking in the tastefully remodeled kitchen with quartz countertops, elegant marble floors, a spacious island with wine cooler, extra storage and a sitting area. Natural light pours in through a door that opens to a lightwell with mature greenery. The formal dining room and living room with a cozy wood-burning fireplace are both enhanced by a verdant outlook, each with large windows, perfect for entertaining and relaxing. This level shines with a remodeled bath and two well-appointed bedrooms with breathtaking views. Step out from the west bedroom onto a private deck to soak in the scenery. On the lower level indulge in the expansive primary suite complete with a dressing/sitting room and an additional versatile room, perfect for a home office or personal retreat. The base level features a vast room, ideal as an art studio or gym that opens to an expansive view deck and a cascading enchanted garden, creating a serene escape. This home seamlessly blends classic Craftsman charm with modern luxury, offering unparalleled living experience.",,,,,,,,,,0.00,0,,,94.0,,,,6621-043,0,Contact Listing Agent,Datashare San Francisco,,,,01975281,01407690,0.00,,RESIDENTIAL,,8/21/2024,,,,,,,Reach out to Frances for appointments. Seller welcomes offers Monday 8/5 at 10am.,San Francisco,Noe,14,15,15,,,,,,,,,,,,0.0,,,,8/5/2024,,,No,,,,,,8/21/2024,Other,7/21/2024 5:00 PM,"$1,002",1159414.0,7/22/2024,,,1908304.0,Full Service,Excl Right,Market Listing,,,,0.0,,,,Vacant,8/5/2024,,0.0,,,,,424050751,,"$2,150,000",,8/5/2024,,,,24,,,,,"$2,510,000",,"$1,170.16",,,,530814584.0,"Discover your dream home in this beautifully updated Craftsman-era residence nestled in a tranquil setting with sprawling views East, West and South. Enjoy cooking in the tastefully remodeled kitchen with quartz countertops, elegant marble floors, a spacious island with wine cooler, extra storage and a sitting area. Natural light pours in through a door that opens to a lightwell with mature greenery. The formal dining room and living room with a cozy wood-burning fireplace are both enhanced by a verdant outlook, each with large windows, perfect for entertaining and relaxing. This level shines with a remodeled bath and two well-appointed bedrooms with breathtaking views. Step out from the west bedroom onto a private deck to soak in the scenery. On the lower level indulge in the expansive primary suite complete with a dressing/sitting room and an additional versatile room, perfect for a home office or personal retreat. The base level features a vast room, ideal as an art studio or gym that opens to an expansive view deck and a cascading enchanted garden, creating a serene escape. This home seamlessly blends classic Craftsman charm with modern luxury, offering unparalleled living experience.",,8.0,"$1,170",,116.0,116.0,For Sale,,Call Showing Contact,,"$1,170.16",Assessor Auto-Fill,,CA,8/21/2024,,Noe Valley,,No,,,2.0,https://www.youtube.com/watch?v=m9wU1LY1Qkg,,,8/24/2024,Yes,Yes,Yes,Yes,,,,,94131 2234,
SF424051854,SLD,1,630 27th Street,,SANFRCISCO,9999,"$5,500,000","$5,200,000",DE,3200.0,4.0,3.0,0.0,,0.0,1942.0,0.0733,"3,192",,,"Stunning John Maniscalco home on a double wide lot in prime Noe Valley location with wide terraces, unobstructed downtown views, Bay Bridge and north bay. Recently renovated with new European Oak floors throughout and designer finishes by Berry Designs. Contemporary clean lines in all the rooms emphasize the stunning views. Deep garden with lush terraced landscaping. Close to vibrant 24th street with restaurants, coffee shops and shopping.",,,,,,,,,,0.00,0,,,82.0,,,,6582-037,0,Contact Listing Agent,Datashare San Francisco,,,,01447526,01834648,0.00,,RESIDENTIAL,,8/16/2024,1090426.0,,,,,,www.noe27th.com,San Francisco,Castro,1,2,2,,,,,,,,,,,,0.0,,,,7/26/2024,,,No,,,,,,8/16/2024,,7/24/2024 5:00 PM,"$1,718",1309178.0,7/25/2024,,,625769.0,Full Service,Excl Right,Market Listing,,,,0.0,,,,Vacant,7/26/2024,,0.0,,,,,424051854,,"$5,500,000",,7/26/2024,,,,75,,,,,"$5,200,000",,"$1,625.00",,,,530816595.0,"Stunning John Maniscalco home on a double wide lot in prime Noe Valley location with wide terraces, unobstructed downtown views, Bay Bridge and north bay. Recently renovated with new European Oak floors throughout and designer finishes by Berry Designs. Contemporary clean lines in all the rooms emphasize the stunning views. Deep garden with lush terraced landscaping. Close to vibrant 24th street with restaurants, coffee shops and shopping.",,,"$1,625",,94.0,94.0,For Sale,,Appointment Only,,"$1,625.00",Graphic Artist,,CA,8/16/2024,,Noe Valley,,No,,,2.0,https://www.noe27th.com,,,8/16/2024,Yes,Yes,Yes,Yes,,,,,94131 1857,
