SF423743386,SLD,32,4089 25th Street,,SANFRCISCO,9999,"$1,125,000","$1,200,000",CO,1514.0,3.0,1.0,1.0,,0.0,1904.0,0.0678,"2,954",466,M,"You'd be hard pressed to beat the location of this truly San Franciscan Edwardian top floor TIC unit. Only 2 blocks away from the beating heart of Noe Valley on 24th St. and all of the great shops, restaurants, and the farmers' market at the town square. Inside you will find soaring ceilings throughout and tall windows in the front facing living room. There's a lovely decorative fireplace that may or may not be an old Murphy bed! Next to the living room, there is a charming office room with stairs leading from the office up to the top floor finished attic room (unwarranted) that has been used as a bedroom with lovely neighborhood views. Triple parlor rooms on the east side of the house provide for flexible living options: guest room, family room, bedroom - the choice is yours! They are currently set up as a living room, formal dining room and bedroom. The hall on the west side is where you will find the full and half baths, and leads to the spacious south facing kitchen with an adjacent bright smaller bedroom, and sunny laundry porch. Big windows look out to the shared verdant garden with many bird and butterfly attracting flowers and plants. Easy public transit, tech shuttle, and",,,,,,,,,,0.00,0,,,119.0,,,,6548-028,0,Contact Listing Agent,Datashare San Francisco,,,,01998808,625769.0,0.00,,RESIDENTIAL,,7/6/2023,,,,,,,"Disclosure package available including Pest and Contractor reports - owners will have clearance on all Pest Inspection Section 1 items. Available leased parking is independent in a 2 car garage at a residential home across the street at 4072 25th St. for $300/mo. Easy to show by appointment or open house times. For private showings contact Amanda: call/text 415.601.9111. Attic bedroom has been used by my clients as their bedroom, but is not legally added living space. If you have trouble parking when coming to view the unit you can park in the driveway at 4072 25th St. if it's free.",San Francisco,Noe,32,33,33,If the driveway is free across the street at 4072,,,,,,,,,,,0.0,,,,6/20/2023,,,Yes,,,,,,7/27/2023,Conventional,5/18/2023 5:00 PM,$743,1386284,5/19/2023,,,01834648,Full Service,Excl Right,Market Listing,,,,0.0,,,,Vacant,6/20/2023,,3600,,,,,423743386,,"$1,125,000",TIC,6/20/2023,,,,115,,No,,,"$1,200,000",,$792.60,,,,530621317.0,"You'd be hard pressed to beat the location of this truly San Franciscan Edwardian top floor TIC unit. Only 2 blocks away from the beating heart of Noe Valley on 24th St. and all of the great shops, restaurants, and the farmers' market at the town square. Inside you will find soaring ceilings throughout and tall windows in the front facing living room. There's a lovely decorative fireplace that may or may not be an old Murphy bed! Next to the living room, there is a charming office room with stairs leading from the office up to the top floor finished attic room (unwarranted) that has been used as a bedroom with lovely neighborhood views. Triple parlor rooms on the east side of the house provide for flexible living options: guest room, family room, bedroom - the choice is yours! They are currently set up as a living room, formal dining room and bedroom. The hall on the west side is where you will find the full and half baths, and leads to the spacious south facing kitchen with an adjacent bright smaller bedroom, and sunny laundry porch. Big windows look out to the shared verdant garden with many bird and butterfly attracting flowers and plants. Easy public transit, tech shuttle, and freeway access. Parking is available across the street for $300/mo if desired - buyer to test car.",,7.0,$792,,106.0,106.0,For Sale,,Appointment Only,,$792.60,Graphic Artist,,CA,7/6/2023,,Noe Valley,,No,,,1.0,http://NoeTIC25thSt.com,,2.0,7/27/2023,Yes,No,Yes,Yes,,,,,94114,
SF423744624,SLD,11,430 Day Street,,SANFRCISCO,9999,"$1,859,000","$2,400,000",DE,1905.0,4.0,3.0,0.0,,0.0,1956.0,0.0654,"2,850",,,"Sensational and semi-attached four-bedroom, three-bathroom home situated on an oversized lot, a stellar street and in a spectacular Noe valley location! This exceptional home is embraced by a coveted floor plan highlighting three bedrooms and two bathrooms on one level, coupled with Mid-century flare. The inviting entryway leads to an updated kitchen, open living/dining area with a fireplace, and gorgeous wood floors awash with natural light. The spacious master bedroom is positioned at the back of the home offering privacy and overlooks the backyard/garden/patio. The second bedroom has a similar view, and the third bedroom is adjacent to the second full bathroom. The lower level of the property presents a versatile layout with an additional bedroom, bathroom, and entertainment area with outlooks to the backyard/garden/patio. A large and tranquil yard with mature landscaping and courtyard creates the perfect ambience for entertaining, gardening, or repose. A garage with interior access, two car side-by side parking, and an abundance of storage space adds the final touches to this special home on the market for the first time by the sole owners since 1956. Don't miss this unique hom",,,,,,,,,,0.00,0,,,67.0,,,,6630-011,0,Contact Listing Agent,Datashare San Francisco,,,,01025595,625769.0,0.00,,RESIDENTIAL,,7/5/2023,,,,,,,The disclosure packet is available on homelight/IO and here is the link: https://app.disclosures.io/link/430-Day-Street-zd21rh52 Please email the listing agent to schedule appointments and follow advised health and safety protocols.---OFFER DATE TUESDAY 6/6/23 BY 3:00PM---,San Francisco,Noe,11,12,12,,,,,,,,,,,,1.0,,,,6/6/2023,,,No,,,,,,7/6/2023,Other,5/25/2023 5:00 PM,$975,1501886,5/26/2023,,,00625769,Full Service,Excl Right,Market Listing,,,,0.0,,,,Owner,6/6/2023,,0,,,,,423744624,,"$1,859,000",,6/6/2023,,,,181,,,,,"$2,400,000",,"$1,259.84",Jeff Salgado,415-939-1039,,530624498.0,"Sensational and semi-attached four-bedroom, three-bathroom home situated on an oversized lot, a stellar street and in a spectacular Noe valley location! This exceptional home is embraced by a coveted floor plan highlighting three bedrooms and two bathrooms on one level, coupled with Mid-century flare. The inviting entryway leads to an updated kitchen, open living/dining area with a fireplace, and gorgeous wood floors awash with natural light. The spacious master bedroom is positioned at the back of the home offering privacy and overlooks the backyard/garden/patio. The second bedroom has a similar view, and the third bedroom is adjacent to the second full bathroom. The lower level of the property presents a versatile layout with an additional bedroom, bathroom, and entertainment area with outlooks to the backyard/garden/patio. A large and tranquil yard with mature landscaping and courtyard creates the perfect ambience for entertaining, gardening, or repose. A garage with interior access, two car side-by side parking, and an abundance of storage space adds the final touches to this special home on the market for the first time by the sole owners since 1956. Don't miss this unique home close to parks, Upper Noe Rec Center, cafes, restaurants, shopping, Muni, HWY 101/280 and more!",,7.0,"$1,259",,129.0,129.0,For Sale,,Appointment Only,,"$1,259.84",Graphic Artist,,CA,7/5/2023,,Noe Valley,,No,,,2.0,https://my.matterport.com/show/?m=KtK4YJEUmf5,,,7/6/2023,Yes,Yes,Yes,Yes,,,,,94131,
ML81920285,SLD,9,231 Topaz Way,,SANFRCISCO,9999,"$1,898,000","$1,700,000",DU,2343.0,3.0,2.0,1.0,Y,2.0,1972.0,0.0737,"3,212",,,,,,,,,,,,,,,,,51.0,,,,7532-011,0,,Datashare MLSListings,,,,02139950,,,,RESIDENTIAL,,3/24/2023,,,,,,,"Vacant, go direct and thanks for showing! Supra is on front door and one key opens that door, the garage door and the home's front door. Please be sure all doors, including the bottom floor door to backyard is closed all the way and locked. Freshly painted and recarpeted. Email agent for disclosures and offer details.",San Francisco,Gold Mine Drive,9,9,9,,,,San Francisco Unified,,,,,,231 Topaz WAY,6075.0,1.0,,,,3/10/2023,,San Francisco Unified,No,,,,,,3/24/2023,Cash,3/1/2023 9:20 AM,$810,1461819.0,3/1/2023,jeri@jeridaines.com,,,Full Service,Excl Right,Market Listing,,,,,,,,Vacant,3/10/2023,,,,,,,,,"$1,898,000",,3/10/2023,,,Public,26,,No,,,"$1,700,000",,$725.57,,,,81920285.0,"Views, views & more views - from all levels!!! Perched on the hill in highly desirable Diamond Heights, this home is truly a diamond in the rough. A little imagination will go a long way in taking this home from high potential to spectacularly stunning! The private and secure entry with direct access from the attached two-car (side by side) garage, sweeps you upstairs to the main floor with gorgeous views from the San Francisco Bay to the Pacific Ocean. This floor offers a large eat-in kitchen, dining room, living room, family room and half bath. On the mid-level you'll find three bedrooms, including a primary suite with it's own private bath plus a hall bath for the other two bedrooms to share. The lower floor is finished off with a laundry room and another versitle family room perfect for an office, game room or for entertaining with access to the backyard which is also ripe with opportunity! You won't want to miss seeing this home, the spectacular views and opportunity it offers.",,,$725,,,,For Sale,,,,$725.57,,,CA,3/24/2023,Two Story,,,,,,,,,,3/25/2023,Yes,Yes,Yes,Yes,,,,,94131,RH1
SF424028396,SLD,7,4317 25th Street,,SANFRCISCO,9999,"$1,495,000","$1,750,000",CO,1360.0,3.0,2.0,0.0,,0.0,1966.0,0.069800,"3,040",,,"Nestled in the heart of Noe Valley, this stunning, light-filled, three-bedroom penthouse has been updated throughout. Built in 1966, this midcentury home features a large, open-concept living space that is ideal for entertaining. The oversized living room features a sleek fireplace, large windows and has room for multiple seating areas. The dining room easily fits a large table, has a wall of windows and custom built-ins. The newly imagined chef's kitchen is meticulously organized with stainless appliances, extensive storage and built around an island large enough to sit large groups. The primary bedroom looks south over the expansive yard and has an updated ensuite bathroom. Two additional bedrooms offer space for bedrooms or flexibility to create a dedicated home office or gym. The large, sun-filled, south facing yard has a patio area, dining area and large lawn, all surrounded by mature plants and trees. One car parking, laundry room and expansive storage complete the home. The perfect balance of modern amenities with intuitive layout creates an unparalleled sanctuary for refined living. Walking distance to everything that Noe Valley has to offer, including Whole Foods, Firefly, Slow Sanchez, the Noe Valley Library and Town Square. Walk score of 95.",,,,,,,,,,0.00,0,,,58.0,,,,6545-044,0,Contact Listing Agent,Datashare San Francisco,,,,01209589,00818204,0.00,,RESIDENTIAL,,5/31/2024,1730431.0,,,,,,Please contact Grant Beggs for any showings at (415) 815-9701.,San Francisco,Diamond Street,7,8,8,,,,,,,,,,,,0.0,,,,5/13/2024,,,Yes,,,,,,5/31/2024,Other,5/5/2024 5:00 PM,"$1,099",1976692.0,5/6/2024,,,01407690,Full Service,Excl Right,Market Listing,,,,0.0,,,,Vacant,5/13/2024,,0,,,,,424028396,,"$1,495,000",,5/13/2024,,,,32,,,,,"$1,750,000",,"$1,286.76",,,,530773208.0,"Nestled in the heart of Noe Valley, this stunning, light-filled, three-bedroom penthouse has been updated throughout. Built in 1966, this midcentury home features a large, open-concept living space that is ideal for entertaining. The oversized living room features a sleek fireplace, large windows and has room for multiple seating areas. The dining room easily fits a large table, has a wall of windows and custom built-ins. The newly imagined chef's kitchen is meticulously organized with stainless appliances, extensive storage and built around an island large enough to sit large groups. The primary bedroom looks south over the expansive yard and has an updated ensuite bathroom. Two additional bedrooms offer space for bedrooms or flexibility to create a dedicated home office or gym. The large, sun-filled, south facing yard has a patio area, dining area and large lawn, all surrounded by mature plants and trees. One car parking, laundry room and expansive storage complete the home. The perfect balance of modern amenities with intuitive layout creates an unparalleled sanctuary for refined living. Walking distance to everything that Noe Valley has to offer, including Whole Foods, Firefly, Slow Sanchez, the Noe Valley Library and Town Square. Walk score of 95.",,,"$1,286",,117.0,117.0,For Sale,,Call Showing Contact,,"$1,286.76",Graphic Artist,,CA,5/31/2024,,Noe Valley,,No,,,1.0,,,2.0,6/4/2024,Yes,No,No,Yes,,,,,94114,
SF424028912,SLD,12,4078 25th Street,,SANFRCISCO,9999,"$1,895,000","$2,153,000",DU,0.0,3.0,2.0,0.0,,1.0,1891.0,0.065400,"2,850",,,"Prepare to be smitten by this 1891 Stick Victorian, just 2 blocks from Noe Valley's bustling 24th St. business district! Inside, discover high ceilings and elegant wainscoting. The living room, with a Victorian biofuel retrofitted fireplace and bay windows, leads to the formal dining room with closet, separated by operational pocket doors. Two bedrooms line the right side of the hallway. The kitchen features a walk-in pantry, chef's Viking stove, and plenty of counter space. A striking family room, added with permits as part of a horizontal addition in 2004, offers neighborhood hill and garden views. A full bathroom with walk-in shower completes this level. There are exterior stairs off the family room that lead to a flat and lush, yet amazingly low-maintenance, yard. The ground level has another bedroom/office room with garden outlooks, a full bathroom, laundry closet, ample storage, and garage parking (with an additional spot in the driveway). This home seamlessly blends historical charm with modern updates, including copper piping, no knob and tube, solar panels, and a Tesla Powerwall. Enjoy easy access to shops, transit, tech shuttles, and Sanchez Slow Street'' where you can leisurely make your way among bikers, strollers, rollers, and walkers from 24th St. to 30th St.",,,,,,,,,,0.0,0,,,133.0,,,,6537-022,0,Contact Listing Agent,Datashare San Francisco,,,,01250089,00625769,0.00,,RESIDENTIAL,,5/24/2024,,,,,,,"Offers at 10am Wednesday, May 15th. Please text/call me at 415.601.9111 with any questions. Email amanda@realestatesf.com or text me for Disclosure Package Tax records show the house as 1354 Sq. Ft., floorplan Graphic Artist shows 1798, Appraisal is 1162 and doesn't take into account any of the permitted space on the lower level due to exterior staircase. Owner was told there was no knob and tube when she purchased the property and electrical had been updated prior to her ownership in 1981. Horizontal addition in rear was completed with permits in 2004. There is a security system that is owned but not currently active.",San Francisco,Noe,12,13,13,Ok to park in driveway or neighboring driveway at,,,,,,,,,,,1.0,,,,5/15/2024,,,No,,,,,,5/25/2024,Cash,5/2/2024 5:00 PM,,1386284.0,5/3/2024,,,01834648,Full Service,Excl Right,Market Listing,,,,0.0,,,,Vacant,5/15/2024,,0,,,,,424028912,,"$1,895,000",,5/15/2024,,,,73,,,,,"$2,153,000",,,,,,530772115.0,"Prepare to be smitten by this 1891 Stick Victorian, just 2 blocks from Noe Valley's bustling 24th St. business district! Inside, discover high ceilings and elegant wainscoting. The living room, with a Victorian biofuel retrofitted fireplace and bay windows, leads to the formal dining room with closet, separated by operational pocket doors. Two bedrooms line the right side of the hallway. The kitchen features a walk-in pantry, chef's Viking stove, and plenty of counter space. A striking family room, added with permits as part of a horizontal addition in 2004, offers neighborhood hill and garden views. A full bathroom with walk-in shower completes this level. There are exterior stairs off the family room that lead to a flat and lush, yet amazingly low-maintenance, yard. The ground level has another bedroom/office room with garden outlooks, a full bathroom, laundry closet, ample storage, and garage parking (with an additional spot in the driveway). This home seamlessly blends historical charm with modern updates, including copper piping, no knob and tube, solar panels, and a Tesla Powerwall. Enjoy easy access to shops, transit, tech shuttles, and Sanchez Slow Street'' where you can leisurely make your way among bikers, strollers, rollers, and walkers from 24th St. to 30th St.",,7.0,,,113.0,113.0,For Sale,,Call Showing Contact,,,,,CA,5/24/2024,,Noe Valley,,No,,,2.0,https://my.matterport.com/show/?m=5JqEzzdrYps&mls=1,,,5/25/2024,Yes,No,Yes,Yes,,,,,94114,
SF424024394,SLD,13,580 28th Street,,SANFRCISCO,9999,"$2,195,000","$2,505,000",DU,0.0,3.0,2.0,0.0,,1.0,1951.0,0.065400,"2,848",,,"California living at its best. 580 28th Street is the epitome of sophisticated simplicity. Meticulously renovated in 2022 by Outerlands Design + Build, this three-bedroom, two-bathroom single family home sits atop Noe Valley and has an open concept floorplan with views of the San Francisco skyline. Upstairs includes the main living space, view deck, two bedrooms, and a full bath. The lower level includes a luxurious primary suite with office nook, a private deck, along with laundry and additional storage. Attached one-car garage. The beautifully landscaped, oversized yard has multiple areas for entertaining. An impeccably done home perfect for those who appreciate quality and comfort.",,,,,,,,,,0.0,0,,,73.0,,,,6604-020,0,Contact Listing Agent,Datashare San Francisco,,,,02001924,00818204,0.00,,RESIDENTIAL,,5/22/2024,1412912.0,,,,,,"Offer date: Wednesday, 5/1 at 12 pm. For showings and disclosures, please contact Marsha @ 415.322.8054 or m@marshaabrahams.com. Two car parking (1-car attached garage, 1 driveway space.)",San Francisco,Diamond,13,14,14,Diamond to 28th St,,,,,,,,,,,0.0,,,,5/1/2024,,,No,,,,,,5/23/2024,Conventional,4/17/2024 5:00 PM,,02008130,4/18/2024,,,02206485,Full Service,Excl Right,Market Listing,,,,0.0,,,,Vacant,5/1/2024,,0,,,,,424024394,,"$2,195,000",,5/1/2024,,,,46,,,,,"$2,505,000",,,,,,530763368.0,"California living at its best. 580 28th Street is the epitome of sophisticated simplicity. Meticulously renovated in 2022 by Outerlands Design + Build, this three-bedroom, two-bathroom single family home sits atop Noe Valley and has an open concept floorplan with views of the San Francisco skyline. Upstairs includes the main living space, view deck, two bedrooms, and a full bath. The lower level includes a luxurious primary suite with office nook, a private deck, along with laundry and additional storage. Attached one-car garage. The beautifully landscaped, oversized yard has multiple areas for entertaining. An impeccably done home perfect for those who appreciate quality and comfort.",,,,,114.0,114.0,For Sale,,Call Showing Contact,,,,,CA,5/22/2024,,Noe Valley,,No,,,2.0,https://www.580-28th-street.com,,,7/30/2024,Yes,No,Yes,Yes,,,,,94131,
SF424023668,SLD,9,514 29th Street,,SANFRCISCO,9999,"$2,295,000","$2,350,000",CO,2129.0,3.0,2.0,1.0,,0.0,2002.0,0.066000,"2,876",,,"Enjoy a unique living experience in this Noe Valley contemporary condominium in a 2002 two-unit building. With a house-like layout, the main level hosts a spacious living area while the top floor features three bedrooms and two bathrooms. The open living/dining/kitchen area, with its 10-foot ceiling height and rare-to-find volume, is an entertainer's dream. The Chef's kitchen comes with stainless steel appliances, a stone countertop, and a breakfast bar. Natural light floods the space highlighting the oak hardwood floors. Two gas-burning fireplaces add warmth and ambiance. The primary bedroom features a comfortable sitting area, a walk-in closet, and a spa-like bathroom offering a jet tub and shower. Additional bedrooms provide ample space and tranquility. A light-filled landing offers a perfect spot for a home office. The private rooftop deck showcases stunning views of Noe Valley, Bernal Heights, and the Bay. A spacious side-by-side 1-car garage also provides ample storage. Located in vibrant west Noe Valley, just steps from slow-traffic Sanchez St and amenities such as the Day St Rec Center & Dog's Park, and Church St shops and restaurants, with easy access to highways and public transportation, this condominium epitomizes modern city living.",,,,,,,,,,0.0,0,,,22.0,,,,6621-051,0,Contact Listing Agent,Datashare San Francisco,,,,01703078,02206485,0.00,,RESIDENTIAL,,5/21/2024,,,,,,,,San Francisco,Noe St,9,10,10,,,,,,,,,,,,0.0,,,,4/26/2024,,,Yes,,,,,,5/29/2024,Conventional,4/16/2024 5:00 PM,"$1,077",01518342,4/17/2024,,,01834648,Full Service,Excl Right,Market Listing,,,,0.0,,,,Vacant,4/26/2024,,0,,,,,424023668,,"$2,295,000",,4/26/2024,,,,94,,,,,"$2,350,000",,"$1,103.80",,,,530760331.0,"Enjoy a unique living experience in this Noe Valley contemporary condominium in a 2002 two-unit building. With a house-like layout, the main level hosts a spacious living area while the top floor features three bedrooms and two bathrooms. The open living/dining/kitchen area, with its 10-foot ceiling height and rare-to-find volume, is an entertainer's dream. The Chef's kitchen comes with stainless steel appliances, a stone countertop, and a breakfast bar. Natural light floods the space highlighting the oak hardwood floors. Two gas-burning fireplaces add warmth and ambiance. The primary bedroom features a comfortable sitting area, a walk-in closet, and a spa-like bathroom offering a jet tub and shower. Additional bedrooms provide ample space and tranquility. A light-filled landing offers a perfect spot for a home office. The private rooftop deck showcases stunning views of Noe Valley, Bernal Heights, and the Bay. A spacious side-by-side 1-car garage also provides ample storage. Located in vibrant west Noe Valley, just steps from slow-traffic Sanchez St and amenities such as the Day St Rec Center & Dog's Park, and Church St shops and restaurants, with easy access to highways and public transportation, this condominium epitomizes modern city living.",,,"$1,103",,102.0,102.0,For Sale,,Appointment Only,,"$1,103.80",Appraisal,,CA,5/21/2024,,Noe Valley,,No,,,1.0,https://vimeo.com/934249583?h=a008769d85,,2.0,5/30/2024,Yes,Yes,Yes,Yes,,,,,94131,
SF423908427,SLD,37,4326 Cesar Chavez Street,,SANFRCISCO,9999,"$5,750,000","$5,500,000",DE,4180.0,5.0,4.0,2.0,,0.0,2014.0,0.0654,"2,850",,,"Everything you have been dreaming of in one location: VIEWS, deep flat yard, floor-to-ceiling windows, skylights, state-of-the-art mechanics, luxury space, solar, AC, designer finishes, privacy. Come see the stunning upgrades to this modern 5 bedroom home in Noe Valley. Enjoy dazzling panoramic views to Downtown SF with the glittering Salesforce Tower, the Bay and over to Twin Peaks. Entertain on the view walk-out deck off the living room with built-in grill or head to the easy-maintenance yard off the media room for a dip in the soaking tub. Firepit and heated yard furniture will keep you wanting more outdoor time. Gather around the deep kitchen island and sip on chilled sparkling water on direct tap. There are three en suite bedrooms with the primary suite commanding the entire top level, replete with a private deck, walk-in closets designed for luxurious display and a customized bathroom with Waterworks hardware, Toto washlet, radiant heat flooring. The 5th bedroom on the lower level has been converted into a state-of-the gym with Mr Steam Sauna. Sonos speakers throughout, Lutron lighting, fiber, two laundry areas, one-car garage with Tesla charger. A short distance to the best",,,,,,,,,,0.00,0,,,9.0,,,,6561-010,0,Contact Listing Agent,Datashare San Francisco,,,Dumican Mosey,01266874,00625769,0.00,,RESIDENTIAL,,11/6/2023,,,,,,,"Major upgrades since last purchase. Call/Text Marie Carr at 415-531-0324. Escrow with Ashley Chuang at Fidelity. Tax Records show 3,987sqft - Buyer to verify. Matterport tour: https://my.matterport.com/show/?m=L7euJmkVav2&mls=1 Property Website: www.4326CesarChavez.com",San Francisco,Diamond,37,38,38,,,,,,,,,,,,1.0,,,,10/27/2023,,,No,,,,,,11/7/2023,Conventional,9/19/2023 5:00 PM,"$1,375",1739426.0,9/20/2023,,,1407690.0,Full Service,Excl Right,Market Listing,,,,0.0,,,,Owner,10/27/2023,,0,,,,,423908427,,"$5,750,000",,10/27/2023,,,,52,,,,,"$5,500,000",,"$1,315.79",,,,530674397.0,"Everything you have been dreaming of in one location: VIEWS, deep flat yard, floor-to-ceiling windows, skylights, state-of-the-art mechanics, luxury space, solar, AC, designer finishes, privacy. Come see the stunning upgrades to this modern 5 bedroom home in Noe Valley. Enjoy dazzling panoramic views to Downtown SF with the glittering Salesforce Tower, the Bay and over to Twin Peaks. Entertain on the view walk-out deck off the living room with built-in grill or head to the easy-maintenance yard off the media room for a dip in the soaking tub. Firepit and heated yard furniture will keep you wanting more outdoor time. Gather around the deep kitchen island and sip on chilled sparkling water on direct tap. There are three en suite bedrooms with the primary suite commanding the entire top level, replete with a private deck, walk-in closets designed for luxurious display and a customized bathroom with Waterworks hardware, Toto washlet, radiant heat flooring. The 5th bedroom on the lower level has been converted into a state-of-the gym with Mr Steam Sauna. Sonos speakers throughout, Lutron lighting, fiber, two laundry areas, one-car garage with Tesla charger. A short distance to the best of 24th Street. One block to lush Douglass Park. Constructed 2014 by famed Dumican Mosey.",,10.0,"$1,315",,95.0,95.0,For Sale,,Appointment Only,,"$1,315.79",Not Verified,,CA,11/6/2023,,Noe Valley,,No,,,1.0,,,,11/7/2023,Yes,Yes,No,Yes,,,,,94131,
