SF423912642,SLD,33,646 40th Avenue,,SANFRCISCO,9999,"$1,395,000","$1,322,202",CO,1535.0,3.0,2.0,0.0,,0.0,1903.0,0.0689,"3,000",150,M,"Remodeled top floor 3 bed, 2 bath, Ocean, Twin Peaks, and Sutro Tower view condo. Views from both sides. Tons of natural light. Private deck. Shared yard. Parking. Engineered Hardwood floors. Fireplace (Decorative). Remodeled kitchen with Stainless appliances. Breakfast nook. En-suite primary bedroom/bathroom with access to deck. Side by side parking for one car, and additional storage. Walk to Balboa Village shops and restaurants, Ocean Beach, Lands End, Golden Gate Park, and enjoy living in one of the Coolest neighborhoods in the world.",,,,,,,,,,0.00,0,,,121.0,,,,1582-034A,0,Contact Listing Agent,Datashare San Francisco,,,,01350213,00625769,0.00,,RESIDENTIAL,,1/5/2024,,,,,,,"Contact Alex for Open House Schedule. Easy to show, just text me and we'll get you in. Alex: 415-254-5351. Disclosure package available. Offer date, tbd.",San Francisco,Balboa,33,34,34,,,,,,,,,,,,0.0,,,,12/12/2023,,,Yes,,,,,,,,11/8/2023 4:00 PM,$908,01339386,11/9/2023,,,01834648,Full Service,Excl Right,Market Listing,,,,0.0,,,,Owner,12/12/2023,,0,,,,,423912642,,"$1,395,000",,12/12/2023,,,,41,,,,,"$1,322,202",,$861.37,,,,530690826.0,"Remodeled top floor 3 bed, 2 bath, Ocean, Twin Peaks, and Sutro Tower view condo. Views from both sides. Tons of natural light. Private deck. Shared yard. Parking. Engineered Hardwood floors. Fireplace (Decorative). Remodeled kitchen with Stainless appliances. Breakfast nook. En-suite primary bedroom/bathroom with access to deck. Side by side parking for one car, and additional storage. Walk to Balboa Village shops and restaurants, Ocean Beach, Lands End, Golden Gate Park, and enjoy living in one of the Coolest neighborhoods in the world.",,,$861,,94.0,94.0,For Sale,,24 Hour Notice,,$861.37,Owner,,CA,1/5/2024,,Outer Richmond,,No,,,1.0,https://thefrontsteps.com/646-40thAve,,2.0,1/25/2024,Yes,Yes,Yes,Yes,,,,,94121,
SF423913540,SLD,38,3927 Clement Street,,SANFRCISCO,9999,"$1,750,000","$1,715,000",DE,2020.0,2.0,2.0,0.0,,0.0,1926.0,0.0615,"2,678",,,"This charming Edwardian/Craftsman home, located in a coveted location, offers a unique blend of character and modern amenities. Situated in a private and sought-after area, the home enjoys ocean views and a tranquil ambiance. It's adjacent to a green belt that's part of Lincoln Park and in proximity to the Legion of Honor Museum, adding cultural richness to the surroundings.The home features two bedrooms and a bathroom on the upper level.The primary bedroom includes a walk-in closet and stunning views extending from Ocean Beach to Ft. Funston, ensuring a peaceful retreat.The formal dining room, kitchen, breakfast nook, and spacious living room provide ample room for daily activities.Downstairs, there's a family room/guest area with a bathroom.It offers access to a home office and a deck with a full-size hot tub, allowing you to unwind while stargazing at night. The yard has a cleverly designed children's climbing gym.It is perfect for outdoor entertaining.The laundry facilities are conveniently located in the large garage.The roof has been replaced and equipped with solar panels, enhancing energy efficiency.The home is within walking distance of the Trailhead to Lands End, Sutro Baths, and the soon-to-reopen Cliff House. It also offers easy access to grocery stores, shops, cafes",,,,,,,,,,0.00,0,,,98.0,,,,1472-022,0,Contact Listing Agent,Datashare San Francisco,,,,02028807,625769.0,0.00,,RESIDENTIAL,,1/2/2024,,,,,,,"Private Remarks: Tax records show 1130 sqft. 2020 sqft per graphic artist. Please use latest SFAR contract and include proof of funds, signed disclosures, and approval letter from lender if financing. Home will be delivered vacant. Disclosures available @ https://app.disclosures.io/link/3927-Clement-Street-vet1fbep Private Remarks: Please text Ann for fastest response at (415)987-2122 or email at ann.dykstra@redfin.com to schedule a showing.",San Francisco,40th,38,39,39,,,,,,,,,,,,1.0,,,,12/6/2023,,,No,,,,,,,Conventional,10/28/2023 5:00 PM,$866,01015279,10/29/2023,,,1723159.0,Full Service,Excl Right,Market Listing,On front window grat,,,0.0,,,,Vacant,12/6/2023,,0,,,,,423913540,,"$1,750,000",,12/6/2023,,,,78,,,,,"$1,715,000",,$849.01,Ann Dykstra,415-987-2122,,530685671.0,"This charming Edwardian/Craftsman home, located in a coveted location, offers a unique blend of character and modern amenities. Situated in a private and sought-after area, the home enjoys ocean views and a tranquil ambiance. It's adjacent to a green belt that's part of Lincoln Park and in proximity to the Legion of Honor Museum, adding cultural richness to the surroundings.The home features two bedrooms and a bathroom on the upper level.The primary bedroom includes a walk-in closet and stunning views extending from Ocean Beach to Ft. Funston, ensuring a peaceful retreat.The formal dining room, kitchen, breakfast nook, and spacious living room provide ample room for daily activities.Downstairs, there's a family room/guest area with a bathroom.It offers access to a home office and a deck with a full-size hot tub, allowing you to unwind while stargazing at night. The yard has a cleverly designed children's climbing gym.It is perfect for outdoor entertaining.The laundry facilities are conveniently located in the large garage.The roof has been replaced and equipped with solar panels, enhancing energy efficiency.The home is within walking distance of the Trailhead to Lands End, Sutro Baths, and the soon-to-reopen Cliff House. It also offers easy access to grocery stores, shops, cafes",,5.0,$849,,98.0,98.0,For Sale,,Appointment Only,,$849.01,Not Verified,,CA,1/2/2024,Two Story,Outer Richmond,,No,,,1.0,https://youtu.be/QLFNtum2OHg,,,1/25/2024,Yes,Yes,No,Yes,,,,,94121,
SF424035984,SLD,35,436 42nd Avenue,,SANFRCISCO,9999,"$1,885,000","$1,885,000",DU,2050.0,3.0,2.0,1.0,,0.0,1946.0,0.0689,"3,000",,,"New Price! This spectacular Edwardian home has been in the same family for 48 years and is perched above most of the neighborhood to offer wonderful views of Golden Gate Park and the Pacific Ocean. The main level consists of a lovely entry foyer; a bright living room with fireplace and tall ceilings; a spacious formal dining room; an adjacent breakfast room overlooking the garden; an updated powder room; and a large kitchen with new appliances, ample cabinets and counters, and new flooring. On the upper level, the large, sunny master bedroom includes a dressing room with closets and wonderful views to the southwest overlooking the park and ocean. There are two additional large bedrooms on this level, one facing the rear garden with views to USF, and the other with south-facing windows looking over the park and ocean. A bright sunroom off of the bedrooms with exceptional views would make a great office. An updated full bath with tub and stall shower completes this level. The garage level has a storage or hobby room, laundry, a full bath, and one car parking. The sunny and large rear yard offers mature trees and a large concrete patio. Balboa Street shops and restaurants, & Golden Gate Park both within walking distance.",,,,,,,,,,0.00,0,,,78.0,,,,1473-005A,0,Show,Datashare San Francisco,,,,01485512,2206485.0,0.00,,RESIDENTIAL,,7/11/2024,,,,,,,"Email Anthony to request disclosures. Lockbox located on gas meter, show anytime. Anthony's Mobile: 415-939-7854. Half-bath, full bath at garage level, and garage bonus room may have been added without permits. Trust sale, no court confirmation.",San Francisco,Clement Street,35,36,36,,,,,,,,,,,,1.0,,,,6/28/2024,,,No,,,,,,7/11/2024,,5/23/2024 5:00 PM,$919,01326401,5/24/2024,,,1908304.0,Full Service,Excl Right,Market Listing,,,,0.0,,,,Vacant,6/28/2024,,0,,,,,424035984,,"$1,946,000",,6/28/2024,,,,68,,,,,"$1,885,000",,$919.51,,,,530783727.0,"New Price! This spectacular Edwardian home has been in the same family for 48 years and is perched above most of the neighborhood to offer wonderful views of Golden Gate Park and the Pacific Ocean. The main level consists of a lovely entry foyer; a bright living room with fireplace and tall ceilings; a spacious formal dining room; an adjacent breakfast room overlooking the garden; an updated powder room; and a large kitchen with new appliances, ample cabinets and counters, and new flooring. On the upper level, the large, sunny master bedroom includes a dressing room with closets and wonderful views to the southwest overlooking the park and ocean. There are two additional large bedrooms on this level, one facing the rear garden with views to USF, and the other with south-facing windows looking over the park and ocean. A bright sunroom off of the bedrooms with exceptional views would make a great office. An updated full bath with tub and stall shower completes this level. The garage level has a storage or hobby room, laundry, a full bath, and one car parking. The sunny and large rear yard offers mature trees and a large concrete patio. Balboa Street shops and restaurants, & Golden Gate Park both within walking distance.",,8.0,$919,,100.0,96.0,For Sale,,Go Directly,,$919.51,Assessor Auto-Fill,Successor Trustee Sale,CA,7/11/2024,,Outer Richmond,,Yes,,,1.0,https://my.matterport.com/show/?m=kTHJbqtgV35,,,7/11/2024,Yes,No,No,Yes,,,,,94121,
SF423747684,SLD,34,734 39th Avenue,,SANFRCISCO,9999,"$1,998,000","$2,175,000",DE,1828.0,4.0,2.0,0.0,,0.0,1924.0,0.0688,"2,996",,,"Warm and inviting Marina-style single family home recently remodeled with special touches and emphasis on comfort and detail. Interior floor plan features four spacious bedrooms and Sunroom, two elegantly remodeled baths. Primary suite enjoys spacious built-out walk-in closet, ocean views. Addl top level BR features expansive views of Sutro Tower, Twin Peaks. On main living level, two bedrooms outfitted w/ closet systems enjoy access to additional sunroom that opens to a deck leading to extra large backyard. All bedrooms enjoy ceiling fans for optimal air flow. Eat-in Kitchen w/ counter seating, open to Living Room, boasts stainless KitchenAid appliance suite, pasta filler above range, wine refrigerator, elegant tile backsplash, counters & flooring, capped by chic pendant lighting. Wood flooring throughout is illuminated by custom light fixtures, recessed lighting. Formal Dining Room creates seamless opportunities to entertain. Beautiful wood-burning fireplace bolsters classic built-in details of Living Room. Lwr level: large garage w/ ample storage, laundry area w/ sink, at least 2-car tandem parking, separate entrance from driveway, workshop area, and access to an atrium room, to",,,,,,,,,,0.00,0,,,99.0,,,,1606-038,0,Contact Listing Agent,Datashare San Francisco,,,,1414095.0,1414095.0,0.0,,RESIDENTIAL,,7/24/2023,,,,,,,"Second adjacent lot has separate APN # and tax bill: 1606 007. Pre-escrow opened with Kallie Castro, First American Title: kcastro@firstam.com.",San Francisco,Balboa,34,35,35,"Balboa west to 39th St, turn right. On east side o",,,,,,,,,,,0.0,,,,7/17/2023,,,No,,,,,,7/26/2023,Conventional,6/12/2023 5:00 PM,"$1,092",1719487.0,6/13/2023,,,625769.0,Full Service,Excl Right,Market Listing,,,,0.0,,,,Vacant,7/17/2023,,0,,,,,423747684,,"$1,998,000",,7/17/2023,,,,137,,,,,"$2,175,000",,"$1,189.82",Victoria Stewart Davis,415-336-2468,,530632523.0,"Warm and inviting Marina-style single family home recently remodeled with special touches and emphasis on comfort and detail. Interior floor plan features four spacious bedrooms and Sunroom, two elegantly remodeled baths. Primary suite enjoys spacious built-out walk-in closet, ocean views. Addl top level BR features expansive views of Sutro Tower, Twin Peaks. On main living level, two bedrooms outfitted w/ closet systems enjoy access to additional sunroom that opens to a deck leading to extra large backyard. All bedrooms enjoy ceiling fans for optimal air flow. Eat-in Kitchen w/ counter seating, open to Living Room, boasts stainless KitchenAid appliance suite, pasta filler above range, wine refrigerator, elegant tile backsplash, counters & flooring, capped by chic pendant lighting. Wood flooring throughout is illuminated by custom light fixtures, recessed lighting. Formal Dining Room creates seamless opportunities to entertain. Beautiful wood-burning fireplace bolsters classic built-in details of Living Room. Lwr level: large garage w/ ample storage, laundry area w/ sink, at least 2-car tandem parking, separate entrance from driveway, workshop area, and access to an atrium room, to a double-lot backyard - accounting for approx 4,054sf of lot size (w/play structure)! MOVE-IN READY",,8.0,"$1,189",,108.0,108.0,For Sale,,Appointment Only,,"$1,189.82",Graphic Artist,,CA,7/24/2023,Three or More Stories,Outer Richmond,,No,,,2.0,,,,7/26/2023,Yes,Yes,Yes,Yes,,,,,94121,
SF424014584,SLD,10,849 39th Avenue,,SANFRCISCO,9999,"$1,495,000","$1,800,000",DE,0.0,4.0,1.0,1.0,,2.0,1922.0,0.068900,"3,000",,,"Experience the allure of this beautifully renovated single-family home in San Francisco's vibrant Richmond neighborhood. The inviting interior features a spacious living room w/wood-burning fireplace, recessed lighting & hardwood floors, creating a cozy & modern ambiance. The dining room boasts built-ins, designer chandelier, hardwood floors, perfect for hosting holiday gatherings & family meals. The remodeled sun-filled kitchen w/designer finishes, is a chef's dream! Stainless appliances, quartz counters, microwave, disposal, dishwasher, & a large 3-door refrigerator, an exquisite setting for masterful culinary delights! Adjacent to the kitchen is a convenient home office; providing a sunny space to work-from-home, or home-work. The full bath on the main level is beautifully remodeled adding a touch of luxury to everyday living. This home offers 4 bedrooms, 1.5 baths, & ample garage parking, including a 220V outlet for Fast EV Charging! The spacious private fenced yard, w/patio, grass, mature trees & flowers, ideal for outdoor entertaining, kids playing & family gatherings. This home is situated half a block from Golden Gate Park, across from a playground -basketball & tennis courts! 1.5 blocks; cafs, restaurants, shops, boutiques along the Balboa corridor!",,,,,,,,,,0.00,0,,,102.0,,,,1682-005,0,Contact Listing Agent,Datashare San Francisco,,,,01250523,01250523,0.00,,RESIDENTIAL,,3/28/2024,,,,,,,"Easy to show Call/Text Reid 415.571.6606 Escrow opened with Elisabeth Davis, Fidelity National Title. Tax records show seven rooms: three rooms, plus living room, dining room and kitchen up, plus one room down. Buyers to investigate to their own satisfaction the permit history, usability and square footage of property.",San Francisco,Cabrillo/Fulton,10,11,11,,,,,,,,,,,,0.0,,,,3/18/2024,,,No,,,,,,3/28/2024,,3/7/2024 4:00 PM,,01374892,3/8/2024,,,00625769,Full Service,Excl Right,Market Listing,,,,0.0,,,,Vacant,3/18/2024,,0,,,,,424014584,,"$1,495,000",,3/18/2024,,,,80,,,,,"$1,800,000",,,,,,530742466.0,"Experience the allure of this beautifully renovated single-family home in San Francisco's vibrant Richmond neighborhood. The inviting interior features a spacious living room w/wood-burning fireplace, recessed lighting & hardwood floors, creating a cozy & modern ambiance. The dining room boasts built-ins, designer chandelier, hardwood floors, perfect for hosting holiday gatherings & family meals. The remodeled sun-filled kitchen w/designer finishes, is a chef's dream! Stainless appliances, quartz counters, microwave, disposal, dishwasher, & a large 3-door refrigerator, an exquisite setting for masterful culinary delights! Adjacent to the kitchen is a convenient home office; providing a sunny space to work-from-home, or home-work. The full bath on the main level is beautifully remodeled adding a touch of luxury to everyday living. This home offers 4 bedrooms, 1.5 baths, & ample garage parking, including a 220V outlet for Fast EV Charging! The spacious private fenced yard, w/patio, grass, mature trees & flowers, ideal for outdoor entertaining, kids playing & family gatherings. This home is situated half a block from Golden Gate Park, across from a playground -basketball & tennis courts! 1.5 blocks; cafs, restaurants, shops, boutiques along the Balboa corridor!",,7.0,,,120.0,120.0,For Sale,,Appointment Only,,,,,CA,3/28/2024,Two Story,Outer Richmond,,No,,,3.0,https://my.matterport.com/show/?m=VcKsfpJX7XY&mls=1,,,3/29/2024,Yes,Yes,Yes,Yes,,,,,94121,
SF424016024,SLD,6,731 34th Avenue,,SANFRCISCO,9999,"$1,498,000","$1,700,000",DU,2020.0,4.0,1.0,1.0,,0.0,1916.0,0.068900,"3,000",,,"Indulge in Edwardian style living at its finest in this meticulously maintained three-story residence. It includes a room on the second level and three on the top floor, versatility meets comfort. Enter into an inviting open floor plan boasting hardwood floors, a cozy fireplace, and ample natural light, perfect for entertaining. Step outside to a charming deck overlooking the spacious backyard. Ideally located between Richmond's top corridors and outdoor attractions, including Golden Gate Park and popular beaches, this home offers unparalleled convenience. Enjoy nearby recreational amenities like playgrounds and courts, and explore the vibrant Balboa corridor with its cafes, restaurants and boutiques. Don't miss out on this exceptional opportunity!",,,,,,,,,,0.00,0,,,108.0,,,,1610-005,0,Show,Datashare San Francisco,,,,02022230,01022642,0.00,,RESIDENTIAL,,3/27/2024,,,,,,,The bedroom and bathroom count might not match public records. Buyer to verif. Please submit offer thru Homelight w/ pre-approval & POFS. Disclosure io: https://app.disclosures.io/link/731-34th-Avenue-jr6jp0or buyers paid for full commission 5% and also SF city and county transfer tax which equal to sale price around $1.800.000,San Francisco,Balboa St,6,7,7,,,,,,,,,,,,0.0,,,,3/21/2024,,,No,,,,,,3/28/2024,Cash,3/14/2024 5:00 PM,$741,02022230,3/15/2024,,,01022642,Full Service,Excl Right,Market Listing,,,,0.0,,,,Vacant,3/21/2024,,0,,,,,424016024,,"$1,498,000",,3/21/2024,,,,34,,,,,"$1,700,000",,$841.58,,,,530745512.0,"Indulge in Edwardian style living at its finest in this meticulously maintained three-story residence. It includes a room on the second level and three on the top floor, versatility meets comfort. Enter into an inviting open floor plan boasting hardwood floors, a cozy fireplace, and ample natural light, perfect for entertaining. Step outside to a charming deck overlooking the spacious backyard. Ideally located between Richmond's top corridors and outdoor attractions, including Golden Gate Park and popular beaches, this home offers unparalleled convenience. Enjoy nearby recreational amenities like playgrounds and courts, and explore the vibrant Balboa corridor with its cafes, restaurants and boutiques. Don't miss out on this exceptional opportunity!",,7.0,$841,,113.0,113.0,For Sale,,Go Directly,,$841.58,Assessor Auto-Fill,,CA,3/27/2024,,Outer Richmond,,No,,,0.0,http://73134thave.com,,,4/1/2024,Yes,Yes,Yes,Yes,,,,,94121,
SF424031005,SLD,31,679 34th Avenue,,SANFRCISCO,9999,"$2,699,000","$2,500,000",DE,2795.0,4.0,3.0,0.0,,1.0,1924.0,0.0688,"2,996",,,"Down-to-the-studs remodeled single-family home located in the Outer Richmond district seamlessly blends contemporary style with classic charm. This beautiful two-level residence boasts 4 bedrooms, 3 full bathrooms and a separate office/study with 2795 sq.' of generous living space. The property features a 1-car garage with 2 off street parking spots. The upper level hosts 3 bedrooms (1 is a primary en-suite) with 2 full baths, kitchen and living room/dining room. Enjoy the cozy ambiance of the fireplace with natural light flooding the home through motorized skylights.The kitchen features high-end Thermador appliances, quartz countertops, and a spacious island.The expansive entry level offers versatile living spaces, including one of two primary suites which can be utilized as a bedroom or a game/family/media room with direct access through Anderson French doors to the private outdoor patio and newly laid synthetic grass. A separate laundry room, an office and interior access from the garage round out this fully functional level. The house is EV car ready with a 240v plug, plumbed for solar, Schluter Ditra radiant heated floors in 2 baths & Container Store Elfa Decor custom closets. Close to GGP, Lincoln Park, Balboa Theatre & More",,,,,,,,,,0.00,0,,,100.0,,,,1577-012,0,Contact Listing Agent,Datashare San Francisco,,,,01477796,01407690,0.00,,RESIDENTIAL,,8/28/2024,,,,,,,"Pre-escrow opened with Michael Gatti @ ORTC. Buyer to verify square footage. Seller reserves the right to accept, reject or counter any offer.Please contact Denise 415.328.5226 for further details.",San Francisco,Balboa,31,32,32,Cross Streets are Anza and Balboa.,,,,,,,,,,,1.0,,,,8/13/2024,,,No,,,,,,8/28/2024,Cash,7/12/2024 5:00 PM,$965,2038659.0,7/13/2024,,,2014153.0,Full Service,Excl Right,Market Listing,Attached to gas mete,,,0.0,,,,Vacant,8/13/2024,,0.0,,,,,424031005,,"$2,699,000",,8/13/2024,,,,59,,No,,,"$2,500,000",,$894.45,Denise Goertz,415-328-5226,,530794912.0,"Down-to-the-studs remodeled single-family home located in the Outer Richmond district seamlessly blends contemporary style with classic charm. This beautiful two-level residence boasts 4 bedrooms, 3 full bathrooms and a separate office/study with 2795 sq.' of generous living space. The property features a 1-car garage with 2 off street parking spots. The upper level hosts 3 bedrooms (1 is a primary en-suite) with 2 full baths, kitchen and living room/dining room. Enjoy the cozy ambiance of the fireplace with natural light flooding the home through motorized skylights.The kitchen features high-end Thermador appliances, quartz countertops, and a spacious island.The expansive entry level offers versatile living spaces, including one of two primary suites which can be utilized as a bedroom or a game/family/media room with direct access through Anderson French doors to the private outdoor patio and newly laid synthetic grass. A separate laundry room, an office and interior access from the garage round out this fully functional level. The house is EV car ready with a 240v plug, plumbed for solar, Schluter Ditra radiant heated floors in 2 baths & Container Store Elfa Decor custom closets. Close to GGP, Lincoln Park, Balboa Theatre & More",,,$894,,92.0,92.0,For Sale,,Call Showing Contact,,$894.45,Builder,,CA,8/28/2024,Two Story,Outer Richmond,,No,,,3.0,,,,8/28/2024,Yes,No,No,Yes,,,,,94121,
SF422707987,SLD,49,834 40th Avenue,,SANFRCISCO,9999,"$1,600,000","$1,338,000",DU,1325.0,2.0,1.0,0.0,,0.0,1925.0,0.068800,"2,996",,,"Lovely 2 Bedroom 1 Bath Home, Full Basement, Flat Yard",,,,,,,,,,0.00,0,,,98.0,,,,1682-022,0,Show,Datashare San Francisco,,,,02145042,01200662,0.0,,RESIDENTIAL,,1/27/2023,,1992531.0,,,,,,San Francisco,Balboa,49,50,50,,,,,,,,,,,,0.0,,,,12/30/2022,,,No,,,,,,,Conventional,11/10/2022 4:00 PM,"$1,207",555201.0,11/11/2022,,,355256.0,Full Service,Excl Right,Market Listing,,,,0.0,,,,Vacant,12/30/2022,,0,,,,,422707987,,"$1,600,000",,12/30/2022,,,,92,,,,,"$1,338,000",,"$1,009.81",,,,530553655.0,"Lovely 2 Bedroom 1 Bath Home, Full Basement, Flat Yard",,5.0,"$1,009",,83.0,83.0,For Sale,,Go Directly,,"$1,009.81",Assessor Auto-Fill,Successor Trustee Sale,CA,1/27/2023,,Outer Richmond,,Yes,,,2.0,,,,3/10/2023,Yes,Yes,Yes,Yes,,,,,94121,
