ME224003466,SLD,7,4124 F Street,,SACRAMENTO,9999,"$550,000","$577,000",DE,993.0,3.0,2.0,0.0,,0.0,1962.0,0.116100,"5,057",,,"Welcome to this delightful 3-bedroom, 1-bathroom home with a converted garage featuring a second bathroom, nestled in the heart of East Sacramento. This charming residence is located in one of the most desirable neighborhoods, known for its tree-lined streets, friendly community, and close proximity to all that East Sacramento has to offer. The home features a brand-new HVAC system and energy-efficient solar panels. The flooring includes recently refinished hardwood floors and new carpet in the bedrooms. The interior has been freshly painted, providing a modern and inviting atmosphere. The open-concept kitchen and living room create a warm and welcoming space filled with beautiful natural light, perfect for entertaining and family gatherings. Located in a neighborhood rich with culinary delights, you'll find a variety of amazing restaurants just a short stroll away. This is a perfect opportunity to secure a home in a highly sought-after neighborhood. Whether you're a first-time homebuyer or looking to relocate, this East Sacramento gem is ready for you to make it your own.",,,0.0,,,,,,,0.00,0,,No,62.0,,,,004-0243-017-000,1,Contact Listing Agent,Datashare MetroList,,,,01875980,01188158,2.0,,RESIDENTIAL,,7/16/2024,,,,,,,"Appointment needed, seller works from home and has a dog. Unavailable times for showings are: Monday and Tuesday mornings until 12. Wed and thurs. 10am to 6:30pm. Please text me for appt. Review reports and disclosures prior to writing an offer, seller prefers to sell as-is. See link in attachments.",Sacramento,41st,7,8,8,41st Street to F Street to address.,,,,,,,,,,6067.0,1.0,,,,6/4/2024,,,No,,,,,,7/16/2024,Conventional,4/29/2024 5:00 PM,$553,1442897.0,4/30/2024,,,970410.0,Full Service,Excl Right,Market Listing,,,,4.0,,,,Owner,6/4/2024,,,,,,,224003466,,"$550,000",,6/4/2024,,,,18,,No,,,"$577,000",,$581.07,Sara Raudelunas,916-826-1500,,560608343.0,"Welcome to this delightful 3-bedroom, 1-bathroom home with a converted garage featuring a second bathroom, nestled in the heart of East Sacramento. This charming residence is located in one of the most desirable neighborhoods, known for its tree-lined streets, friendly community, and close proximity to all that East Sacramento has to offer. The home features a brand-new HVAC system and energy-efficient solar panels. The flooring includes recently refinished hardwood floors and new carpet in the bedrooms. The interior has been freshly painted, providing a modern and inviting atmosphere. The open-concept kitchen and living room create a warm and welcoming space filled with beautiful natural light, perfect for entertaining and family gatherings. Located in a neighborhood rich with culinary delights, you'll find a variety of amazing restaurants just a short stroll away. This is a perfect opportunity to secure a home in a highly sought-after neighborhood. Whether you're a first-time homebuyer or looking to relocate, this East Sacramento gem is ready for you to make it your own.",,,$581,,104.0,104.0,For Sale,,Appointment Only,,$581.07,Assessor Auto-Fill,Successor Trustee Sale,CA,7/16/2024,One Story,,,No,,,0.0,,,,7/17/2024,Yes,Yes,Yes,Yes,,,,,95819 3129,RES
ME224066640,SLD,6,3328 Forney Way,,SACRAMENTO,9999,"$1,200,000","$1,200,000",DE,2680.0,4.0,3.0,1.0,,2.0,2018.0,0.109400,"4,765",254,M,"Welcome to your dream home in McKinley Village! This stunning 2,680 sq. ft. property offers 4 bedrooms, 3.5 baths, 2 balconies, a Loft & Study, and an abundance of modern luxury and comfort. The gourmet chef's kitchen with stainless steel appliances and ample counter space is a culinary enthusiast's haven. Conveniently located between East Sacramento and Midtown, you'll have easy access to a vibrant array of amenities. Enjoy the Outdoor kitchen, Deco light fixtures, Crown molding, high end Window treatments, added garage storage, and a 40A outlet in the garage for EV charger. The neighborhood features a community pool/hot tub, gym, clubhouse with outdoor bar and fireplace, playground, pickleball courts, and art installations. Don't miss out on this perfect blend of luxury and convenience!",,,0.0,,,,,,,0.00,0,,No,6.0,,,,001-0250-056-000,4,,Datashare MetroList,,,,01880488,00999879,53.01,Yes,RESIDENTIAL,,7/24/2024,,,,,,,"Escrow has been pre-opened at Chicago Title in Roseville #7522400760KS. Please review and sign attached Seller Instructions and submit with offer. Disclosers are attached in MLS. Offer's are due 7/2/24 at 5:00pm. Wine fridge, outdoor furniture, and fireplaces (2) are negotiable.",Sacramento,Fischbacher St /,6,7,7,80/Capital City Frwy to H St exit; Slight left to,,,,,,,,,,6067.0,0.0,,,,7/3/2024,,,Yes,,,,,,7/25/2024,Conventional,6/26/2024 5:00 PM,$447,1359213.0,6/27/2024,,,01188158,Full Service,Excl Right,Market Listing,,,,1.0,,,,Owner,7/3/2024,,2610,,,,,224066640,,"$1,200,000",,7/3/2024,,,,66,,Private,,,"$1,200,000",,$447.76,Hilary Buchanan,916-397-7502,,560685391.0,"Welcome to your dream home in McKinley Village! This stunning 2,680 sq. ft. property offers 4 bedrooms, 3.5 baths, 2 balconies, a Loft & Study, and an abundance of modern luxury and comfort. The gourmet chef's kitchen with stainless steel appliances and ample counter space is a culinary enthusiast's haven. Conveniently located between East Sacramento and Midtown, you'll have easy access to a vibrant array of amenities. Enjoy the Outdoor kitchen, Deco light fixtures, Crown molding, high end Window treatments, added garage storage, and a 40A outlet in the garage for EV charger. The neighborhood features a community pool/hot tub, gym, clubhouse with outdoor bar and fireplace, playground, pickleball courts, and art installations. Don't miss out on this perfect blend of luxury and convenience!",,,$447,,100.0,100.0,For Sale,,Supra iBox,,$447.76,Assessor Auto-Fill,,CA,7/24/2024,One Story,,,Yes,,,0.0,https://view.paradym.com/v/3328-Forney-Way-Sacramento-CA-95816/4873007/sk/400,,,7/25/2024,Yes,Yes,Yes,Yes,,,,,95816 6555,R-1A
ME223055486,SLD,4,905 43rd Street,,SACRAMENTO,9999,"$689,000","$710,000",DE,966.0,2.0,1.0,0.0,,1.0,1920.0,0.112000,"4,879",,,"You're going to fall in love with this charming East Sac Bungalow! It provides the perfect blend of period charm and modern updates. Perched off the tree-lined street with an inviting front porch, you immediately feel at home. The home features 2 bedrooms, 1 bathroom, with an open concept living/dinning space, hardwood floors, newer roof and a lovely shaded back yard perfect for entertaining. The light filled kitchen has a large skylight and both the kitchen and laundry rooms are tucked to the rear of the house. Imagine the possibilities the detached garage offers with extra storage and or a conversion to an ADU. One of the best features of this home is it's location and walk-ability as you stroll to some of the best shops and eateries in Sacramento. You are only blocks from Mercy General Hospital and practically a part of the fab forties. It doesn't get much better than this!",,,0.0,,,,,,,0.00,0,,No,103.0,,,,008-0092-015-000,0,Show,Datashare MetroList,,,,01277071,00999899,16.02,,RESIDENTIAL,,7/12/2023,,,,,,,Seller is out of the country on his honeymoon. Please allow time to review offer.,Sacramento,H street,4,5,5,J Street to 43rd Street,,,,,,,,,,6067.0,1.0,,,,6/19/2023,,,No,,,,,,7/19/2023,Conventional,6/14/2023 5:00 PM,$713,2017793,6/15/2023,,,1908304.0,Full Service,Excl Right,Market Listing,,,,2.0,,,,Owner,6/19/2023,,,,,,,223055486,,"$689,000",,6/19/2023,,,,35,,No,,,"$710,000",,$734.99,,,,560526404.0,"You're going to fall in love with this charming East Sac Bungalow! It provides the perfect blend of period charm and modern updates. Perched off the tree-lined street with an inviting front porch, you immediately feel at home. The home features 2 bedrooms, 1 bathroom, with an open concept living/dinning space, hardwood floors, newer roof and a lovely shaded back yard perfect for entertaining. The light filled kitchen has a large skylight and both the kitchen and laundry rooms are tucked to the rear of the house. Imagine the possibilities the detached garage offers with extra storage and or a conversion to an ADU. One of the best features of this home is it's location and walk-ability as you stroll to some of the best shops and eateries in Sacramento. You are only blocks from Mercy General Hospital and practically a part of the fab forties. It doesn't get much better than this!",,,$734,,103.0,103.0,For Sale,,Vacant w/Lockbox,,$734.99,Appraisal,,CA,7/12/2023,One Story,,,No,,,0.0,,,,7/19/2023,Yes,Yes,Yes,Yes,,,,,95819 3403,R1
ME224044497,SLD,13,305 39th Street,,SACRAMENTO,9999,"$799,000","$799,000",DE,1063.0,2.0,1.0,0.0,,2.0,1940.0,0.124000,"5,401",,,"This exquisite East Sac bungalow retains the charm and architecture of 1940, but has been meticulously updated (every square inch!) to provide the amenities and luxuries that today's buyer is looking for. Located in idyllic McKinley Park, this home is a private retreat with its mature trees, landscaped yards, brick patio and cozy interior. All the work was completed with permits: new roof, HVAC, redwood fencing/driveway gate, upgraded electrical panel, paint, windows and fiber-optic internet.",,,0.0,,,,,,,0.00,0,,No,84.0,,,,004-0111-024-000,1,Contact Listing Agent,Datashare MetroList,,,,01415304,00970410,3.00,,RESIDENTIAL,,6/13/2024,,,,,,,Easy to show! Text listing agent (Pettit) at 916-330-0490. List of upgrades and improvements are attached in MLS. Offers to be reviewed as received. Escrow is opened with Placer Title. This deal is contingent on sellers closing on a replacement property. A three-week seller rent back is ideal. You will be videoed when touring.,Sacramento,36th Way,13,14,14,Located on the corner of 39th Street and 36th Way,,,,,,,,,,6067.0,1.0,,,,5/14/2024,,,No,,,,,,6/14/2024,Cash,4/30/2024 5:00 PM,$751,01956019,5/1/2024,,,01026478,Full Service,Excl Right,Market Listing,,,,1.0,,,,Owner,5/14/2024,,850,,,,,224044497,,"$799,000",,5/14/2024,,,,54,,No,,,"$799,000",,$751.65,Pettit Gilwee,916-330-0490,,560658629.0,"This exquisite East Sac bungalow retains the charm and architecture of 1940, but has been meticulously updated (every square inch!) to provide the amenities and luxuries that today's buyer is looking for. Located in idyllic McKinley Park, this home is a private retreat with its mature trees, landscaped yards, brick patio and cozy interior. All the work was completed with permits: new roof, HVAC, redwood fencing/driveway gate, upgraded electrical panel, paint, windows and fiber-optic internet.",,,$751,,100.0,100.0,For Sale,,Call Showing Contact,,$751.65,Assessor Auto-Fill,,CA,6/13/2024,One Story,,,No,,,0.0,,,,6/14/2024,Yes,Yes,Yes,Yes,,,,,95816 3427,RES
ME224052620,SLD,1,104 Aiken Way,,SACRAMENTO,9999,"$949,000","$970,000",DE,1862.0,3.0,2.0,0.0,,1.0,1949.0,0.126300,"5,502",,,"Charming Updated Home in East Sacramento Welcome to your dream home! Nestled in the highly sought-after East Sacramento neighborhood, this beautifully updated residence boasts a bright and airy open-concept layout that is perfect for modern living. With 3 spacious bedrooms and 2 updated bathrooms, this home offers comfort and style in every corner. Step inside and be greeted by light-filled living spaces that seamlessly flow from room to room. The heart of the home, the kitchen, is designed for both functionality and entertaining, making it a delightful space for family gatherings and culinary adventures. The property features a sparkling pool, ideal for relaxing on warm summer days, and a lush vegetable garden where you can grow your own fresh produce. A dedicated laundry room adds convenience to your daily routine. Recent upgrades include a brand new roof, fresh exterior paint, and a state-of-the-art HVAC system, ensuring that this home is move-in ready and equipped for year-round comfort. Situated in a prime location, you'll enjoy easy access to amazing restaurants, parks, and your choice of schools. Don't miss out on this fantastic opportunity to own a piece of East Sacramento.",,,0.0,,,,,,,0.00,0,,No,75.0,,,,004-0082-015-000,0,Contact Listing Agent,Datashare MetroList,,,,01778361,01908304,2.00,,RESIDENTIAL,,6/10/2024,,,,,,,"Please call or text Listing Agent for appointment. Owner Occupied. New Roof, New Exterior Paint, New HVAC. Approved Remodel plans available to view. Escrow pre opened. Please email offers to michelle.drewes@cbrealty.com",Sacramento,A Street,1,2,2,Up McKinley Blvd toward Elvas. Right onto Elvas. R,,,,,,,,,,6067.0,1.0,,,,5/18/2024,,,No,,,,,,6/12/2024,Conventional,5/16/2024 5:00 PM,$509,2162071.0,5/17/2024,,,01908304,Full Service,Excl Right,Market Listing,,,,1.0,,,,Owner,5/18/2024,,3500,,,,,224052620,,"$949,000",,5/18/2024,,,,59,,Private,,,"$970,000",,$520.95,Michelle Drewes,415-517-9925,,560668446.0,"Charming Updated Home in East Sacramento Welcome to your dream home! Nestled in the highly sought-after East Sacramento neighborhood, this beautifully updated residence boasts a bright and airy open-concept layout that is perfect for modern living. With 3 spacious bedrooms and 2 updated bathrooms, this home offers comfort and style in every corner. Step inside and be greeted by light-filled living spaces that seamlessly flow from room to room. The heart of the home, the kitchen, is designed for both functionality and entertaining, making it a delightful space for family gatherings and culinary adventures. The property features a sparkling pool, ideal for relaxing on warm summer days, and a lush vegetable garden where you can grow your own fresh produce. A dedicated laundry room adds convenience to your daily routine. Recent upgrades include a brand new roof, fresh exterior paint, and a state-of-the-art HVAC system, ensuring that this home is move-in ready and equipped for year-round comfort. Situated in a prime location, you'll enjoy easy access to amazing restaurants, parks, and your choice of schools. Don't miss out on this fantastic opportunity to own a piece of East Sacramento.",,,$520,,102.0,102.0,For Sale,,Appointment Only,,$520.95,Assessor Auto-Fill,,CA,6/10/2024,Two Story,,,No,,,0.0,,,,6/13/2024,Yes,Yes,Yes,Yes,,,,,95819 2120,R-1
ME224010703,SLD,24,317 41st Street,,SACRAMENTO,9999,"$658,000","$658,000",DE,1115.0,2.0,1.0,0.0,,1.0,1941.0,0.129100,"5,624",,,"Back on Market--no fault of property! Located in the heart of East Sac, this adorable 1940's cottage offers a great layout and loads of recent updates. The 1,115 sf gives you a large living room with a cozy fireplace; a formal dining room; a cute, timeless kitchen that retains some of the original period features (including a breakfast nook that looks out on the neighborhood activity) while incorporating some new must-haves (such as the designer hood over the gas range); a separate laundry room includes washer & dryer plus loads of shelf space; 2 bedrooms (with walk-in closets) and 1 bathroom with a very unique door! You will also enjoy the amenities of a spacious lot: a welcoming front yard and front porch, a long, gated driveway, a detached garage and a large, fully fenced and private backyard. Updates over the past 3 years include all new: plumbing (including sewer & water lines), electrical inside & out, dual pane windows, HVAC, roof, laminate flooring, garage door, backyard fencing & gates, ceiling fans, doors, landscaping (including concrete & front yard gate) & appliances. Wow--all of this in a great neighborhood close to McKinley Park, shops & restaurants!",,,0.0,,,,,,,0.0,0,,No,83.0,,,,004-0191-044-000,2,,Datashare MetroList,,,,01875980,1188158.0,2.00,,RESIDENTIAL,,4/25/2024,,1401323.0,,,,,"Back on Market, no fault of property! This is a successor trustee sale; knowledge of property is limited and disclosures are limited. Extensive remodeling was reportedly done in 2021--see attached list--Trustee did not complete this work himself but has documentation from previous occupant that it was completed. Offers should include POF and preapproval letter if financed. Seller is Ryan Andersen, Trustee, Grace E. Bankey Family Trust. You can abbreviate as needed for CARS forms. Escrow pre-opened with Stewart Title. House is Vacant with lockbox (lockbox on left side of house).",Sacramento,D Street,24,25,25,"From Capitol City Freeway exit on E street, left o",,,,,,,,,,6067.0,1.0,,,,3/28/2024,,,No,,,,,,4/28/2024,Conventional,2/12/2024 4:00 PM,$590,01988667,2/13/2024,,,01401323,Full Service,Excl Right,Market Listing,,,,1.0,,,,Vacant,3/28/2024,,,,,,,224010703,,"$658,000",,3/28/2024,,,,44,,No,,,"$658,000",,$590.13,,,,560619997.0,"Back on Market--no fault of property! Located in the heart of East Sac, this adorable 1940's cottage offers a great layout and loads of recent updates. The 1,115 sf gives you a large living room with a cozy fireplace; a formal dining room; a cute, timeless kitchen that retains some of the original period features (including a breakfast nook that looks out on the neighborhood activity) while incorporating some new must-haves (such as the designer hood over the gas range); a separate laundry room includes washer & dryer plus loads of shelf space; 2 bedrooms (with walk-in closets) and 1 bathroom with a very unique door! You will also enjoy the amenities of a spacious lot: a welcoming front yard and front porch, a long, gated driveway, a detached garage and a large, fully fenced and private backyard. Updates over the past 3 years include all new: plumbing (including sewer & water lines), electrical inside & out, dual pane windows, HVAC, roof, laminate flooring, garage door, backyard fencing & gates, ceiling fans, doors, landscaping (including concrete & front yard gate) & appliances. Wow--all of this in a great neighborhood close to McKinley Park, shops & restaurants!",,,$590,,100.0,100.0,For Sale,,Vacant w/Lockbox,,$590.13,Assessor Auto-Fill,Successor Trustee Sale,CA,4/25/2024,One Story,,,No,,,0.0,,,,4/28/2024,Yes,Yes,Yes,Yes,,,,,95819 2013,R-1
ME223101600,SLD,9,810 38th Street,,SACRAMENTO,9999,"$525,000","$575,000",DE,1324.0,2.0,1.0,0.0,,0.0,1907.0,0.111800,"4,870",,,"Nestled in the heart of the highly sought-after East Sacramento neighborhood on 38th Street, this meticulously updated 2-bedroom, 1-bathroom high water bungalow boasts 1,324 square feet of warm and inviting living space. The open living area seamlessly transitions into the kitchen, offering both character and practicality. Bonus features include a laundry room with an additional toilet for added convenience. Step outside to discover a backyard with incredible potential to entertain family and friends. Located within close proximity to parks, cafes, and boutiques, this home is ideal for those who value a blend of charm and contemporary living. Don't miss the opportunity to make this enchanting home yours!",,,0.0,,,,,,,0.00,0,,No,116.0,,,,008-0031-004-000,4,Contact Listing Agent,Datashare MetroList,,,,02027768,01834648,15.00,,RESIDENTIAL,,11/14/2023,,,,,,,Offers due at 5PM on Monday 10/23. Agents to review inspections and provide proof of funds and pre-approval. Foundation was updated in 2009. All offers should be sent to melissa@houserealestate.com,Sacramento,H St,9,10,10,"Head west on H St, turn left onto 38th St, propert",,,,,,,,,,6067.0,0.0,,,,10/27/2023,,,No,,,,,,11/14/2023,Conventional,10/17/2023 5:00 PM,$396,2027768,10/18/2023,,,01834648,Full Service,Excl Right,Market Listing,,,,5.0,,,,Vacant,10/27/2023,,,,,,,223101600,,"$525,000",,10/27/2023,,,,32,,No,,,"$575,000",,$434.29,Melissa Williams,916-996-9503,,560581970.0,"Nestled in the heart of the highly sought-after East Sacramento neighborhood on 38th Street, this meticulously updated 2-bedroom, 1-bathroom high water bungalow boasts 1,324 square feet of warm and inviting living space. The open living area seamlessly transitions into the kitchen, offering both character and practicality. Bonus features include a laundry room with an additional toilet for added convenience. Step outside to discover a backyard with incredible potential to entertain family and friends. Located within close proximity to parks, cafes, and boutiques, this home is ideal for those who value a blend of charm and contemporary living. Don't miss the opportunity to make this enchanting home yours!",,,$434,,109.0,109.0,For Sale,,Call Showing Contact,,$434.29,Assessor Auto-Fill,,CA,11/14/2023,One Story,,,No,,,0.0,,,,11/15/2023,Yes,Yes,Yes,Yes,,,,,95816 4603,R-1
ME223049895,SLD,61,3317 Mckinley Village Way,,SACRAMENTO,9999,"$1,395,000","$1,350,000",DE,3172.0,4.0,3.0,1.0,,2.0,2016.0,0.113400,"4,940",265,M,"Located in the heart of the East Sacramento community of McKinley Village, this coveted luxury home was built with extensive upgrades. As a former model home, the gourmet chef's kitchen is equipped with Viking appliances, oversized island, quartz counter tops and upgraded cabinets. Restoration Hardware lighting fixtures, imperfect smooth wall finishes and upgraded hardwood floors make this home shine. Experience full audio-video entertainment in common areas. The great room with high ceilings opens to the kitchen and adjacent butler pantry, complete with wet bar and wine fridge. The family room and dedicated breakfast area provide direct access to the tastefully landscaped backyard. Relax comfortably under the covered patio with a built-in fireplace, or soak in the hot tub while watching your favorite show on the outdoor TV. Let the dog stretch their legs along the side of the home on the high-grade artificial turf dog-run. This exquisite low maintenance home was strategically designed for perfect work-play balance. With unique amenities and proximity to stores, restaurants, major hospitals, reputable schools, midtown and downtown, this well-established community is highly sought a",,,0.0,,,,,,,0.00,0,,No,7.0,,,,001-0250-060-000,0,Contact Listing Agent,Datashare MetroList,,,New Home Compa,01870081,01802283,53.01,Yes,RESIDENTIAL,,8/17/2023,,,,,,,Pls do not disturb occupant. Qualified buyers only. Call or text Pierre D. Viard to schedule all showings (916) 767-6813. Offers will be presented as received.,Sacramento,Fonseca,61,62,62,"From C Street, turn onto McKinley Village Way. Con",,,,,,,,,,6067.0,1.0,,,,7/22/2023,,,Yes,,,Landmark Limited,916-742-1149,,8/19/2023,Cash,5/21/2023 5:00 PM,$439,2128355.0,5/22/2023,,,1908304.0,Full Service,Excl Right,Market Listing,,,,1.0,,,,Owner,7/22/2023,,,,,,,223049895,,"$1,439,500",,7/22/2023,,,,71,,Private,,,"$1,350,000",,$425.60,Pierre D. Viard,916-767-6813,,560519491.0,"Located in the heart of the East Sacramento community of McKinley Village, this coveted luxury home was built with extensive upgrades. As a former model home, the gourmet chef's kitchen is equipped with Viking appliances, oversized island, quartz counter tops and upgraded cabinets. Restoration Hardware lighting fixtures, imperfect smooth wall finishes and upgraded hardwood floors make this home shine. Experience full audio-video entertainment in common areas. The great room with high ceilings opens to the kitchen and adjacent butler pantry, complete with wet bar and wine fridge. The family room and dedicated breakfast area provide direct access to the tastefully landscaped backyard. Relax comfortably under the covered patio with a built-in fireplace, or soak in the hot tub while watching your favorite show on the outdoor TV. Let the dog stretch their legs along the side of the home on the high-grade artificial turf dog-run. This exquisite low maintenance home was strategically designed for perfect work-play balance. With unique amenities and proximity to stores, restaurants, major hospitals, reputable schools, midtown and downtown, this well-established community is highly sought after, as it has something for everyone!",,,$425,,96.0,93.0,For Sale,,Leave Card,,$425.60,Assessor Auto-Fill,,CA,8/17/2023,Two Story,,,No,,,0.0,https://my.matterport.com/show/?m=GCcwx7rrZaN,,,8/19/2023,Yes,Yes,Yes,Yes,,,,,95816 6567,R-1A
