MLS No,Status,DOM,Address,Unit,City,Area,LP,SP,BT,SqFt,BR,Bth,PB,Gar,GarSp,YrBlt,Acres,Lot SqFt,HOA Fee,Freq,3rd Party Synd. Remarks,ADU Baths Full,ADU Baths Partial,ADU Bedrooms,ADU Building Type,ADU Description,ADU Kitchen,ADU Main Entry Floor,ADU Meter,ADU Occupied,ADU Rents For,ADU Sq. Ft.,ADU SqFt Source,ADU Y/N,Age,Agent Has Ownership,Agent Hit Count,Agent Related to Principal,Assessors Parcel No,Associated Document Count,Available to Show,Board ID,Branded Media Link,Branded Media Link 2,Builder/Architect,Buyer Agent DRE Num.,Buyer Broker DRE Number,Census Tract,City Transfer Tax,Class,Client Hit Count,Closing Date,Co Buy Agent DRE Num.,Co List Agent DRE Num.,Co-List Agent email,Co-List Agent Fax,Complex Name,Concessions at COE,Confidential Remarks,County,Cross Street,Cumulative DOM,Cumulative DOMLS,Days On MLS,Directions to Property,Disclosures Link,Dist/Nbrhood/Sub,Elementary School Distric,Entry Agent First Name,Entry Agent ID,Entry Agent Last Name,Entry Agent License ID,Expire Date,Filtered Address,FIPS Code,Fireplaces,Floor Unit is on,Foreclosure Status,Gate Code,General Date,Geocode Quality,High School District,HOA,HOA Management Companies,HOA Name,HOA Name (Other),HOA Phone,Homesnap Appt. Scheduling,Hotsheet Date,How Sold,Input Date,List $/SqFt,List Agent DRE Num.,List Date,Listing Agt email,Listing Agt Fax,Listing Broker DRE Number,Listing Service,Listing Type,Listing Visibility Type,Lockbox Location,Model,New Subdivision,Number of offers,Occpnt Req 24 Hr Notice,Occupant Name,Occupant Phone,Occupied By,Off Market Date,Old Complex,Old Concessions,Old Elem,Old High,Old HOA Name,Old Middle,Old MLS #,Old Subdivision,Original Price,Ownership Type,Pending Date,Pending Litigation,Percent Owner Occ,Photo Permission,Picture Count,Point of Sale Ordinance,Pool,Preferred Agent Fax,Previous Price,Price,Price Date,Price Per SQFT,Primary Showing Contact,Primary Showing Phone,Printed Neighborhood Rpt,Property ID,Public Remarks,Radar ID,Rooms Total,Sale $/SqFt,Sale COOP,Sale/Last List $,Sale/Original $,Sale/Rent,Sales Office Info Remarks,Showing Instruction,Showing Schedule Link,Sold Price Per SQFT,Source,Special Information,State,Status Date,Stories,Subdivision (Other),Subdivision Profile Rmks,Supra Box?,Tax ID,TIC % Owner Offered,Total # of Garage and Parking Spaces,Unbranded Media Link,Unbranded Media Link 2,Units in Complex,Update Date,VOW Address,VOW AVM,VOW Comment,VOW Include,WiFi Last,ZIDX Only House #,ZIDX Only Street Dir,ZIDX Only Street Name,Zip,Zoning
ME224020947,SLD,1,842 41st Street,,SACRAMENTO,9999,"$579,000","$515,000",DE,1286.0,2.0,1.0,0.0,,1.0,1928.0,0.114800,"5,001",,,"This charming home is situated in the heart of East Sacramento. It features lead lined windows, original hardwood floors, a large enclosed/climate controlled sun room. There is an abundance of storage throughout. The rear yard is a low maintenance landscape. The detached garage offers plenty of additional storage and space for your car. You are just a short walk to Dignity Health Mercy Hospital, restaurants, shops, and McKinley park. Bring your imagination on how to make this home your own.",,,0.0,,,,,,,0.00,0,,No,96.0,,,,008-0041-005-000,0,,Datashare MetroList,,,,02204136,01996600,15.00,,RESIDENTIAL,,4/8/2024,,,,,,,"Back on the market at no fault of the seller. Buyer was not able to preform, so here we are. Reach out for inspection reports. Home is vacant, so please make sure to lock up the sunroom door, and turn off all the lights. Please contact Marcos Mercado at (916)600-6085 with any questions. Please do not go past the rear fence onto the hospital property.",Sacramento,H St.,1,2,2,Take H Street to 41st and turn going South. The ho,,,,,,,,,,6067.0,1.0,,,,3/7/2024,,,No,,,,,,4/9/2024,Cash,3/5/2024 4:00 PM,$450,01956017,3/6/2024,,,01996600,Full Service,Excl Right,Market Listing,,,,2.0,,,,Vacant,3/7/2024,,,,,,,224020947,,"$579,000",,3/7/2024,,,,43,,No,,,"$515,000",,$400.47,,,,560630298.0,"This charming home is situated in the heart of East Sacramento. It features lead lined windows, original hardwood floors, a large enclosed/climate controlled sun room. There is an abundance of storage throughout. The rear yard is a low maintenance landscape. The detached garage offers plenty of additional storage and space for your car. You are just a short walk to Dignity Health Mercy Hospital, restaurants, shops, and McKinley park. Bring your imagination on how to make this home your own.",,,$400,,88.0,88.0,For Sale,,Vacant w/Lockbox,,$400.47,Assessor Auto-Fill,,CA,4/8/2024,One Story,,,No,,,0.0,,,,4/9/2024,Yes,Yes,Yes,Yes,,,,,95819 2747,R-1
ME223023442,SLD,7,724 San Antonio Way,,SACRAMENTO,9999,"$1,298,000","$1,305,000",DE,2701.0,4.0,3.0,0.0,,1.0,1924.0,0.1194,"5,201",,,"Modern Amazing Meets Old World Charm & Character. This is a one of a kind property in East Sacramento. If you are looking for a place to plant your roots, this 2700 sf home is it. All the modern amenities you want wrapped up and oozing with character from the craftsman style trim, vinyl plank flooring, Kitchen Aid appliances, Emtek hardware & high end finishes. Downstairs, the primary suite features a sitting area, huge walk in closet and dreamy bathroom retreat. The multi-use upstairs area is perfect for guests with a remote bedroom/bathroom, additional loft area, kids space, hobby/office, you choose. If you think it can't get any better, step outside to the manicured backyard with large patio & privacy fencing. In addition, you can utilize the detached building for studio, exercise, storage or garage. Ideal location, within minutes from Mercy Hospital, Temple Coffee, restaurants, shopping and so much more.",,,0.0,,,,,,,0.00,0,,No,99.0,,,,004-0285-014-000,0,Contact Listing Agent,Datashare MetroList,,,,01887890,01834648,3.00,,RESIDENTIAL,,5/9/2023,1304855.0,1077144.0,,,,,Contact Renee' for showings 916.203.9690 Pest Inspection and seller disclosures available.,Sacramento,H Street,7,8,8,"Take exit toward H St, take a slight right onto H",,,,,,,,,,6067.0,1.0,,,,4/4/2023,,,No,,,,,,5/9/2023,Conventional,3/27/2023 5:00 PM,$480,1942370.0,3/28/2023,,,00625769,Full Service,Excl Right,Market Listing,,,,1.0,,,,Vacant,4/4/2023,,2000,,,,,223023442,,"$1,298,000",,4/4/2023,,,,39,,No,,,"$1,305,000",,$483.15,Renee' Catricala,916-203-9690,,560488799.0,"Modern Amazing Meets Old World Charm & Character. This is a one of a kind property in East Sacramento. If you are looking for a place to plant your roots, this 2700 sf home is it. All the modern amenities you want wrapped up and oozing with character from the craftsman style trim, vinyl plank flooring, Kitchen Aid appliances, Emtek hardware & high end finishes. Downstairs, the primary suite features a sitting area, huge walk in closet and dreamy bathroom retreat. The multi-use upstairs area is perfect for guests with a remote bedroom/bathroom, additional loft area, kids space, hobby/office, you choose. If you think it can't get any better, step outside to the manicured backyard with large patio & privacy fencing. In addition, you can utilize the detached building for studio, exercise, storage or garage. Ideal location, within minutes from Mercy Hospital, Temple Coffee, restaurants, shopping and so much more.",,,$483,,100.0,100.0,For Sale,,Appointment Only,,$483.15,Assessor Auto-Fill,,CA,5/9/2023,Two Story,,,No,,,0.0,https://tour.TPGtours.com/2106495?a=1,,,5/11/2023,Yes,Yes,Yes,Yes,,,,,95819 2716,R-1
ME224016005,SLD,8,508 San Antonio Way,,SACRAMENTO,9999,"$724,900","$782,000",DE,914.0,2.0,2.0,0.0,,1.0,1924.0,0.1194,"5,201",,,"Refined and lovingly restored East Sacramento home. Experience the rare display of care in every detail of this bright, 1920s high-water bungalow! From your first view, you'll be captivated by the lush, Tuscan-inspired landscaping. Plentiful citrus and apple, dwarf Italian cypress, bay laurel, and ornamental olive trees transport you to Italy. The backyard with its wisteria-covered dining pergola provides ample space to relax and entertain. The home has been redesigned with a nod to European convenience and style, including towel warmers in both bathrooms, heated Italian tile flooring in the primary bath, custom maple cabinetry in kitchen, primary bedroom and primary bath, quartz countertops and hand-painted Moroccan Zellige tile backsplashes in kitchen and primary bath. The home also features Miele washer, dryer and dishwasher, Fulgor Milano dual-fuel range, Bosch refrigerator, as well as LED recessed lighting throughout. The partially finished full basement, while not living area, can be configured for storage, art/crafts studio, workshop, or home office. Though no longer in use, the vintage kitchen and bathroom fixtures remain in the basement. DON'T MISS this exceptional home!",,,0.0,,,,,,,0.00,0,,No,100.0,,,,004-0234-009-000,3,Contact Listing Agent,Datashare MetroList,,,,00697566,970410.0,3.00,,RESIDENTIAL,,3/15/2024,,,,,,,Thank you agents for showing!! Cleared pest from Twin Termite and roof inspection from Roofchecks available- seller is making roof repairs and providing roof certification. All new copper plumbing and all new electrical! Sewer line was replaced during the seller's ownership! Squeaky clean property! Please review seller instructions and disclosures prior to making offer! Submit offers to Mairin.haley@compass.com with pre-approval and Proof of funds Link for disclosures:https://app.disclosures.io/link/508-San-Antonio-Way-zfem97dn,Sacramento,H and E,8,9,9,From H or D street turn on to San antonio,,,,,,,,,,6067.0,0.0,,,,2/29/2024,,,No,,,,,,3/16/2024,Conventional,2/20/2024 4:00 PM,$793,1965456.0,2/21/2024,,,625769.0,Full Service,Excl Right,Market Listing,,,,3.0,,,,Owner,2/29/2024,,5000,,,,,224016005,,"$724,900",,2/29/2024,,,,53,,No,,,"$782,000",,$855.58,Mairin Haley,916-420-6369,,560624426.0,"Refined and lovingly restored East Sacramento home. Experience the rare display of care in every detail of this bright, 1920s high-water bungalow! From your first view, you'll be captivated by the lush, Tuscan-inspired landscaping. Plentiful citrus and apple, dwarf Italian cypress, bay laurel, and ornamental olive trees transport you to Italy. The backyard with its wisteria-covered dining pergola provides ample space to relax and entertain. The home has been redesigned with a nod to European convenience and style, including towel warmers in both bathrooms, heated Italian tile flooring in the primary bath, custom maple cabinetry in kitchen, primary bedroom and primary bath, quartz countertops and hand-painted Moroccan Zellige tile backsplashes in kitchen and primary bath. The home also features Miele washer, dryer and dishwasher, Fulgor Milano dual-fuel range, Bosch refrigerator, as well as LED recessed lighting throughout. The partially finished full basement, while not living area, can be configured for storage, art/crafts studio, workshop, or home office. Though no longer in use, the vintage kitchen and bathroom fixtures remain in the basement. DON'T MISS this exceptional home!",,,$855,,107.0,107.0,For Sale,,Leave Card,,$855.58,Assessor Auto-Fill,,CA,3/15/2024,One Story,,,No,,,0.0,https://media.showingtimeplus.com/videos/4587389f-b483-4976-8366-8079016be2d4,,,3/16/2024,Yes,Yes,Yes,Yes,,,,,95819 2712,R-1
ME223037693,SLD,6,380 40th Street,,SACRAMENTO,9999,"$1,450,000","$1,539,000",DE,2491.0,4.0,4.0,0.0,,1.0,2017.0,0.126300,"5,502",,,"This perfect East Sac home was completely rebuilt in 2017 with a wonderful floor plan. The chefs kitchen boasts a large island that seats four, quartz counters, stainless steel appliances, wine fridge, pot filler over the 6 burner stove and a large pantry closet. The junior suite downstairs has two closets and an on-suite full bath. The primary suite upstairs has two closets and a spacious bathroom with soaking tub, large shower and walk-in closet. The loft at the top of the stairs makes a perfect office with views of the tree lined street. This great, open designed home has lots of storage throughout and upgrades like custom window treatments, split level HVAC, tankless water heater and more. 2491 SF home plus 252 SF finished room behind the garage with AC and plumbing for a bathroom in garage for easy conversion to an ADU. The covered Trex deck adds lots of outdoor living and the hot tub is perfect for soaking. Easy walking to McKinley Park, Comptons, coffee shops and restaurants.",0.0,0.0,0.0,Detached,Bonus Room behind garage,No,,,No,0.00,252,Appraisal,Yes,6.0,,,,004-0183-014-000,0,Contact Listing Agent,Datashare MetroList,,,,02159665,01908304,3.00,,RESIDENTIAL,,6/8/2023,1751888.0,,,,,,"Do Not Let The Cat Out. Schedule all showings through ShowingTime and wait for confirmation. Please provide at least one hour notice for showings. Provide proof of funds and pre-approval with all offers. Please allow 3 days to respond to offers. House is 2,491 square feet and air conditioned bonus room behind the garage is 252 square feet per appraisal measurements. Office loft could easily be converted into 10x17' 5th bedroom.",Sacramento,D Street / McKin,6,7,7,80/Capital City Frwy to H St exit; Slight left at,,,,,,,,,,6067.0,1.0,,,,5/10/2023,,,No,,,,,,6/12/2023,Cash,5/3/2023 5:00 PM,$582,01875980,5/4/2023,,,1188158.0,Full Service,Excl Right,Market Listing,,,,2.0,,,,Owner,5/10/2023,,300,,,,,223037693,,"$1,450,000",,5/10/2023,,,,75,,No,,,"$1,539,000",,$617.82,Showing Time,000-000-0000,,560504520.0,"This perfect East Sac home was completely rebuilt in 2017 with a wonderful floor plan. The chefs kitchen boasts a large island that seats four, quartz counters, stainless steel appliances, wine fridge, pot filler over the 6 burner stove and a large pantry closet. The junior suite downstairs has two closets and an on-suite full bath. The primary suite upstairs has two closets and a spacious bathroom with soaking tub, large shower and walk-in closet. The loft at the top of the stairs makes a perfect office with views of the tree lined street. This great, open designed home has lots of storage throughout and upgrades like custom window treatments, split level HVAC, tankless water heater and more. 2491 SF home plus 252 SF finished room behind the garage with AC and plumbing for a bathroom in garage for easy conversion to an ADU. The covered Trex deck adds lots of outdoor living and the hot tub is perfect for soaking. Easy walking to McKinley Park, Comptons, coffee shops and restaurants.",,,$617,,106.0,106.0,For Sale,,Appointment Only,,$617.82,Appraisal,,CA,6/8/2023,Two Story,,,No,,,0.0,https://view.paradym.com/v/380-40th-St-Sacramento-CA-95819/4801983/sk/400,,,6/12/2023,Yes,Yes,Yes,Yes,,,,,95819 2028,R-1
ME223099057,SLD,37,708 San Miguel Way,,SACRAMENTO,9999,"$995,000","$900,000",DE,1691.0,3.0,1.0,1.0,,0.0,1930.0,0.1148,"5,001",,,"Dreamy French countryside feel in the heart of East Sacramento, featured in the 2022 Sacred Heart Home Tour, French Country Magazine, and Sac Mag! Enchanting secret garden vibes in the front courtyard lead to endless charm inside this 3 bedroom, 1.5 bath home, with a detached 307 sq ft casita! Enjoy views of the lush courtyards from almost every room. French doors in the living/dining room open to the front porch creating a magical indoor/outdoor experience. The second floor features a peaceful retreat to the private primary en-suite with a walk-in closet and 1/2 bath. Both well-sized downstairs bedrooms offer outdoor access. Custom features throughout include original hardwood flooring, reclaimed terracotta tiles, Pierre Frey wallpaper, reclaimed open beams in the kitchen and upstairs bathroom and crown molding. Recent upgrades (2022) include new electrical panel, kitchen appliances, mini split in casita, thermostats, and insulation. The backyard is a serene escape with multiple inviting corners to unwind and plenty of space to entertain. The detached casita is perfect for a remote guest bedroom or office. Perfectly located within blocks of McKinley Park and less than 1 mile from an array of East Sac and Midtown dining favorites, great schools, fitness, coffee, fwy access & more",,,0.0,,,,,,,0.00,0,,No,94.0,,,,004-0284-011-000,0,,Datashare MetroList,,,,,,3.00,,RESIDENTIAL,,1/3/2024,,,,,,,"Showings by appointment only. Contact Sarah Sutherland with questions - (916) 498-4999. Lockbox is on the front railing. Please note that the key only works for the back teal door. Home sold as is! All offers welcome! Please send offers to SarahSutherland@houserealestate.com. Seller hoping to include the following with the sale of property:Washer and Dryer, Refrigerator, Front piece in dining room, All fountains, Bedding and matching window coverings in upstairs room and downstairs room, Bed in upstairs room, Dresser in upstairs closet, Both cabinets in laundry room,All Window Coverings.",Sacramento,H Street,37,38,38,H to San Miguel to property on the left.,,,,,,,,,,6067.0,2.0,,,,12/1/2023,,,No,,,,,,1/8/2024,Conventional,10/24/2023 5:00 PM,$588,02124285,10/25/2023,,,01834648,Full Service,Excl Right,Market Listing,,,,1.0,,,,Owner,12/1/2023,,,,,,,223099057,,"$1,150,000",,12/1/2023,,,,23,,No,,,"$900,000",,$532.23,Sarah Sutherland,916-498-4999,,560578790.0,"Dreamy French countryside feel in the heart of East Sacramento, featured in the 2022 Sacred Heart Home Tour, French Country Magazine, and Sac Mag! Enchanting secret garden vibes in the front courtyard lead to endless charm inside this 3 bedroom, 1.5 bath home, with a detached 307 sq ft casita! Enjoy views of the lush courtyards from almost every room. French doors in the living/dining room open to the front porch creating a magical indoor/outdoor experience. The second floor features a peaceful retreat to the private primary en-suite with a walk-in closet and 1/2 bath. Both well-sized downstairs bedrooms offer outdoor access. Custom features throughout include original hardwood flooring, reclaimed terracotta tiles, Pierre Frey wallpaper, reclaimed open beams in the kitchen and upstairs bathroom and crown molding. Recent upgrades (2022) include new electrical panel, kitchen appliances, mini split in casita, thermostats, and insulation. The backyard is a serene escape with multiple inviting corners to unwind and plenty of space to entertain. The detached casita is perfect for a remote guest bedroom or office. Perfectly located within blocks of McKinley Park and less than 1 mile from an array of East Sac and Midtown dining favorites, great schools, fitness, coffee, fwy access & more",,,$532,,90.0,78.0,For Sale,,See Remarks,,$532.23,Owner,Offer As Is,CA,1/3/2024,Two Story,,,No,,,0.0,,,,1/8/2024,Yes,Yes,Yes,Yes,,,,,95819 2724,R-1
ME223037423,SLD,2,417 San Antonio,,SACRAMENTO,9999,"$998,000","$1,050,000",DE,1753.0,4.0,2.0,1.0,,1.0,1940.0,0.113100,"4,927",,,"Step inside your dream home! This charming, lovingly maintained cottage sits in one of East Sac's most coveted neighborhoods. As you walk through the front door you'll notice a home filled with incredible light filtering through large picture windows & skylights with solar powered blackout & light filtering blinds. Beautiful original wood floors on the main floor & LED recessed lighting throughout the entire home has wi-fi enabled switches & smart home compatibility. The updated kitchen features stainless steel appliances, quartz countertops, soft close cabinets & updated fixtures. The primary bedroom and office are located on the main floor with a full bath with bidet & built-in storage cabinets for all your necessities. Two bedrooms & full bath are upstairs for more privacy. Step outside to a backyard paradise that includes lovely, mature orange and mandarin trees. Relax on the stamped concrete patio with personal spa tucked under the vine covered pergola. The easy care landscaping includes sprinkler & drip irrigation systems that are smart home controlled. Enjoy living on this tree-lined street & stroll to nearby parks, restaurants, schools & all the entertainment of the adjacen",,,0.0,,,,,,,0.00,0,,No,83.0,,,,004-0235-007-000,3,Contact Listing Agent,Datashare MetroList,,,,01994094,1908304.0,3.00,,RESIDENTIAL,,5/24/2023,,1311232.0,,,,,"Do not use ShowingTime. Schedule showings through Bernadette or Melissa to arrange time. Escrow pre-opened with OCTC. Offers should be sent to remaxbernadette@gmail.com with a cc to mshroutre@gmail.com Please include lender letter, proof of funds if cash and attached SPQ and TDS with buyer's signature.",Sacramento,H St.,2,3,3,H Street to San Antonio Way.,,,,,,,,,,6067.0,1.0,,,,5/5/2023,,,No,,,,,,5/30/2023,Conventional,5/2/2023 5:00 PM,$569,01939979,5/3/2023,,,1338273.0,Full Service,Excl Right,Market Listing,,,,1.0,,,,Owner,5/5/2023,,0,,,,,223037423,,"$998,000",,5/5/2023,,,,57,,No,,,"$1,050,000",,$598.97,Bernadette Augustine,916-541-1607,,560504474.0,"Step inside your dream home! This charming, lovingly maintained cottage sits in one of East Sac's most coveted neighborhoods. As you walk through the front door you'll notice a home filled with incredible light filtering through large picture windows & skylights with solar powered blackout & light filtering blinds. Beautiful original wood floors on the main floor & LED recessed lighting throughout the entire home has wi-fi enabled switches & smart home compatibility. The updated kitchen features stainless steel appliances, quartz countertops, soft close cabinets & updated fixtures. The primary bedroom and office are located on the main floor with a full bath with bidet & built-in storage cabinets for all your necessities. Two bedrooms & full bath are upstairs for more privacy. Step outside to a backyard paradise that includes lovely, mature orange and mandarin trees. Relax on the stamped concrete patio with personal spa tucked under the vine covered pergola. The easy care landscaping includes sprinkler & drip irrigation systems that are smart home controlled. Enjoy living on this tree-lined street & stroll to nearby parks, restaurants, schools & all the entertainment of the adjacent Midtown, McKinley and Fab 40's neighborhoods. This is the home you've been waiting for!",,,$598,,105.0,105.0,For Sale,,Call 1st Lockbox,,$598.97,Assessor Auto-Fill,,CA,5/24/2023,Two Story,,,No,,,0.0,https://my.matterport.com/show/?m=roBYMpnMV9R&brand=0&mls=1&,,,5/30/2023,Yes,Yes,Yes,Yes,,,,,95819 2709,R-1
ME224082315,SLD,24,716 San Miguel Way,,SACRAMENTO,9999,"$579,900","$575,000",DE,1262.0,2.0,1.0,1.0,,1.0,1924.0,0.114800,"5,001",,,"Lovely Dutch Colonial home waiting for your personal touches! This property is 2 bed, 2 bath, 1,262sqft, on a 5,000sqft lot. This property is best for a family that wants to make this house their own through personally renovating the property. It is a blank canvas awaiting your touch! This property would also be an excellent opportunity for an investor looking to perform a remodel, or remodel addition, in one of the best neighborhoods in Sacramento. 716 San Miguel will need some repairs done, so please bring buyers that are comfortable with a project! This property is located on a quiet tree lined street, very walkable to many East Sac favorites. It is in excellent proximity to Mercy Hospital. This charming home is centrally located with easy access to most major highways, 80, 50, & 99, as well as Downtown/Midtown Sacramento.",,,0.0,,,,,,,0.00,0,,No,100.0,,,,004-0284-012-000,0,,Datashare MetroList,,,,02080725,01022642,3.00,,RESIDENTIAL,,9/13/2024,,,,,,,"Text/Call Michael for details. Please acknowledge on offer that agent has ownership interest in the property. Please submit approval letter, POF, and full offer package with submittal.",Sacramento,H St,24,25,25,"H st, turn north San Miguel, house is on the left",,,,,,,,,,6067.0,1.0,,,,8/18/2024,,,No,,,,,,9/14/2024,Conventional,7/24/2024 5:00 PM,$459,1975620.0,7/25/2024,,,1894180.0,Full Service,Excl Right,Market Listing,front steps,,,6.0,,,,Vacant,8/18/2024,,,,,,,224082315,,"$599,900",,8/18/2024,,,,14,,No,,,"$575,000",,$455.63,Michael Nerby,916-847-5409,,560704431.0,"Lovely Dutch Colonial home waiting for your personal touches! This property is 2 bed, 2 bath, 1,262sqft, on a 5,000sqft lot. This property is best for a family that wants to make this house their own through personally renovating the property. It is a blank canvas awaiting your touch! This property would also be an excellent opportunity for an investor looking to perform a remodel, or remodel addition, in one of the best neighborhoods in Sacramento. 716 San Miguel will need some repairs done, so please bring buyers that are comfortable with a project! This property is located on a quiet tree lined street, very walkable to many East Sac favorites. It is in excellent proximity to Mercy Hospital. This charming home is centrally located with easy access to most major highways, 80, 50, & 99, as well as Downtown/Midtown Sacramento.",,,$455,,99.0,95.0,For Sale,,Vacant w/Lockbox,,$455.63,Assessor Auto-Fill,,CA,9/13/2024,Two Story,,,No,,,0.0,,,,9/14/2024,Yes,Yes,Yes,Yes,,,,,95819 2724,R1
