ME224081975,SLD,0,3325 Dullanty Way,,SACRAMENTO,9999,"$1,149,000","$1,180,000",DE,2474.0,3.0,3.0,1.0,,2.0,2019.0,0.108300,"4,718",275,M,"Rare Spanish Beauty! Could this be your new residence? From the moment you arrive, you'll be captivated by the charm and sophistication that define this home. The grand entrance leads to an open-concept living area featuring stunning hardwood flooring, which adds warmth and elegance. The heart of the home is the mammoth quartz kitchen island, too many chefs in the kitchen? Not in this home, there is ample space for meals prep, entertaining, even cooking classes. Upgraded appliances ensure both style and functionality, making every culinary experience a delight. The home offers three spacious bedrooms plus a versatile den that can serve as a home office or study. Additionally, a flexible room on the main floor provides endless possibilities, whether you need a playroom, additional living space, or a guest suite. Outdoors, the property features a thoughtfully designed dog run, and for the green thumbs a garden space equipped with a convenient drip irrigation system is awaiting. McKinley Village is know easy to no maintenance living in the most vibrant Communities. Experience the perfect blend of classic Spanish charm and contemporary amenities in this exceptional home.",,,0.0,,,,,,,0.00,0,,No,5.0,,,,001-0270-018-000,0,Contact Listing Agent,Datashare MetroList,,,New Home Compa,01880615,01908304,53.01,,RESIDENTIAL,,9/16/2024,784986.0,,,,,,Pls call or better yet text listing Agent Pierre Viard 916-767-6813. House is Vacant with lockbox. Escrow pre-opened with Old Republic.,Sacramento,McKinley Village,0,1,1,"From C and 28th St take McKinley Village Way, righ",,,,,,,,,,6067.0,1.0,,,,8/23/2024,,,Yes,,,Landmark Limited,916-742-1149,,9/18/2024,Cash,8/22/2024 5:00 PM,$464,02128355,8/23/2024,,,1908304.0,Full Service,Excl Right,Market Listing,,,,1.0,,,,Owner,8/23/2024,,,,,,,224081975,,"$1,100,000",,8/23/2024,,,,79,,Private,,,"$1,180,000",,$476.96,Pierre Viard,916-767-6813,,560704013.0,"Rare Spanish Beauty! Could this be your new residence? From the moment you arrive, you'll be captivated by the charm and sophistication that define this home. The grand entrance leads to an open-concept living area featuring stunning hardwood flooring, which adds warmth and elegance. The heart of the home is the mammoth quartz kitchen island, too many chefs in the kitchen? Not in this home, there is ample space for meals prep, entertaining, even cooking classes. Upgraded appliances ensure both style and functionality, making every culinary experience a delight. The home offers three spacious bedrooms plus a versatile den that can serve as a home office or study. Additionally, a flexible room on the main floor provides endless possibilities, whether you need a playroom, additional living space, or a guest suite. Outdoors, the property features a thoughtfully designed dog run, and for the green thumbs a garden space equipped with a convenient drip irrigation system is awaiting. McKinley Village is know easy to no maintenance living in the most vibrant Communities. Experience the perfect blend of classic Spanish charm and contemporary amenities in this exceptional home.",,,$476,,102.0,107.0,For Sale,,Call 1st Lockbox,,$476.96,Assessor Auto-Fill,,CA,9/16/2024,Two Story,,,Yes,,,0.0,https://player.vimeo.com/video/1002017307,,,9/18/2024,Yes,Yes,Yes,Yes,,,,,95816 6552,R-1A
ME223001066,SLD,29,709 San Miguel Way,,SACRAMENTO,9999,"$675,000","$675,000",DE,938.0,2.0,1.0,0.0,,1.0,1923.0,0.119400,"5,201",,,"Charming, stylish, and modernized to perfection. Life on the tree-lined streets of East Sacramento puts you close to amazing coffee shops, eateries, parks, and quick access to the freeway. Near McKinley Park, Temple Coffee, Mercy Hospital, the Fab '40s, and an excellent list of restaurants that are highly acclaimed: Allora, Kru, One Speed, and THAI, just to name a few. This darling two-bedroom bungalow has been enhanced to include a remodeled kitchen with quartz countertops, new fixtures and hardware, and the most amazing vintage range! New HVAC, gas fire pit, tankless water heater, and new fences. The cozy living room with fireplace, formal dining area, nice-sized bedrooms, and spacious kitchen are laid out in an open & functional floor plan. It's really a fall-in-love type of home, in a great location. Imagine summers in that backyard! This is the right place and the right time to call this one home. A community where biking and walking are alive. Live life on San Miguel.",,,0.0,,,,,,,0.0,0,,No,100.0,,,,004-0285-021-0000,1,Contact Listing Agent,Datashare MetroList,,,,02157105,1908304.0,3.00,,RESIDENTIAL,,3/15/2023,,,,,,,Please use showing time to schedule your showing and prevent overlap. It is owner occupied but you will receive immediate confirmation. Please do not open the side door to the driveway...weather has made it hard to close and lock. Disclosure link in attachments.,Sacramento,H St.,29,30,30,"From H Street, right on San Miguel Way, to address",,,,,,,,,,6067.0,1.0,,,,2/13/2023,,,No,,,,,,3/15/2023,Conventional,1/14/2023 4:00 PM,$719,1442897,1/15/2023,,,970410.0,Full Service,Excl Right,Market Listing,,,,2.0,,,,Owner,2/13/2023,,15000,,,,,223001066,,"$659,000",,2/13/2023,,,,31,,No,,,"$675,000",,$719.62,Showing Time,000-000-0000,,560459821.0,"Charming, stylish, and modernized to perfection. Life on the tree-lined streets of East Sacramento puts you close to amazing coffee shops, eateries, parks, and quick access to the freeway. Near McKinley Park, Temple Coffee, Mercy Hospital, the Fab '40s, and an excellent list of restaurants that are highly acclaimed: Allora, Kru, One Speed, and THAI, just to name a few. This darling two-bedroom bungalow has been enhanced to include a remodeled kitchen with quartz countertops, new fixtures and hardware, and the most amazing vintage range! New HVAC, gas fire pit, tankless water heater, and new fences. The cozy living room with fireplace, formal dining area, nice-sized bedrooms, and spacious kitchen are laid out in an open & functional floor plan. It's really a fall-in-love type of home, in a great location. Imagine summers in that backyard! This is the right place and the right time to call this one home. A community where biking and walking are alive. Live life on San Miguel.",,,$719,,100.0,102.0,For Sale,,Appointment Only,,$719.62,Assessor Auto-Fill,,CA,3/15/2023,One Story,,,No,,,0.0,https://player.vimeo.com/video/789479540,,,3/16/2023,Yes,Yes,Yes,Yes,,,,,95819 2723,Res
ME224032415,SLD,6,608 Santa Ynez Way,,SACRAMENTO,9999,"$549,900","$600,000",DE,1018.0,2.0,1.0,0.0,,1.0,1925.0,0.126300,"5,502",,,"Incredible opportunity to own in McKinley Park and put your personal touches on this Diamond in the Rough! Spacious living room with fireplace, formal dining area with built-in, alley kitchen with breakfast nook, indoor laundry room, detached single car garage. Brand new roof was just installed! Original hardwood floors too!",,,0.0,,,,,,,0.0,0,,No,99.0,,,,004-0273-002-000,1,,Datashare MetroList,,,,01302455,01359660,3.00,,RESIDENTIAL,,5/13/2024,,,,,,,"Only cash offers or hard money loans will be considered due to condition. Probate sale, please include the Probate Agreement Purchase Addendum. Court confirmation not required. Highest and best due on Wednesday April 10th at 12pm. Pest report from last year is attached. Please note, listing agent will be out of town Saturday through Monday, all calls/texts/emails will be returned on Tuesday.",Sacramento,McKinley Blvd,6,7,7,McKinley Blvd to Santa Ynez,,,,,,,,,,6067.0,1.0,,,,4/11/2024,,,No,,,,,,5/14/2024,Cash,4/4/2024 5:00 PM,$540,01362388,4/5/2024,,,01359660,Full Service,Excl Right,Market Listing,,,,10.0,,,,Vacant,4/11/2024,,,,,,,224032415,,"$549,900",,4/11/2024,,,,19,,No,,,"$600,000",,$589.39,,,,560646078.0,"Incredible opportunity to own in McKinley Park and put your personal touches on this Diamond in the Rough! Spacious living room with fireplace, formal dining area with built-in, alley kitchen with breakfast nook, indoor laundry room, detached single car garage. Brand new roof was just installed! Original hardwood floors too!",,,$589,,109.0,109.0,For Sale,,Vacant w/Lockbox,,$589.39,Assessor Auto-Fill,Probate Listing,CA,5/13/2024,One Story,,,No,,,0.0,,,,5/14/2024,Yes,Yes,Yes,Yes,,,,,95816 3910,R-1
ME224029516,SLD,6,922 42nd Street,,SACRAMENTO,9999,"$1,300,000","$1,440,000",DE,2238.0,4.0,3.0,1.0,,0.0,1922.0,0.114800,"5,001",,,"You're sure to fall in love with this fully remodeled home in the center of East Sac with all the charm you desire and all the amenities you need. Walk in through the arched front door, through the foyer and in to the light and bright living room and you will know you have found your new home. Anderson windows throughout the home bring in so much light, the refinished floors gleam and the fireplace insert will keep you toasty warm in the winter. The dining room boasts a bar with wine fridge and beer tap. The spacious kitchen is a cooks delight with top of the line appliances and large pantry. The primary bedroom is downstairs and has two walk-in closets, french doors to the back yard and a spa bathroom with a spacious shower and a soaking tub with a heated back rest. The second bedroom downstairs has vaulted ceilings, skylight, french doors to the back yard and its own on-suite bathroom. Upstairs is a great loft area, two more bedrooms and the third full bathroom. The tranquil back yard with a large deck is a perfect gathering place. Other upgrades: quiet cork board flooring, speakers throughout, disappearing backdoor screens, dual zone HVAC, whole house fan, updated electrical, tankless water heater, Tesla charger and more. All of this and walkable to everything in East Sac!",,,0.0,,,,,,,0.00,0,,No,102.0,,,,008-0042-011-000,2,,Datashare MetroList,,,,00878571,01908304,15.00,Yes,RESIDENTIAL,,5/8/2024,,,,,,,"Please remove shoes if it has been raining! Provide pre-approval and proof of funds with offers. VA loan is possibly assumable, ask for details. Virtual Tour and Floor Plan in the links. Please leave the lights on after showing. Hardwood floors refinished a week ago and the smell from refinishing them should dissipate soon. Offers are due by Tuesday at 2 o'clock. Multiple offers so bring in your highest and best offer.",Sacramento,J St and H St,6,7,7,80/Capital City Frwy to H St exit; East on H St; R,,,,,,,,,,6067.0,1.0,,,,4/10/2024,,,No,,,,,,5/8/2024,Conventional,4/3/2024 5:00 PM,$580,01875980,4/4/2024,,,01188158,Full Service,Excl Right,Market Listing,,,,4.0,,,,Vacant,4/10/2024,,12500,,,,,224029516,,"$1,300,000",,4/10/2024,,,,65,,No,,,"$1,440,000",,$643.43,,,,560643757.0,"You're sure to fall in love with this fully remodeled home in the center of East Sac with all the charm you desire and all the amenities you need. Walk in through the arched front door, through the foyer and in to the light and bright living room and you will know you have found your new home. Anderson windows throughout the home bring in so much light, the refinished floors gleam and the fireplace insert will keep you toasty warm in the winter. The dining room boasts a bar with wine fridge and beer tap. The spacious kitchen is a cooks delight with top of the line appliances and large pantry. The primary bedroom is downstairs and has two walk-in closets, french doors to the back yard and a spa bathroom with a spacious shower and a soaking tub with a heated back rest. The second bedroom downstairs has vaulted ceilings, skylight, french doors to the back yard and its own on-suite bathroom. Upstairs is a great loft area, two more bedrooms and the third full bathroom. The tranquil back yard with a large deck is a perfect gathering place. Other upgrades: quiet cork board flooring, speakers throughout, disappearing backdoor screens, dual zone HVAC, whole house fan, updated electrical, tankless water heater, Tesla charger and more. All of this and walkable to everything in East Sac!",,,$643,,110.0,110.0,For Sale,,Vacant w/Lockbox,,$643.43,Assessor Auto-Fill,,CA,5/8/2024,Two Story,,,No,,,0.0,https://my.matterport.com/show/?m=vSJ4fazgJme&brand=0,,,5/8/2024,Yes,Yes,Yes,Yes,,,,,95819 2728,R-1
ME223072538,SLD,6,4117 A Street,,SACRAMENTO,9999,"$840,000","$897,000",DE,1488.0,3.0,2.0,0.0,,1.0,1949.0,0.122800,"5,349",,,"Welcome to this immaculately cared-for East Sac charmer. This one is a rare find. Completely remodeled (down to the studs) in 2014. Everything from the cooks' kitchen with a new Fulgor Milano Italian Gas stove (2023), private primary retreat, coffered ceilings, quality custom woodwork, and 220 EV charger outlet make this an extraordinary home. Enjoy the stunning Front and back yards, a true gardeners paradise. The backyard feels like a sanctuary, methodically created, not a detail was missed. Sit and take in the sheer beauty of this gorgeous oasis, including an Ipe hardwood deck, koi pond, waterfall, gazebo, mature blueberry, kumquat, and fig trees. Award-winning front yard (East Sac In Bloom) with drought-tolerant natives that super bloom in the Spring. This lovely home is walkable to Comptons, Bertha Henschel, and McKinley Park.",,,0.0,,,,,,,0.00,0,,No,74.0,,,,004-0074-013-000,0,Contact Listing Agent,Datashare MetroList,,,,01189785,1026478.0,2.00,,RESIDENTIAL,,9/8/2023,1972229.0,,,,,,"No more showings at this time. Please text owner to arrange showings, give a minimum of one hour notice. Items that DO NOT CONVEY; Dining Custom Chandelier, Hot Tub, Koi fish & ALL potted plants/trees. The Koi fish and tropical tanks are available for sale outside of escrow. There are two cats that live here, they come and go as they please. Escrow is pre-opened with Placer Title.",Sacramento,40th Street,6,7,7,"From McKinley Park, take McKinley Blvd, right on M",,,,,,,,,,6067.0,1.0,,,,8/23/2023,,,No,,,,,,9/13/2023,Conventional,8/16/2023 5:00 PM,$564,01919329,8/17/2023,,,01026478,Full Service,Excl Right,Market Listing,Pipe to the right of,,,4.0,,,,Owner,8/23/2023,,15780,,,,,223072538,,"$810,000",,8/23/2023,,,,90,,No,,,"$897,000",,$602.82,Amber,510-326-0685,,560546581.0,"Welcome to this immaculately cared-for East Sac charmer. This one is a rare find. Completely remodeled (down to the studs) in 2014. Everything from the cooks' kitchen with a new Fulgor Milano Italian Gas stove (2023), private primary retreat, coffered ceilings, quality custom woodwork, and 220 EV charger outlet make this an extraordinary home. Enjoy the stunning Front and back yards, a true gardeners paradise. The backyard feels like a sanctuary, methodically created, not a detail was missed. Sit and take in the sheer beauty of this gorgeous oasis, including an Ipe hardwood deck, koi pond, waterfall, gazebo, mature blueberry, kumquat, and fig trees. Award-winning front yard (East Sac In Bloom) with drought-tolerant natives that super bloom in the Spring. This lovely home is walkable to Comptons, Bertha Henschel, and McKinley Park.",,,$602,,106.0,110.0,For Sale,,Leave Card,,$602.82,Assessor Auto-Fill,,CA,9/8/2023,One Story,,,Yes,,,0.0,https://tours.topnotch360.net/2166031,,,9/13/2023,Yes,Yes,Yes,Yes,,,,,95819 2017,R-1
ME223082832,SLD,4,4150 Moddison Avenue,,SACRAMENTO,9999,"$619,888","$619,888",DE,1328.0,3.0,2.0,0.0,,2.0,1958.0,0.123700,"5,388",,,"Welcome home to the very desirable River Park community that has plenty of gorgeous trees and old time charm. This 3 bedroom 2 Full Bath house is a great deal with plenty to offer such as Re-finished wood floors, gas fireplace, updated windows, ceiling fans, enclosed sunroom, and a newer roof. The location is great for commuting, and close to downtown. You are just minutes from great restaurants, and shopping. In addition, it's not far from the highly rated Caleb Greenwood Elementary school. Sacramento State is also very close by. Don't miss out!",,,0.0,,,,,,,0.00,0,,No,65.0,,,,005-0033-005-000,0,Contact Listing Agent,Datashare MetroList,,,,01504107,00995131,1.00,,RESIDENTIAL,,9/20/2023,,,,,,,"Call Charles at 916-201-9228 to set up appointment. Send offers, Pre-approval, and POF to kelloggrealtors@yahoo.com",Sacramento,Carlson Dr,4,5,5,"From Carlson Dr, turn left onto Moddison.",,,,,,,,,,6067.0,1.0,,,,8/30/2023,,,No,,,,,,9/20/2023,Conventional,8/25/2023 5:00 PM,$466,1444843,8/26/2023,,,01022642,Full Service,Excl Right,Market Listing,,,,2.0,,,,Owner,8/30/2023,,12500,,,,,223082832,,"$619,888",,8/30/2023,,,,26,,No,,,"$619,888",,$466.78,Charles,916-201-9228,,560558560.0,"Welcome home to the very desirable River Park community that has plenty of gorgeous trees and old time charm. This 3 bedroom 2 Full Bath house is a great deal with plenty to offer such as Re-finished wood floors, gas fireplace, updated windows, ceiling fans, enclosed sunroom, and a newer roof. The location is great for commuting, and close to downtown. You are just minutes from great restaurants, and shopping. In addition, it's not far from the highly rated Caleb Greenwood Elementary school. Sacramento State is also very close by. Don't miss out!",,,$466,,100.0,100.0,For Sale,,Appointment Only,,$466.78,Assessor Auto-Fill,,CA,9/20/2023,One Story,,,No,,,0.0,,,,9/21/2023,Yes,Yes,Yes,Yes,,,,,95819,R1
ME223110392,SLD,6,147 Meister Way,,SACRAMENTO,9999,"$699,000","$705,000",DE,1200.0,3.0,1.0,1.0,,2.0,1949.0,0.126300,"5,502",,,"Charming 3 bedroom 2 bath home located in the Heart of East Sacramento. Amenities include: Lovely brick walkway and front porch. Large Living room with wood floors, cozy wood burning fireplace, and recessed lighting. Dining bar and Breakfast bar to the kitchen newly remodeled with custom tile, tiled backsplash, granite countertops, SS appliances, and custom white cabinets. The main bathroom also recently remodeled boasts tile flooring and custom vanity & sink. Three large bedrooms with full closets, wood flooring, and one with ceiling fan. Unique to the area is a large laundry room with sink that leads to a huge bonus room with vaulted ceiling, recessed lighting, brick fireplace, and half bath. Two car garage with shelving and workbench. The backyard is perfect for entertaining with patio, lush lawn, and a rejuvenating secluded spa. Located close to McKinley Park, the American River, Comptons Market,Orphan Breakfast House, & Roxies Deli. Hurry, do not miss out, this beautiful home will not last long!",,,0.0,,,,,,,0.00,0,,No,74.0,,,,004-0062-005-000,1,Contact Listing Agent,Datashare MetroList,,,,02068462,01893932,3.00,,RESIDENTIAL,,12/15/2023,,,,,,,Escrow opened with Chicago Title Co. Buyer to verify Sq. ft. Rear Bonus room sq. footage is not in tax records. Buyer purchased with existing room attached.,Sacramento,C St.,6,7,7,C street to East on Meister Way.,,,,,,,,,,6067.0,2.0,,,,11/21/2023,,,No,,,,,,12/16/2023,Conventional,11/14/2023 4:00 PM,$582,01334798,11/15/2023,,,01334798,Full Service,Excl Right,Market Listing,Railing on Front Por,,,2.0,,,,Owner,11/21/2023,,8000,,,,,223110392,,"$699,000",,11/21/2023,,,,34,,No,,,"$705,000",,$587.50,Colin,616-644-2939,,560594443.0,"Charming 3 bedroom 2 bath home located in the Heart of East Sacramento. Amenities include: Lovely brick walkway and front porch. Large Living room with wood floors, cozy wood burning fireplace, and recessed lighting. Dining bar and Breakfast bar to the kitchen newly remodeled with custom tile, tiled backsplash, granite countertops, SS appliances, and custom white cabinets. The main bathroom also recently remodeled boasts tile flooring and custom vanity & sink. Three large bedrooms with full closets, wood flooring, and one with ceiling fan. Unique to the area is a large laundry room with sink that leads to a huge bonus room with vaulted ceiling, recessed lighting, brick fireplace, and half bath. Two car garage with shelving and workbench. The backyard is perfect for entertaining with patio, lush lawn, and a rejuvenating secluded spa. Located close to McKinley Park, the American River, Comptons Market,Orphan Breakfast House, & Roxies Deli. Hurry, do not miss out, this beautiful home will not last long!",,,$587,,100.0,100.0,For Sale,,Appointment Only,,$587.50,Assessor Auto-Fill,,CA,12/15/2023,One Story,,,Yes,,,0.0,,,,12/17/2023,Yes,Yes,Yes,Yes,,,,,95819 1939,R-1
ME223100728,SLD,10,4460 C Street,,SACRAMENTO,9999,"$849,000","$825,000",DE,1778.0,3.0,2.0,0.0,,1.0,1948.0,0.116400,"5,070",,,"Welcome to your dream home in the heart of East Sacramento. Nestled on a quiet street, this stunning classic was fully remodeled in 2017. Spacious and filled with light, this open floor plan gives everyone a place to be. Gorgeous hardwood floors and duel pane windows throughout the entire home. The open concept kitchen has marble countertops, a large sit-in island, high end stainless steel appliances, and ample storage space. Huge separate family room at the rear of the home has plenty of room for additional dining and extra large sliding glass doors that lead to the electric shade covered raised patio. The primary suite has a large walk-in closet, huge marble tile shower and double vanities. High end window coverings that include plantation shutters and remote operated drapes. Sellers recently installed a custom Trex deck to enjoy the seasons from the front of the home, including raised planting beds, irrigation and cleverly designed wheelchair access to the home. Oversized single car garage and plenty of room for multiple cars on the driveway. Home has a tankless water heater and includes a newer washer and dryer. New HVAC and ducting installed in 2020. No work to be done here, this home is 100% turnkey.",,,0.0,,,,,,,0.00,0,,No,75.0,,,,004-0133-002-000,2,Contact Listing Agent,Datashare MetroList,,,,01944422,1354059.0,2.00,,RESIDENTIAL,,12/12/2023,,01304855,,,,,Sale is subject to seller successfully completing court approved probate scheduled for 10/25/23. Please send offers to Kim & Tim Offers will be reviewed Monday 10/23 at 5pm. Sellers mother passed away peacefully in the home last August.Pst report available upon request. Fireplace to convey as is,Sacramento,45th St,10,11,11,From J St turn right on 50th St. 50th becomes Colo,,,,,,,,,,6067.0,1.0,,,,10/26/2023,,,No,,,,,,12/13/2023,Conventional,10/15/2023 5:00 PM,$477,1887890.0,10/16/2023,,,01834648,Full Service,Excl Right,Market Listing,,,,1.0,,,,Vacant,10/26/2023,,,,,,,223100728,,"$849,000",,10/26/2023,,,,32,,No,,,"$825,000",,$464.00,Kim Squglia,916-205-2681,,560580952.0,"Welcome to your dream home in the heart of East Sacramento. Nestled on a quiet street, this stunning classic was fully remodeled in 2017. Spacious and filled with light, this open floor plan gives everyone a place to be. Gorgeous hardwood floors and duel pane windows throughout the entire home. The open concept kitchen has marble countertops, a large sit-in island, high end stainless steel appliances, and ample storage space. Huge separate family room at the rear of the home has plenty of room for additional dining and extra large sliding glass doors that lead to the electric shade covered raised patio. The primary suite has a large walk-in closet, huge marble tile shower and double vanities. High end window coverings that include plantation shutters and remote operated drapes. Sellers recently installed a custom Trex deck to enjoy the seasons from the front of the home, including raised planting beds, irrigation and cleverly designed wheelchair access to the home. Oversized single car garage and plenty of room for multiple cars on the driveway. Home has a tankless water heater and includes a newer washer and dryer. New HVAC and ducting installed in 2020. No work to be done here, this home is 100% turnkey.",,,$464,,97.0,97.0,For Sale,,Call 1st Lockbox,,$464.00,Assessor Auto-Fill,,CA,12/12/2023,One Story,,,No,,,0.0,,,,12/14/2023,Yes,Yes,Yes,Yes,,,,,95819 2143,R-1
