ME224058273,SLD,5,311 41st Street,,SACRAMENTO,9999,"$1,098,000","$1,200,000",DE,2221.0,3.0,2.0,0.0,,1.0,1955.0,0.125300,"5,458",,,"Nestled in the sought-after McKinley Park neighborhood, this quintessential East Sac craftsman-style residence exudes charm and warmth. Boasting over 2,200 sqft of living space across two levels, this well maintained home offers 3 bd and 2 ba. The covered front porch invites you into the formal entry through tall French doors originally from the state capitol. The main level with separate living and dining areas, are complemented by a sunlit kitchen featuring an eat-in breakfast nook. At the top of the stairs a serene primary retreat, complete with vaulted ceilings, expansive picture windows, and built-in cabinetry. Unwind in the spa-like bath featuring a clawfoot tub, stall shower and walk-in closet. Outside, the private yard and expansive back deck create an ideal oasis for relaxation & entertainment. The detached garage offers ample storage space, with the potential for a separate studio in the finished upstairs room. Conveniently located near Theodore Judah Elementary, McKinley Park, and vibrant shops & eateries, this home epitomizes East Sac living at its finest.",,,0.0,,,,,,,0.00,0,,No,69.0,,,,004-0191-045-000,0,Contact Listing Agent,Datashare MetroList,,,,01849596,01908304,2.00,,RESIDENTIAL,,6/24/2024,,,,,,,Showing by appointment only. Call Shawn Norlin at 415-533-8566 for appointment. Disclosures and reports are available at : https://app.disclosures.io/link/311-41st-Street-aod0bf65,Sacramento,C St,5,6,6,"From Capitol City Freeway exit on E street, L on E",,,,,,,,,,6067.0,1.0,,,,6/11/2024,,,No,,,,,,6/25/2024,Conventional,6/5/2024 5:00 PM,$494,01910516,6/6/2024,,,2014153.0,Full Service,Excl Right,Market Listing,,,,2.0,,,,Vacant,6/11/2024,,,,,,,224058273,,"$1,098,000",,6/11/2024,,,,63,,No,,,"$1,200,000",,$540.30,Shawn Norlin,415-533-8566,,560678999.0,"Nestled in the sought-after McKinley Park neighborhood, this quintessential East Sac craftsman-style residence exudes charm and warmth. Boasting over 2,200 sqft of living space across two levels, this well maintained home offers 3 bd and 2 ba. The covered front porch invites you into the formal entry through tall French doors originally from the state capitol. The main level with separate living and dining areas, are complemented by a sunlit kitchen featuring an eat-in breakfast nook. At the top of the stairs a serene primary retreat, complete with vaulted ceilings, expansive picture windows, and built-in cabinetry. Unwind in the spa-like bath featuring a clawfoot tub, stall shower and walk-in closet. Outside, the private yard and expansive back deck create an ideal oasis for relaxation & entertainment. The detached garage offers ample storage space, with the potential for a separate studio in the finished upstairs room. Conveniently located near Theodore Judah Elementary, McKinley Park, and vibrant shops & eateries, this home epitomizes East Sac living at its finest.",,,$540,,109.0,109.0,For Sale,,Appointment Only,,$540.30,Assessor Auto-Fill,,CA,6/24/2024,Two Story,,,No,,,0.0,,,,6/25/2024,Yes,Yes,Yes,Yes,,,,,95819 2013,Resi
ME224051343,SLD,24,616 37th Street,,SACRAMENTO,9999,"$1,860,000","$1,745,000",DE,2865.0,4.0,3.0,0.0,,0.0,2024.0,0.115100,"5,014",,,"Welcome to this stunning new construction modern farmhouse in the heart of East Sacramento that offers a perfect blend of modern amenities and classic charm. Situated on a tree-lined street, this home boasts meticulous attention to detail and high-end finishes throughout. Inside, you'll find an open and airy floor plan with an abundance of natural light. The main level features a spacious living room perfect for entertaining guests or cozying up by the fireplace on chilly evenings. The adjacent dining area flows seamlessly into the gourmet kitchen, which is equipped with stainless steel appliances, quartz countertops, and a large center island. Retreat to the serene primary suite complete with a walk-in closet and a spa-like ensuite bathroom, featuring a soaking tub and a luxurious shower. The home offers three additional bedrooms, providing plenty of space for family and guests and each bedroom is beautifully sunlit. Outside you find a private backyard oasis, where you can relax and unwind on the spacious patio. This prime East Sacramento location offers easy access to a variety of local amenities, including parks, restaurants, shops and top-rated schools.",,,0.0,,,,,,,0.00,0,,No,0.0,,,,004-0275-003-000,0,Contact Listing Agent,Datashare MetroList,,,,,,3.00,,RESIDENTIAL,,6/27/2024,,,,,,,"Please call LA1 for all showings and questions 310-570-6659, or LA2: Verna Helbling, vernahelbling1@gmail.com 310-849-2485",Sacramento,H St,24,25,25,"Left on H Street, home is on the left.",,,,,,,,,,6067.0,0.0,,,,6/7/2024,,,No,,,,,,8/7/2024,Cash,5/13/2024 5:00 PM,$649,2087163,5/14/2024,,,824452.0,Full Service,Excl Right,Market Listing,,,,0.0,,,,Vacant,6/7/2024,,,,,,,224051343,,"$1,860,000",,6/7/2024,,,,22,,No,,,"$1,745,000",,$609.08,Brooke Bates,310-570-6659,,560666924.0,"Welcome to this stunning new construction modern farmhouse in the heart of East Sacramento that offers a perfect blend of modern amenities and classic charm. Situated on a tree-lined street, this home boasts meticulous attention to detail and high-end finishes throughout. Inside, you'll find an open and airy floor plan with an abundance of natural light. The main level features a spacious living room perfect for entertaining guests or cozying up by the fireplace on chilly evenings. The adjacent dining area flows seamlessly into the gourmet kitchen, which is equipped with stainless steel appliances, quartz countertops, and a large center island. Retreat to the serene primary suite complete with a walk-in closet and a spa-like ensuite bathroom, featuring a soaking tub and a luxurious shower. The home offers three additional bedrooms, providing plenty of space for family and guests and each bedroom is beautifully sunlit. Outside you find a private backyard oasis, where you can relax and unwind on the spacious patio. This prime East Sacramento location offers easy access to a variety of local amenities, including parks, restaurants, shops and top-rated schools.",,4.0,$609,,93.0,93.0,For Sale,,24 Hour Notice,,$609.08,Builder,,CA,6/27/2024,Two Story,,,No,,,0.0,,,,8/8/2024,Yes,Yes,Yes,Yes,,,,,95816,Resi
ME224056877,SLD,7,945 36th Street,,SACRAMENTO,9999,"$675,000","$695,000",DE,1426.0,2.0,1.0,0.0,,2.0,1924.0,0.126700,"5,519",,,"Offered by 5th generation owners.....Turn of the century adaptations of the popular Tudor and English Revival styles with Hollywood Glam influence all make for charming historical chic in this 2-bedroom East Sacramento gem. Constructed when barreled ceilings were in vogue, multi-pane window grids reflected well, gabled roofs were added for flare and a fireplace was the focal point of the living room. Rich colors are drawn in, like subtle reds, dark browns as accents for warmth and style. Beautiful barrel ceilings, enchanting interior arches & added accents of built-in corner cabinets. Picture hanging molding & 6 inch baseboards, solid wood doors. Beautiful refinished hardwood floors and hexagon penny tile floor in the bath. Chandeliers, sconces, other light fixtures and possibly some antique door hardware in the home may be original. Big bright kitchen with some updates, including recessed ceiling lights and the sought after sink under window. Plus an inviting Breakfast nook with arched entry. Good sized bedrooms and closets. Indoor laundry w/extra storage area for convenience. HVAC & water heater-in the partial basement. Detached 2 car garage w/newer garage door & opener. All of the charm of yesteryear plus modern conveniences such as central heat & air. Virtual staging",,,0.0,,,,,,,0.00,0,,No,100.0,,,,007-0076-005-000,0,,Datashare MetroList,,,,01859274,1808645.0,15.00,,RESIDENTIAL,,7/2/2024,,611754.0,,,,,"Street parking may require a permit. Garage door opener is in the upper cabinet to the left of the stove. please return it back to the cabinet when you're finished.Escrow is pre-opened with Fidelity National Title, Fair Oaks office. All offer to be submitted by Monday 3rd of June. Seller will review offers Tuesday the 4th of June. Send proof of fund, loan approval letter and offers to both Pohare@c21selectgroup.com and Tdeller@c21selectgroup.com",Sacramento,J Street,7,8,8,4th home from corner 36th & J Street. Walking dist,,,,,,,,,,6067.0,1.0,,,,6/4/2024,,,No,,,,,,7/2/2024,Conventional,5/27/2024 5:00 PM,$473,856701,5/28/2024,,,1019265.0,Full Service,Excl Right,Market Listing,gas meter at end of,,,3.0,,,,Vacant,6/4/2024,,,,,,,224056877,,"$675,000",,6/4/2024,,,,33,,No,,,"$695,000",,$487.38,,,,560673968.0,"Offered by 5th generation owners.....Turn of the century adaptations of the popular Tudor and English Revival styles with Hollywood Glam influence all make for charming historical chic in this 2-bedroom East Sacramento gem. Constructed when barreled ceilings were in vogue, multi-pane window grids reflected well, gabled roofs were added for flare and a fireplace was the focal point of the living room. Rich colors are drawn in, like subtle reds, dark browns as accents for warmth and style. Beautiful barrel ceilings, enchanting interior arches & added accents of built-in corner cabinets. Picture hanging molding & 6 inch baseboards, solid wood doors. Beautiful refinished hardwood floors and hexagon penny tile floor in the bath. Chandeliers, sconces, other light fixtures and possibly some antique door hardware in the home may be original. Big bright kitchen with some updates, including recessed ceiling lights and the sought after sink under window. Plus an inviting Breakfast nook with arched entry. Good sized bedrooms and closets. Indoor laundry w/extra storage area for convenience. HVAC & water heater-in the partial basement. Detached 2 car garage w/newer garage door & opener. All of the charm of yesteryear plus modern conveniences such as central heat & air. Virtual staging",,8.0,$487,,102.0,102.0,For Sale,,Vacant w/Lockbox,,$487.38,Assessor Auto-Fill,Offer As Is,CA,7/2/2024,One Story,,,No,,,0.0,https://travismturnerphoto.hd.pics/945-36th-St/idx,,1.0,7/3/2024,Yes,Yes,Yes,Yes,,,,,95816 4557,R-1
ME223091189,SLD,7,544 36th Street,,SACRAMENTO,9999,"$849,000","$910,000",DE,1348.0,3.0,1.0,0.0,,1.0,1924.0,0.108400,"4,722",,,"Welcome to this charming gem in the heart of East Sacramento! Near McKinley Park, this 3bd/1ba home is situated on a sought after tree-lined street. A bright and spacious floor plan with tasteful renovations, this home effortlessly combines elegance with modern living. The kitchen boasts newly installed white shaker cabinetry, sleek marble countertops, and stainless steel appliances, including an under counter wine refrigerator. Gorgeous original hardwood floors grace the living and dining areas. Notable upgrades include a newly installed A/C and furnace in 2022. Outside, you'll find a meticulously paved private fenced backyard adorned with beautiful hydrangeas. Enjoy the covered patio with a charming pergola, as well as a spacious open patio area, ideal for hosting gatherings. This home also features recessed lighting, fresh paint, double-paned windows, a renovated bathroom and kitchen as well as a re-stuccoed exterior. Detached bonus room/office, tankless water heater, and a single-car detached garage with additional shelving and new concrete floors. The garage also offers flex space for storage or workshop. The location is ideal, with McKinley Park, Mercy Hospital, UC Davis Med Center, restaurants, shops, and esteemed schools just a short distance away.",,,0.0,,,,,,,0.00,0,,No,99.0,,,,004-0226-004-000,0,Contact Listing Agent,Datashare MetroList,,,,01364594,01908304,0.00,,RESIDENTIAL,,10/16/2023,,,,,,,"Seller occupied. Showings by appointment only, with 2 hours notice. Do not use showing time. No Open House requests. TEXT agent Azi at 916-337-2299 for showing requests. Escrow has been pre-opened with Placer Title, escrow # P-607266. Offers due by Tuesday, September 26th at 7pm.",Sacramento,McKinley Blvd.,7,8,8,"From Business 80W: Exit E st, E st turns into McKi",,,,,,,,,,6067.0,1.0,,,,9/28/2023,,,No,,,,,,10/16/2023,Cash,9/20/2023 5:00 PM,$629,2084520.0,9/21/2023,,,01834648,Full Service,Excl Right,Market Listing,Lockbox on side gate,,,4.0,,,,Owner,9/28/2023,,9000,,,,,223091189,,"$849,000",,9/28/2023,,,,44,,No,,,"$910,000",,$675.07,Azi Hayatdavoudi,916-337-2299,,560569167.0,"Welcome to this charming gem in the heart of East Sacramento! Near McKinley Park, this 3bd/1ba home is situated on a sought after tree-lined street. A bright and spacious floor plan with tasteful renovations, this home effortlessly combines elegance with modern living. The kitchen boasts newly installed white shaker cabinetry, sleek marble countertops, and stainless steel appliances, including an under counter wine refrigerator. Gorgeous original hardwood floors grace the living and dining areas. Notable upgrades include a newly installed A/C and furnace in 2022. Outside, you'll find a meticulously paved private fenced backyard adorned with beautiful hydrangeas. Enjoy the covered patio with a charming pergola, as well as a spacious open patio area, ideal for hosting gatherings. This home also features recessed lighting, fresh paint, double-paned windows, a renovated bathroom and kitchen as well as a re-stuccoed exterior. Detached bonus room/office, tankless water heater, and a single-car detached garage with additional shelving and new concrete floors. The garage also offers flex space for storage or workshop. The location is ideal, with McKinley Park, Mercy Hospital, UC Davis Med Center, restaurants, shops, and esteemed schools just a short distance away.",,,$675,,107.0,107.0,For Sale,,Appointment Only,,$675.07,Assessor Agent-Fill,,CA,10/16/2023,One Story,,,No,,,0.0,,,,12/6/2023,Yes,Yes,Yes,Yes,,,,,95816,R-1
ME224050805,SLD,31,308 41st Street,,SACRAMENTO,9999,"$687,000","$696,800",DE,1189.0,2.0,2.0,0.0,,1.0,1939.0,0.120800,"5,260",,,"Nestled in the charming and prestigious East Sacramento neighborhood, this home features tree-lined streets and an inviting atmosphere. The property includes 2 full bedrooms and an office off the primary bedroom, along with spacious walk-in closets, rare for a 1939 home. Freshly painted with new carpet in the bedrooms and mostly dual-pane windows, the house offers a spacious living room and a large, bright kitchen with a separate pantry. The washer, dryer, and fridge are included, and the laundry area is conveniently located inside. Additional amenities include central heating and air conditioning, a tile roof, and proximity to shopping, trendy eateries, galleries, McKinley Park, and Mercy Hospital.",,,0.0,,,,,,,0.00,0,,No,85.0,,,,004-0184-007-000,9,,Datashare MetroList,,,,01493133,01493133,3.00,,RESIDENTIAL,,8/26/2024,,,,,,,"All inspections done, probate sale in which administrator has Full authority (meaning it's much like a regular sale). For seller name on offer use Seller of Record. Refrigerator, washer, dryer stays with no value and no warranty. Roof work has been done. This particular type of roof which is called cap and pan can last up to 150 years according to Mr. Google on the internet. Roofer says 15 years plus. No further repairs will be made. Sellers mother passed away in the home. She died peacefully of old age. Primary bath and extra square footage does not show up in tax records. The seller purchased it with the primary bath in place. It is unknown if it was done with permits.",Sacramento,D Street,31,32,32,"H Street, north on 41st. Home on left.",,,,,,,,,,6067.0,1.0,,,,8/5/2024,,,No,,,,,,8/28/2024,Conventional,7/4/2024 5:00 PM,$577,1925466,7/5/2024,,,1026478.0,Full Service,Excl Right,Market Listing,Right side of house,,,2.0,,,,Owner,8/5/2024,,,,,,,224050805,,"$687,000",,8/5/2024,,,,43,,No,,,"$696,800",,$586.04,Jennifer Ramey,916-549-6294,,560666307.0,"Nestled in the charming and prestigious East Sacramento neighborhood, this home features tree-lined streets and an inviting atmosphere. The property includes 2 full bedrooms and an office off the primary bedroom, along with spacious walk-in closets, rare for a 1939 home. Freshly painted with new carpet in the bedrooms and mostly dual-pane windows, the house offers a spacious living room and a large, bright kitchen with a separate pantry. The washer, dryer, and fridge are included, and the laundry area is conveniently located inside. Additional amenities include central heating and air conditioning, a tile roof, and proximity to shopping, trendy eateries, galleries, McKinley Park, and Mercy Hospital.",,,$586,,101.0,101.0,For Sale,,Call 1st Lockbox,,$586.04,Assessor Agent-Fill,Probate Listing,CA,8/26/2024,One Story,,,No,,,0.0,https://fusion.realtourvision.com/234744,,,8/28/2024,Yes,Yes,Yes,Yes,,,,,95819 2014,R-1
ME224071279,SLD,6,341 Santa Ynez Way,,SACRAMENTO,9999,"$949,000","$950,000",DE,1613.0,3.0,2.0,0.0,,1.0,1929.0,0.126300,"5,502",,,"Step into the timeless charm of this Tudor home, where every detail reflects pride of ownership. Beyond the arched front door, the traditional floor plan unfolds with a spacious living room boasting stunning windows framing picturesque Santa Ynez Way. A formal dining room leads to a kitchen adorned with stainless steel appliances and a generous island, perfect for culinary endeavors. Comfortable bedrooms and updated bathrooms provide modern convenience, while gleaming hardwood floors, a captivating barrel ceiling, moldings, and a cozy fireplace evoke classic warmth throughout. The home also features leaded windows, charming alcoves, and French doors that lead to a serene backyard to relax or entertain. Additional highlights include a spacious laundry room with ample storage, a basement for added storage, a large attic space and a detached oversized garage. Nestled in desirable East Sacramento, this residence is minutes away from McKinley Park, renowned restaurants, quaint coffee shops, the vibrant nightlife of Midtown, and essential amenities like hospitals, shopping, and markets. Don't miss out on experiencing the allure of this exceptional home, a perfect blend of historic charm and modern comfort in sought after East Sac.",,,0.0,,,,,,,0.00,0,,No,95.0,,,,004-0173-019-000,14,,Datashare MetroList,,,,02136186,01834648,3.00,,RESIDENTIAL,,8/16/2024,,,,,,,"Back on the market... After 23 days in escrow, all contingencies removed, final walk through completed and lender about to fund, the Buyer decided not to move forward and cancel the sale on closing day... Seller just moved out, pictures of home depict the home with the seller's furniture. Escrow opened with Stewart Title, Escrow number 2392336-KM",Sacramento,39th Street,6,7,7,H Street or McKinley Blvd. to Santa Ynez to addres,,,,,,,,,,6067.0,1.0,,,,7/27/2024,,,No,,,,,,8/16/2024,Cash,6/27/2024 5:00 PM,$588,878571.0,6/28/2024,,,1908304.0,Full Service,Excl Right,Market Listing,Driveway gate,,,1.0,,,,Vacant,7/27/2024,,,,,,,224071279,,"$949,000",,7/27/2024,,,,30,,No,,,"$950,000",,$588.96,,,,560691190.0,"Step into the timeless charm of this Tudor home, where every detail reflects pride of ownership. Beyond the arched front door, the traditional floor plan unfolds with a spacious living room boasting stunning windows framing picturesque Santa Ynez Way. A formal dining room leads to a kitchen adorned with stainless steel appliances and a generous island, perfect for culinary endeavors. Comfortable bedrooms and updated bathrooms provide modern convenience, while gleaming hardwood floors, a captivating barrel ceiling, moldings, and a cozy fireplace evoke classic warmth throughout. The home also features leaded windows, charming alcoves, and French doors that lead to a serene backyard to relax or entertain. Additional highlights include a spacious laundry room with ample storage, a basement for added storage, a large attic space and a detached oversized garage. Nestled in desirable East Sacramento, this residence is minutes away from McKinley Park, renowned restaurants, quaint coffee shops, the vibrant nightlife of Midtown, and essential amenities like hospitals, shopping, and markets. Don't miss out on experiencing the allure of this exceptional home, a perfect blend of historic charm and modern comfort in sought after East Sac.",,6.0,$588,,100.0,100.0,For Sale,,Supra iBox,,$588.96,Assessor Auto-Fill,,CA,8/16/2024,One Story,,,Yes,,,0.0,,,,8/17/2024,Yes,Yes,Yes,Yes,,,,,95816 3419,R-1
ME222147541,SLD,13,627 44th St,,SACRAMENTO,9999,"$735,000","$725,000",DE,1280.0,3.0,2.0,0.0,,1.0,1920.0,0.124000,"5,401",,,"LIKE-NEW!!Nestled Right in the heart of East Sacramento. Nothing's left untouched in this charming 3 bedroom 2 bath single story home with all new electrical, all new plumbing, new roof, new landscaping, kitchen, floors walls, and so much more. Did we mention the BRAND NEW oversized garage with abundant storage for all of your holiday decorations & hobbies-PERFECT option to convert to an ADU for additional income or living space. A head to toe remodel giving you BRAND NEW in a well established neighborhood, the best of both worlds! Enjoy entertaining your guests while cooking in the open concept kitchen. When your day is done make your way into the cozy master suite, tucked away from the rest of the home. Then head outback & relax under the covered patio & shade trees in the serene yard while watching the kids play. A home with so much to offer and waiting for the next family to make it their own. Come see it today.... priced to sell!!",,,0.0,,,,,,,0.00,0,,No,103.0,,,,004-0301-025-0000,0,,Datashare MetroList,,,,01460174,01902860,2.0,,RESIDENTIAL,,1/25/2023,,,,,,,"Please contact Janelle Williams with questions 916-833-2227. Lockbox on the right of the front door on spigot. Maintenance box code is 2021. The owner, Bobby Peterson, is a licensed realestate agent Lic.01975523. Listing agent is member on seller's real estate team.",Sacramento,F St.,13,14,14,"Get on I-80 W. Take Exit 86, I-5 S and CA-99 S/I-8",,,,,,,,,,6067.0,0.0,,,,12/22/2022,,,No,,,,,,1/25/2023,Conventional,12/8/2022 4:00 PM,$574,2072535.0,12/9/2022,,,995131.0,Full Service,Excl Right,Market Listing,,,,1.0,,,,Vacant,12/22/2022,,0,,,,,222147541,,"$735,000",,12/22/2022,,,,30,,No,,,"$725,000",,$566.41,Janelle Williams,916-833-2227,,560454896.0,"LIKE-NEW!!Nestled Right in the heart of East Sacramento. Nothing's left untouched in this charming 3 bedroom 2 bath single story home with all new electrical, all new plumbing, new roof, new landscaping, kitchen, floors walls, and so much more. Did we mention the BRAND NEW oversized garage with abundant storage for all of your holiday decorations & hobbies-PERFECT option to convert to an ADU for additional income or living space. A head to toe remodel giving you BRAND NEW in a well established neighborhood, the best of both worlds! Enjoy entertaining your guests while cooking in the open concept kitchen. When your day is done make your way into the cozy master suite, tucked away from the rest of the home. Then head outback & relax under the covered patio & shade trees in the serene yard while watching the kids play. A home with so much to offer and waiting for the next family to make it their own. Come see it today.... priced to sell!!",,,$566,,98.0,98.0,For Sale,,Leave Card,,$566.41,Assessor Auto-Fill,,CA,1/25/2023,One Story,,,Yes,,,0.0,,,,1/26/2023,Yes,Yes,Yes,Yes,,,,,95819 3117,SFR
