MLS No,Status,DOM,Address,Unit,City,Area,LP,SP,BT,SqFt,BR,Bth,PB,Gar,GarSp,YrBlt,Acres,Lot SqFt,HOA Fee,Freq,3rd Party Synd. Remarks,ADU Baths Full,ADU Baths Partial,ADU Bedrooms,ADU Building Type,ADU Description,ADU Kitchen,ADU Main Entry Floor,ADU Meter,ADU Occupied,ADU Rents For,ADU Sq. Ft.,ADU SqFt Source,ADU Y/N,Age,Agent Has Ownership,Agent Hit Count,Agent Related to Principal,Assessors Parcel No,Associated Document Count,Available to Show,Board ID,Branded Media Link,Branded Media Link 2,Builder/Architect,Buyer Agent DRE Num.,Buyer Broker DRE Number,Census Tract,City Transfer Tax,Class,Client Hit Count,Closing Date,Co Buy Agent DRE Num.,Co List Agent DRE Num.,Co-List Agent email,Co-List Agent Fax,Complex Name,Concessions at COE,Confidential Remarks,County,Cross Street,Cumulative DOM,Cumulative DOMLS,Days On MLS,Directions to Property,Disclosures Link,Dist/Nbrhood/Sub,Elementary School Distric,Entry Agent First Name,Entry Agent ID,Entry Agent Last Name,Entry Agent License ID,Expire Date,Filtered Address,FIPS Code,Fireplaces,Floor Unit is on,Foreclosure Status,Gate Code,General Date,Geocode Quality,High School District,HOA,HOA Management Companies,HOA Name,HOA Name (Other),HOA Phone,Homesnap Appt. Scheduling,Hotsheet Date,How Sold,Input Date,List $/SqFt,List Agent DRE Num.,List Date,Listing Agt email,Listing Agt Fax,Listing Broker DRE Number,Listing Service,Listing Type,Listing Visibility Type,Lockbox Location,Model,New Subdivision,Number of offers,Occpnt Req 24 Hr Notice,Occupant Name,Occupant Phone,Occupied By,Off Market Date,Old Complex,Old Concessions,Old Elem,Old High,Old HOA Name,Old Middle,Old MLS #,Old Subdivision,Original Price,Ownership Type,Pending Date,Pending Litigation,Percent Owner Occ,Photo Permission,Picture Count,Point of Sale Ordinance,Pool,Preferred Agent Fax,Previous Price,Price,Price Date,Price Per SQFT,Primary Showing Contact,Primary Showing Phone,Printed Neighborhood Rpt,Property ID,Public Remarks,Radar ID,Rooms Total,Sale $/SqFt,Sale COOP,Sale/Last List $,Sale/Original $,Sale/Rent,Sales Office Info Remarks,Showing Instruction,Showing Schedule Link,Sold Price Per SQFT,Source,Special Information,State,Status Date,Stories,Subdivision (Other),Subdivision Profile Rmks,Supra Box?,Tax ID,TIC % Owner Offered,Total # of Garage and Parking Spaces,Unbranded Media Link,Unbranded Media Link 2,Units in Complex,Update Date,VOW Address,VOW AVM,VOW Comment,VOW Include,WiFi Last,ZIDX Only House #,ZIDX Only Street Dir,ZIDX Only Street Name,Zip,Zoning
41050574,SLD,3,6539 Whitney St,,OAKLAND,9999,"$1,425,000","$1,900,000",DE,2250.0,4.0,2.0,1.0,Y,1.0,1922.0,0.090000,"3,780",,,"Claudia Mills - 510-350-6419 - Nestled on a tranquil street in Oakland's vibrant Berkeley border, this 1922 craftsman gem was meticulously renovated in 2015. With 4 bedrooms, 2.5 baths, and a blend of historic charm and modern amenities, it's a perfect fusion of old and new. Upon entering, you are greeted by an open-plan living, kitchen, and dining area that seamlessly connects. The kitchen boasts a charming peninsula and rustic island, perfect for hosting. Also on this level is a bedroom, powder room, laundry closet, and family room. Up the grand staircase, discover two more bedrooms and a full bath. The primary ensuite is a luxurious retreat with corner windows, dual closets, and a spa-like bathroom featuring a freestanding tub, double vanity, walk-in shower, and private water closet. The fenced garden offers wood benches and a covered outdoor area. An automatic gate leads to a spacious garage with an opener. Located close to cafes and restaurants on Shattuck Ave, including favorites like Nick's Pizza and Nomad Cafe, and with Ashby BART and easy freeway access to San Francisco nearby, you have the Bay Area at your fingertips. 6539 Whitney St seamlessly merges form and function, offering a lifestyle that is both sophisticated and comfortable.",,,,,,,,,,,,,No,102.0,No,,No,16-1429-9,0,,Bridge AOR,,,,02017063,01989146,,Yes,RESIDENTIAL,,4/11/2024,,,,,,,Seller accepted a preemptive offer. ,Alameda,65th St,3,30,30,Use GPS,,BERKELEY BORDER,Oakland (510) 879-8111,,,,,,,6001.0,1.0,,,,3/22/2024,,Oakland (510) 879-8111,No,,,,,,4/12/2024,Conventional,2/21/2024 6:25 PM,$633,01881682,3/19/2024,,,2029039.0,Full Service,Excl Right,Market Listing,,Craftsman,,1.0,No,,,Vacant,3/22/2024,,none,,,,,41050574,,"$1,425,000",,3/22/2024,,,,1,Yes,No,,"$1,425,000","$1,900,000",4/12/2024,$844.44,Claudia Mills,(510) 350-6419,Yes,,"Nestled on a tranquil street in Oakland's vibrant Berkeley border, this 1922 craftsman gem was meticulously renovated in 2015. With 4 bedrooms, 2.5 baths, and a blend of historic charm and modern amenities, it's a perfect fusion of old and new. Upon entering, you are greeted by an open-plan living, kitchen, and dining area that seamlessly connects. The kitchen boasts a charming peninsula and rustic island, perfect for hosting. Also on this level is a bedroom, powder room, laundry closet, and family room. Up the grand staircase, discover two more bedrooms and a full bath. The primary ensuite is a luxurious retreat with corner windows, dual closets, and a spa-like bathroom featuring a freestanding tub, double vanity, walk-in shower, and private water closet. The fenced garden offers wood benches and a covered outdoor area. An automatic gate leads to a spacious garage with an opener. Located close to cafes and restaurants on Shattuck Ave, including favorites like Nick's Pizza and Nomad Cafe, and with Ashby BART and easy freeway access to San Francisco nearby, you have the Bay Area at your fingertips. 6539 Whitney St seamlessly merges form and function, offering a lifestyle that is both sophisticated and comfortable. ",,10.0,$844,,133.0,133.0,For Sale,,Call Claudia to show.,,$844.44,Public Records,,CA,4/12/2024,Two Story,,,No,16-1429-9,,,,,,4/12/2024,Yes,Yes,Yes,Yes,,6539.0,,Whitney St,94609,
41033778,SLD,13,446 59Th St,,OAKLAND,9999,"$1,050,000","$1,435,000",DE,1018.0,3.0,1.0,0.0,N,1.0,1902.0,0.090000,"4,000",,,"Norah Brower - Agt: 510-703-6934 - This updated 1902 Craftsman maintains the charm of yesteryear with details like leaded glass cabinets, original wainscotting and built-in window seating with bench storage, but with many modern conveniences. Most notably among them, a new foundation and seismic retrofit, updated kitchen, stainless steel appliances, updated bath and a large basement area with laundry and utility sink. Off-street parking for several cars. This sunlit beauty has warm oak floors and fantastic indoor/outdoor flow. The garden deck off the kitchen is perfect for evening parties or summer afternoon lunches. Sit on the front porch and watch people and their canine companions walk the wide dreamy tree-lined street to nearby shops and cafes on College and Telegraph in Elmwood, Rockridge, Temescal and surrounds. Easy commutes with Rockridge BART, Highway 24, Transbay Bus line E with zero stops and WiFi!",,,,,,,,,,,,,,121.0,,,,16-1396-10,0,,Bridge AOR,,,,018962909,01521930,,Yes,RESIDENTIAL,,8/15/2023,,2086148.0,,,,,"Open Sun. July 23rd & 30th, 2023, 2 - 4 pm. Sq.footage & bed/bath count not verified or guaranteed by seller or listing agents. Pre-escrow with Placer Title #P-595225. Offers 8-2-23 by 2 pm.",Alameda,Howell,13,13,13,Telegraph east on 59th,,NORTH OAKLAND,,,,,,,,6001.0,1.0,,,,8/2/2023,,,No,,,,,,8/15/2023,Conventional,7/20/2023 7:51 PM,"$1,031",1197240,7/20/2023,,,01527235,Full Service,Excl Right,Market Listing,Faucet on driveway,Craftsman,,5.0,No,,,Vacant,8/2/2023,,none,,,,,41033778,,"$1,050,000",,8/2/2023,,,,42,Yes,No,,"$1,050,000","$1,435,000",8/15/2023,"$1,409.63",,,No,,"This updated 1902 Craftsman maintains the charm of yesteryear with details like leaded glass cabinets, original wainscotting and built-in window seating with bench storage, but with many modern conveniences. Most notably among them, a new foundation and seismic retrofit, updated kitchen, stainless steel appliances, updated bath and a large basement area with laundry and utility sink. Off-street parking for several cars. This sunlit beauty has warm oak floors and fantastic indoor/outdoor flow. The garden deck off the kitchen is perfect for evening parties or summer afternoon lunches. Sit on the front porch and watch people and their canine companions walk the wide dreamy tree-lined street to nearby shops and cafes on College and Telegraph in Elmwood, Rockridge, Temescal and surrounds. Easy commutes with Rockridge BART, Highway 24, Transbay Bus line E with zero stops and WiFi!",,5.0,"$1,410",,137.0,137.0,For Sale,,Lockbox on faucet in driveway,,"$1,409.63",Assessor Auto-Fill,,CA,8/15/2023,One Story,,,Yes,16-1396-10,,1.0,https://www.446-59thstreet.com,,,8/16/2023,Yes,Yes,Yes,Yes,,446.0,,59Th St,94609,
41012673,SLD,49,5833 Ayala Ave,,OAKLAND,9999,"$2,500,000","$2,510,000",DE,2265.0,4.0,3.0,1.0,Y,1.0,1911.0,0.090000,"4,000",,,"Norah Brower - Agt: 510-703-6934 - TRANSPARENT PRICE. LOWER ROCKRIDGE: SLEEK & BEAUTIFULLY REBUILT.  Another chance to live in this house that has it all! Completely renovated in 2019 from the foundation up. A kitchen designed for family or entertaining with equal elegance, the accordion doors open up to the deck and garden. Work from home with built-in office space. Relax in the new sauna, then rinse off in the outdoor shower. Enjoy film night on the lawn with an outdoor screen. Garage conversion to rec. space can flex between a gym or playspace for young kids. Tesla charger, 2-zone system radiant heat & new top notch appliances throughout. The flow and organization of space is unparalleled, w/one full bedroom and bath on the ground floor. Original character shines with charming details such as a wrap-around porch, handsome eaves & a wide walkway. Redesigned w/an abundance of functional & esthetic aspects. The corner lot orientation allows natural light to flood through the numerous mahogany windows. A bed. & bath on the main level & 3+ bds. 2ba upstairs, which includes a generous main suite. A 1/2  bath in the garage / rec space. Perfect for commuters - close to BART, freeway & all the amenities of Rockridge.  * Open House Sunday, Jan. 29th, 2 - 4 pm.",,,,,,,,,,,,,,112.0,,,,16-1398-12,0,,Bridge AOR,http://www.5833Ayala.com,https://my.matterport.com/show/?m=GUEnJE47FMc,Next Level,01891381,02060530,,Yes,RESIDENTIAL,,2/21/2023,,2086148.0,,,,,"Sq.ft. as per architectural plans and are not verified by seller or listing agents. Sidewalk & sewer compliant.  Transparent price. Just go anytime. Broker's tour Jan. 26th, 10 am - 1 pm.",Alameda,Howell,49,49,49,"Telegraph, McCauley, Howell",,LOWER ROCKRIDGE,Oakland (510) 879-8111,,,,,,,6001.0,1.0,,,,1/27/2023,,Oakland (510) 879-8111,No,,,,,,2/22/2023,Conventional,10/26/2022 1:50 PM,"$1,104",1197240,10/26/2022,,,1197240.0,Full Service,Excl Right,Market Listing,Railing on porch,Craftsman,,1.0,No,,,Vacant,1/27/2023,,none,,,,,41012673,,"$2,395,000",,1/27/2023,,,,60,Yes,No,,"$2,395,000","$2,510,000",2/22/2023,"$1,108.17",Norah Brower,510.703.6934,No,,"TRANSPARENT PRICE. LOWER ROCKRIDGE: SLEEK & BEAUTIFULLY REBUILT.  Another chance to live in this house that has it all! Completely renovated in 2019 from the foundation up. A kitchen designed for family or entertaining with equal elegance, the accordion doors open up to the deck and garden. Work from home with built-in office space. Relax in the new sauna, then rinse off in the outdoor shower. Enjoy film night on the lawn with an outdoor screen. Garage conversion to rec. space can flex between a gym or playspace for young kids. Tesla charger, 2-zone system radiant heat & new top notch appliances throughout. The flow and organization of space is unparalleled, w/one full bedroom and bath on the ground floor. Original character shines with charming details such as a wrap-around porch, handsome eaves & a wide walkway. Redesigned w/an abundance of functional & esthetic aspects. The corner lot orientation allows natural light to flood through the numerous mahogany windows. A bed. & bath on the main level & 3+ bds. 2ba upstairs, which includes a generous main suite. A 1/2  bath in the garage / rec space. Perfect for commuters - close to BART, freeway & all the amenities of Rockridge.  * Open House Sunday, Jan. 29th, 2 - 4 pm.",,11.0,"$1,108",LA & BA different company/franchise,100.0,105.0,For Sale,,Just go,,"$1,108.17",Measured,,CA,2/22/2023,Two Story,,,Yes,16-1398-12,,2.0,http://5833ayala.com/mls,https://my.matterport.com/show/?m=GUEnJE47FMc&mls=1,,2/23/2023,Yes,Yes,Yes,Yes,,5833.0,,Ayala Ave,94609,
41021605,SLD,53,5935 Whitney St,,OAKLAND,9999,"$1,995,000","$2,100,000",DE,3241.0,5.0,4.0,1.0,N,0.0,1905.0,0.1,"4,280",,,"Faye Keogh - Cell: 510-220-6373 - Move right into this turnkey, light-filled contemporary North Oakland/Bushrod home.  Completely redesigned and upgraded in 2018/2019, the residence features a 2 story, 4 bed/3.5 bath house with a 1bed/1bath ADU.  The main house has an open floorplan with living/dining area, large kitchen/great room combo with soaring ceilings and ample windows. Perfectly laid out for large gatherings with great indoor/outdoor access via sliding doors to a deck leading down to a garden with lawn area, plantings, fountain, patio area, and ADU.  The main level has a den/library with wall of custom bookshelves/sliding ladder + an en-suite bedroom.  The chef’s kitchen has a large island, plenty of storage, and high end appliances.  The lower level has 3 bedrooms, incl. a primary suite with dual closets and luxurious bath.  The sitting area is perfect for a media room/play area.  2 rear BRs have large closets with built-ins & sliding doors that open onto the rear patio. Hall bath, laundry, utility space, lg storage area.  The ADU has 1BR+sitting area, full kitchen, & stylish bath.  Other upgrades include Tesla car charger, AC, Shade Store window coverings, A+ appliances incl. a Miele washer/ dryer and wine fridge. Quiet street, super convenient location, this amazing home awaits it’s new owners!",,,,,,,,,,,,,,118.0,,,,15-1371-6,0,,Bridge AOR,http://5935whitney.com,,,1986924.0,2029039.0,,Yes,RESIDENTIAL,,6/14/2023,,1394142.0,,,,, Call agents prior to showing.  ADU has 1BR/1BA.  SQFT of house and lot not verified or guaranteed by Listing Agent or Seller.,Alameda,60th,53,53,53,Shattuck > 60th > Whitney,,BUSHROD,Oakland (510) 879-8111,,,,,,,6001.0,1.0,,,,5/7/2023,,Oakland (510) 879-8111,No,,,,,,6/14/2023,Conventional,3/15/2023 3:34 PM,$616,1334075.0,3/15/2023,,,1170009.0,Full Service,Excl Right,Market Listing,,,,3.0,No,,,Call Agent,5/7/2023,,,,,,,41021605,,"$1,995,000",,5/7/2023,,,,50,Yes,No,,"$1,995,000","$2,100,000",6/14/2023,$647.95,,,Yes,,"Move right into this turnkey, light-filled contemporary North Oakland/Bushrod home.  Completely redesigned and upgraded in 2018/2019, the residence features a 2 story, 4 bed/3.5 bath house with a 1bed/1bath ADU.  The main house has an open floorplan with living/dining area, large kitchen/great room combo with soaring ceilings and ample windows. Perfectly laid out for large gatherings with great indoor/outdoor access via sliding doors to a deck leading down to a garden with lawn area, plantings, fountain, patio area, and ADU.  The main level has a den/library with wall of custom bookshelves/sliding ladder + an en-suite bedroom.  The chef’s kitchen has a large island, plenty of storage, and high end appliances.  The lower level has 3 bedrooms, incl. a primary suite with dual closets and luxurious bath.  The sitting area is perfect for a media room/play area.  2 rear BRs have large closets with built-ins & sliding doors that open onto the rear patio. Hall bath, laundry, utility space, lg storage area.  The ADU has 1BR+sitting area, full kitchen, & stylish bath.  Other upgrades include Tesla car charger, AC, Shade Store window coverings, A+ appliances incl. a Miele washer/ dryer and wine fridge. Quiet street, super convenient location, this amazing home awaits it’s new owners!  ",,10.0,$648,LA & BA different company/franchise,105.0,105.0,For Sale,,Call agents prior to showing,,$647.95,Measured,,CA,6/14/2023,Two Story,,,Yes,15-1371-6,,,http://5935whitney.com/mls,,,6/15/2023,Yes,No,No,Yes,,5935.0,,Whitney St,94609,
41026124,SLD,13,5970 Canning St,,OAKLAND,9999,"$2,050,000","$2,800,000",DE,2440.0,4.0,4.0,1.0,Y,1.0,1910.0,0.09,"4,000",,,"Claudia Mills - 510-350-6419 - Located on a quiet tree-lined street,  this stunning four-bedroom and four-and-a-half-bathroom property defines modern living. Newly renovated, the home has been thoughtfully modernized with state-of-the-art upgrades, stunning designer details, and bespoke custom features. The main level features an open concept great room, kitchen, and dining area out to garden, powder room, laundry room, office, and ensuite bedroom. The central staircase leads you upstairs where you will find the family room area with glass paneled door leading out to a sweet balcony and two additional ensuite bedrooms. Last but not least is the primary bedroom suite. With windows overlooking the back garden and bedside reading sconces, this room was made for lazy mornings in bed. The suite also features a large walk-in closet, but the spa-inspired bathroom truly makes the space feel like a retreat. Private gated driveway, garage with auto remote and stylish outdoor entertaining area with built in gas fire pit and lawn complete the property. Situated in one of the best locations in Rockridge, with College Avenue shopping, fine dining, schools, and transportation, 5970 Canning is an achievement of high-quality construction and artful design.",,,,,,,,,,,,,No,113.0,,,,16-1395-18,0,,Bridge AOR,,,Millennium,1395481.0,2027353.0,,Yes,RESIDENTIAL,,6/5/2023,,,,,,, Call Claudia with questions 510-350-6419.,Alameda,McAuley,13,13,13,McAuley to Canning,,ROCKRIDGE,Oakland (510) 879-8111,,,,,,,6001.0,0.0,,,,5/16/2023,,Oakland (510) 879-8111,No,,,,,,6/6/2023,Cash,5/3/2023 3:45 PM,$840,1881682.0,5/3/2023,,,2029039.0,Full Service,Excl Right,Market Listing,,Modern Craftsman,,5.0,No,,,Vacant,5/16/2023,,none,,,,,41026124,,"$2,050,000",,5/16/2023,,,,4,Yes,No,,"$2,050,000","$2,800,000",6/6/2023,"$1,147.54",Claudia Mills,510-350-6419,Yes,,"Located on a quiet tree-lined street,  this stunning four-bedroom and four-and-a-half-bathroom property defines modern living. Newly renovated, the home has been thoughtfully modernized with state-of-the-art upgrades, stunning designer details, and bespoke custom features. The main level features an open concept great room, kitchen, and dining area out to garden, powder room, laundry room, office, and ensuite bedroom. The central staircase leads you upstairs where you will find the family room area with glass paneled door leading out to a sweet balcony and two additional ensuite bedrooms. Last but not least is the primary bedroom suite. With windows overlooking the back garden and bedside reading sconces, this room was made for lazy mornings in bed. The suite also features a large walk-in closet, but the spa-inspired bathroom truly makes the space feel like a retreat. Private gated driveway, garage with auto remote and stylish outdoor entertaining area with built in gas fire pit and lawn complete the property. Situated in one of the best locations in Rockridge, with College Avenue shopping, fine dining, schools, and transportation, 5970 Canning is an achievement of high-quality construction and artful design.",,9.0,"$1,148",,137.0,137.0,For Sale,,,,"$1,147.54",Builder,,CA,6/6/2023,Two Story,,,No,16-1395-18,,4.0,,,,6/7/2023,Yes,Yes,Yes,Yes,,5970.0,,Canning St,94609,
41043644,SLD,25,560 57Th St,,OAKLAND,9999,"$1,075,000","$1,100,000",DE,1569.0,3.0,1.0,0.0,Y,2.0,1931.0,0.11,"4,600",,,"Derek Wagley - Agt: 925-451-6679 - Situated in one of North Oakland’s most desirable neighborhoods, it is the first time on the market for this classic Bushrod home.  The home sits on a large lot and features three bedrooms and one bathroom and offers great separation of space with a large living room and fireplace and separate formal dining room and breakfast nook. Period details are seen throughout with hardwood floors and numerous built-ins. Multiple usable bonus spaces will also be found in the home, most notably, the built out basement which serves as a large utility and laundry room, storage area, an extra room and bathroom, The primary bedroom of the home includes two very large walk-in closets. Detached multi car garage plus the long driveway allows for additional parking. Close proximity to Bushrod Park & tennis courts and Temescal and Rockridge shopping.",,,,,,,,,,,,,,93.0,No,,No,15-1277-52,0,,CONTRA COSTA,https://my.matterport.com/show/?m=Ere4dJJKzu3,,,01429857,01527235,,Yes,RESIDENTIAL,,1/19/2024,,,,,,,Agents: Please only lock the security gate. The main door has a different key not at property. Trust sale. Pre escrow with Old Republic Title Montclair. Bathroom count different than public record. There are a total of two full bathrooms.  Bonus room off utility room. See link to Matterport tour. Open Sat/Sun 1-4pm.,Alameda,Telegraph,25,58,58,Telegraph to 57th,,NORTH OAKLAND,,,,,,,,6001.0,1.0,,,,12/31/2023,,,No,,,,,,1/19/2024,Conventional,11/3/2023 9:22 AM,$685,01724531,12/6/2023,,,01359403,Full Service,Excl Right,Market Listing,driveway-window bar,,,3.0,No,,,Vacant,12/31/2023,,no,,,,,41043644,,"$1,075,000",,12/31/2023,,,,55,Yes,No,,"$1,075,000","$1,100,000",1/19/2024,$701.08,,,Yes,,"Situated in one of North Oakland’s most desirable neighborhoods, it is the first time on the market for this classic Bushrod home.  The home sits on a large lot and features three bedrooms and one bathroom and offers great separation of space with a large living room and fireplace and separate formal dining room and breakfast nook. Period details are seen throughout with hardwood floors and numerous built-ins. Multiple usable bonus spaces will also be found in the home, most notably, the built out basement which serves as a large utility and laundry room, storage area, an extra room and bathroom, The primary bedroom of the home includes two very large walk-in closets. Detached multi car garage plus the long driveway allows for additional parking. Close proximity to Bushrod Park & tennis courts and Temescal and Rockridge shopping.",,6.0,$701,LA & BA different company/franchise,102.0,102.0,For Sale,,Text agent 925-451-6679 and go,,$701.08,Public Records,Successor Trustee Sale,CA,1/19/2024,Three or More Stories,,,Yes,15-1277-52,,4.0,https://my.matterport.com/show/?m=Ere4dJJKzu3&brand=0,,,1/20/2024,Yes,Yes,Yes,Yes,,560.0,,57Th St,94609,
