41051158,SLD,13,544 57Th St,,OAKLAND,9999,"$1,249,000","$1,825,000",DE,1980.0,3.0,2.0,1.0,N,1.0,1932.0,0.100000,"4,280",,,"Anna V Bellomo - 510-417-9390 - Welcome to this 1930's Tudor in Idora Park, the site of the iconic amusement park of the same name established there in the 1900’s.As you enter through the formal foyer, you'll be greeted by an expansive living room with floor-to-ceiling windows and coved ceilings, a space that flows right into the formal dining room. The fully updated kitchen has a generous eat-in area, ample storage, and is conveniently open to the dining room. A powder room completes this level.Go down to  find the spacious family room that leads to a meticulously landscaped yard. On the upper level, two bedrooms share a tiled bathroom, while a few steps up reveal the primary bedroom with high ceilings, a modern en-suite bathroom, and ample closet space.The garage, equipped with custom-built-ins, provides interior access to the house.The outdoor space has it all: a grassy area, a stylish pergola, mature landscaping, a veggie garden, a charming firepit and a deck equipped with outdoor heaters—ideal for year-round entertainment. This home has undergone substantial upgrades and offers many “tech” features. Convenient to Temescal and Rockridge, this residence is perfectly located and has access to transportation (BART), cafes, restaurants, shopping and more.",,,,,,,,,,,,,No,92.0,No,,No,15-1277-48,0,,Bridge AOR,https://www.544-57th.com,,,01930373,0152735,,Yes,RESIDENTIAL,,3/29/2024,,,,,,,"There is NO ALARM, go right in. Sqft on MLS is derived from measurements and does not match public records. One bathroom added without permits. It seems this may be Peralta school, definitely check, not guaranteed. Open 02/29 for brokers, then Sat 03/02 and Sun 03/03. Offers on Tuesday March 12th.",Alameda,Shattuck Ave,13,13,13,Shattuck or Telegraph to 57th,,IDORA PARK,Oakland (510) 879-8111,,,,,,,6001.0,1.0,,,,3/12/2024,,Oakland (510) 879-8111,No,,,,,,3/29/2024,Conventional,2/28/2024 9:57 AM,$631,01822897,2/28/2024,,,02014153,Full Service,Excl Right,Market Listing,Front door,Storybook,,14.0,No,,,Vacant,3/12/2024,,Thank you Megan!,,,,,41051158,,"$1,249,000",,3/12/2024,,,,60,Yes,No,,"$1,249,000","$1,825,000",3/29/2024,$921.72,,,No,,"Welcome to this 1930's Tudor in Idora Park, the site of the iconic amusement park of the same name established there in the 1900’s. As you enter through the formal foyer, you'll be greeted by an expansive living room with floor-to-ceiling windows and coved ceilings, a space that flows right into the formal dining room.  The fully updated kitchen has a generous eat-in area, ample storage, and is conveniently open to the dining room. A powder room completes this level. Go down to  find the spacious family room that leads to a meticulously landscaped yard. On the upper level, two bedrooms share a tiled bathroom, while a few steps up reveal the primary bedroom with high ceilings, a modern en-suite bathroom, and ample closet space. The garage, equipped with custom-built-ins, provides interior access to the house. The outdoor space has it all: a grassy area, a stylish pergola, mature landscaping, a veggie garden, a charming firepit and a deck equipped with outdoor heaters—ideal for year-round entertainment. This home has undergone substantial upgrades and offers many “tech” features.  Convenient to Temescal and Rockridge, this residence is perfectly located and has access to transportation (BART), cafes, restaurants, shopping and more. ",,7.0,$922,LA & BA different company/franchise,146.0,146.0,For Sale,,There is NO ALARM!,,$921.72,Measured,,CA,3/29/2024,Two Story,,,Yes,15-1277-48,,,https://www.544-57th.com/mls/127695956,,,3/30/2024,Yes,Yes,Yes,Yes,,544.0,,57Th St,94609,
41066273,SLD,0,563 62Nd St,,OAKLAND,9999,"$900,000","$877,000",DE,1434.0,3.0,1.0,0.0,Y,1.0,1912.0,0.100000,"4,160",,,Tomaj Trenda - Agt: 415-505-3536 - Fixer. Needs everything. Bring your contractor.,,,,,,,,,,,,,No,112.0,No,,No,15-1376-39,0,,CONTRA COSTA,,,,01497085,02027353,,Yes,RESIDENTIAL,,7/24/2024,,,,,,,Fixer. No Showings. Call Agent for Details.,Alameda,Shattuck,0,0,0,Shattuck to 62nd,,N OAKLAND,,,,,,,,6001.0,1.0,,,,7/12/2024,,,No,,,,,,7/24/2024,Cash,7/12/2024 11:04 AM,$628,1497085.0,7/12/2024,,,2027353.0,Full Service,Excl Right,Market Listing,,,,2.0,No,,,Vacant,7/12/2024,,none,,,,,41066273,,"$900,000",,7/12/2024,,,,21,Yes,No,,"$900,000","$877,000",7/24/2024,$611.58,,,No,,Fixer. Needs everything. Bring your contractor.,,6.0,$612,,97.0,97.0,For Sale,,,,$611.58,Public Records,Probate Listing,CA,7/24/2024,One Story,,,No,15-1376-39,,,,,,7/24/2024,Yes,Yes,Yes,Yes,,563.0,,62Nd St,94609,
41064555,SLD,13,5775 Ayala Ave,,OAKLAND,9999,"$949,000","$1,150,000",DE,1034.0,2.0,2.0,0.0,N,1.0,1910.0,0.090000,"3,750",,,"Lauren McLane - Agt: 925-297-9226 - Fall in Love with Modern Comfort in this Oakland Gem!This captivating 2-bedroom, 2-bathroom home in Oakland isn't just a place to live, it's a feeling. Recently remodeled with a thoughtful blend of modern upgrades and cozy charm, this special home is ready to welcome you.Imagine unwinding in a light-filled living space, bathed in the warm glow of natural light. The updated kitchen will inspire your inner chef, boasting sleek countertops and stainless steel appliances. After a long day, retreat to one of the two tranquil bedrooms.This is your chance to live in an Oakland oasis.  Close proximity to Hwy 24 allowing quick access to the East Bay, downtown Oakland, or even downtown San Francisco makes it an ideal location. You're also a hop, skip, and a jump away from Berkeley!Don't miss out on the opportunity to make this special home yours. Contact us today!",,,,,,,,,,,,,,114.0,No,,No,14-1271-3,0,,CONTRA COSTA,,,,01234464,01234464,,Yes,RESIDENTIAL,,7/22/2024,,,,,,,"Supra is located on the gas meter - vacant, go show! Offers due by Friday, 7/5 at 12pm via disclosures.io. Please include signed disclosure cover sheet and POF/pre-approval.",Alameda,Martin St,13,13,13,Telegraph Avenue Exit to 57th St to Ayala Ave,,NORTH OAKLAND,,,,,,,,6001.0,1.0,,,,7/8/2024,,,No,,,,,,7/22/2024,Cash,6/25/2024 7:28 PM,$918,1955004.0,6/25/2024,,,1878277.0,Full Service,Excl Right,Market Listing,,,,4.0,No,,,Vacant,7/8/2024,,0,,,,,41064555,,"$949,000",,7/8/2024,,,,49,Yes,No,,"$949,000","$1,150,000",7/22/2024,"$1,112.19",,,Yes,,"Fall in Love with Modern Comfort in this Oakland Gem! This captivating 2-bedroom, 2-bathroom home in Oakland isn't just a place to live, it's a feeling. Recently remodeled with a thoughtful blend of modern upgrades and cozy charm, this special home is ready to welcome you.  Imagine unwinding in a light-filled living space, bathed in the warm glow of natural light. The updated kitchen will inspire your inner chef, boasting sleek countertops and stainless steel appliances. After a long day, retreat to one of the two tranquil bedrooms.  This is your chance to live in an Oakland oasis.  Close proximity to Hwy 24 allowing quick access to the East Bay, downtown Oakland, or even downtown San Francisco makes it an ideal location. You're also a hop, skip, and a jump away from Berkeley!  Don't miss out on the opportunity to make this special home yours. Contact us today!",,6.0,"$1,112",LA & BA different company/franchise,121.0,121.0,For Sale,,"Supra on hose bib. Vacant, go show!",,"$1,112.19",Public Records,,CA,7/22/2024,Two Story,,,Yes,14-1271-3,,,,,,7/23/2024,Yes,Yes,Yes,Yes,,5775.0,,Ayala Ave,94609,
SF423746420,SLD,13,5524 Vicente Way,,OAKLAND,9999,"$599,000","$785,000",DE,820.0,2.0,1.0,0.0,,0.0,1900.0,0.087200,"3,800",,,"This unique property is waiting for its next visionary owner! Consisting of three buildings on one lot, the main bungalow is super cute and offers 2 bedrooms (one of which has a lofted sleeping area), 1 full bath, formal living room and eat-in kitchen. The kitchen looks out over the lush, tranquil gardens that includes many types of Fuchsia, Calla lilies, variety of succulents, alstroemeria, many tea roses, Sweetheart'' rambling rose, nasturtium, hyacinth, geranium, cymbidium, and Japanese Iris along with guava, lemon, apple, blackberry, cherry, nectarine and plum trees/bushes. All on a fenced, private flat lot! The two other buildings located on the lot include a studio space and an office space. Well-located in the Temescal neighborhood with its charming shops and restaurants as well as the Rockridge-Temescal Greenbelt playground and creek. Transportation is a breeze with the Rockridge BART station within walking distance and easy access to Highway 24. Walk score = 94. Bike score = 94.",,,,,,,,,,0.00,0,,,123.0,,,,014-1228-010,0,Contact Listing Agent,Datashare San Francisco,,,,01370959,00625769,0.00,,RESIDENTIAL,,7/12/2023,,,,,,,The legality of the two external buildings (aka the studio space and the office space) is unwarranted. Pre-escrow #FWAC-5852301011 opened with Chicago Title. Contact Alex Gonzalez at 510-350-0979 or alex.gonzalez@ctt.com. Contact listing agent with any questions.,Alameda,Claremont Ave,13,14,14,Access Vicente Way from Claremont Ave.,,,,,,,,,,6001.0,0.0,,,,6/15/2023,,,No,,,,,,7/12/2023,Conventional,6/1/2023 5:00 PM,$730,1407927,6/2/2023,,,1834648.0,Full Service,Excl Right,Market Listing,Front door of main b,,,0.0,,,,Vacant,6/15/2023,,0,,,,,423746420,,"$599,000",,6/15/2023,,,,50,,,,,"$785,000",,$957.32,,,,530627634.0,"This unique property is waiting for its next visionary owner! Consisting of three buildings on one lot, the main bungalow is super cute and offers 2 bedrooms (one of which has a lofted sleeping area), 1 full bath, formal living room and eat-in kitchen. The kitchen looks out over the lush, tranquil gardens that includes many types of Fuchsia, Calla lilies, variety of succulents, alstroemeria, many tea roses, Sweetheart'' rambling rose, nasturtium, hyacinth, geranium, cymbidium, and Japanese Iris along with guava, lemon, apple, blackberry, cherry, nectarine and plum trees/bushes. All on a fenced, private flat lot! The two other buildings located on the lot include a studio space and an office space. Well-located in the Temescal neighborhood with its charming shops and restaurants as well as the Rockridge-Temescal Greenbelt playground and creek. Transportation is a breeze with the Rockridge BART station within walking distance and easy access to Highway 24. Walk score = 94. Bike score = 94.",,4.0,$957,,131.0,131.0,For Sale,,Appointment Only,,$957.32,Graphic Artist,Offer As Is,CA,7/12/2023,,,,Yes,,,1.0,,,,7/12/2023,Yes,No,No,Yes,,,,,94609,
41019347,SLD,13,471 North St,,OAKLAND,9999,"$1,025,000","$1,525,000",DE,1421.0,2.0,1.0,0.0,N,0.0,1914.0,0.100000,"4,160",,,"Scott Ward - Agt: 415-225-4593 - Supremely cute and quintessential two bedroom Bungalow in lower Rockridge. Brimming with period details such as; box beam ceilings, picture rails, clinker brick fireplace, built-in shelving, hardwood floors, clawfoot tub, and tall baseboards. Light filled throughout – formal dining area flows into kitchen. Spacious bedrooms both have ample closet space. Large eat-in kitchen has a bank of west facing windows. French doors from kitchen open onto deck and charming south facing yard with a grassy area, and a  lovely birch tree. The rest of the yard is flush with both native and mature plantings. The separate pebble patio area is an ideal spot for outdoor dining. Additionally there is a fantastic, detached studio (permitted) with wood flooring and handsome double doors -  functions as a great retreat spot – perfect for the home office AND music/creative space as it is comprised of two rooms. The long driveway can hold multiple cars but given the prime location you may not need one. 471 North is nestled at the end of a cul de sac- adjacent to Peralta Elementary. A short stroll takes you to the Oakland section of College Ave – home to fine dining, a butcher shop, grocery stores, bespoke coffee spots and other uber convenient commerce. 100 Walkscore 89 Bikescore Open 2/26 2-4:30",,,,,,,,,,,,,,109.0,,,,16-1391-29,0,,Bridge AOR,,,Charming,02000963,619098.0,,Yes,RESIDENTIAL,,3/17/2023,,,,,,,"Open Broker Tour 2/23, 10-12:30 PM. Open Sunday 2/26, 2:00-4:30 PM. Sewer lateral and Sidewalk OK. Studio built with permit.  Bedroom, bathroom, SQF, Room count etc. may be different than public records, buyer to verify. All Q's please call Scott, 415-225-4593 OFFER DATE - 2/28 by 1:00 PM Please submit offers via IO platform.",Alameda,Telegraph,13,13,13,North on Telegraph east on North,,LOWER ROCKRIDGE,,,,,,,,6001.0,1.0,,,,2/28/2023,,,No,,,,,,3/17/2023,Conventional,2/15/2023 5:27 PM,$721,01490471,2/15/2023,,,619098.0,Full Service,Excl Right,Market Listing,Gas Line,Well Made,,9.0,No,,,Vacant,2/28/2023,,none,,,,,41019347,,"$1,025,000",,2/28/2023,,,,44,Yes,No,,"$1,025,000","$1,525,000",3/17/2023,"$1,073.19",,,No,,"Supremely cute and quintessential two bedroom Bungalow in lower Rockridge. Brimming with period details such as; box beam ceilings, picture rails, clinker brick fireplace, built-in shelving, hardwood floors, clawfoot tub, and tall baseboards. Light filled throughout – formal dining area flows into kitchen. Spacious bedrooms both have ample closet space. Large eat-in kitchen has a bank of west facing windows. French doors from kitchen open onto deck and charming south facing yard with a grassy area, and a  lovely birch tree. The rest of the yard is flush with both native and mature plantings. The separate pebble patio area is an ideal spot for outdoor dining. Additionally there is a fantastic, detached studio (permitted) with wood flooring and handsome double doors -  functions as a great retreat spot – perfect for the home office AND music/creative space as it is comprised of two rooms. The long driveway can hold multiple cars but given the prime location you may not need one. 471 North is nestled at the end of a cul de sac- adjacent to Peralta Elementary. A short stroll takes you to the Oakland section of College Ave – home to fine dining, a butcher shop, grocery stores, bespoke coffee spots and other uber convenient commerce. 100 Walkscore 89 Bikescore Open 2/26 2-4:30",,6.0,"$1,073",LA & BA same company different office,149.0,149.0,For Sale,,,,"$1,073.19",Measured,,CA,3/17/2023,One Story,,,Yes,16-1391-29,,1.0,,,,3/18/2023,Yes,Yes,Yes,Yes,,471.0,,North St,94609,
41020466,SLD,9,466 NORTH St,,OAKLAND,9999,"$1,049,000","$1,550,000",DE,1252.0,2.0,1.0,0.0,Y,1.0,1915.0,0.110000,"4,590",,,"MADELINE LILLEY - 510-919-8997 - Nestled at the end of a cul-de-sac in Rockridge’s Fairview Park neighborhood sits this chic 1915 bungalow sporting a fresh new look! This spacious floorplan includes a bonus home office in the front (or future 2nd bathroom), generous living and dining rooms with craftsman detailing, a private hallway separating the 2 bedrooms and bathroom from the rest of the home, and a large, sunny eat-in kitchen overlooking the garden. Ample storage is provided in the various built-in cabinets, large closets, a partial basement, plus a detached garage AND storage shed! The roomy lot provides a multitude of outdoor spaces: a big deck off the kitchen, a flagstone patio with path to the garage/studio space, a small seating pergola, a large brick patio, and a HUGE side yard adorned with cafe lights and beautiful plantings! Pétanque anyone? The vibe here is a mashup of vintage charm meets today’s designer styling, and the result is refreshingly soulful. Walkscore 100!! Close to Peralta Elementary, La Farine, Wood Tavern, Cole Coffee, Boichik Bagels and so much more.",,,,,,,,,,,,,No,108.0,,,,16-1391-30,0,,Bridge AOR,https://my.matterport.com/show/?m=eZvGxBkc5z6&mls=1,https://www.466north.com,,01433093,1527235.0,,Yes,RESIDENTIAL,,3/29/2023,,,,,,,"**OFFER Date CHANGE**: Seller is kindly requesting offers by this FRI 3/10 at 10:30am. Sq footage on tax records is 1238 sq feet, prop measured 1252 which does not include the garage 221 sq ft, the partial basement 137 sq ft, or the detached storage shed 129 sq ft. Sewer and sidewalk are not in compliance, see bids in packet. More photos available at 466north.com. Disclosures link: https://app.disclosures.io/link/466-North-Street-ryu2phg6",Alameda,Telegraph,9,9,9,Telegraph -> North,,LOWER ROCKRIDGE,,,,,,,,6001.0,0.0,,,,3/10/2023,,,No,,,,,,3/29/2023,Conventional,3/1/2023 4:36 PM,$838,01919653,3/1/2023,,,619098.0,Full Service,Excl Right,Market Listing,Front door,Cul-de-sac Cutie!,,2.0,No,,,Vacant,3/10/2023,,,,,,,41020466,,"$1,049,000",,3/10/2023,,,,50,Yes,No,,"$1,049,000","$1,550,000",3/29/2023,"$1,238.02",,,Yes,,"Nestled at the end of a cul-de-sac in Rockridge’s Fairview Park neighborhood sits this chic 1915 bungalow sporting a fresh new look! This spacious floorplan includes a bonus home office in the front (or future 2nd bathroom), generous living and dining rooms with craftsman detailing, a private hallway separating the 2 bedrooms and bathroom from the rest of the home, and a large, sunny eat-in kitchen overlooking the garden. Ample storage is provided in the various built-in cabinets, large closets, a partial basement, plus a detached garage AND storage shed! The roomy lot provides a multitude of outdoor spaces: a big deck off the kitchen, a flagstone patio with path to the garage/studio space, a small seating pergola, a large brick patio, and a HUGE side yard adorned with cafe lights and beautiful plantings! Pétanque anyone? The vibe here is a mashup of vintage charm meets today’s designer styling, and the result is refreshingly soulful. Walkscore 100!! Close to Peralta Elementary, La Farine, Wood Tavern, Cole Coffee, Boichik Bagels and so much more.",,5.0,"$1,238",LA & BA different company/franchise,148.0,148.0,For Sale,,Go Show!,,"$1,238.02",Measured,,CA,3/29/2023,One Story,,,Yes,16-1391-30,,1.0,https://www.466north.com/mls,,,3/30/2023,Yes,Yes,Yes,Yes,,466.0,,NORTH St,94609,
41039001,SLD,33,5638 Oak Grove Ave.,,OAKLAND,9999,"$1,595,000","$1,900,000",DE,2493.0,3.0,3.0,,N,0.0,1916.0,0.100000,"4,264",,,"Noreen Sanders - 510-502-1978 - New Price! Super roomy traditional home in prime Rockridge. Welcome to your forever home with space for everyone. The Smith family enjoyed 50 wonderful years on this leafy street. Classic details meet modern updates. Enjoy great flow with open floor plan and tall ceilings. The gracious living room centers around an impressive fireplace. Host large gatherings in the oversized formal dining room with coffered ceilings, wainscoting and plate moulding. The spacious, light-filled den includes a closet which could be configured into a bedroom if needed on the main floor with an adjacent full bathroom. A grand staircase leads to 3 generously-sized bedrooms and 2 updated baths. Enormous primary suite includes a relaxing lounge/office area and a surprisingly spacious bathroom with double sinks. The backyard is fenced-in and ready to create your garden oasis. Driveway fits 4 cars. Friendly sidewalk traffic on the wide tree-lined street includes strollers, TJ's shoppers and Kevin the resident peacock. Live close to all that Rockridge offers including easy SF BART commutes, great schools with outstanding shops and restaurants at your fingertips.",,,,,,,,,,,,,No,107.0,,,,,0,,Bridge AOR,https://vimeo.com/863062901?h=7c931088e0,,,02019343,1527235.0,,Yes,RESIDENTIAL,,11/13/2023,,,,,,,Alarm is on. Square footage derived from appraisal and differs from county records. Offer date: Tuesday 10/17 by 3pm.,Alameda,College,33,33,33,College or Forest to Oak Grove,,ROCKRIDGE,Oakland (510) 879-8111,,,,,,,6001.0,1.0,,,,10/18/2023,,Oakland (510) 879-8111,No,,,,,,11/13/2023,Conventional,9/13/2023 2:13 PM,$640,1707067.0,9/13/2023,,,619098.0,Full Service,Excl Right,Market Listing,Gas meter in front,Classic Rockridge,,2.0,No,,,Vacant,10/18/2023,,none,,,,,41039001,,"$1,729,000",,10/18/2023,,,,48,Yes,No,,"$1,729,000","$1,900,000",11/13/2023,$762.13,Noreen Sanders,510-502-1978,Yes,,"New Price! Super roomy traditional home in prime Rockridge. Welcome to your forever home with space for everyone. The Smith family enjoyed 50 wonderful years on this leafy street. Classic details meet modern updates. Enjoy great flow with open floor plan and tall ceilings. The gracious living room centers around an impressive fireplace. Host large gatherings in the oversized formal dining room with coffered ceilings, wainscoting and plate moulding. The spacious, light-filled den includes a closet which could be configured into a bedroom if needed on the main floor with an adjacent full bathroom. A grand staircase leads to 3 generously-sized bedrooms and 2 updated baths. Enormous primary suite includes a relaxing lounge/office area and a surprisingly spacious bathroom with double sinks. The backyard is fenced-in and ready to create your garden oasis. Driveway fits 4 cars. Friendly sidewalk traffic on the wide tree-lined street includes strollers, TJ's shoppers and Kevin the resident peacock. Live close to all that Rockridge offers including easy SF BART commutes, great schools with outstanding shops and restaurants at your fingertips.",,7.0,$762,LA & BA different company/franchise,119.0,110.0,For Sale,,Shows beautifully!,,$762.13,Appraisal,,CA,11/13/2023,Two Story,,,Yes,,,4.0,,,,11/14/2023,Yes,Yes,Yes,Yes,,5638.0,,Oak Grove Ave.,94618,
41036800,SLD,0,6110 Canning St,,OAKLAND,9999,"$2,800,000","$2,800,000",DE,2193.0,4.0,3.0,0.0,Y,1.0,1910.0,0.090000,"4,000",,,"Claudia Mills - 510-350-6419 - In a terrific Rockridge location this fully remodeled and expanded gracious home features open floor plan living, primary suite with deluxe ensuite and stylish Aqua Fire. Wall-to-wall accordion doors in the great room connects beautifully to the generous garden. Designer kitchen, bedroom, and full bath are also on this level. Up the stairs the bonus family room leads out to the balcony plus 2 bedrooms and bath in addition to the lux primary suite with walk-in closet and spa-inspired bath. Truly unique with all new systems and attached garage. Near shopping, Bart and schools.",,,,,,,,,,,,,No,113.0,,,,16-1393-27,0,,Bridge AOR,,,Millennium LV,1523160.0,02014153,,Yes,RESIDENTIAL,,8/22/2023,,,,,,,Added for comps only,Alameda,61st,0,0,0,Use GPS,,ROCKRIDGE,,,,,,,,6001.0,0.0,,,,8/22/2023,,,No,,,,,,8/22/2023,Conventional,8/22/2023 11:30 AM,"$1,277",01881682,8/22/2023,,,2029039.0,Full Service,Excl Right,Market Listing,,,,1.0,No,,,Vacant,8/22/2023,,0,,,,,41036800,,"$2,800,000",,8/22/2023,,,,12,Yes,No,,"$2,800,000","$2,800,000",8/22/2023,"$1,276.79",,,Yes,,"In a terrific Rockridge location this fully remodeled and expanded gracious home features open floor plan living, primary suite with deluxe ensuite and stylish Aqua Fire. Wall-to-wall accordion doors in the great room connects beautifully to the generous garden. Designer kitchen, bedroom, and full bath are also on this level. Up the stairs the bonus family room leads out to the balcony plus 2 bedrooms and bath in addition to the lux primary suite with walk-in closet and spa-inspired bath. Truly unique with all new systems and attached garage. Near shopping, Bart and schools.",,8.0,"$1,277",,100.0,100.0,For Sale,,,,"$1,276.79",Builder,,CA,8/22/2023,Two Story,,,No,16-1393-27,,2.0,,,,8/22/2023,Yes,Yes,Yes,Yes,,6110.0,,Canning St,94609,
