41026415,SLD,13,3041 Fulton Street,,BERKELEY,9999,"$1,295,000","$1,845,000",DE,1760.0,3.0,3.0,0.0,Y,1.0,1924.0,0.1,"4,250",,,"Sari C Cooper - 510-715-9807 - Welcome to 3041 Fulton! This dreamy property is located on a lovely street in the beautiful neighborhood of Lower Elmwood in Berkeley. Experience the elegant Craftsman-style home, spacious sun-filled backyard, and picturesque brown shingle cottage.  The handsome bungalow with period details boasts 2 bedrooms and 2 bathrooms, as well as a large office that is perfect for working from home, a basement and a garage. In the garden, you will find a charming brown shingle cottage containing 1 bedroom, 1 bathroom, a kitchen, a living room, and a pleasant outdoor patio. Imagine waking up in the morning and heading outside to enjoy this peaceful and sunny oasis! You'll find yourself immersed in a gardener's paradise filled with fruit trees, mature landscaping, and a deck that's perfect for entertaining. Imagine lounging in your own private outdoor wonderland as you gaze at blooming flowers all around you. Looking for relaxation? Gaze up at the stars as you take a dip in your own private hot tub",,,,,,,,,,,,,No,99.0,,,,52-1583-26,0,,Bridge AOR,,,, 00833300,1527235.0,,Yes,RESIDENTIAL,,5/26/2023,,,,,,,"Go show! Square footage source is public records, bath count from measured floor plan, bath count does not match public records. 2 units on public records, Buyer to verify. Previous tenant told seller this was a golden duplex, seller did not verify, buyer to verify.   Silver key is house key, gold key is cottage. Garage key looks like a bike lock key on a blue key chain in kitchen drawer. Garage interior open switch looks like a doorbell button on garage wall near house interior access.  Offer date Thursday 5/18 by 10am. No pre-emptives please. Seller intends a 1031 Exchange, buyer to cooperate. Disclosures: https://app.disclosures.io/link/3041-Fulton-Street-9iojbqrb Call Sari with questions 510-715-9807  Open Sat 2-4:30, Open Sun 1-4pm",Alameda,Prince Street,13,13,13,"Take Ashby to Fulton, Turn south on Fulton",,LOWER ELMWOOD,,,,,,,,6001.0,1.0,,,,5/18/2023,,,No,,,,,,5/26/2023,Cash,5/5/2023 2:33 PM,$736,02002965,5/5/2023,,,619098.0,Full Service,Excl Right,Market Listing,Hose Bib Right Side,,,6.0,No,,,Vacant,5/18/2023,,none,,,,,41026415,,"$1,295,000",,5/18/2023,,,,29,Yes,No,,"$1,295,000","$1,845,000",5/26/2023,"$1,048.30",Sari Cooper,510-715-9807,No,,"Welcome to 3041 Fulton! This dreamy property is located on a lovely street in the beautiful neighborhood of Lower Elmwood in Berkeley. Experience the elegant Craftsman-style home, spacious sun-filled backyard, and picturesque brown shingle cottage.  The handsome bungalow with period details boasts 2 bedrooms and 2 bathrooms, as well as a large office that is perfect for working from home, a basement and a garage. In the garden, you will find a charming brown shingle cottage containing 1 bedroom, 1 bathroom, a kitchen, a living room, and a pleasant outdoor patio. Imagine waking up in the morning and heading outside to enjoy this peaceful and sunny oasis! You'll find yourself immersed in a gardener's paradise filled with fruit trees, mature landscaping, and a deck that's perfect for entertaining. Imagine lounging in your own private outdoor wonderland as you gaze at blooming flowers all around you. Looking for relaxation? Gaze up at the stars as you take a dip in your own private hot tub",,9.0,"$1,048",LA & BA different company/franchise,142.0,142.0,For Sale,,Go Show!,,"$1,048.30",Public Records,,CA,5/26/2023,Two Story,,,Yes,,,1.0,,,,5/27/2023,Yes,Yes,Yes,Yes,,3041.0,,Fulton Street,94705,
41043680,SLD,34,5648 Oak Grove Ave,,OAKLAND,9999,"$1,295,000","$1,525,000",DE,2161.0,5.0,1.0,1.0,Y,1.0,1916.0,0.1,"4,200",,,"Daniel Stea - 510-843-6400 - Welcome to your forever home, a spacious and airy Craftsman nestled in the heart of Rockridge. The open and inviting living room welcomes you with a grand fireplace as its centerpiece, flanked by elegant built-in cabinetry. Transition seamlessly into the dining room adorned with an open-beam ceiling, a captivating space that's perfect for hosting large gatherings. Character abounds with charming wainscoting and original built-ins, adding a touch of timeless elegance to your dining experience. As you ascend the grand staircase, you'll discover 4 generously-sized bedrooms, each thoughtfully equipped with its own closet. The primary bedroom, awash in natural light, offers a peaceful garden view. This generously-sized primary suite goes beyond expectations, featuring an inviting lounge or office area for added relaxation. Outside, the wide tree-lined street sets the scene for friendly sidewalk activity, where strollers, Trader Joe's shoppers, and even Kevin, the resident peacock, contribute to the unique charm of this community. Living in this coveted Rockridge neighborhood means you'll relish an exceptional lifestyle with easy SF BART commutes, access to top-tier schools, and an abundance of nearby shops and restaurants offering everyday convenience and amenities at your fingertips.",,,,,,,,,,,,,No,107.0,,,,14-1266-31,0,,Bridge AOR,http://5648Oakgrove.com,,,01951068,01527235,,Yes,RESIDENTIAL,,12/22/2023,,,,,,,Offers as they come; Open Sunday from 2-4; Vacant and easy to show; Access disclosures & submit offers via HomeLight; Pre-escrow w/ Steve @ Placer Title in Berkeley; SF & bed/bath count may differ from public records and are not verified or guaranteed; PLENTY OF DEDICATED PARKING ON DRIVEWAY W/ SHARED INGRESS / EGRESS; BRAND NEW FOUNDATION & ROOF BUT DATED KITCHEN & BATHS READY FOR YOUR BUYER TO DREAM & DESIGN!; PRICED BELOW MARKET VALUE TO GENERATE INTEREST.,Alameda,College,34,34,34,College to Oak Grove,,ROCKRIDGE,,,,,,,,6001.0,1.0,,,,12/7/2023,,,No,,,,,,12/23/2023,Conventional,11/3/2023 12:36 PM,$599,01452156,11/3/2023,,,1452156.0,Full Service,Excl Right,Market Listing,Front door,,,3.0,No,,,Vacant,12/7/2023,,none,,,,,41043680,,"$1,295,000",,12/7/2023,,,,59,Yes,No,,"$1,295,000","$1,525,000",12/23/2023,$705.69,,,Yes,,"Welcome to your forever home, a spacious and airy Craftsman nestled in the heart of Rockridge. The open and inviting living room welcomes you with a grand fireplace as its centerpiece, flanked by elegant built-in cabinetry. Transition seamlessly into the dining room adorned with an open-beam ceiling, a captivating space that's perfect for hosting large gatherings. Character abounds with charming wainscoting and original built-ins, adding a touch of timeless elegance to your dining experience. As you ascend the grand staircase, you'll discover 4 generously-sized bedrooms, each thoughtfully equipped with its own closet. The primary bedroom, awash in natural light, offers a peaceful garden view. This generously-sized primary suite goes beyond expectations, featuring an inviting lounge or office area for added relaxation. Outside, the wide tree-lined street sets the scene for friendly sidewalk activity, where strollers, Trader Joe's shoppers, and even Kevin, the resident peacock, contribute to the unique charm of this community. Living in this coveted Rockridge neighborhood means you'll relish an exceptional lifestyle with easy SF BART commutes, access to top-tier schools, and an abundance of nearby shops and restaurants offering everyday convenience and amenities at your fingertips.",,7.0,$706,,118.0,118.0,For Sale,,,,$705.69,Public Records,,CA,12/23/2023,Two Story,,,Yes,14-1266-31,,2.0,https://www.zillow.com/view-imx/eed3509f-91dd-42a2-af24-bfe6e049ee65?setAttribution=mls&wl=true&initialViewType=pano&utm_source=dashboard,,,12/24/2023,Yes,Yes,Yes,Yes,,5648,,Oak Grove Ave,94618,
41068240,SLD,12,678 62Nd St,,OAKLAND,9999,"$1,598,000","$2,085,000",DE,3241.0,5.0,4.0,1.0,N,0.0,1907.0,0.100000,"4,140",,,"Wael Tayara - 408-373-5040 - Live in elegance & modern comfort in this 5 bedroom/4.5 bath with detached ADU (Accessory Dwelling Unit) in the highly desirable Bushrod neighborhood & top rated Peralta Elementary. Entering this elegant home one can't help but appreciate the fine details & premium finishes to meet luxurious living. Main house with 2969 sqft. Open concept living, dining, family room & kitchen area. Two primary suites located upstairs & downstairs. Detached ADU cottage with 272 sqft having separate meters. Plus, adding a great deal more value to this already impressive property. Main house complete with Chef's kitchen, large island & top of the line appliances. New floor plans, foundation, windows, roof, electrical, plumbing, sewer lateral & so many other features & improvements. Prime location, nicely landscaped, tandem parking w/low maintenance yards. Enjoy the excellent flow and elegant living. Open House SAT 8/10 & SUN 8/11 from 1:30pm to 4:30pm.",1.0,,1.0,Detached,676 62nd St,Yes,Street,Separate,No,,272,Measured,Yes,117.0,Yes,,Yes,15-1363-22,0,,BAY EAST,,,,1878277.0,02195988,,Yes,RESIDENTIAL,,9/5/2024,,,,,,Yes,"Escrow opened with Semiko Prim at Chicago Title. Newly rebuilt & fully remodeled with detached ADU. Main House 4 bedrooms, 3.5 baths having 2969 sqft. ADU 1 bedroom, 1 bath having 272 sqft.  All work performed involved City permits. County Records differ from actual. Please contact the listing agent for Key Features & Improvement List. Please include Pre-Approval & POF when submitting purchase offer. Also please visit us at https://www.62ndstreetoakland.com/. Offer Review Date TBD. Open House SAT 8/10 & SUN 8/11 from 1:30pm to 4:30pm.",Alameda,Shattuck Ave,12,12,12,Martin Luther King Jr Way to 62nd St,,BUSHROD,,,,,,,,6001.0,0.0,,,,8/12/2024,,,No,,,,,,9/5/2024,Cash,7/31/2024 11:10 AM,$493,01811937,7/31/2024,,,1312944.0,Full Service,Excl Right,Market Listing,,,,1.0,No,,,Vacant,8/12/2024,,,,,,,41068240,,"$1,598,000",,8/12/2024,,,,1,Yes,No,,"$1,598,000","$2,085,000",9/5/2024,$643.32,,,No,,"Live in elegance & modern comfort in this 5 bedroom/4.5 bath with detached ADU (Accessory Dwelling Unit) in the highly desirable Bushrod neighborhood & top rated Peralta Elementary. Entering this elegant home one can't help but appreciate the fine details & premium finishes to meet luxurious living. Main house with 2969 sqft. Open concept living, dining, family room & kitchen area. Two primary suites located upstairs & downstairs. Detached ADU cottage with 272 sqft having separate meters. Plus, adding a great deal more value to this already impressive property. Main house complete with Chef's kitchen, large island & top of the line appliances. New floor plans, foundation, windows, roof, electrical, plumbing, sewer lateral & so many other features & improvements. Prime location, nicely landscaped, tandem parking w/low maintenance yards. Enjoy the excellent flow and elegant living. Open House SAT 8/10 & SUN 8/11 from 1:30pm to 4:30pm.",,14.0,$643,,130.0,130.0,For Sale,,Go and Show,,$643.32,Assessor Agent-Fill,,CA,9/5/2024,Two Story,,,Yes,15-1363-22,,2.0,,,,9/5/2024,Yes,Yes,Yes,Yes,,678,,62Nd St,94609,
41018051,SLD,13,6515 Raymond St,,OAKLAND,9999,"$995,000","$1,525,000",DE,1288.0,2.0,2.0,0.0,N,0.0,1921.0,0.110000,"4,636",,,"Ruth B Goldstone - Agt: 510-418-7191 - Calling All Makers and Urban Farmers! Deep, SW-exposure yard w/8 fruiting trees & 3 other edibles, chicken coop, grassy play area, room to BBQ, dine al fresco, and even build a sailboat! Huge basement almost doubles space and offers an incredible Makers' Dream Workshop. Additional backyard structure w/full bath, used by sellers as office/flex space. EZ indoor-outdoor living from capacious, updated kitchen w/nooks (2!) to two-level deck and garden. (Farm-to-Table Chefs, we got you!) Craftsman 2 Br w/copious details: divided lite door and windows, FP w/original tile hearth, tray ceilings, hardwoods, built-in hutch, plate rail and wainscoting. Lovingly maintained w/foundation & seismic upgrades, many dual panes, ample closets & a dec. 2017 roof. Prime, central location, under a mile to parks, BART, award-winning Peralta elementary, myriad foodie delights and shopping of Rockridge, Berkeley Bowl, Elmwood districts. (Plus Nick's Pizza & Bakery, Nomad Cafe, Phosho Dough, Whole Foods, too much to name all.) Open Sat & Sun. Note SuperBowl SUN hours. DON'T MISS.",,,,,,,,,,,,,No,102.0,,,,16-1426-31,0,,Bridge AOR,http://www.RaymondMakerFarm.com,,,01872575,187257.0,,Yes,RESIDENTIAL,,3/10/2023,,,,,,,"Offer day: TUES 2/14 by 1pm in Disc IO preferred but email ok too. Pricing NOT TRANSPARENT. See comps. Please return keys to plus spaces to DINING ROOM TABLE after use. 1288 MLS sq ft: Main level 1066 + garden structure 222 sf per floorplan. Measured sq ft/bath count does not equal public record. Internal floor-plan measurements: 2,269 total sq ft, includes 981 sq ft basement plus space w/varying, non-conforming ceiling height, and 222 sq ft backyard structure used by seller as zoom office/flex space w/full bath. Agent has not/ will not verify sq ft or use of spaces.  ",Alameda,66th St,13,18,18,Telegraph/Shattuck to Alcatraz/66th St. to Raymond,,OAK/BERK BORDER,,,,,,,,6001.0,1.0,,,,2/14/2023,,,No,,,,,,3/10/2023,Conventional,1/27/2023 9:55 PM,$773,01300164,2/1/2023,,,619098.0,Full Service,Excl Right,Market Listing,gas meter on 2/2/23,,,10.0,Yes,,,Call Agent,2/14/2023,,none,,,,,41018051,,"$995,000",,2/14/2023,,,,58,Yes,No,,"$995,000","$1,525,000",3/10/2023,"$1,184.01",,,Yes,,"Calling All Makers and Urban Farmers! Deep, SW-exposure yard w/8 fruiting trees & 3 other edibles, chicken coop, grassy play area, room to BBQ, dine al fresco, and even build a sailboat! Huge basement almost doubles space and offers an incredible Makers' Dream Workshop. Additional backyard structure w/full bath, used by sellers as office/flex space. EZ indoor-outdoor living from capacious, updated kitchen w/nooks (2!) to two-level deck and garden. (Farm-to-Table Chefs, we got you!) Craftsman 2 Br w/copious details: divided lite door and windows, FP w/original tile hearth, tray ceilings, hardwoods, built-in hutch, plate rail and wainscoting. Lovingly maintained w/foundation & seismic upgrades, many dual panes, ample closets & a dec. 2017 roof. Prime, central location, under a mile to parks, BART, award-winning Peralta elementary, myriad foodie delights and shopping of Rockridge, Berkeley Bowl, Elmwood districts. (Plus Nick's Pizza & Bakery, Nomad Cafe, Phosho Dough, Whole Foods, too much to name all.) Open Sat & Sun. Note SuperBowl SUN hours. DON'T MISS.",,8.0,"$1,184",LA & BA different company/franchise,153.0,153.0,For Sale,,"No Show Until BrokerTour thursday 10am-1:30 PM 2/2/23, after that use Supra.",,"$1,184.01",Other,,CA,3/10/2023,One Story,,,Yes,16-1426-31,,2.0,https://my.matterport.com/show/?m=EtEiAmwENDZ&mls=1,,,3/11/2023,Yes,Yes,Yes,Yes,,6515.0,,Raymond St,94609,
41036162,SLD,17,563 63rd St,,OAKLAND,9999,"$1,898,000","$2,275,000",DE,2374.0,4.0,3.0,,Y,1.0,1910.0,0.1,"4,140",,,"Wael Tayara - 408-373-5040 - Stunning! Luxury 4 bedroom & 3 full baths. Highly desirable S. Berkeley area & close to Emeryville. Bushrod neighborhood & top rated Peralta Elementary. Newly  rebuilt by Cornerstone. Entering this elegant home one can't help but appreciate the fine details. Main house with 2374 sqft of modern living with nothing short of high-end finishes & decorative lighting. Main level living area with bedroom & full bath. Open concept step-down formal great room to dining & kitchen area with folding style door level out to garden. The upstairs offers primary retreat, large walk-in closet & exquisite ensuite bath. Two additional bedrooms & full bath with laundry room. Key features are extensive with Oak flooring, Anderson windows, 2 zone heating system, new roof, electrical, plumbing, foundation, sewer lateral & wired for cable & ethernet, to mention a few. Detached 331 sqft garage with auto opener plus tandem driveway parking. Nicely landscaped with privacy gate. Spectacular property & move-in ready. Please check the link for 3d matter port and video. A true gem!",,,,,,,,,,,,,,113.0,,,Yes,15-1377-37,0,,BAY EAST,,,Cornerstone,01751791,00619098,,Yes,RESIDENTIAL,,9/19/2023,,,,,,,"Escrow opened with Shanti Thomas WFG Title in Castro Valley. Newly rebuilt & fully remodeled. All work performed with City permits. County Records differ from actual. All information is deemed reliable but should be verified. Agents, Broker & Seller do not guarantee. Please check the link for 3d matter port and video. Please contact the listing agent Wally for disclosure packet info. When submitting offer, please include POF & follow instructions within the disclosure packet. Open House on Sat 8/26 1-4:30pm & Sun 8/27 1-4:30pm. OFFER REVIEW DATE IS FRIDAY SEPTMEBER 1ST BY 6PM.",Alameda,Racine St,17,17,17,Telegraph to Racine to 63rd St,,BUSHROD,,,,,,,,6001.0,0.0,,,,9/2/2023,,,No,,,,,,9/21/2023,Conventional,8/16/2023 1:05 PM,$799,1811937.0,8/16/2023,,,1312944.0,Full Service,Excl Right,Market Listing,Front Door,,,4.0,No,,,Vacant,9/2/2023,,none,,,,,41036162,,"$1,898,000",,9/2/2023,,,,45,Yes,No,,"$1,898,000","$2,275,000",9/21/2023,$958.30,,,No,,"Stunning! Luxury 4 bedroom & 3 full baths. Highly desirable S. Berkeley area & close to Emeryville. Bushrod neighborhood & top rated Peralta Elementary. Newly  rebuilt by Cornerstone. Entering this elegant home one can't help but appreciate the fine details. Main house with 2374 sqft of modern living with nothing short of high-end finishes & decorative lighting. Main level living area with bedroom & full bath. Open concept step-down formal great room to dining & kitchen area with folding style door level out to garden. The upstairs offers primary retreat, large walk-in closet & exquisite ensuite bath. Two additional bedrooms & full bath with laundry room. Key features are extensive with Oak flooring, Anderson windows, 2 zone heating system, new roof, electrical, plumbing, foundation, sewer lateral & wired for cable & ethernet, to mention a few. Detached 331 sqft garage with auto opener plus tandem driveway parking. Nicely landscaped with privacy gate. Spectacular property & move-in ready. Please check the link for 3d matter port and video. A true gem!",,9.0,$958,,120.0,120.0,For Sale,,Go & Show!,,$958.30,Assessor Agent-Fill,,CA,9/21/2023,Two Story,,,Yes,,,,,,,9/21/2023,Yes,Yes,Yes,Yes,,563.0,,63rd St,94609-1244,
41061379,SLD,14,566 61St St,,OAKLAND,9999,"$899,000","$1,390,000",DE,1282.0,3.0,2.0,,N,0.0,1910.0,0.1,"4,160",,,"Scott Ward - Agt: 415-225-4593 - Welcome to true optionality. Uber charming from the street with a long useful driveway. This well-taken care of sunny 3 bed, 2 bath Craftsman has a lovely front porch that beckons neighborhood connection. Complete with a “classic” floorplan; wood floors throughout, a large living room, and spacious bedrooms with one serving as the primary with a full ensuite bath. Big kitchen leads directly to the backyard. The home is on a grid-tied solar system. The full basement is quite practical with a washer and dryer and workspace. The outside area has an apple tree, grassy yard, native plantings, and patio – all receive southwest light, ideal for late afternoon to evening hanging out. The true bonus of 61st Street is the modern permitted ADU. Accessed from the side yard via a wooden gate this attractive unit has an electric boiler radiant floor heating system, a kitchen, and a stylish bath with expansive stall shower. The French doors open out onto welcome light from the east light. The functionality of this ADU is fantastic as it can serve as a separate private space or, be integrated into the flow of the yard and main house. The location of 61st is wonderful, Rockridge, Temescal, Berkeley and Bushrod Park are all very close-by. WalkScore 93/BikeScore 99 Open 6/8 and 6/9, 2:00-4:30.",1.0,,1.0,Detached,Contemporary w/ full bath,Yes,Street,Separate,No,,324,,Yes,114.0,No,,No,15-1376-15,0,,Bridge AOR,https://www.Complexat61st.com/mls,,Built Well,00200618,2014153.0,,Yes,RESIDENTIAL,,7/3/2024,,,,,,,"NO ALARM. On MLS 5/29, Open for Broker 5/30, 10:00-1:00. Open 6/8 and 6/9, 2:00-4:30 PM. ADU (street address 568 61st) is permitted and roughly 324 SQF, this SQF info is not included in the MLS SQF, nor is the bathroom from the ADU added to MLS info. 2nd bathroom off primary in main house is permitted. OFFER DATE 6/12 by 1:00 PM - Gate on east side (right side) is open and not on combo code. Please be sure to lock up everything upon exit, basement too. Solar system to be paid off in full by seller at COE. Buyer to investigate all information with the City. Neither seller nor listing agent has verified the accuracy of any of these sources of information. Buyer to confirm all. - Please call Scott with any questions - 415-225-4593",Alameda,Racine,14,14,14,East off Shattuck onto 61st,,BUSHROD,,,,,,,,6001.0,1.0,,,,6/12/2024,,,No,,,,,,7/3/2024,Conventional,5/29/2024 8:52 PM,$701,1490471,5/29/2024,,,619098.0,Full Service,Excl Right,Market Listing,Metal Railing,Old School,,9.0,No,,,Vacant,6/12/2024,,none,,,,,41061379,,"$899,000",,6/12/2024,,,,39,Yes,No,,"$899,000","$1,390,000",7/3/2024,"$1,084.24",,,No,,"Welcome to true optionality. Uber charming from the street with a long useful driveway. This well-taken care of sunny 3 bed, 2 bath Craftsman has a lovely front porch that beckons neighborhood connection. Complete with a “classic” floorplan; wood floors throughout, a large living room, and spacious bedrooms with one serving as the primary with a full ensuite bath. Big kitchen leads directly to the backyard. The home is on a grid-tied solar system. The full basement is quite practical with a washer and dryer and workspace. The outside area has an apple tree, grassy yard, native plantings, and patio – all receive southwest light, ideal for late afternoon to evening hanging out. The true bonus of 61st Street is the modern permitted ADU. Accessed from the side yard via a wooden gate this attractive unit has an electric boiler radiant floor heating system, a kitchen, and a stylish bath with expansive stall shower. The French doors open out onto welcome light from the east light. The functionality of this ADU is fantastic as it can serve as a separate private space or, be integrated into the flow of the yard and main house. The location of 61st is wonderful, Rockridge, Temescal, Berkeley and Bushrod Park are all very close-by. WalkScore 93/BikeScore 99 Open 6/8 and 6/9, 2:00-4:30.   ",,6.0,"$1,084",LA & BA different company/franchise,155.0,155.0,For Sale,,"Gate on east side (right side) is open and not on combo code. Please be sure to lock up everything upon exit, basement too. No ALARM on main house or ADU.",,"$1,084.24",Public Records,,CA,7/3/2024,Two Story,,,Yes,15-1376-15,,3.0,,,,7/4/2024,Yes,Yes,Yes,Yes,,566.0,,61St St,94609,
41029637,SLD,15,6023 Colby St,,OAKLAND,9999,"$399,000","$1,448,000",DE,1302.0,2.0,2.0,0.0,Y,1.0,1913.0,0.090000,"4,000",,,Michael Stephens - Agt: 510-816-9693 - Come bring your creative touch to this fixer upper that is located just a short  distance to Claremont Ave and College Ave. This home has a 91/100 Walk Score and a 98/100 on biking score. The home features 2 bedrooms and 2 bathrooms with bonus spaces including upper converted attic. Make this house your home!!,,,,,,,,,,,,,,110.0,,,,,0,,Bridge AOR,https://blueskypixs.hd.pics/6023-Colby-St,https://hd.pics/995748,,01312944,01312944,,Yes,RESIDENTIAL,,7/28/2023,,,,,,,"Brokers tour 11-1 on 6/08. SOH  2-5:00PM on 6/11 and 6/18. Offers due by noon on 6/21. Send to LA via email. No appointments needed for showing. No preemptive offers. Email, not text, LA for disclosures link. Per Fair Housing Advisory seller will not accept or review Buyer support letters.",Alameda,60th Street,15,15,15,Claremont to Colby,,LOWER ROCKRIDGE,,,,,,,,6001.0,1.0,,,,6/22/2023,,,No,,,,,,7/28/2023,Conventional,6/7/2023 8:18 PM,$306,01186416,6/7/2023,,,00818204,Full Service,Excl Right,Market Listing,Front hose bib,,,51.0,No,,,Vacant,6/22/2023,,No,,,,,41029637,,"$399,000",,6/22/2023,,,,47,Yes,No,510.263.6090,"$399,000","$1,448,000",7/28/2023,"$1,112.14",,,No,,Come bring your creative touch to this fixer upper that is located just a short  distance to Claremont Ave and College Ave. This home has a 91/100 Walk Score and a 98/100 on biking score. The home features 2 bedrooms and 2 bathrooms with bonus spaces including upper converted attic. Make this house your home!!,,7.0,"$1,112",LA & BA different company/franchise,363.0,363.0,For Sale,,GO!,,"$1,112.14",Public Records,,CA,7/28/2023,One Story,,,Yes,,,3.0,https://blueskypixs.hd.pics/6023-Colby-St/idx,https://hd.pics/x995748,,7/28/2023,Yes,Yes,Yes,Yes,,6023.0,,Colby St,94618,
