41053380,SLD,13,6220 Baker Street,,OAKLAND,9999,"$895,000","$1,210,000",DE,948.0,2.0,1.0,,N,0.0,1905.0,0.09,"3,840",,,"Elizabeth Behrens - 510-381-2014 - This charming NOBE bungalow built in 1905 has been beautifully updated with high-end finishes while keeping its old world charm. Hardwood floors, crown molding, built in cabinets are just a few of the classic details. The kitchen is the heart of the home with many modern conveniences, lots of natural light and room to dine at the raised  counter. French doors open to the expansive deck with seamless flow from inside to out creating a wonderful extension to the living space. Whether you are dining, lounging or gardening in the raised bed veggie garden, there is room for many outdoor activities. The large light-filled studio if perfect for an office or creative endeavors. Updates to the home include new foundation, roof, electrical, central heating, and air conditioning. Ample storage is available in the attic with pull-down stairs. Ideally located on the Berkeley/Oakland/Emeryville border, this amazing home is close to vibrant cafes, farmers’ markets, shops, and great restaurants. The location can’t be beat with easy commute options or just saunter across your backyard to the home office!",,,,,,,,,,,,,No,119.0,No,,No,16-1440-15,0,,Bridge AOR,https://www.6220baker.com/,,,01824502,1527235.0,,Yes,RESIDENTIAL,,4/19/2024,,,,,,,"Offer date April 2nd, Tuesday at 2pm.  Open house Sunday March 31st from 2-4:30. Studio space in back is permitted as 'miscellaneous space' and is 371 sqft. as per country assessor's office. Buyer to verify. Solar lease is through 2025 at no cost to buyer. The lease can be renewed, buyer to investigate. Square footage and lot size not verified or guaranteed by the Seller or Listing Agent.",Alameda,Alcatraz,13,13,13,Alcatraz to Baker,,NOBE,Oakland (510) 879-8111,,,,,,,6001.0,1.0,,,,4/2/2024,,Oakland (510) 879-8111,No,,,,,,4/19/2024,Conventional,3/20/2024 2:44 PM,$944,01839898,3/20/2024,,,01170009,Full Service,Excl Right,Market Listing,front door,,,7.0,No,,,Vacant,4/2/2024,,,,,,,41053380,,"$895,000",,4/2/2024,,,,41,Yes,No,,"$895,000","$1,210,000",4/19/2024,"$1,276.37",,,No,,"This charming NOBE bungalow built in 1905 has been beautifully updated with high-end finishes while keeping its old world charm. Hardwood floors, crown molding, built in cabinets are just a few of the classic details. The kitchen is the heart of the home with many modern conveniences, lots of natural light and room to dine at the raised  counter. French doors open to the expansive deck with seamless flow from inside to out creating a wonderful extension to the living space. Whether you are dining, lounging or gardening in the raised bed veggie garden, there is room for many outdoor activities. The large light-filled studio if perfect for an office or creative endeavors. Updates to the home include new foundation, roof, electrical, central heating, and air conditioning. Ample storage is available in the attic with pull-down stairs. Ideally located on the Berkeley/Oakland/Emeryville border, this amazing home is close to vibrant cafes, farmers’ markets, shops, and great restaurants. The location can’t be beat with easy commute options or just saunter across your backyard to the home office!",,5.0,"$1,276",LA & BA different company/franchise,135.0,135.0,For Sale,,Go and Show!,,"$1,276.37",Public Records,,CA,4/19/2024,One Story,,,Yes,16-1440-15,,,https://www.6220baker.com/mls,,,4/20/2024,Yes,Yes,Yes,Yes,,6220.0,,Baker Street,94608,
41052906,SLD,21,1050 61st Street,,OAKLAND,9999,"$895,000","$916,000",DE,1226.0,3.0,3.0,,N,0.0,1912.0,0.1,"4,125",,,"Anne Gross-Ayankoya - Agt: 510-388-2781 - Move in Ready Home in Prime NOBE Location.  House has 3 bedrooms and 3 Bathrooms and a Sleek, Sophisticated and Contemporary Vibe. Fresh Interior and Exterior painting, open alluring floor plan, with skylights in the updated kitchen, giving this home amazing natural light. New Stainless-Steel Appliances, two bedrooms have their own in-suite Bathrooms. It is all right at your door, close to Stanford Park, Doyle St Café, Cosmic Cycles Bike Shop, and the famous Oakland Golden Gate Branch public library. This very commuter friendly location is adjacent to a main bus line. Sweet pocket with many surrounding renovated properties.  Beautiful outdoor deck off the primary suite. Nice size backyard for gardening or sitting out and sipping your favorite beverage.  Home Sweet Home Awaits You!",,,,,,,,,,,,,No,112.0,No,,No,16-1442-22,0,,Bridge AOR,https://www.tourfactory.com/3136918,https://www.tourfactory.com/3136918,,01480350,2066937.0,,Yes,RESIDENTIAL,,4/26/2024,,1462562.0,,,,,"  Offers As they Come!  RPA, POF's, Lender DU Approval, and Acknowledgment of Property Disclosures.   Questions Call Willie at (510) 703-0413. Inspector was legally unable to turn on Appliances.  The heating system is working, as well as the water heater and dishwasher.   Neither Seller nor Agents guarantee, room count or the square footage of the property or lot size.  Public Records and Current Property specifications differ,   Property was inherited and Owner states foot print of house has been the same for years.",Alameda,Herzog,21,21,21,San Pablo to 61st,,GOLDEN GATE,,,,,,,,6001.0,0.0,,,,4/5/2024,,,No,,,,,,5/6/2024,Conventional,3/15/2024 9:21 AM,$730,01331899,3/15/2024,,,00818204,Full Service,Excl Right,Market Listing,Gas Meter Left Side,,,1.0,No,,,Vacant,4/5/2024,,20K Closing Cost,,,,,41052906,,"$899,000",,4/5/2024,,,,25,Yes,No,,"$899,000","$916,000",5/6/2024,$747.15,Anne Gross Ayankoya,(510) 388-2781,Yes,,"Move in Ready Home in Prime NOBE Location.  House has 3 bedrooms and 3 Bathrooms and a Sleek, Sophisticated and Contemporary Vibe. Fresh Interior and Exterior painting, open alluring floor plan, with skylights in the updated kitchen, giving this home amazing natural light. New Stainless-Steel Appliances, two bedrooms have their own in-suite Bathrooms. It is all right at your door, close to Stanford Park, Doyle St Café, Cosmic Cycles Bike Shop, and the famous Oakland Golden Gate Branch public library. This very commuter friendly location is adjacent to a main bus line. Sweet pocket with many surrounding renovated properties.  Beautiful outdoor deck off the primary suite. Nice size backyard for gardening or sitting out and sipping your favorite beverage.  Home Sweet Home Awaits You! ",,5.0,$747,LA & BA different company/franchise,102.0,102.0,For Sale,,,,$747.15,Measured,Successor Trustee Sale,CA,4/26/2024,One Story,,,Yes,16-1442-22,,1.0,https://www.tourfactory.com/idxr3136918,https://youriguide.com/1050_61st_st_oakland_ca?unbranded,,5/6/2024,Yes,Yes,Yes,Yes,,1050.0,,61st Street,94608,
41020357,SLD,4,1077 57th Street,,OAKLAND,9999,"$1,348,000","$1,350,000",DE,2100.0,3.0,2.0,0.0,N,0.0,2017.0,0.080000,"3,596",,,"David H Yi - TRANSPARENT PRICING! Tucked away from the street for ultimate privacy, 1077 57th Street offers a recently built, Napa inspired modern farmhouse in the desirable NOBE neighborhood of Oakland, CA. Built in 2017, this three bedroom, two bathroom home contains 2,100 SF of luxurious living space. Thoughtful designer choices and a highly functional floor plan make for a one-of-a-kind urban retreat. The main floor highlights a stunning open space over stained concrete flooring, with a full chef’s kitchen featuring quartz counters and custom cabinets, with state-of-the-art (BT/Internet ready) Samsung appliances. French doors open to an inviting backyard, ready for entertaining. The upper floor presents a truly incredible and lavish primary suite, with dual work-from-home “wings”, a gorgeous bathroom with both tub and stall showers, and a bonus room that could be ideal as an office, a nursery, or a yoga/Peloton studio. Vehicles will sit in secure, off-street spaces behind a motorized gate, ready to drive a few minutes to an updated Bay Street, all major East Bay freeways nearby, or moments to the Bay Bridge.",,,,,,,,,,,,,No,6.0,,,,15-1306-22-1,0,,Bridge AOR,,,,02199639,1322466.0,,Yes,RESIDENTIAL,,3/29/2023,1293006.0,,,,,,Pending but feel free to show for backups. Supra at the front gate - go and show! See reports and disclosures at: https://app.disclosures.io/link/1077-57th-Street-dtlfaxvz. One of the Sellers is a licensed real estate agent in CA. Offers will be reviewed as received. Square footage not verified or guaranteed. Sewer lateral and sidewalk compliant. Pre-escrow with Jennifer Senhaji at ORTC in Oakland. Email or call listing agent with questions.,Alameda,Gaskill Street,104,103,4,San Pablo to 57th St.,,NOBE,,,,,,,,6001.0,0.0,,,,3/4/2023,,,No,,,,,,3/29/2023,Conventional,2/28/2023 4:46 PM,$642,01914323,2/28/2023,,,1900817.0,Full Service,Excl Right,Market Listing,Front Gate,,,1.0,No,,,Vacant,3/4/2023,,,,,,,41020357,,"$1,348,000",,3/4/2023,,,,46,Yes,No,,"$1,348,000","$1,350,000",3/29/2023,$642.86,,,Yes,,"TRANSPARENT PRICING! Tucked away from the street for ultimate privacy, 1077 57th Street offers a recently built, Napa inspired modern farmhouse in the desirable NOBE neighborhood of Oakland, CA. Built in 2017, this three bedroom, two bathroom home contains 2,100 SF of luxurious living space. Thoughtful designer choices and a highly functional floor plan make for a one-of-a-kind urban retreat. The main floor highlights a stunning open space over stained concrete flooring, with a full chef’s kitchen featuring quartz counters and custom cabinets, with state-of-the-art (BT/Internet ready) Samsung appliances. French doors open to an inviting backyard, ready for entertaining. The upper floor presents a truly incredible and lavish primary suite, with dual work-from-home “wings”, a gorgeous bathroom with both tub and stall showers, and a bonus room that could be ideal as an office, a nursery, or a yoga/Peloton studio. Vehicles will sit in secure, off-street spaces behind a motorized gate, ready to drive a few minutes to an updated Bay Street, all major East Bay freeways nearby, or moments to the Bay Bridge.",,7.0,$643,LA & BA different company/franchise,100.0,100.0,For Sale,,,,$642.86,Measured,,CA,3/29/2023,Two Story,,,Yes,15-1306-22-1,,2.0,https://my.matterport.com/show/?m=jLpYq3VGg4t,,,3/30/2023,Yes,Yes,Yes,Yes,,1077.0,,57th Street,94608,
41011243,SLD,77,"1049 61st Street, A",,OAKLAND,9999,"$1,495,000","$1,495,000",DE,2206.0,3.0,2.0,1.0,Y,1.0,2022.0,0.080000,"3,526",,,"Daniel M Winkler - 510-421-4528 - Transparent Price!!!  The home and location you have been waiting for! Fully electric with solar!!! Stunning all-new construction in the hot NOBE district of North Oakland. Offering 3 bedrooms, 2.5 luxurious baths, an open kitchen/living/dining area concept and an enormous backyard, this 2,200 square foot home will delight the pickiest of buyers! Ideally located at the border of Berkeley and Emeryville, this new home offers an easy luxury lifestyle. As you enter, you will immediately see the builder’s attention to detail; the high-end finishes & quality workmanship are evident. With its high ceilings, a breezy, airy feel, gorgeous hardwood floors, radiant heat, an abundance of natural light, a lovely kitchen with quartz counters and KitchenAid stainless steel appliances, this home checks all the boxes. Upstairs, all three bedrooms are generous in size. The primary suite is huge, with a spa-like lux bath with designer tile, top-of-the-line fixtures. The guest baths look fantastic with designer tile, cabinets, and finishes. The open floorplan is an entertainer's dream, with a posh powder bath on the first floor. To top things off, a huge south-facing yard is where you’ll enjoy al fresco dining in our wonderful Oakland weather.",,,,,,,,,,,,,No,1.0,,,,015 -1338-006-03,0,,Bridge AOR,http://www.1049a-61st.com,,Baran Studio,01875716,1527235.0,,Yes,RESIDENTIAL,,3/20/2023,1354869.0,,,,,,"Square Footage from approved plans, not verified or guaranteed by seller or agent.  Any questions feel free to call or text 510-421-4528. Pre-escrow with Rebecca Skipper at Chicago Title in Albany. Disclosure link:  https://app.disclosures.io/link/1049A-61st-Street-0ot2watt",Alameda,Idaho,174,174,77,San Pablo to 61st,,NOBE,Oakland (510) 879-8111,,,,,,,6001.0,0.0,,,,1/15/2023,,Oakland (510) 879-8111,No,,,,,,3/20/2023,Conventional,10/11/2022 1:47 PM,$678,01090765,10/11/2022,,,1322466.0,Full Service,Excl Right,Market Listing,front door,Modern,,1.0,No,,,Vacant,1/15/2023,,none,,,,,41011243,,"$1,495,000",,1/15/2023,,,,29,Yes,No,,"$1,495,000","$1,495,000",10/11/2022,$677.70,Daniel Winkler,510-421-4528,Yes,,"Transparent Price!!!  The home and location you have been waiting for! Fully electric with solar!!! Stunning all-new construction in the hot NOBE district of North Oakland. Offering 3 bedrooms, 2.5 luxurious baths, an open kitchen/living/dining area concept and an enormous backyard, this 2,200 square foot home will delight the pickiest of buyers! Ideally located at the border of Berkeley and Emeryville, this new home offers an easy luxury lifestyle. As you enter, you will immediately see the builder’s attention to detail; the high-end finishes & quality workmanship are evident. With its high ceilings, a breezy, airy feel, gorgeous hardwood floors, radiant heat, an abundance of natural light, a lovely kitchen with quartz counters and KitchenAid stainless steel appliances, this home checks all the boxes. Upstairs, all three bedrooms are generous in size. The primary suite is huge, with a spa-like lux bath with designer tile, top-of-the-line fixtures. The guest baths look fantastic with designer tile, cabinets, and finishes. The open floorplan is an entertainer's dream, with a posh powder bath on the first floor. To top things off, a huge south-facing yard is where you’ll enjoy al fresco dining in our wonderful Oakland weather.",,7.0,$678,LA & BA different company/franchise,100.0,100.0,For Sale,,,,$677.70,Builder,,CA,3/20/2023,Two Story,,,Yes,,,,,,,3/20/2023,Yes,Yes,Yes,Yes,,1049.0,,"61st Street, A",94608,
41008619,SLD,110,1049 61st Street,,OAKLAND,9999,"$1,495,000","$1,470,000",DE,2189.0,3.0,2.0,1.0,Y,1.0,2022.0,0.087000,"3,810",,,"Daniel M Winkler - 510-421-4528 - Stunning near all new construction in the Hot NOBE District of North Oakland. Offering three bedrooms, two and a half luxurious baths, an open kitchen/living/dining area concept and a den area over nearly 2,200 square feet, this home will delight the pickiest of Buyers!  Located ideally at the border of Berkeley and Emeryville this wonderful nearly new home offers a wonderful easy luxury lifestyle.  As you enter the home, you will immediately see the super high attention to detail by the Builder, the high-end finishes and quality workmanship are easily evident.  Offering high ceilings, a breezy airy feel, gorgeous hardwood floors, beautiful wainscot details, radiant heat, an abundance of natural light, a lovely kitchen with quartz counters and KitchenAid stainless steel appliances this home checks all the boxes.  Upstairs, all three bedrooms feature cathedral ceilings, two baths and a huge laundry room.  The primary suite is huge, with a spa like lux bath with designer tile, top of the line fixtures.  The guest baths look fantastic with wonderful use of designer tile, cabinets and finishes.  A cute yard to enjoy al fresco dining in our wonderful Oakland weather.  The open floorplan is an entertainer's dream, with a posh powder bath on the first floor and an office!",,,,,,,,,,,,,No,1.0,,,,015 -1338-006-03,0,,Bridge AOR,http://www.1049-61st.com,https://my.matterport.com/show/?m=CvcZwnCt8qN,Baran Studio,02002965,619098.0,,Yes,RESIDENTIAL,,3/24/2023,,,,,,,"Square Footage from approved plans, not verified or guaranteed by seller or agent.  Any questions feel free to call or text 510-421-4528. Pre-escrow with Rebecca Skipper at Chicago Title in Albany. Disclosure link:  https://app.disclosures.io/link/1049-61st-Street-rexa8ufk",Alameda,Idaho,110,110,110,San Pablo to 61st,,NOBE,Oakland (510) 879-8111,,,,,,,6001.0,0.0,,,,3/2/2023,,Oakland (510) 879-8111,No,,,,,,3/24/2023,Cash,9/15/2022 1:20 PM,$683,01090765,9/15/2022,,,1322466.0,Full Service,Excl Right,Market Listing,front door,Modern,,2.0,No,,,Vacant,3/2/2023,,0,,,,,41008619,,"$1,495,000",,3/2/2023,,,,30,Yes,No,510-528-2100,"$1,595,000","$1,470,000",3/24/2023,$671.54,Daniel Winkler,510-421-4528,Yes,,"Stunning near all new construction in the Hot NOBE District of North Oakland. Offering three bedrooms, two and a half luxurious baths, an open kitchen/living/dining area concept and a den area over nearly 2,200 square feet, this home will delight the pickiest of Buyers!  Located ideally at the border of Berkeley and Emeryville this wonderful nearly new home offers a wonderful easy luxury lifestyle.  As you enter the home, you will immediately see the super high attention to detail by the Builder, the high-end finishes and quality workmanship are easily evident.  Offering high ceilings, a breezy airy feel, gorgeous hardwood floors, beautiful wainscot details, radiant heat, an abundance of natural light, a lovely kitchen with quartz counters and KitchenAid stainless steel appliances this home checks all the boxes.  Upstairs, all three bedrooms feature cathedral ceilings, two baths and a huge laundry room.  The primary suite is huge, with a spa like lux bath with designer tile, top of the line fixtures.  The guest baths look fantastic with wonderful use of designer tile, cabinets and finishes.  A cute yard to enjoy al fresco dining in our wonderful Oakland weather.  The open floorplan is an entertainer's dream, with a posh powder bath on the first floor and an office!",,7.0,$672,LA & BA different company/franchise,98.0,98.0,For Sale,,,,$671.54,Builder,,CA,3/24/2023,Two Story,,,Yes,,,1.0,,,,3/25/2023,Yes,Yes,Yes,Yes,,1049.0,,61st Street,94608,
ML81959121,SLD,20,975 Aileen Street,,OAKLAND,9999,"$1,399,000","$1,400,000",DE,2300.0,5.0,5.0,,,0.0,2023.0,0.089000,"3,875",,,,,,,,,,,,,,,,,1.0,,,,015-1301-023,0,,Datashare MLSListings,,,,01992462,,,,RESIDENTIAL,,5/21/2024,,,,,,,"Square footage per seller. Property square footage more than doubled during complete remodel/ADU construction. Official records might not reflect. New foundation/framing/roofing. All construction done with permits. Appraisal comes in at $1.6M Property is extensively remodeled. Bottom floor is new construction. Top floor foundation and partial walls re-used. This disqualifies it from being called NEW, while it's in reality 99% new. The only retained (original) part of the house is upper floor framing and siding. Everything else is brand new! Bring your buyer clients. This property is sure made to attract and entice. Submit offers on CAR contract WITH pre-approval and proof of funds. Seller may offer rate buydown when necessary and deemed applicable. One seller is a licensed real estate agent.",Alameda,Lowell,20,20,20,,,,Oakland (510) 879-8111,,,,,,975 Aileen ST,6001.0,,,,,4/16/2024,,Oakland (510) 879-8111,No,,,,,,5/21/2024,,3/27/2024 5:37 AM,$608,1865839.0,3/27/2024,garantrealtors@gmail.com,,,,,Market Listing,,,,,,,,Vacant,4/16/2024,,,,,,,,,"$1,399,000",,4/16/2024,,,Public,33,,No,,,"$1,400,000",,$608.70,,,,81959121.0,"This impeccably rebuilt property seamlessly blends Craftsman allure with contemporary opulence. Featuring lofty coved ceilings, premium Italian appliances, marble countertops and sophisticated black & gold accents, the craftsmanship shines through vintage detailing, upscale touches, and abundant storage. What truly distinguishes this property is its lower level Accessory Dwelling Unit (ADU) with 3 separate entrances, opening up a myriad of lucrative rental possibilities to offset your mortgage to pave the way to financial freedom. With the possible future flexibility to effortlessly convert the home into up to 5 bedrooms and 4 bathrooms plus an ADU, this house hacking gem perfect for securing recession-resistant income for decades, while offering a spacious retreat for a growing family. Main house 1165sf, Lower ADU 1135sf. Step into a mature backyard sanctuary adorned with the neighborhood's oldest tree canopy, setting it apart as true gem. Keep in mind the exciting potential to transform the high-ceiling attic into a customized space tailored to your individual desires! Unlock an Incredible Deal*: The seller is presenting MORTGAGE BUYDOWN, potentially reducing your mortgage rate to below 5%. Also SELLER CARRY (not Seller Finance). *Subject to eligibility and offer terms.",,,$608,,,,For Sale,,Appointment Only,,$608.70,,,CA,5/21/2024,Two Story,,,,,,,,,,5/22/2024,Yes,Yes,Yes,Yes,,,,,94608,R-3
41024773,SLD,112,1405 Harmon St,,BERKELEY,9999,"$999,900","$1,080,000",DE,1304.0,3.0,2.0,0.0,Y,1.0,1947.0,0.090000,"3,830",,,"Harmit S Toor - 925-202-7027 - Huge Price Reduction. Completely remodeled 3 bedrooms and 2 bathrooms in a desirable Berkeley location. This home features new windows, new windows screens, a new roof, new interior/exterior paint, new copper pipes plumbing, new can lights, remodeled hall bathrooms with custom standing shower, new vanity with custom windows, mirror, toilet, new luxury SPC Waterproof vinyl flooring throughout, new textured to walls/Ceiling, new vents, new gutters with new down sprouts, kitchen with new granite countertops, kitchen-Aid appliances, new custom cabinets in kitchen and bathrooms, new five-inch baseboards, new garage door with opener chamberlain powered by myQ, new sod front/backyard, sun tunnel skylight in the hallway and walk-in closet, second bathroom addition with walk-in closet, custom standing shower, double sink vanity with custom cabinets, mirrors, tile flooring, new barn door, new iron railing at the front, new stucco at the front, new interior doors with modern look trim, and much more. So close to shopping, schools, and the park: an ideal home to live in or a great rental home.",,,,,,,,,,,,,No,76.0,,,Yes,52-1537-12,0,,BAY EAST,https://virtualtourcafe.com/tour/1626961,,,01990789,01522885,,Yes,RESIDENTIAL,,8/25/2023,,,,,,,"For Showing, CBS Code, please Contact Listing Agent. The listing broker/listing agent is related to the seller.   The offer due date is Wednesday, August 2nd, by 2 PM.   Disclosure Link:   https://app.disclosures.io/link/1405-Harmon-Street-prm76lp5. ",Alameda,Sacramento St,158,157,112,San Pablo Ave to Alcatraz Ave Lt Baker Rt Harmon,,SOUTH BERKELEY,,,,,,,,6001.0,1.0,,,,8/10/2023,,,No,,,,,,8/25/2023,Conventional,4/20/2023 12:42 PM,$767,1462579.0,4/20/2023,,,2007516.0,Full Service,Excl Right,Market Listing,Front Railing,,,4.0,No,,,Vacant,8/10/2023,,none,,,,,41024773,,"$1,098,000",,8/10/2023,,,,56,Yes,No,,"$1,097,000","$1,080,000",8/25/2023,$828.22,Harmt Toor,925-202-7027,No,,"Huge Price Reduction. Completely remodeled 3 bedrooms and 2 bathrooms in a desirable Berkeley location. This home features new windows, new windows screens, a new roof, new interior/exterior paint, new copper pipes plumbing, new can lights, remodeled hall bathrooms with custom standing shower, new vanity with custom windows, mirror, toilet, new luxury SPC Waterproof vinyl flooring throughout, new textured to walls/Ceiling, new vents, new gutters with new down sprouts, kitchen with new granite countertops, kitchen-Aid appliances, new custom cabinets in kitchen and bathrooms, new five-inch baseboards, new garage door with opener chamberlain powered by myQ, new sod front/backyard, sun tunnel skylight in the hallway and walk-in closet, second bathroom addition with walk-in closet, custom standing shower, double sink vanity with custom cabinets, mirrors, tile flooring, new barn door, new iron railing at the front, new stucco at the front, new interior doors with modern look trim, and much more. So close to shopping, schools, and the park: an ideal home to live in or a great rental home.",,7.0,$828,LA & BA different company/franchise,108.0,98.0,For Sale,,,https://www.homesnap.com/CA/Berkeley/1405-Harmon-Street?bookshowing&utm_source=booking_url,$828.22,Owner,,CA,8/25/2023,One Story,,,Yes,52-1537-12,,,https://virtualtourcafe.com/mls/1626961,,,8/26/2023,Yes,Yes,Yes,Yes,,1405.0,,Harmon St,94702,
