41066875,SLD,4,1059 65Th St,,OAKLAND,9999,"$799,900","$965,000",DE,1169.0,2.0,2.0,0.0,N,0.0,1903.0,0.100000,"4,400",,,"Max DeVries - 925-525-0116 - This beautiful NOBE Bungalow was originally built in 1903 and has undergone a complete transformation and is in a Move-In condition. The open and inviting floor plan leads you in to a family room with open kitchen. Ideal for entertaining. The living spaces are covered with upgraded flooring, new windows and new fixtures. The kitchen is equipped with new Whirlpool stainless steel appliances, White shaker cabinets, Quartz counters and High-end fixtures with Bronze finishes. In addition there are 2 bedrooms with 2 full bathrooms. The primary bath has a large walk-in shower with dual tropical shower heads, upgraded cabinets and high-end wall and floor finishes. A staircase will lead you to a finished Loft that is ideal for an office space or even a 3rd bedroom. at the back off the house is a cozy patio and nice size backyard. Property has A/C and a Tankless water heater. The home is a stone throw away from Berkeley and is close to all entertaining and shopping that this neighborhood has to offer.",,,,,,,,,,,,,,121.0,No,,No,16-1449-4-2,0,,BAY EAST,,,,01922669,1878277.0,,Yes,RESIDENTIAL,,8/7/2024,,,,,,,Pre escrow is opened with first America Montclair. Escrow officer Shanelle Magaña. All disclosures https://app.disclosures.io/link/1059-65th-Street-woo2pjxn. For any and all questions call Max at 925-525-0116. Seller is a licensed real estate agent. Room count and SQ ft is different from Tax record. buyer to verify.,Alameda,San Pablo,4,4,4,San Pablo to 65th,,NOBE,,,,,,,,6001.0,0.0,,,,7/22/2024,,,No,,,,,,8/7/2024,Conventional,7/18/2024 8:50 AM,$684,1373199.0,7/18/2024,,,2065804.0,Full Service,Excl Right,Market Listing,front water spout,,,1.0,No,,,Vacant,7/22/2024,,,,,,,41066875,,"$799,900",,7/22/2024,,,,1,Yes,No,,"$799,900","$965,000",8/7/2024,$825.49,925-525-0116,Max,Yes,,"This beautiful NOBE Bungalow was originally built in 1903 and has undergone a complete transformation and is in a Move-In condition. The open and inviting floor plan leads you in to a family room with open kitchen. Ideal for entertaining. The living spaces are covered with upgraded flooring, new windows and new fixtures. The kitchen is equipped with new Whirlpool stainless steel appliances, White shaker cabinets, Quartz counters and High-end fixtures with Bronze finishes. In addition there are 2 bedrooms with 2 full bathrooms. The primary bath has a large walk-in shower with dual tropical shower heads, upgraded cabinets and high-end wall and floor finishes. A staircase will lead you to a finished Loft that is ideal for an office space or even a 3rd bedroom. at the back off the house is a cozy patio and nice size backyard. Property has A/C and a Tankless water heater. The home is a stone throw away from Berkeley and is close to all entertaining and shopping that this neighborhood has to offer.",,5.0,$825,LA & BA different company/franchise,121.0,121.0,For Sale,,Text agent and go.,,$825.49,Not Verified,,CA,8/7/2024,One Story,,,Yes,16-1449-4-2,,2.0,,,,8/8/2024,Yes,Yes,Yes,Yes,,1059.0,,65Th St,94608,
41047493,SLD,6,1119 54th St,,OAKLAND,9999,"$999,000","$1,100,000",DE,1800.0,4.0,2.0,,Y,2.0,1944.0,0.090000,"4,113",,,"Judy A Swaby - Agt: 510-253-6931 - Gorgeous NOBE Contemporary 2-family residence in sought after North Oakland Emeryville Border. This sweetheart duplex is is optimized for cash flow or the perfect home for a multi-generational family sitting on a tree-lined street in a mature neighborhood with long term residents. Stylishly renovated mirror images, each two-story unit has 2 Bds/1Bth with living, dining, kitchen on the main level and bedrooms and baths on the upper level. Each unit sports gleaming refinished original red oak floors, dual pane windows, new on demand water heaters, new furnace, updated plumbing and electrical, new kitchens, new bathrooms, new appliances, washer/dryers, new designer lighting throughout and freshly painted with a designer paint palette in and out. On the exterior there’s a new roof, new electric garage doors, new redwood fences, new custom-made gates, new porches, new landscaping including trees, new garage roof shingles and more. There is a two-car garage + pking for 2 to 3 more. In a vibrant urban community close to North Oakland Farmers’ Market, Donut Farm, Lois the Pie Queen, Trader Joe’s,  Temescal Creek Park, Emery Public Market, Bay Street shops, restaurants and theatres, Pixar, Amtrak, Transbay Bus Line mins to Ashby Bart. **New driveway gates installed not showing in pics.**",,,,,,,,,,,,,No,80.0,No,,No,13-1183-33,0,,CONTRA COSTA,https://www.youtube.com/watch?v=mHfwmbbJ25k,https://www.cbhometour.com/1119-54th-Street-Oakland-CA-94608/index.html,,02210914,01906450,,Yes,RESIDENTIAL,,2/9/2024,,,,,,,"Property was remodeled with permits where required per the Seller except replacement in kind bathrooms. Square footage advertised differs from the public record and has not been verified by seller or agent. Buyer is advised to conduct own investigation with the city prior to proceeding with purchase. Front unit living room closet has new infrastructure for a bonus powder room. Call agent for details! Turn Key! Clear pest. Sewer and Sidewalk compliant. Both units vacant! Buyer to cooperate with Seller's 1031 Exchange at no cost to buyer.  Seller will consider preemptive offers.  OPEN HOUSES :      1/14, 2-4:30pm                          1/20, 2-4:30pm I/21, 2-4:30pm                        Broker Tour 1/18, 10am-12pm   ",Alameda,San Pablo,18,18,6,San Pablo to 55th St. U-turn to 54th St,,NOBE,Oakland (510) 879-8111,,,,,,,6001.0,0.0,,,,1/19/2024,,Oakland (510) 879-8111,No,,,,,,2/14/2024,Conventional,1/13/2024 6:44 PM,$555,01205773,1/13/2024,,,01908304,Full Service,Excl Right,Market Listing,Water pipe in rear.,,,3.0,No,,,Owner,1/19/2024,,none,,,,,41047493,,"$999,000",,1/19/2024,,,,24,Yes,No,,"$999,000","$1,100,000",2/14/2024,$611.11,Judy Swaby,510.253.6931,Yes,,"Gorgeous NOBE Contemporary 2-family residence in sought after North Oakland Emeryville Border. This sweetheart duplex is is optimized for cash flow or the perfect home for a multi-generational family sitting on a tree-lined street in a mature neighborhood with long term residents. Stylishly renovated mirror images, each two-story unit has 2 Bds/1Bth with living, dining, kitchen on the main level and bedrooms and baths on the upper level. Each unit sports gleaming refinished original red oak floors, dual pane windows, new on demand water heaters, new furnace, updated plumbing and electrical, new kitchens, new bathrooms, new appliances, washer/dryers, new designer lighting throughout and freshly painted with a designer paint palette in and out. On the exterior there’s a new roof, new electric garage doors, new redwood fences, new custom-made gates, new porches, new landscaping including trees, new garage roof shingles and more. There is a two-car garage + pking for 2 to 3 more. In a vibrant urban community close to North Oakland Farmers’ Market, Donut Farm, Lois the Pie Queen, Trader Joe’s,  Temescal Creek Park, Emery Public Market, Bay Street shops, restaurants and theatres, Pixar, Amtrak, Transbay Bus Line mins to Ashby Bart. **New driveway gates installed not showing in pics.** ",,8.0,$611,Other,110.0,110.0,For Sale,,Access supra lock box in rear through pedestrian gates on either side of property. Door Codes in lock box. Please do not adjust anything on the door knob. Door locks automatically when shut.  BROKER TOUR. CANCELLED!  OPEN HOUSES THIS WEEKEND CXLED 1/20 & 1/21                          ,,$611.11,Measured,,CA,2/14/2024,Two Story,,,Yes,,,6.0,,,,2/15/2024,Yes,Yes,Yes,Yes,,1119,,54th St,94608,
41063031,SLD,13,1046 Aileen St,,OAKLAND,9999,"$835,000","$950,000",DE,1306.0,3.0,1.0,0.0,Y,0.0,1921.0,0.09,"4,000",,,"Scott Ward - Agt: 415-225-4593 - Welcome home to this uber charming, rehabbed, 3-bedroom, 1 bathroom Craftsman in North Oakland. Period details remain beautifully commingling with modern finishes found in the tiled bathroom and stylish kitchen. A sunny Bungalow floorplan, hardwood floors throughout a true living room complete with bay windows and bookshelves frame the brick fireplace. The dining room has a large functioning built-in hutch – perfect for storage and flaunting nick-nacks.  All three bedrooms are generously sized with ample closet space. The second and third bedrooms look out onto the backyard. An eat-in kitchen with all new appliances is spacious and flooded in west light – it also accesses the back Redwood deck, patio and outdoor space. Outside is private and beautiful – with a brick patio, an outdoor dining area, grass, and native plantings. The TRUE bonus – is the detached garage. Enter through new French doors. This updated space is awesome (new roof, flooring, windows etc.) All the necessary parts are in place for new owners to create what they want. Additional storage found in partial basement. Long driveway delivers plenty of off-street parking. Close proximity to Golden Gate Library, Stanford Ave Park and Temescal Creek Park. Plus, easy access to bike lanes and transportation. 84 WalkScore",,,,,,,,,,,,,,103.0,No,,No,15-1302-14,0,,Bridge AOR,https://www.amazingaileen.com/mls,,Well Made,01353359,619098.0,,Yes,RESIDENTIAL,,7/10/2024,,,,,,,"Open Broker Tour, 6/13, 10:00-1:00. Open SAT 6/22 and SUN 6/23, 2:00-4:30 PM. Offer date 6/25 by noon. Disclosure link in MLS.  Seller has never lived at the property. Bedroom, bathroom and SQF pulled posted in the MLS pulled from public record. Buyer to investigate all information with the City. Neither seller nor listing agent has verified the accuracy of any of these sources of information. Buyer to confirm all. Sewer lateral in compliance. Please call Scott with any questions, 415-225-4593.",Alameda,Gaskill,13,13,13,West onto Aileen from Market,,NORTH OAKLAND,,,,,,,,6001.0,1.0,,,,6/25/2024,,,No,,,,,,7/10/2024,Cash,6/12/2024 3:38 PM,$639,1490471,6/12/2024,,,619098.0,Full Service,Excl Right,Market Listing,Right Side,Done Right,,5.0,No,,,Vacant,6/25/2024,,,,,,,41063031,,"$835,000",,6/25/2024,,,,43,Yes,No,,"$835,000","$950,000",7/10/2024,$727.41,,,No,,"Welcome home to this uber charming, rehabbed, 3-bedroom, 1 bathroom Craftsman in North Oakland. Period details remain beautifully commingling with modern finishes found in the tiled bathroom and stylish kitchen. A sunny Bungalow floorplan, hardwood floors throughout a true living room complete with bay windows and bookshelves frame the brick fireplace. The dining room has a large functioning built-in hutch – perfect for storage and flaunting nick-nacks.  All three bedrooms are generously sized with ample closet space. The second and third bedrooms look out onto the backyard. An eat-in kitchen with all new appliances is spacious and flooded in west light – it also accesses the back Redwood deck, patio and outdoor space. Outside is private and beautiful – with a brick patio, an outdoor dining area, grass, and native plantings. The TRUE bonus – is the detached garage. Enter through new French doors. This updated space is awesome (new roof, flooring, windows etc.) All the necessary parts are in place for new owners to create what they want. Additional storage found in partial basement. Long driveway delivers plenty of off-street parking. Close proximity to Golden Gate Library, Stanford Ave Park and Temescal Creek Park. Plus, easy access to bike lanes and transportation. 84 WalkScore",,7.0,$727,LA & BA same company different office,114.0,114.0,For Sale,,"No Alarm. Please be sure all the doors are locked, basement, back door and garage/studio doors. Thank you.",,$727.41,Public Records,,CA,7/10/2024,One Story,,,Yes,15-1302-14,,3.0,,,,7/11/2024,Yes,Yes,Yes,Yes,,1046.0,,Aileen St,94608,
41062276,SLD,14,1224 66th Street,,BERKELEY,9999,"$1,195,000","$1,525,000",DE,1706.0,3.0,2.0,1.0,Y,1.0,2019.0,0.1,"4,400",,,"Danielle Broad - Cell: 925-383-9200 - Luxury Custom Home, Built in 2019! Beautiful contemporary 3 bed/2.5 bath, Located in South Berkeley. Designed w/energy efficiency, openness & indoor/outdoor flow. Pre-wired for solar & EV charger. Balanced interior w/warmth & modernism, High ceilings, Custom edge shelves, seamless quartz c-tops, walnut cab fronts & reclaimed wood vanities, polished concrete floors, and wide plank white oak flooring. The Bi-fold patio door opens to a beautiful Zen-style yard, creating the best indoor/outdoor living. Designer touches throughout. Commuters dream, 25mins to SF, 16 mins walk to Ashby BART and a short walk to top-rated restaurants, Berkeley Bowl grocery & short drive to UC Berkeley & the local favorite 13-acre park that offers after-school programs w/tennis & basketball lessons. A Perfect blend of luxury & convenience.",,,,,,,,,,,,,No,5.0,No,,No,52-1452-24,0,,DELTA,,,,01115126,1115126.0,,Yes,RESIDENTIAL,,7/11/2024,,,,,,,"TEXT FOR CBS & ALARM CODE!!  Newer construction was built in 2019 in an excellent South Berkeley location—pre-escrow with Fidelity National title #3082400279 Brentwood-Malou Gallardo/925.240.0070  This home is a detached site condo, NO DUES. Should Compare to SFRs for loan and appraisal purposes. Maintenance Association & CCRs. NO DUES.",Alameda,Sacramento,14,14,14,Sacramento to 66th,,NOBE,,,,,,,,6001.0,0.0,,,,6/20/2024,,,No,,,,,,7/11/2024,Conventional,6/6/2024 8:28 AM,$700,1293925,6/6/2024,,,2188495.0,Full Service,Excl Right,Market Listing,water pipe- driveway,,,1.0,No,,,Owner,6/20/2024,,0,,,,,41062276,,"$1,195,000",,6/20/2024,,,,26,Yes,No,,"$1,195,000","$1,525,000",7/11/2024,$893.90,Danielle,(925)383-9200,No,,"Luxury Custom Home, Built in 2019! Beautiful contemporary 3 bed/2.5 bath, Located in South Berkeley. Designed w/energy efficiency, openness & indoor/outdoor flow. Pre-wired for solar & EV charger. Balanced interior w/warmth & modernism, High ceilings, Custom edge shelves, seamless quartz c-tops, walnut cab fronts & reclaimed wood vanities, polished concrete floors, and wide plank white oak flooring. The Bi-fold patio door opens to a beautiful Zen-style yard, creating the best indoor/outdoor living. Designer touches throughout. Commuters dream, 25mins to SF, 16 mins walk to Ashby BART and a short walk to top-rated restaurants, Berkeley Bowl grocery & short drive to UC Berkeley & the local favorite 13-acre park that offers after-school programs w/tennis & basketball lessons. A Perfect blend of luxury & convenience.",,5.0,$894,LA & BA different company/franchise,128.0,128.0,For Sale,,CBS & ALARM - Text agent for CBS & Alarm code - Please reset the Alarm after touring.,,$893.90,Public Records,,CA,7/11/2024,Two Story,,,Yes,,,1.0,https://my.matterport.com/show/?m=Rd9iTiCL1DD,,,7/12/2024,Yes,Yes,Yes,Yes,,1224.0,,66th Street,94702,
41039922,SLD,15,1059 65th,,OAKLAND,9999,"$799,000","$600,000",DE,969.0,2.0,1.0,0.0,N,0.0,1903.0,0.100000,"4,400",,,Ben Taylor - 510-637-9266 - Investor Specials  !!!   this home is truly a Diamond -N-the-Rough with great bones.  Bring your construction skill set and make the desirable North Oakland  area a GEM.,,,,,,,,,,,,,No,121.0,,,,16-1449-4-2,4,,Bridge AOR,,,,02013278,01799782,,Yes,RESIDENTIAL,,10/13/2023,,,,,,,THIS IS NOT A REO AS THE STATUS IS SHOWING. An Investor Special with great Bones !!!  Need A Lot Of Work.  Bring your construction skill set !!!  SELLER IS MOTIVATED1!!!!  OFFERS  AS-IS ARE VIEWED AS THEY COME IN.  NOTE:  SEWER LATERAL ; HOME INSPECTION; TERMITE; ROOF REPORTS ARE ALL IN THE ASSOCIATED  DOCS ON MLS.  COMBOLXBX CODE:  1106,Alameda,Herzog,15,15,15,Herzog to 65th Street,,NORTH OAKLAND,,,,,,,,6001.0,0.0,,,,10/13/2023,,,No,,,,,,10/23/2023,Cash,9/22/2023 10:19 AM,$825,884531.0,9/22/2023,,,00884531,Full Service,Excl Right,Market Listing,COMBOLCXBX FRONT POR,,,4.0,No,,,Vacant,10/13/2023,,0,,,,,41039922,,"$799,000",,10/13/2023,,,,1,Yes,No,,"$799,000","$600,000",10/23/2023,$619.20,Go Direct   - COMBO LCXBX ON FRONT PORCH,,No,,Investor Specials  !!!   this home is truly a Diamond -N-the-Rough with great bones.  Bring your construction skill set and make the desirable North Oakland  area a GEM.,,5.0,$619,LA & BA different company/franchise,75.0,75.0,For Sale,,"AGENTS, PLEASE SEE THE CONFIDENITAL REMARKS FOR COBO LCBX CODE ",,$619.20,Assessor Auto-Fill,,CA,10/23/2023,One Story,,,No,16-1449-4-2,,,,,,1/3/2024,Yes,Yes,Yes,Yes,,1059.0,,65th,94608,
CL24357840,SLD,7,1074 53rd Street,,OAKLAND,9999,"$895,000","$1,035,000",DE,1100.0,2.0,2.0,0.0,,,1922.0,0.084800,"3,696",,,"Welcome to your charming new home in the heart of Oakland! This quaint 2 bed 1 bath home + ADU/Bonus Space, perfectly blends modern comfort and classic elegance. As you step through the front door, you're greeted by an abundance of natural light flowing through the spacious living area, adorned with hardwood floors and stylish finishes throughout. The kitchen is a chef's dream, featuring beautiful tile countertops, stainless steel appliances, and ample cabinet space. Whether you're whipping up a quick breakfast or preparing a gourmet feast, this kitchen is sure to inspire your culinary creations. Step outside to the private backyard, where you'll find a fully equipped ADU/Bonus Space with a kitchenette and bathroom perfect for a home office, guest suite or rental. The beautifully landscaped garden and patio area is perfect for outdoor dining, gardening, or simply unwinding after a long day. There is a small basement for storage. Conveniently located on the border of Oakland and Emeryville, this home offers easy access to a plethora of amenities, including shops, restaurants, and parks. Commuters will appreciate the close proximity to major highways and public transportation, providing quick and easy access to downtown Oakland, San Francisco, and beyond. Don't miss this opportunity to live in one of Oakland's most coveted neighborhoods!",,,,,,,,,,,,,,,,,Yes,013118600706,0,,Datashare CLAW,,,,01977223,,,,RESIDENTIAL,,3/26/2024,2100875.0,2199253.0,Jacob@TheAlligoodGroup.com,,,,"Offers Due Tuesday February 27th by 12pm. Please include in one PDF - RPA, Pre- Approval & Proof of Funds. Link to disclosures : https://app.disclosures.io/link/1074-53rd-Street-i6wzf6ao. The Bonus space/ADU is estimated by the seller at 205 SF and is included in the total sq. footage. Seller, broker, and broker's agents do not represent or guarantee the accuracy of the Square Footage of home or ADU/Bonus Space, bedroom/bathroom count, lot size or lot lines/dimensions, permitted or unpermitted spaces, school boundary lines or eligibility, or other information concerning the conditions or features of the property. Buyer is advised to independently verify the accuracy of all information.",Alameda,,7,8,8,Half a block east of San Pablo,,,,,,,,,,6001.0,,,,,2/28/2024,,,No,,,,,,3/27/2024,Other,2/20/2024 4:00 PM,$813,02099406,2/21/2024,Trey@TheAlligoodGroup.com,3104822201.0,01947727,Full Service,Excl Right,Market Listing,,,,,,,,Vacant,2/28/2024,,,,,,,24357840,,"$895,000",,2/28/2024,,,,33,,No,,,"$1,035,000",,$940.91,Hans Struzyna,5107688228|,,372420283.0,"Welcome to your charming new home in the heart of Oakland! This quaint 2 bed 1 bath home + ADU/Bonus Space, perfectly blends modern comfort and classic elegance. As you step through the front door, you're greeted by an abundance of natural light flowing through the spacious living area, adorned with hardwood floors and stylish finishes throughout. The kitchen is a chef's dream, featuring beautiful tile countertops, stainless steel appliances, and ample cabinet space. Whether you're whipping up a quick breakfast or preparing a gourmet feast, this kitchen is sure to inspire your culinary creations. Step outside to the private backyard, where you'll find a fully equipped ADU/Bonus Space with a kitchenette and bathroom perfect for a home office, guest suite or rental. The beautifully landscaped garden and patio area is perfect for outdoor dining, gardening, or simply unwinding after a long day. There is a small basement for storage. Conveniently located on the border of Oakland and Emeryville, this home offers easy access to a plethora of amenities, including shops, restaurants, and parks. Commuters will appreciate the close proximity to major highways and public transportation, providing quick and easy access to downtown Oakland, San Francisco, and beyond. Don't miss this opportunit",,,$940,,115.0,115.0,For Sale,,"Showing Instructions: Contact Hans Struzyna at 510-768-8228 Showing Information: Text LA 2,Supra Lock Box",,$940.91,,,CA,3/25/2024,One Story,,,Yes,,,1.0,,,,3/27/2024,Yes,Yes,Yes,Yes,,,,,94608,
41060218,SLD,51,983 Arlington Ave,,OAKLAND,9999,"$945,000","$945,000",DE,1847.0,3.0,2.0,0.0,Y,2.0,1925.0,0.100000,"4,200",,,"Eileen Townsend - Cell: 510-725-7422 - $50,000 price reduction! Extensively renovated, vacant side-by-side duplex offers perfect opportunity to enjoy all the comforts of a single-family home to own and live in, with or without rental income from the mirror-image second unit. Floorplan allows for easy conversion to single family by opening a wall. Re-built detached garage/workshop in the rear offers future living space/ADU potential. Live convenient-to-everything in your light-filled 10-foot ceiling Craftsman floorplan, from the covered front porch and native-plant garden, to fenced backyard with lawn, raised beds, and fern garden shaded by nearby redwood. Renovated with permits over the past 9 years, preserved period features combine with updated electrical, plumbing, rooves, closets, porcelain tile floors and subway tile in kitchens and baths for a turn-key experience without sacrificing character. Split-level step-up to primary bedroom affords privacy and Oakland Hills view; step-down to finished lower level rooms for possibility of additional bedrooms or bonus space. Both units are finished to the same exacting standard. Reno is detailed in disclosures.",,,,,,,,,,,,,,99.0,No,,No,15-1297-18,0,,Bridge AOR,,,,02196755,01499008,,Yes,RESIDENTIAL,,7/29/2024,,,,,,,"Green key opens 983 front and side/lower  door. Red key opens 985 front door. There are separate keys for garage/workshop and side/lower door on 985. See Matterport to view both units, also see www.983arlington.com    Bedroom count and SF differ from public record -- public record says 4 BR, 2 baths (two 2/1 units) and counts only upstairs finished square footage (1669). Owner has finished 983 bonus room/poss. 2nd BR in lower level for 1847 SF shown in MLS. See floorplans. Lower level in 985 unit is semi-finished, and not included in MLS square footage or BR count. Offers as they come.",Alameda,Los Angeles,51,51,51,Powell to Los Angeles to Arlington,,NOBE,Oakland (510) 879-8111,,,,,,,6001.0,2.0,,,,7/7/2024,,Oakland (510) 879-8111,No,,,,,,7/29/2024,Conventional,5/17/2024 3:13 PM,$512,2019343.0,5/17/2024,,,152723.0,Full Service,Excl Right,Market Listing,983 front door,Craftsman,,2.0,Yes,,,Vacant,7/7/2024,,2.5,,,,,41060218,,"$995,000",,7/7/2024,,,,49,Yes,No,,"$995,000","$945,000",6/27/2024,$511.64,"LA, Eileen",510-725-7422,Yes,,"$50,000 price reduction! Extensively renovated, vacant side-by-side duplex offers perfect opportunity to enjoy all the comforts of a single-family home to own and live in, with or without rental income from the mirror-image second unit. Floorplan allows for easy conversion to single family by opening a wall. Re-built detached garage/workshop in the rear offers future living space/ADU potential. Live convenient-to-everything in your light-filled 10-foot ceiling Craftsman floorplan, from the covered front porch and native-plant garden, to fenced backyard with lawn, raised beds, and fern garden shaded by nearby redwood. Renovated with permits over the past 9 years, preserved period features combine with updated electrical, plumbing, rooves, closets, porcelain tile floors and subway tile in kitchens and baths for a turn-key experience without sacrificing character. Split-level step-up to primary bedroom affords privacy and Oakland Hills view; step-down to finished lower level rooms for possibility of additional bedrooms or bonus space. Both units are finished to the same exacting standard. Reno is detailed in disclosures.",,8.0,$512,LA & BA different company/franchise,100.0,95.0,For Sale,,Vacant - show on Supra,,$511.64,Measured,,CA,7/29/2024,Split Level,,,Yes,15-1297-18,,,https://my.matterport.com/show/?m=SPY6SZHzYLd&brand=0,https://my.matterport.com/show/?m=fE7WYQC7K8x&brand=0,,7/30/2024,Yes,Yes,Yes,Yes,,983.0,,Arlington Ave,94608,
