MLS No,Status,DOM,Address,Unit,City,Area,LP,SP,BT,SqFt,BR,Bth,PB,Gar,GarSp,YrBlt,Acres,Lot SqFt,HOA Fee,Freq,3rd Party Synd. Remarks,ADU Baths Full,ADU Baths Partial,ADU Bedrooms,ADU Building Type,ADU Description,ADU Kitchen,ADU Main Entry Floor,ADU Meter,ADU Occupied,ADU Rents For,ADU Sq. Ft.,ADU SqFt Source,ADU Y/N,Age,Agent Has Ownership,Agent Hit Count,Agent Related to Principal,Assessors Parcel No,Associated Document Count,Available to Show,Board ID,Branded Media Link,Branded Media Link 2,Builder/Architect,Buyer Agent DRE Num.,Buyer Broker DRE Number,Census Tract,City Transfer Tax,Class,Client Hit Count,Closing Date,Co Buy Agent DRE Num.,Co List Agent DRE Num.,Co-List Agent email,Co-List Agent Fax,Complex Name,Concessions at COE,Confidential Remarks,County,Cross Street,Cumulative DOM,Cumulative DOMLS,Days On MLS,Directions to Property,Disclosures Link,Dist/Nbrhood/Sub,Elementary School Distric,Entry Agent First Name,Entry Agent ID,Entry Agent Last Name,Entry Agent License ID,Expire Date,Filtered Address,FIPS Code,Fireplaces,Floor Unit is on,Foreclosure Status,Gate Code,General Date,Geocode Quality,High School District,HOA,HOA Management Companies,HOA Name,HOA Name (Other),HOA Phone,Homesnap Appt. Scheduling,Hotsheet Date,How Sold,Input Date,List $/SqFt,List Agent DRE Num.,List Date,Listing Agt email,Listing Agt Fax,Listing Broker DRE Number,Listing Service,Listing Type,Listing Visibility Type,Lockbox Location,Model,New Subdivision,Number of offers,Occpnt Req 24 Hr Notice,Occupant Name,Occupant Phone,Occupied By,Off Market Date,Old Complex,Old Concessions,Old Elem,Old High,Old HOA Name,Old Middle,Old MLS #,Old Subdivision,Original Price,Ownership Type,Pending Date,Pending Litigation,Percent Owner Occ,Photo Permission,Picture Count,Point of Sale Ordinance,Pool,Preferred Agent Fax,Previous Price,Price,Price Date,Price Per SQFT,Primary Showing Contact,Primary Showing Phone,Printed Neighborhood Rpt,Property ID,Public Remarks,Radar ID,Rooms Total,Sale $/SqFt,Sale COOP,Sale/Last List $,Sale/Original $,Sale/Rent,Sales Office Info Remarks,Showing Instruction,Showing Schedule Link,Sold Price Per SQFT,Source,Special Information,State,Status Date,Stories,Subdivision (Other),Subdivision Profile Rmks,Supra Box?,Tax ID,TIC % Owner Offered,Total # of Garage and Parking Spaces,Unbranded Media Link,Unbranded Media Link 2,Units in Complex,Update Date,VOW Address,VOW AVM,VOW Comment,VOW Include,WiFi Last,ZIDX Only House #,ZIDX Only Street Dir,ZIDX Only Street Name,Zip,Zoning
41030291,SLD,27,1057 66th St,,OAKLAND,9999,"$998,000","$1,310,000",DE,1573.0,3.0,2.0,0.0,Y,0.0,1923.0,0.100000,"4,400",,,"Crystal Florida - 925-785-6488 - Looking to live in one of the most vibrant neighborhoods in the Bay Area? Look no further than this stunning single-family home located on the Oakland, Berkeley, and Emeryville border. This coveted location offers the best of all worlds, with easy access to the bustling urban areas as well as the trendy shops and restaurants nearby. Inside the home, you'll find a beautifully updated living space that is perfect for modern living. The updated kitchen boasts all the latest amenities, including stainless steel appliances and quartz countertops, while the new flooring and recessed lighting through the main living area add a touch of elegance to the space. With three spacious bedrooms and two bathrooms, this home is ideal for comfortable living or anyone who loves to entertain guests.But perhaps the best feature of this home is its location. Situated within walking distance of some of the area's best restaurants, cafes, and shops, you'll never be far from the action. And with a spacious driveway that can accommodate up to five vehicles, parking is never an issue. In short, this home offers the perfect combination of comfort, convenience, and style. Don't miss your chance to make it your own!",,,,,,,,,,,,,,100.0,,,,16-1452-12,0,,BAY EAST,,,,02085874,01527235,,Yes,RESIDENTIAL,,8/2/2023,,,,,,,,Alameda,Herzog,27,27,27,San Pablo->66th,,SOUTHWEST BERKELEY,,,,,,,,6001.0,1.0,,,,7/11/2023,,,No,,,,,,8/2/2023,Conventional,6/14/2023 3:47 PM,$634,1926266,6/14/2023,,,01527235,Full Service,Excl Right,Market Listing,,,,2.0,No,,,Vacant,7/11/2023,,none,,,,,41030291,,"$998,000",,7/11/2023,,,,35,Yes,No,,"$998,000","$1,310,000",8/2/2023,$832.80,,,Yes,,"Looking to live in one of the most vibrant neighborhoods in the Bay Area? Look no further than this stunning single-family home located on the Oakland, Berkeley, and Emeryville border. This coveted location offers the best of all worlds, with easy access to the bustling urban areas as well as the trendy shops and restaurants nearby.  Inside the home, you'll find a beautifully updated living space that is perfect for modern living. The updated kitchen boasts all the latest amenities, including stainless steel appliances and quartz countertops, while the new flooring and recessed lighting through the main living area add a touch of elegance to the space. With three spacious bedrooms and two bathrooms, this home is ideal for comfortable living or anyone who loves to entertain guests. But perhaps the best feature of this home is its location. Situated within walking distance of some of the area's best restaurants, cafes, and shops, you'll never be far from the action. And with a spacious driveway that can accommodate up to five vehicles, parking is never an issue.  In short, this home offers the perfect combination of comfort, convenience, and style. Don't miss your chance to make it your own!  ",,7.0,$833,"LA & BA same franchise, different office",131.0,131.0,For Sale,,,,$832.80,Measured,,CA,8/2/2023,One Story,,,Yes,16-1452-12,,5.0,,,,8/3/2023,Yes,Yes,Yes,Yes,,1057.0,,66th St,94608,
41021627,SLD,9,964 56Th St,,OAKLAND,9999,"$549,999","$700,000",DE,1172.0,4.0,1.0,1.0,Y,1.0,1908.0,0.090000,"3,750",,,"Alexander Watson - 925-566-5757 - Absolute Bargain!  Unbelievable Price!  Great Deal on a Super Home in a Great Area.  Hurry it will not last long at the Low, Low, Price.  Don't miss this Golden Opportunity for a Fantastic Deal in a Wonderful, Quiet, Neighborhood!",,,,,,,,,,,,,No,115.0,,,,15-1301-32,0,,BAY EAST,,,,01194792,1527235.0,,Yes,RESIDENTIAL,,4/7/2023,,,,,,,"Please lock the gate at front door.  Do not lock the front door. All reports (home, pest, roof, sewer lateral, sidewalk, hazard, prelim and disclosures will be provided after you view the property.  Email, Alex@ARWrealty.com for reports, disclosures and information.  Pre-escrow is open at First American Title with Stacy Schindler, sschindler@firstam.com,  925-750-6866.  Offers will be review as received.",Alameda,Lowell Street,9,9,9,See GPS,,NORTH OAKLAND,,,,,,,,6001.0,0.0,,,,3/24/2023,,,No,,,,,,4/10/2023,Private,3/15/2023 6:11 PM,$469,1335571,3/15/2023,,,02065804,Full Service,Excl Right,Market Listing,,,,8.0,No,,,Vacant,3/24/2023,,,,,,,41021627,,"$549,999",,3/24/2023,,,,1,Yes,No,,"$549,999","$700,000",4/10/2023,$597.27,,,Yes,,"Absolute Bargain!  Unbelievable Price!  Great Deal on a Super Home in a Great Area.  Hurry it will not last long at the Low, Low, Price.  Don't miss this Golden Opportunity for a Fantastic Deal in a Wonderful, Quiet, Neighborhood!",,6.0,$597,,127.0,127.0,For Sale,,Go and Show.  Supra on front door. Lock front gate.  Do not lock front door.,,$597.27,Public Records,,CA,4/10/2023,Two Story,,,Yes,15-1301-32,,,,,,4/10/2023,Yes,Yes,Yes,Yes,,964.0,,56Th St,94608,
41025142,SLD,20,1017 60Th St,,OAKLAND,9999,"$1,149,000","$1,210,000",DE,1991.0,4.0,2.0,0.0,N,0.0,1892.0,0.100000,"4,290",,,"Gaylen Roberts - Cell: 510-761-9536 - Spectacular opportunity to own this sunny, spacious, open concept Cape Cod Victorian with extra bonus spaces & an urban gardener's paradise. Endless indoor & outdoor space to entertain/garden & let your hobbies/vision take hold! 3 generous beds & 1 updated bath located on the second floor. Open concept kitchen, dining/living room, updated bathroom, sunny bonus office/patio doors lead to a spacious & private deck/backyard which is perfect for morning & evening meals. Additional family room and bedroom off of the kitchen is perfect to use for in-laws and guests with its separate entrance as well. Updates include: newer kitchen and baths with stone counters, dual pane windows, hardwoods, fresh interior paint, water heater, and furnace. Shared driveway leads to a wonderful backyard with a pergola covered seating area which is perfect for BBQ’s. Plenty of space to build an ADU still if desired. Centrally located in Paradise Park nearby Emeryville, Berkeley, North Oakland, San Pablo ave with all of it’s neighborhood eateries and shops: such as SideShow kitchen, Café Colucci, Cassave Mexican, Wolfhound Bar, Ace Maker Space and so much more. This is the one you have been looking for in a stellar central location!",,,,,,,,,,,,,,131.0,,,,15-1340-23,0,,Bridge AOR,http://www.soodo.us,http://www.gaylenrobertsgroup.com,,02081605,2081605.0,,Yes,RESIDENTIAL,,6/5/2023,,,,,,,"Open house 4/29 & 4/30, 5/6 & 5/7 from 2pm to 4:30pm. Text agent and show. Sewer and Sidewalk estimate in disclosures and buyers responsibility after the close of escrow. Disclosures: https://app.glide.com/share/7mviXk3HLET1XYUqiFmzVr/ Pre escrow opened with old republic title escrow # 5852300605 Offers: Contact Agent Driveway to the left of the house is shared with the house to the left approximately down the middle between both houses. See easement map in disclosures. A parking space, garage or ADU can be built or added at the rear if desired, buyer to confirm/perform their own due diligence as needed.  Advertised sqft was derived from Open Homes Photography and is larger than the public tax records. Neither agent or seller have verified bed/bath count, sqft or any advertised information.",Alameda,Idaho St,20,20,20,Stanford Ave >Idaho St > 60th Ave,,OAKLAND,Oakland (510) 879-8111,,,,,,,6001.0,0.0,,,,5/14/2023,,Oakland (510) 879-8111,No,,,,,,6/5/2023,Conventional,4/24/2023 2:01 PM,$577,01885597,4/24/2023,,,2029039.0,Full Service,Excl Right,Market Listing,Gas meter,Victorian,,1.0,No,,,Vacant,5/14/2023,,,,,,,41025142,,"$1,149,000",,5/14/2023,,,,50,Yes,No,,"$1,149,000","$1,210,000",6/5/2023,$607.73,,,No,,"Spectacular opportunity to own this sunny, spacious, open concept Cape Cod Victorian with extra bonus spaces & an urban gardener's paradise. Endless indoor & outdoor space to entertain/garden & let your hobbies/vision take hold! 3 generous beds & 1 updated bath located on the second floor. Open concept kitchen, dining/living room, updated bathroom, sunny bonus office/patio doors lead to a spacious & private deck/backyard which is perfect for morning & evening meals. Additional family room and bedroom off of the kitchen is perfect to use for in-laws and guests with its separate entrance as well. Updates include: newer kitchen and baths with stone counters, dual pane windows, hardwoods, fresh interior paint, water heater, and furnace. Shared driveway leads to a wonderful backyard with a pergola covered seating area which is perfect for BBQ’s. Plenty of space to build an ADU still if desired. Centrally located in Paradise Park nearby Emeryville, Berkeley, North Oakland, San Pablo ave with all of it’s neighborhood eateries and shops: such as SideShow kitchen, Café Colucci, Cassave Mexican, Wolfhound Bar, Ace Maker Space and so much more. This is the one you have been looking for in a stellar central location!",,8.0,$608,LA & BA different company/franchise,105.0,105.0,For Sale,,,,$607.73,Measured,,CA,6/5/2023,Two Story,,,Yes,15-1340-23,,1.0,,,,6/6/2023,Yes,Yes,Yes,Yes,,1017.0,,60Th St,94608,
41024944,SLD,12,1012 63rd St,,OAKLAND,9999,"$995,000","$1,240,000",DE,1195.0,3.0,1.0,0.0,Y,1.0,1908.0,0.110000,"4,556",,,"Mike Yohay - 510-717-2380 - Craftsman charm meets modern livability! Welcome to Paradise Park, a vibrant NOBE neighborhood at the intersection of Oakland, Berkeley, and Emeryville. This delightful bungalow has it all: spacious backyard, garage, tons of storage, and tasteful updates. Original period details include coved ceilings and built-in cabinets, plus gleaming hardwood floors that were recently refinished. An abundance of natural light pours in through the bay windows, while the bright cook’s kitchen offers plenty of storage and counter space. Make your way onto the sunny back deck, which is flanked by a majestic redwood. From there you can enjoy the private back patio, surrounded by a mature bamboo grove. Downstairs is a massive unfinished basement - a perfect flex space for your storage, workshop, or other endless possibilities. Just a couple blocks to the shops on San Pablo and Paradise Park Cafe - this home is close to Berkeley Bowl West, Ashby BART, freeway access, and so much more!",,,,,,,,,,,,,No,115.0,,,,16-1445-8,0,,Bridge AOR,https://my.matterport.com/show/?m=KhTDkjRLCwC,,,02064049,1527235.0,,Yes,RESIDENTIAL,,5/18/2023,,2118184.0,,,,,"Home qualifies for $10,500 lender grant (closing cost credit) through Bank of the West - Buyer to verify. Neither Seller nor Listing Agent have verified square footage or room count. Buyer to cooperate with Seller’s 1031 Exchange at no cost or liability to Buyer. Open Sat & Sun 2-4pm, Brokers Tour 4/27 10:30-12:30. Offers due Tues. 5/2 at 1pm.",Alameda,Baker St,12,12,12,Baker > 63rd,,NOBE,,,,,,,,6001.0,1.0,,,,5/3/2023,,,No,,,,,,5/18/2023,Conventional,4/21/2023 10:45 AM,$833,02080767,4/21/2023,,,1527235.0,Full Service,Excl Right,Market Listing,Front gas meter,,,3.0,No,,,Vacant,5/3/2023,,0,,,,,41024944,,"$995,000",,5/3/2023,,,,49,Yes,No,,"$995,000","$1,240,000",5/18/2023,"$1,037.66",,,Yes,,"Craftsman charm meets modern livability! Welcome to Paradise Park, a vibrant NOBE neighborhood at the intersection of Oakland, Berkeley, and Emeryville. This delightful bungalow has it all: spacious backyard, garage, tons of storage, and tasteful updates. Original period details include coved ceilings and built-in cabinets, plus gleaming hardwood floors that were recently refinished. An abundance of natural light pours in through the bay windows, while the bright cook’s kitchen offers plenty of storage and counter space. Make your way onto the sunny back deck, which is flanked by a majestic redwood. From there you can enjoy the private back patio, surrounded by a mature bamboo grove. Downstairs is a massive unfinished basement - a perfect flex space for your storage, workshop, or other endless possibilities. Just a couple blocks to the shops on San Pablo and Paradise Park Cafe - this home is close to Berkeley Bowl West, Ashby BART, freeway access, and so much more!",,6.0,"$1,038",LA & BA same office,125.0,125.0,For Sale,,Go and show!,,"$1,037.66",Public Records,,CA,5/18/2023,Two Story,,,Yes,16-1445-8,,2.0,https://my.matterport.com/show/?brand=0&m=KhTDkjRLCwC,,,5/19/2023,Yes,Yes,Yes,Yes,,1012,,63rd St,94608,
41068264,SLD,22,5531 Fremont St,,OAKLAND,9999,"$1,100,000","$1,060,000",DE,2215.0,5.0,4.0,0.0,N,0.0,1890.0,0.090000,"4,000",,,"Jason Pugao - 510-472-6916 -  Nestled in Oakland's coveted Golden Gate neighborhood and situated on a beautiful Magnolia Tree-Lined street. This property is the epitome of versatile living boasting a 3 bed 3 bath main unit and 2 bed 1 bath secondary unit. Both units have recently remodeled kitchens and bathrooms, new floors, fresh interior/exterior paint, appliances and new plumbing/electrical fixtures. A rare sighting of an Oakland property with Air Conditioning! Separately metered for gas/elect, the main unit also benefits from solar energy with its owned solar panels. Ready for EV charging. Ready for immediate occupancy. The existing floor plan may allow an additional 3rd unit without much reconfiguring. The property features a long driveway, a very special feature that most homes in this neighborhood just  don't have. The backyard is flat and a nice blank canvas for your creation. With a walk score of 84/100, many errands can be accomplished on foot, also many nearby public transportation options and flat enough to bike to Emeryville's Bay Street, Berkeley's 4th St Shops and Restaurants, UC Berkeley Campus and Oakland's Uptown. 5531 Fremont St is in close proximity to many freeway arteries such as 80/580/24 and the Bay Bridge.",,,,,,,,,,,,,,134.0,No,,No,15-1311-14,0,,BAY EAST,,,,01865014,00619098,,Yes,RESIDENTIAL,,9/9/2024,2133046.0,,,,,Yes,"Pre-escrow opened with Sharon Lupo, Chicago Title Pleasanton. Seller is looking for highest offer and cleanest terms. Please submit your offers via Disclosures IO. If you have any questions, call listing agent Jason Pugao (510) 472-6916",Alameda,Stanford Ave,97,97,22,Stanford Ave to Fremont St,,EMERYVILLE BORDR,,,,,,,,6001.0,0.0,,,,8/22/2024,,,No,,,,,,9/9/2024,Conventional,7/31/2024 1:01 PM,$497,01908325,7/31/2024,,,2065804.0,Full Service,Excl Right,Market Listing,,,,1.0,No,,,Vacant,8/22/2024,,,,,,,41068264,,"$1,100,000",,8/22/2024,,,,52,Yes,No,,"$1,100,000","$1,060,000",9/9/2024,$478.56,,,Yes,," Nestled in Oakland's coveted Golden Gate neighborhood and situated on a beautiful Magnolia Tree-Lined street. This property is the epitome of versatile living boasting a 3 bed 3 bath main unit and 2 bed 1 bath secondary unit. Both units have recently remodeled kitchens and bathrooms, new floors, fresh interior/exterior paint, appliances and new plumbing/electrical fixtures. A rare sighting of an Oakland property with Air Conditioning! Separately metered for gas/elect, the main unit also benefits from solar energy with its owned solar panels. Ready for EV charging. Ready for immediate occupancy. The existing floor plan may allow an additional 3rd unit without much reconfiguring. The property features a long driveway, a very special feature that most homes in this neighborhood just  don't have. The backyard is flat and a nice blank canvas for your creation. With a walk score of 84/100, many errands can be accomplished on foot, also many nearby public transportation options and flat enough to bike to Emeryville's Bay Street, Berkeley's 4th St Shops and Restaurants, UC Berkeley Campus and Oakland's Uptown. 5531 Fremont St is in close proximity to many freeway arteries such as 80/580/24 and the Bay Bridge.",,10.0,$479,,96.0,96.0,For Sale,,"PLEASE READ CAREFULLY ; Two locks. One at the fence near the pedestrian opening. Combo code is 8327. Then supra is at the main unit front door (5533). Please lock up all doors, windows. and turn off all lights. Return all keys to supra and comb",,$478.56,Public Records,,CA,9/9/2024,Two Story,,,Yes,15-1311-14,,,,,,9/10/2024,Yes,Yes,Yes,Yes,,5531.0,,Fremont St,94608,
41016948,SLD,21,5527 FREMONT ST,,OAKLAND,9999,"$949,000","$1,070,000",DE,1866.0,4.0,2.0,,N,0.0,1910.0,0.090000,"4,000",,,"Theresa D. Carlisle - 510-219-5121 - Welcome to 5527 Fremont Street. A charming Edwardian Style home that offers great flexibility and variety of living arrangements. Lovely formal spaces, a refreshed kitchen that is bound to inspire, easy two-story floor plan, and an amazing level yard with garden make this home a winner! This home features: two bedrooms, one bath on the main level and a finished non-conforming lower level with two bedrooms, plus spaces, bath, laundry and storage down (this space is included in the total sq footage). Great outdoor spaces include: a patio/deck off the kitchen, level lawn, patio, arbor, fruit trees, and veggie beds. Recently refreshed with an upgraded kitchen, interior paint, refinished hardwood & softwood floors, newer roof with solar (owned), upgraded electrical, sewer compliant, and more! Great NOBE location with countless amenities: Escuela Bilingüe Internacional (EBI), East Bay German International School, Emery-Go-Round, Public Transportation, Café Colucci, Wolfhound, Arizmendi, Donut Farm, Golden Gate Public Library, Big Box stores in Emeryville, and more!",,,,,,,,,,,,,No,113.0,,,,15 -1311-15,0,,Bridge AOR,http://www.5527FremontSt.com,,,01370959,1527235.0,,Yes,RESIDENTIAL,,3/2/2023,,1935524.0,,,,,OFFERS DUE Tues 1/31 by 11AM via disclosures.io. Contact Alex Dierkx 510-599-3440 with questions. Sq ft of the house as published was taken from Open Homes.  Sq ft of the house will not be verified by the Seller or Listing Agents. Disclosures: https://app.disclosures.io/link/5527-Fremont-Street-pzkbk63w   PLEASE READ DISCLOSURE INSTRUCTIONS ON COVER SHEET BEFORE SUBMITTING AN OFFER. RELO SALE- Have questions? Call us and ask!,Alameda,55th Street,21,21,21,San Pablo to 55th St to Fremont,,NOBE,,,,,,,,6001.0,1.0,,,,2/2/2023,,,No,,,,,,3/3/2023,Conventional,1/12/2023 2:58 PM,$509,01016920,1/12/2023,,,1527235.0,Full Service,Excl Right,Market Listing,Meter R of stairs,Charming,No,5.0,No,,,Vacant,2/2/2023,,,,,,,41016948,,"$949,000",,2/2/2023,,,,45,Yes,No,,"$949,000","$1,070,000",3/3/2023,$573.42,Alexandra Dierkx,510-599-34440,No,,"Welcome to 5527 Fremont Street. A charming Edwardian Style home that offers great flexibility and variety of living arrangements. Lovely formal spaces, a refreshed kitchen that is bound to inspire, easy two-story floor plan, and an amazing level yard with garden make this home a winner! This home features: two bedrooms, one bath on the main level and a finished non-conforming lower level with two bedrooms, plus spaces, bath, laundry and storage down (this space is included in the total sq footage). Great outdoor spaces include: a patio/deck off the kitchen, level lawn, patio, arbor, fruit trees, and veggie beds. Recently refreshed with an upgraded kitchen, interior paint, refinished hardwood & softwood floors, newer roof with solar (owned), upgraded electrical, sewer compliant, and more! Great NOBE location with countless amenities: Escuela Bilingüe Internacional (EBI), East Bay German International School, Emery-Go-Round, Public Transportation, Café Colucci, Wolfhound, Arizmendi, Donut Farm, Golden Gate Public Library, Big Box stores in Emeryville, and more!",,8.0,$573,"LA & BA same franchise, different office",113.0,113.0,For Sale,,,,$573.42,Measured,,CA,3/3/2023,Two Story,,,Yes,,,,http://www.5527FremontSt.com/mls,,,3/4/2023,Yes,No,No,Yes,,5527.0,,FREMONT ST,94608,
41066356,SLD,13,1038 57Th St,,OAKLAND,9999,"$995,000","$1,410,000",DE,2491.0,5.0,3.0,0.0,N,0.0,1910.0,0.09,"4,000",,,"M. Nobu Ito - 415-297-6623 - Have you dreamed of an oasis in the city?Beautiful stately craftsman bungalow with lots of natural light and original details, 3bd 1ba upstairs and 2+/2 downstairs, large 5 bd 3 bath home with options.  Updated kitchen and baths, living room flows into the dining room with built ins and box beam ceilings. Beautiful backyard oasis with a hot tub, outdoor shower, patio and landscaped garden with fruit trees (passion fruit, persimmon, lemon, lime, kiwi, blueberries, apples and fig) perfect for your daily staycations.  Downstairs rooms have separate entrances, perfect for inlaws, offices or bring it back to a large home again.  It's a wonderful street close to all of the amenities, restaurants, Pixar, SF, Berkeley Bowl, Farmer's Markets, Public Transport, FWY, etc.",,,,,,,,,,,,,No,114.0,No,,No,15-1303-13,0,,Bridge AOR,https://1038-57th-Street.com,,,01937039,01993663,,Yes,RESIDENTIAL,,8/12/2024,,,,,,No,"Great home that was once a large single family 5/3 but has been used as a 3/1 home upstairs with a 2bd 2ba inlaw unit downstairs perfect for a home office or split into two 1 bedroom 1 bath offices, with separate kitchens.  Can be converted back to a SFR. https://app.disclosures.io/link/1038-57th-Street-bllvn2s0  Offers, if any, due Wednesday 7/31 by 12 pm.",Alameda,Gaskill,13,19,19,Market to 57th,,GOLDEN GATE,,,,,,,,6001.0,1.0,,,,7/31/2024,,,No,,,,,,8/14/2024,Cash,7/12/2024 3:36 PM,$399,1934607.0,7/18/2024,,,1802283.0,Full Service,Excl Right,Market Listing,,,,3.0,No,,,Owner,7/31/2024,,,,,,,41066356,,"$995,000",,7/31/2024,,,,60,Yes,No,,"$995,000","$1,410,000",8/14/2024,$566.04,Contact Nobu for showing,4152976623,Yes,,"Have you dreamed of an oasis in the city? Beautiful stately craftsman bungalow with lots of natural light and original details, 3bd 1ba upstairs and 2+/2 downstairs, large 5 bd 3 bath home with options.  Updated kitchen and baths, living room flows into the dining room with built ins and box beam ceilings. Beautiful backyard oasis with a hot tub, outdoor shower, patio and landscaped garden with fruit trees (passion fruit, persimmon, lemon, lime, kiwi, blueberries, apples and fig) perfect for your daily staycations.  Downstairs rooms have separate entrances, perfect for inlaws, offices or bring it back to a large home again.  It's a wonderful street close to all of the amenities, restaurants, Pixar, SF, Berkeley Bowl, Farmer's Markets, Public Transport, FWY, etc.   ",,11.0,$566,LA & BA different company/franchise,142.0,142.0,For Sale,,Supra box located on right side of stair banister. ,,$566.04,Public Records,,CA,8/14/2024,Two Story,,,Yes,15-1303-13,,4.0,https://1038-57th-Street.com/2260663?idx=1,,,8/15/2024,Yes,Yes,Yes,Yes,,1038.0,,57Th St,94608,
