MLS No,Status,DOM,Address,Unit,City,Area,LP,SP,BT,SqFt,BR,Bth,PB,Gar,GarSp,YrBlt,Acres,Lot SqFt,HOA Fee,Freq,3rd Party Synd. Remarks,ADU Baths Full,ADU Baths Partial,ADU Bedrooms,ADU Building Type,ADU Description,ADU Kitchen,ADU Main Entry Floor,ADU Meter,ADU Occupied,ADU Rents For,ADU Sq. Ft.,ADU SqFt Source,ADU Y/N,Age,Agent Has Ownership,Agent Hit Count,Agent Related to Principal,Assessors Parcel No,Associated Document Count,Available to Show,Board ID,Branded Media Link,Branded Media Link 2,Builder/Architect,Buyer Agent DRE Num.,Buyer Broker DRE Number,Census Tract,City Transfer Tax,Class,Client Hit Count,Closing Date,Co Buy Agent DRE Num.,Co List Agent DRE Num.,Co-List Agent email,Co-List Agent Fax,Complex Name,Concessions at COE,Confidential Remarks,County,Cross Street,Cumulative DOM,Cumulative DOMLS,Days On MLS,Directions to Property,Disclosures Link,Dist/Nbrhood/Sub,Elementary School Distric,Entry Agent First Name,Entry Agent ID,Entry Agent Last Name,Entry Agent License ID,Expire Date,Filtered Address,FIPS Code,Fireplaces,Floor Unit is on,Foreclosure Status,Gate Code,General Date,Geocode Quality,High School District,HOA,HOA Management Companies,HOA Name,HOA Name (Other),HOA Phone,Homesnap Appt. Scheduling,Hotsheet Date,How Sold,Input Date,List $/SqFt,List Agent DRE Num.,List Date,Listing Agt email,Listing Agt Fax,Listing Broker DRE Number,Listing Service,Listing Type,Listing Visibility Type,Lockbox Location,Model,New Subdivision,Number of offers,Occpnt Req 24 Hr Notice,Occupant Name,Occupant Phone,Occupied By,Off Market Date,Old Complex,Old Concessions,Old Elem,Old High,Old HOA Name,Old Middle,Old MLS #,Old Subdivision,Original Price,Ownership Type,Pending Date,Pending Litigation,Percent Owner Occ,Photo Permission,Picture Count,Point of Sale Ordinance,Pool,Preferred Agent Fax,Previous Price,Price,Price Date,Price Per SQFT,Primary Showing Contact,Primary Showing Phone,Printed Neighborhood Rpt,Property ID,Public Remarks,Radar ID,Rooms Total,Sale $/SqFt,Sale COOP,Sale/Last List $,Sale/Original $,Sale/Rent,Sales Office Info Remarks,Showing Instruction,Showing Schedule Link,Sold Price Per SQFT,Source,Special Information,State,Status Date,Stories,Subdivision (Other),Subdivision Profile Rmks,Supra Box?,Tax ID,TIC % Owner Offered,Total # of Garage and Parking Spaces,Unbranded Media Link,Unbranded Media Link 2,Units in Complex,Update Date,VOW Address,VOW AVM,VOW Comment,VOW Include,WiFi Last,ZIDX Only House #,ZIDX Only Street Dir,ZIDX Only Street Name,Zip,Zoning
41030806,SLD,5,3996 Oak Hill Rd,,OAKLAND,9999,"$1,100,000","$1,200,000",DE,1792.0,4.0,3.0,0.0,Y,2.0,1959.0,0.150000,"6,305",,,"Patricia D Lipscomb-Hadden - 510-612-0562 - Just the home you have been waiting for! This Charming Classic Mid-Century corner lot, gated home offers excellent potential to add your personal touch. The 1,792 square ft. of living space on the main level features 4 bedrooms, 2 bathrooms, recently freshly painted interior walls, and nicely soft luster refinished hardwood floors. It also boasts a cozy living room with a warm fireplace and vaulted ceilings that flow into a formal dining area. The generous size eat-in kitchen has stone countertops and stainless-steel appliances. It has easy access to a serene backyard for perfect backyard barbecues, year-round entertainment, or simple relaxation. The lower level bonus rooms offers plenty of space to play, relax or entertain. The  spacious family room, bathroom, and indoor laundry room with sink provides additional convenient living space. This space was built with the original house but not included in public records. The 2-car garage is also adjacent to this area. Effortless access to Interstate 580 and convenient to 880, 13, 24, and 680 freeways. The home is near Bishop O'Dowd High School, the Oakland Zoo, and Sequoyah Country Club and Golf Course This is a home where you can breathe and realize that Life is Good!",,,,,,,,,,,,,No,64.0,,,,43A-4675-6,0,,Bridge AOR,https://youtu.be/LUgVzYyEzlQ,,,01747429,01747429,,Yes,RESIDENTIAL,,8/8/2023,,1454298.0,,,,,"- Offers due Wednesday, July 19th, 5:00pm. Seller willing to take a strong preemptive offer. Seller has the right to refuse offer. - This is a probate property. It does not require count confirmation unless one of the heirs objects to offer. - The owner passed away peacefully in the home. - Agent is one of the heirs to the estate. - Neither sellers nor listing agent represents nor warrants square footage of subject property. Bonus room isn't included in public record square footage. - Seller offers home warranty with Crest coverage included with purchase. - Buyer responsible for sewer lateral and sidewalk compliance.      ",Alameda,Golf Links Rd,5,22,22,Take Golf Links Rd to Oak Hill Rd,,SEQUOYAH HILLS,,,,,,,,6001.0,1.0,,,,7/12/2023,,,No,,,,,,8/9/2023,Conventional,6/20/2023 10:02 AM,$614,1958776,7/7/2023,,,01499008,Full Service,Excl Right,Market Listing,,,,3.0,No,,,Vacant,7/12/2023,,,,,,,41030806,,"$1,100,000",,7/12/2023,,,,43,Yes,No,,"$1,100,000","$1,200,000",8/9/2023,$669.64,,,Yes,,"Just the home you have been waiting for! This Charming Classic Mid-Century corner lot, gated home offers excellent potential to add your personal touch. The 1,792 square ft. of living space on the main level features 4 bedrooms, 2 bathrooms, recently freshly painted interior walls, and nicely soft luster refinished hardwood floors. It also boasts a cozy living room with a warm fireplace and vaulted ceilings that flow into a formal dining area. The generous size eat-in kitchen has stone countertops and stainless-steel appliances. It has easy access to a serene backyard for perfect backyard barbecues, year-round entertainment, or simple relaxation.   The lower level bonus rooms offers plenty of space to play, relax or entertain. The  spacious family room, bathroom, and indoor laundry room with sink provides additional convenient living space. This space was built with the original house but not included in public records. The 2-car garage is also adjacent to this area. Effortless access to Interstate 580 and convenient to 880, 13, 24, and 680 freeways. The home is near Bishop O'Dowd High School, the Oakland Zoo, and Sequoyah Country Club and Golf Course This is a home where you can breathe and realize that Life is Good!  ",,8.0,$670,,109.0,109.0,For Sale,,,,$669.64,Other,Offer As Is,CA,8/9/2023,Two Story,,,Yes,43A-4675-6,,,https://youtu.be/LUgVzYyEzlQ,,,8/10/2023,Yes,Yes,Yes,Yes,,3996.0,,Oak Hill Rd,94605,
ME222143955,SLD,22,9601 Las Vegas,,OAKLAND,9999,"$760,000","$780,000",DE,1249.0,3.0,2.0,0.0,,2.0,1940.0,0.139200,"6,064",,,Beautiful fully remodeled single family home! Great for 1st time homebuyers and investors. Appraised value as 12/10/22 $850k.,,,0.0,,,,,,,0.00,0,,No,83.0,,,,043A-4756-004,0,Show,Datashare MetroList,,,,01210970,1210970.0,554.00,,RESIDENTIAL,,2/16/2023,,,,,,,cOMBO #4747 alarm code #1947 when leaving please press the AWAY button on the alarm. Submit all offers to Shapiersonrealtor@gmail.com. offers will be reviewed as they come in. Please copy and paste link to review disclosures. https://app.disclosures.io/link/9601-Las-Vegas-Avenue-sk0vts07. Qualifies for the first republic bank eagle community loan rates as low as 3.79% (discounts) with 20% down,Alameda,98th Ave,22,23,23,Take hyw 580 going east or west exit 98th/golf lin,,,,,,,,,,6001.0,1.0,,,,12/14/2022,,,No,,,,,,2/18/2023,Other,11/21/2022 4:00 PM,$608,01838502,11/22/2022,,,1838502.0,Full Service,Excl Right,Market Listing,Supra and combo loca,,,1.0,,,,Vacant,12/14/2022,,4500,,,,,222143955,,"$760,000",,12/14/2022,,,,31,,No,,,"$780,000",,$624.50,Sha Pierson,510-326-9922,,560450642.0,Beautiful fully remodeled single family home! Great for 1st time homebuyers and investors. Appraised value as 12/10/22 $850k.,,5.0,$624,,102.0,102.0,For Sale,,Leave Card,,$624.50,Assessor Auto-Fill,,CA,2/16/2023,Two Story,,,No,,,0.0,,,,2/18/2023,Yes,Yes,Yes,Yes,,,,,94605,Resi
ML81924725,SLD,7,3568 Calandria Avenue,,OAKLAND,9999,"$798,000","$830,000",DE,1562.0,4.0,2.0,,Y,1.0,1947.0,0.169800,"7,398",,,,,,,,,,,,,,,,,76.0,,,,043A-4691-025,0,,Datashare MLSListings,https://3568calandriaave1799852.f8re.com/,,,02147224,,,,RESIDENTIAL,,5/12/2023,,,justhomes.realtor@gmail.com,,,,"Text listing agent for combo code and go direct. Escrow with Old Republic in Los Altos - Susan Goulet, purchase as is, one business day deposit, all disclosures and buyer agent AVID must be signed along with proof of funds and pre-approval. Agents - we have received a lot of interest and requests for disclosures. Seller has not set an offer date but will look at any clean non-contingent offers please also make sure to present highest and best offer price.",Alameda,Crest,7,7,7,,,,Oakland (510) 879-8111,,,,,,3568 Calandria AVE,6001.0,1.0,,,,4/21/2023,,Oakland (510) 879-8111,No,,,,,,,Conventional,4/14/2023 7:49 AM,$510,1373723.0,4/14/2023,samuel.pilli@cbrealty.com,,,Full Service,Excl Right,Market Listing,,,,,,,,Vacant,4/21/2023,,,,,,,,,"$798,000",,4/21/2023,,,,43,,No,,,"$830,000",,$531.37,,,,81924725.0,"Amazing opportunity to own and update to your preferance a 4 bedroom 2 bath home in the Oak Knolls Neighborhood with Bay Views. Situated up on top of Calandria Ave among high end homes and a neighborhood with panoramic views of the City, Golden Gate, Bay Bridge, downtown Oakland and bay views. This home features 2 bed 1 bath on the main level and 2 bed 1 bath on the lower level. There is also lovely front private patio area with direct access to the dining room. There is also a large back patio to enjoy the summer afternoons and large terraced backyard to explore your garnering creativity. Easy access to 580, BART, Knowland Park and the Oakland Zoo, hiking, equestrian trails, and just a mile from Leona Canyon Regional Open Space Preserve.",,,$531,,,,For Sale,,"Call Listing Agent,Leave Card",,$531.37,,,CA,5/17/2023,One Story,,,,,,,https://3568calandriaave1799852mls.f8re.com/,,,9/17/2024,Yes,Yes,Yes,Yes,,,,,94605,R!
41042411,SLD,49,10611 Mark St,,OAKLAND,9999,"$739,000","$720,000",DE,1283.0,3.0,2.0,0.0,Y,1.0,1960.0,0.16,"7,112",,,"Luis Castillo-Munoz - 510-593-4642 - Welcome to 10611 Mark Street!  This single level, 3br/2ba single family home is nestled in the Oakland Hills. A lovely home located in a quiet cul-de-sac neighborhood, close to Knowland Park/The Oakland Zoo, Lake Chabot Regional Park, hiking trails and easy access to Highways 580, 13 and 24. Has strong bones and a great layout featuring a spacious living room with a working fireplace, an inviting dining room connecting to the kitchen with a breakfast bar.  It also has a large bonus room which can be used as a sunroom, den or family room.  It has a nice feature with windows looking out to the yard and walks out to a covered patio.   You can enjoy the spacious yard for entertaining or possibly build an ADU/home office.  A great investment opportunity to add to your real estate portfolio. LOT SQ FT:  Approx. 7,100",,,,,,,,,,,,,,64.0,,,,48-5665-19,0,,BAY EAST,,,,01781827,01781827,,Yes,RESIDENTIAL,,1/2/2024,2092972.0,,,,,,PROBATE; no court confirmation required.  OH every Saturday btw 2-4pm until SOLD!  Buyer to complete any and all inspections deemed necessary.,Alameda,Malcolm,99,98,49,Take 580; exit 106th; turn L/R; just above 580 fwy,,OAKLAND,,,,,,,,6001.0,1.0,,,,12/7/2023,,Oakland (510) 879-8111,No,,,,,,1/2/2024,Conventional,10/19/2023 2:42 PM,$576,01317503,10/19/2023,,,01317503,Full Service,Excl Right,Market Listing,Front fence by bushe,,,2.0,Yes,,,Vacant,12/7/2023,,2500,,,,,41042411,,"$796,800",,12/7/2023,,,,16,Yes,No,,"$739,888","$720,000",1/2/2024,$561.18,Call agent,510-593-4642,No,,"Welcome to 10611 Mark Street!  This single level, 3br/2ba single family home is nestled in the Oakland Hills. A lovely home located in a quiet cul-de-sac neighborhood, close to Knowland Park/The Oakland Zoo, Lake Chabot Regional Park, hiking trails and easy access to Highways 580, 13 and 24. Has strong bones and a great layout featuring a spacious living room with a working fireplace, an inviting dining room connecting to the kitchen with a breakfast bar.  It also has a large bonus room which can be used as a sunroom, den or family room.  It has a nice feature with windows looking out to the yard and walks out to a covered patio.   You can enjoy the spacious yard for entertaining or possibly build an ADU/home office.  A great investment opportunity to add to your real estate portfolio. LOT SQ FT:  Approx. 7,100",,5.0,$561,LA & BA different company/franchise,97.0,90.0,For Sale,,Easy to show,,$561.18,Assessor Auto-Fill,,CA,1/2/2024,One Story,,,Yes,48-5665-19,,,,,,1/2/2024,Yes,Yes,Yes,Yes,,10611.0,,Mark St,94605,
41025588,SLD,12,3417 Oak Knoll Blvd,,OAKLAND,9999,"$800,000","$1,060,000",DE,1711.0,2.0,2.0,1.0,N,0.0,1991.0,0.140000,"6,172",,,"Tracy McBride - Agt: 510-517-6202 - Architect-designed contemporary home w/abundant natural light, private spaces to gather and a level, sunny organic garden. Built in 1991, the entry level has 10’ ceilings, spacious living room w/fireplace, custom cabinets, open staircase. The dining room connects to the kitchen up 3 steps or via a pass-through. The efficient kitchen has a modern aesthetic, white appliances, windows on 2 sides, and opens to the backyard. A half bath also on this level. Upstairs, 9’ ceilings usher light into the primary bedroom suite, walk-in closet, split updated bath with built-in cabinets. Large 2nd bedroom (potential to split into a 3rd bedroom?), sep laundry closet, and 2nd full bath. Fabulous systems: solar power + battery backup, heat-pump hot water heater, 30-year roof (installed 2011), high-efficiency furnace. Architectural-quality dual-pane windows, mathematically placed, capture light and open vistas onto the East Bay hills and garden. Vertical growing space for herbs and drought-resistant plants in front and rock-bordered vegetable beds, fruit trees (orange, fig, persimmon, plum, and pineapple guava), patios, and native plants enhance the backyard. Conveniently located minutes from neighborhood parks, Chabot/Redwood parks, and the central freeway for access to points north and south.",,,,,,,,,,,,,,32.0,,,,43A-4687-14,0,,Bridge AOR,http://www.3417OakKnoll.com,,Dreyfuss,01990459,2014153.0,,Yes,RESIDENTIAL,,5/26/2023,,,,,,,"Go and show! Disclosures to be updated soon. Brokers Tour May 1 10am-1pm. Please call Simone Hoover with questions, (510) 467-7640. Square footage not verified or guaranteed by agent or seller. No buyer letters. One key opens all locked doors. Solar battery is down east side yard. Offer date Wednesday, May 10, noon. Sellers out of area, please allow time for response.",Alameda,Murillo,12,12,12,Calandria/Murillo or Castlewood to Oak Knoll,,OAK KNOLL,Oakland (510) 879-8111,,,,,,,6001.0,1.0,,,,5/10/2023,,Oakland (510) 879-8111,No,,,,,,5/26/2023,Conventional,4/28/2023 8:36 AM,$468,01863856,4/28/2023,,,1527235.0,Full Service,Excl Right,Market Listing,Call agent,Contemporary,,18.0,No,,,Vacant,5/10/2023,,none,,,,,41025588,,"$800,000",,5/10/2023,,,,60,Yes,No,,"$800,000","$1,060,000",5/26/2023,$619.52,Simone Hoover,?(510) 467-7640?,Yes,,"Architect-designed contemporary home w/abundant natural light, private spaces to gather and a level, sunny organic garden. Built in 1991, the entry level has 10’ ceilings, spacious living room w/fireplace, custom cabinets, open staircase. The dining room connects to the kitchen up 3 steps or via a pass-through. The efficient kitchen has a modern aesthetic, white appliances, windows on 2 sides, and opens to the backyard. A half bath also on this level. Upstairs, 9’ ceilings usher light into the primary bedroom suite, walk-in closet, split updated bath with built-in cabinets. Large 2nd bedroom (potential to split into a 3rd bedroom?), sep laundry closet, and 2nd full bath. Fabulous systems: solar power + battery backup, heat-pump hot water heater, 30-year roof (installed 2011), high-efficiency furnace. Architectural-quality dual-pane windows, mathematically placed, capture light and open vistas onto the East Bay hills and garden. Vertical growing space for herbs and drought-resistant plants in front and rock-bordered vegetable beds, fruit trees (orange, fig, persimmon, plum, and pineapple guava), patios, and native plants enhance the backyard. Conveniently located minutes from neighborhood parks, Chabot/Redwood parks, and the central freeway for access to points north and south.",,5.0,$620,LA & BA different company/franchise,132.0,132.0,For Sale,,Go and show!,,$619.52,Public Records,,CA,5/26/2023,Two Story,,,No,43A-4687-14,,,,,,5/27/2023,Yes,Yes,Yes,Yes,,3417,,Oak Knoll Blvd,94605,
41025664,SLD,6,50 Woodcliff Ct,,OAKLAND,9999,"$1,125,000","$1,300,000",DE,2019.0,4.0,2.0,1.0,Y,2.0,1962.0,0.18,"7,650",,,"Moya C Robinson - 415-635-6512 - Introducing this sweet & idyllic tri-level mid-century home on a cul-de sac built in 1962 with partial bay views. Meticulously maintained, extensively renovated, and now on the market for the first time in over 60 years. The generously proportioned rooms including 4 bedrooms 2.5 baths cover 2019 sqft of living space and are nestled on an exceptional flat lot with wrap-around backyard overlooked from the kitchen window and back deck. On the main level is the living room, dining room and kitchen. The kitchen is newly equipped with quartz countertops, Bosch appliances, and charming period details. The second (split) level has four bedrooms, including a spacious master suite, and renovated bathrooms. The lower (split) level offers a spacious den with sliding glass doors leading to a level out back yard with room for play, entertaining, gardening and much more. There are also possibilities of use as a flex space. Adjacent you will find a laundry room, and a two car attached garage with interior access. Originally built as a gold medallion home this home stood test of time and presents a strong bill of health. Located in the desirable Chabot Park neighborhood, this home is close to Sequoyah Country Club, hiking trails, Oakland Zoo, and provides easy access to highways 580 and 13.",,,,,,,,,,,,,,61.0,,,,48-6173-93,0,,Bridge AOR,https://www.moyarobinsonre.com/50woodcliffct,,,01936210,1878277.0,,Yes,RESIDENTIAL,,5/19/2023,,,,,,,Seller received and decided to accept a pre-emptive offer.   ,Alameda,Malcolm,6,6,6,Malcolm to Woodcliff,,CHABOT PARK,,,,,,,,6001.0,1.0,,,,5/4/2023,,,No,,,,,,5/19/2023,Conventional,4/28/2023 1:57 PM,$557,01776635,4/28/2023,,,1527235.0,Full Service,Excl Right,Market Listing,,,,3.0,No,,,Vacant,5/4/2023,,"None, smooth and clean closing!",,,,,41025664,,"$1,125,000",,5/4/2023,,,,55,Yes,No,,"$1,125,000","$1,300,000",5/19/2023,$643.88,,,Yes,,"Introducing this sweet & idyllic tri-level mid-century home on a cul-de sac built in 1962 with partial bay views. Meticulously maintained, extensively renovated, and now on the market for the first time in over 60 years. The generously proportioned rooms including 4 bedrooms 2.5 baths cover 2019 sqft of living space and are nestled on an exceptional flat lot with wrap-around backyard overlooked from the kitchen window and back deck. On the main level is the living room, dining room and kitchen. The kitchen is newly equipped with quartz countertops, Bosch appliances, and charming period details. The second (split) level has four bedrooms, including a spacious master suite, and renovated bathrooms. The lower (split) level offers a spacious den with sliding glass doors leading to a level out back yard with room for play, entertaining, gardening and much more. There are also possibilities of use as a flex space. Adjacent you will find a laundry room, and a two car attached garage with interior access. Originally built as a gold medallion home this home stood test of time and presents a strong bill of health. Located in the desirable Chabot Park neighborhood, this home is close to Sequoyah Country Club, hiking trails, Oakland Zoo, and provides easy access to highways 580 and 13.",,8.0,$644,LA & BA different company/franchise,116.0,116.0,For Sale,,Call/email/text me: name & DRE# for CBS Code then - JUST GO!,,$643.88,Public Records,,CA,5/19/2023,Tri-Level,,,Yes,48-6173-93,,,,,,5/19/2023,Yes,No,Yes,Yes,,50.0,,Woodcliff Ct,94605,
41038749,SLD,62,3546 Calandria Ave,,OAKLAND,9999,"$1,249,000","$1,281,000",DE,2150.0,5.0,3.0,,Y,2.0,1952.0,0.138,"6,000",,,"Christopher P Rael - Agt: 925-305-3466 - PRICE REDUCED 150k! Luxury Redefined: Exquisite Upgrades in Every Corner Prepare to be amazed by this stunning property, where every detail has been carefully curated to create a modern masterpiece of elegance and luxury. Premium-grade solid wood cabinets offering both durability and sophistication, the soft-close doors and drawers add a touch of refinement, while the quartz countertops create breathtaking waterfall effects. High-end signature appliances make this kitchen a haven for culinary enthusiasts. A brand-new subpanel and an updated electrical system throughout ensure safety and efficiency. New surface-mounted lighting fixtures and recessed lighting provide a warm and inviting ambiance. Illuminated mirrors in all bathrooms add a touch of luxury and practicality. Goodbye to plumbing concerns with all-new plumbing and water lines. Eco-friendly and efficient water fixtures and toilets contribute to a greener lifestyle. A new natural gas system enhances energy efficiency. Enjoy customized comfort with the new multi-zone heating and ventilation system, ensuring the perfect temperature in every room. Step into a fresh and inviting space with new hardware and a pristine paint job.  Seller willing to Offer a 15K Buyer Credit, Call Chris for more information/Showings 925-305-3466.",,,,,,,,,,,,,No,71.0,,,,,0,,CONTRA COSTA,https://listings.dremarvisuals.com/sites/3546-calandria-ave-oakland-ca-94605-6095075/branded,,,01910603,01527235,,Yes,RESIDENTIAL,,12/22/2023,,,,,,,"Back on Market, no fault of Property. Reduced Price by 150k and seller willing to offer $15k Seller Credit.",Alameda,Crest,62,62,62,Fontaine to Crest right on Calandria,,OAK KNOLL,,,,,,,,6001.0,1.0,,,,11/27/2023,,,No,,,,,,12/23/2023,Conventional,9/11/2023 12:05 PM,$581,02030079,9/11/2023,,,1908304.0,Full Service,Excl Right,Market Listing,Front Door,,,3.0,No,,,Call Agent,11/27/2023,,,,,,,41038749,,"$1,399,000",,11/27/2023,,,,48,Yes,No,,"$1,299,000","$1,281,000",12/23/2023,$595.81,,,Yes,,"PRICE REDUCED 150k! Luxury Redefined: Exquisite Upgrades in Every Corner Prepare to be amazed by this stunning property, where every detail has been carefully curated to create a modern masterpiece of elegance and luxury. Premium-grade solid wood cabinets offering both durability and sophistication, the soft-close doors and drawers add a touch of refinement, while the quartz countertops create breathtaking waterfall effects. High-end signature appliances make this kitchen a haven for culinary enthusiasts. A brand-new subpanel and an updated electrical system throughout ensure safety and efficiency. New surface-mounted lighting fixtures and recessed lighting provide a warm and inviting ambiance. Illuminated mirrors in all bathrooms add a touch of luxury and practicality. Goodbye to plumbing concerns with all-new plumbing and water lines. Eco-friendly and efficient water fixtures and toilets contribute to a greener lifestyle. A new natural gas system enhances energy efficiency. Enjoy customized comfort with the new multi-zone heating and ventilation system, ensuring the perfect temperature in every room. Step into a fresh and inviting space with new hardware and a pristine paint job.  Seller willing to Offer a 15K Buyer Credit, Call Chris for more information/Showings 925-305-3466.",,8.0,$596,LA & BA different company/franchise,103.0,92.0,For Sale,,"Home Vacant, Please be sure to lock up. Reduced down to $1,249,000 + Seller is willing to offer a $15,000 Credit",https://calendly.com/chris-2718/showing-3546-calandria-ave,$595.81,Other,,CA,12/23/2023,Two Story,,,Yes,,,,,,,12/23/2023,Yes,Yes,Yes,Yes,,3546,,Calandria Ave,94560-5,
