SF424025493,SLD,11,3441 Oak Knoll Boulevard,,OAKLAND,9999,"$649,998","$850,000",DE,1456.0,2.0,2.0,1.0,,0.0,,0.144800,"6,307",,,"Welcome to your dream home in coveted Oak Knoll! This 2 bed, 2.5 bath residence offers comfort, convenience, and elegance. Nestled close to the zoo, enjoy serenity with mature trees and a manicured front garden. Step inside to discover a spacious living room flooded with natural light, perfect for cozy evenings by the fireplace. The adjacent dining room overlooks the expansive back garden, ideal for gardening and gatherings. The remodeled kitchen features new counters, stainless steel appliances, and deck access for al fresco dining. Retreat to the oversized primary bedroom with double sink ensuite and fireplace. The second bedroom offers ample space for relaxation. Outside, the backyard oasis boasts a lush lawn, patio, gardens and deck for entertaining. Additional highlights include two-car parking, and versatile bonus space downstairs with a half bath, plus access to a large basement with two storage areas. With its separate entrance, the bonus space offers endless opportunities. Buyers to conduct their own research on what is possible. Don't miss this opportunity.",,,,,,,,,,0.00,0,,,,,,,043A468701100,0,Contact Listing Agent,Datashare San Francisco,,,,02197518,01802283,0.00,,RESIDENTIAL,,5/13/2024,,01877522,,,,,"Text Matt Gomez (412) 216-1268 for tours outside of open house times. Buyers and buyer's agents to do their own due diligence and research. Tax records show 3 bedrooms, 2.5 baths, building square footage also shows 1898 on tax records, but shows 1456 on historic MLS records. Year built also shows discrepancy, 1949 built and effective 1968. Offer Date: 4/30/2024 at noon. Submit offers via Homelight. Disclosures: https://app.disclosures.io/link/3441-Oak-Knoll-Boulevard-uc4x8fud",Alameda,Alcala Ave,11,12,12,,,,,,,,,,,6001.0,2.0,,,,4/29/2024,,,No,,,,,,5/15/2024,Conventional,4/17/2024 5:00 PM,$446,02097814,4/18/2024,,,02206485,Full Service,Excl Right,Market Listing,,,,0.0,,,,Vacant,4/29/2024,,0,,,,,424025493,,"$649,998",,4/29/2024,,,,37,,,,,"$850,000",,$583.79,,,,530763750.0,"Welcome to your dream home in coveted Oak Knoll! This 2 bed, 2.5 bath residence offers comfort, convenience, and elegance. Nestled close to the zoo, enjoy serenity with mature trees and a manicured front garden. Step inside to discover a spacious living room flooded with natural light, perfect for cozy evenings by the fireplace. The adjacent dining room overlooks the expansive back garden, ideal for gardening and gatherings. The remodeled kitchen features new counters, stainless steel appliances, and deck access for al fresco dining. Retreat to the oversized primary bedroom with double sink ensuite and fireplace. The second bedroom offers ample space for relaxation. Outside, the backyard oasis boasts a lush lawn, patio, gardens and deck for entertaining. Additional highlights include two-car parking, and versatile bonus space downstairs with a half bath, plus access to a large basement with two storage areas. With its separate entrance, the bonus space offers endless opportunities. Buyers to conduct their own research on what is possible. Don't miss this opportunity.",,,$583,,130.0,130.0,For Sale,,Call Showing Contact,,$583.79,Assessor Agent-Fill,,CA,5/13/2024,,,,No,,,2.0,,,,5/15/2024,Yes,Yes,Yes,Yes,,,,,94605,
41064574,SLD,17,9332 Granada Ave,,OAKLAND,9999,"$998,000","$972,000",DE,1807.0,4.0,2.0,0.0,Y,2.0,1930.0,0.140000,"6,093",,,"Abril Manzo - 925-549-1200 - This Mediterranean-style home in Oak Knoll offers a picturesque setting, perfect for enjoying stunning sunsets & views! The interior boasts 1930s charming details like wood beam ceilings, arched doorways, and Art Deco wood trim, adding character to the living space. Over 1,800 square feet spread across 4 bedrooms, 2 full baths and bonus room for a home office and ample storage space add convenience and organization to the home. The hardwood floors add warmth, while the wood-burning fireplace sets a cozy ambiance. The large bay window invites natural light to flood the space flowing into the spacious formal dining room. The kitchen is a chef's delight, featuring granite counters, stainless steel appliances, and a charming breakfast nook with a view. The private deck provides an ideal spot for al-fresco dining on warm evenings, overlooking the serene surroundings. The inclusion of owned solar system, tank-less water heater, and dual-pane windows not only offer modern convenience but also contribute to energy efficiency. Conveniently located to Sequoyah Country Club, Oakland Zoo, and Bishop O'Dowd High School adds to its appeal, providing easy access to various amenities and recreational activities.",,,,,,,,,,,,,,94.0,No,,No,43A-4685-21,0,,BAY EAST,,,,01704071,1704071.0,,Yes,RESIDENTIAL,,8/2/2024,,,,,,,,Alameda,OAK KNOLL,70,70,17,GPS,,OAK KNOLL,,,,,,,,6001.0,1.0,,,,7/13/2024,,,No,,,,,,8/2/2024,Conventional,6/26/2024 6:55 AM,$552,1785409.0,6/26/2024,,,1522885.0,Full Service,Excl Right,Market Listing,Handrail by Plant,,,3.0,No,,,Owner,7/13/2024,,$22k credit to Buyers,,,,,41064574,,"$1,010,000",,7/13/2024,,,,41,Yes,No,,"$1,010,000","$972,000",8/2/2024,$537.91,"Easy, TEXT Agent",925-549-1200,No,,"This Mediterranean-style home in Oak Knoll offers a picturesque setting, perfect for enjoying stunning sunsets & views! The interior boasts 1930s charming details like wood beam ceilings, arched doorways, and Art Deco wood trim, adding character to the living space. Over 1,800 square feet spread across 4 bedrooms, 2 full baths and bonus room for a home office and ample storage space add convenience and organization to the home. The hardwood floors add warmth, while the wood-burning fireplace sets a cozy ambiance. The large bay window invites natural light to flood the space flowing into the spacious formal dining room. The kitchen is a chef's delight, featuring granite counters, stainless steel appliances, and a charming breakfast nook with a view. The private deck provides an ideal spot for al-fresco dining on warm evenings, overlooking the serene surroundings. The inclusion of owned solar system, tank-less water heater, and dual-pane windows not only offer modern convenience but also contribute to energy efficiency. Conveniently located to Sequoyah Country Club, Oakland Zoo, and Bishop O'Dowd High School adds to its appeal, providing easy access to various amenities and recreational activities.",,7.0,$538,LA & BA different company/franchise,97.0,96.0,For Sale,,EASY! Text Agent,,$537.91,Public Records,Offer As Is,CA,8/2/2024,Two Story,,,Yes,43A-4685-21,,,,,,8/3/2024,Yes,Yes,Yes,Yes,,9332.0,,Granada Ave,94605,
41051117,SLD,99,3083 Malcolm Ave,,OAKLAND,9999,"$930,000","$930,000",DE,1864.0,3.0,2.0,0.0,Y,2.0,1963.0,0.140000,"5,990",,,"Alonya Buford - 510-828-3369 - Welcome to your new home in the serene Oakland Hills! This inviting residence features an open living room with exposed wood beamed ceilings, providing a warm and charming atmosphere. Enjoy breathtaking views right from your living room window.The entire house has received a fresh coat of paint, and the wood floors have been beautifully refinished, adding a touch of elegance throughout. The kitchen is a chef’s delight, boasting refaced cabinets, new quartz countertops, and modern stainless steel appliances.With three bedrooms, each showcasing original wood floors, and two full bathrooms, comfort and style abound. The recently remodeled primary bathroom adds a contemporary touch to your private space.Discover versatility in the bonus room downstairs, ideal for an office, gym, or potential fourth bedroom. The convenience of a two-car attached garage with interior access enhances your daily living experience.Embrace low-maintenance living with thoughtfully designed landscaping. Don’t miss out on this exceptional opportunity – make this house your new home today!",,,,,,,,,,,,,No,61.0,No,,No,48-5664-21,0,,Bridge AOR,,,,01901395,1527235.0,,Yes,RESIDENTIAL,,8/14/2024,,,,,,Yes,"Transparent Pricing: contact agent at 510-828-3369. Please lock all doors and turn off lights after showings. Escrow is pre-opened with Chicago Title, Andrea Steiner. Sewer lateral compliant.",Alameda,106th,99,101,101,Google Maps,,CHABOT HIGHLANDS,,,,,,,,6001.0,1.0,,,,7/24/2024,,,No,,,,,,8/14/2024,Conventional,2/27/2024 6:48 PM,$499,1747429.0,2/29/2024,,,2029039.0,Full Service,Excl Right,Market Listing,,,,5.0,No,,,Vacant,7/24/2024,,,,,,,41051117,,"$849,000",,7/24/2024,,,,32,Yes,No,,"$849,000","$930,000",4/8/2024,$498.93,,,Yes,,"Welcome to your new home in the serene Oakland Hills! This inviting residence features an open living room with exposed wood beamed ceilings, providing a warm and charming atmosphere. Enjoy breathtaking views right from your living room window.  The entire house has received a fresh coat of paint, and the wood floors have been beautifully refinished, adding a touch of elegance throughout. The kitchen is a chef’s delight, boasting refaced cabinets, new quartz countertops, and modern stainless steel appliances.  With three bedrooms, each showcasing original wood floors, and two full bathrooms, comfort and style abound. The recently remodeled primary bathroom adds a contemporary touch to your private space.  Discover versatility in the bonus room downstairs, ideal for an office, gym, or potential fourth bedroom. The convenience of a two-car attached garage with interior access enhances your daily living experience.  Embrace low-maintenance living with thoughtfully designed landscaping. Don’t miss out on this exceptional opportunity – make this house your new home today!",,6.0,$499,LA & BA different company/franchise,100.0,110.0,For Sale,,,,$498.93,Public Records,,CA,8/14/2024,Split Level,,,Yes,48-5664-21,,,,,,8/15/2024,Yes,Yes,Yes,Yes,,3083.0,,Malcolm Ave,94605,
41043664,SLD,15,3416 MIRASOL AVENUE,,OAKLAND,9999,"$995,000","$1,085,000",DE,2590.0,3.0,3.0,,Y,2.0,1930.0,0.140000,"5,865",,,"David Gunderman - 510-205-4369 - This gorgeous 3BR/3BA Tudor home in the Oakland Hills boasts tasteful modern upgrades and enchanting old world charm. Conveniently located in the Oak Knoll neighborhood and near Bishop O’Dowd High School, you can hike in the nearby King Estate open space or enjoy the Oakland Zoo! From the foyer, step through a Gothic arch to the sunlit living room with mullioned picture window, high, coved ceilings, and ornate vintage fireplace. Through another arch, the dining room is bright with an easy flow into the upgraded sunny kitchen and attached breakfast nook with built-in glass cabinets. Refinished hardwood floors span the 2590 SQFT home. Upstairs, two spacious bedrooms with roomy closets share a full bath. The crown jewel–a gorgeous primary suite–is up a few short steps and offers vaulted ceilings, privacy, plenty of space, and a luxurious bath with a double sink, claw-footed tub, and massive walk-in shower with rainfall shower head. A staircase off the kitchen leads down to a flexible family room and kitchenette (future in-law apartment?) with a high beamed ceiling, fireplace, full bath, ample storage and 2-car garage. A sliding glass door leads to the backyard featuring mature landscaping, raised beds, large patio ready for entertaining and low-maintenance turf ready for play.",,,,,,,,,,,,,,93.0,,,,43A-4687-20,0,,BAY EAST,http://3416Mirasol.com,https://vimeo.com/881278916,,01716499,1527235.0,,Yes,RESIDENTIAL,,12/13/2023,,02028425,,,,,Accepted Offer NO OPEN HOUSE 11/19. Hans Struzyna is lead agent 510-768-8228 hans@thegundermangroup.com.  *contact Hans for offer details*  Bed/Bath/Square Feet may not match public records - buyer to verify/satisfy.  *The taking of images of this property is limited to those persons preparing Appraisal or Inspection reports.*   Matterport and website: 3416Mirasol.com  ,Alameda,Murillo,15,15,15,Golf Links/Encina/Castlewood/Murillo,,OAK KNOLL,,,,,,,,6001.0,2.0,,,,11/18/2023,,,No,,,,,,12/13/2023,Conventional,11/3/2023 11:12 AM,$384,1313613.0,11/3/2023,,,2029039,Full Service,Excl Right,Market Listing,,,,2.0,No,,,Vacant,11/18/2023,,,,,,,41043664,,"$995,000",,11/18/2023,,,,57,Yes,No,,"$995,000","$1,085,000",12/13/2023,$418.92,Hans Struzyna,510-768-8228,No,,"This gorgeous 3BR/3BA Tudor home in the Oakland Hills boasts tasteful modern upgrades and enchanting old world charm. Conveniently located in the Oak Knoll neighborhood and near Bishop O’Dowd High School, you can hike in the nearby King Estate open space or enjoy the Oakland Zoo! From the foyer, step through a Gothic arch to the sunlit living room with mullioned picture window, high, coved ceilings, and ornate vintage fireplace. Through another arch, the dining room is bright with an easy flow into the upgraded sunny kitchen and attached breakfast nook with built-in glass cabinets. Refinished hardwood floors span the 2590 SQFT home. Upstairs, two spacious bedrooms with roomy closets share a full bath. The crown jewel–a gorgeous primary suite–is up a few short steps and offers vaulted ceilings, privacy, plenty of space, and a luxurious bath with a double sink, claw-footed tub, and massive walk-in shower with rainfall shower head. A staircase off the kitchen leads down to a flexible family room and kitchenette (future in-law apartment?) with a high beamed ceiling, fireplace, full bath, ample storage and 2-car garage. A sliding glass door leads to the backyard featuring mature landscaping, raised beds, large patio ready for entertaining and low-maintenance turf ready for play.",,6.0,$419,LA & BA different company/franchise,109.0,109.0,For Sale,,Go & Show,,$418.92,Measured,,CA,12/13/2023,Three or More Stories,,,Yes,43A-4687-20,,2.0,https://my.matterport.com/show/?m=xhPgZE1wF6c,,,12/14/2023,Yes,Yes,Yes,Yes,,3416.0,,MIRASOL AVENUE,94605,
41061745,SLD,7,3449 Encina Way,,OAKLAND,9999,"$700,000","$700,000",DE,1897.0,4.0,2.0,,Y,2.0,1946.0,0.165100,"7,192",,,"Randy Munmon Jr. - 415-845-1160 - Welcome to your new home in the desirable Oak Knoll neighborhood of Oakland! This four-bedroom, two-bathroom house is ready for new owners to bring their personal touch.  Enjoy a spacious living area filled with natural light, a kitchen waiting for your creativity, and large front and back yards perfect for outdoor activities. The home offers a private feel, nestled in a friendly community with easy access to amenities, parks, and public transportation.  Don’t miss this opportunity to make this Oak Knoll gem your own! Contact us today to schedule a viewing.",,,,,,,,,,,,,,78.0,No,,No,,0,,Bridge AOR,,,,02020518,2208841.0,,Yes,RESIDENTIAL,,7/15/2024,,,,,,,"Please request an appointment via ShowingTime link. Owner occupied, 24 hours notice preferred. No lockbox, Agent will give access. Disclosures link https://app.disclosures.io/link/3449-Encina-Way-e2xlws0f. Square footage and bedroom count does not match public record. All information and images should be independently reviewed and verified for accuracy. Submit offers via HomeLight, please include PAL, POF, and EMD within 24 hours of ratified contract. We appreciate your interest in this Listing! You may call Randy Munmon at 415-845-1160 with any questions.",Alameda,Oak Knoll Blvd,7,7,7,use maps,,GOLF LINKS,,,,,,,,6001.0,1.0,,,,6/7/2024,,,No,,,,,,7/17/2024,Conventional,5/31/2024 5:58 PM,$369,2041436,5/31/2024,,,2208841.0,Full Service,Excl Right,Market Listing,,,,4.0,No,,,Owner,6/7/2024,,none,,,,,41061745,,"$700,000",,6/7/2024,,,,20,Yes,No,,"$700,000","$700,000",5/31/2024,$369.00,,,Yes,,"Welcome to your new home in the desirable Oak Knoll neighborhood of Oakland! This four-bedroom, two-bathroom house is ready for new owners to bring their personal touch.  Enjoy a spacious living area filled with natural light, a kitchen waiting for your creativity, and large front and back yards perfect for outdoor activities. The home offers a private feel, nestled in a friendly community with easy access to amenities, parks, and public transportation.  Don’t miss this opportunity to make this Oak Knoll gem your own! Contact us today to schedule a viewing.",,7.0,$369,LA & BA same office,100.0,100.0,For Sale,,,,$369.00,Not Verified,Offer As Is,CA,7/17/2024,Two Story,,,No,,,,,,,7/18/2024,Yes,Yes,Yes,Yes,,3449.0,,Encina Way,94605,
41037479,SLD,15,10626 Sheldon St,,OAKLAND,9999,"$799,000","$952,888",DE,1524.0,3.0,2.0,,Y,2.0,1949.0,0.150000,"6,466",,,"Gaylen Roberts - Cell: 510-761-9536 - 10626 Sheldon st is an immaculate sunny home in the Grass Valley neighborhood of the Oakland hills.  This lovely home boasts 3 beds, 2 baths, with an updated kitchen/dining room, a large living room/family room with a wood burning fireplace. Easy access to the private rear patio & low maintenance backyard/garden from the main living space is ideal for relaxing, entertaining, gardening & the ideal California lifestyle that we all dream of! Expansive panoramic bay views from many areas of the property. Upgrades include: updated kitchen, bathrooms, hardwood floors, dual pane windows, fresh paint, HVAC with AC. This home offers a split level plan that could be great as a house hack rental, Airbnb, or inlaw unit. 2 car garage with interior access/additional storage space. Minutes to the newly expanded Oakland Zoo, Oakland airport, Lake Chabot golf course, & the 3,300 acre Anthony Chabot Regional Park with 70 miles of hiking & riding trails. This turnkey home offers a remarkable blend of views, peace & tranquility!",,,,,,,,,,,,,,74.0,,,,48-5663-14-1,0,,Bridge AOR,http://www.soodo.us,http://www.gaylenrobertsgroup.com,,01738860,01902981,,Yes,RESIDENTIAL,,10/12/2023,,,,,,,"Open house 9/3 and 9/10 from 2pm to 4:30pm. Disclosures: https://app.glide.com/share/7qHt5dUZQ51M0O9RV0f7KE/ ,Pre-escrow opened with Sean Loftus - Chicago title escrow #5852301542  Neither agent or seller have verified bed/bath count, sqft or any advertised information.",Alameda,Malcolm Ave,15,15,15,Malcolm Ave > Sheldon St,,OAKLAND,Oakland (510) 879-8111,,,,,,,6001.0,1.0,,,,9/13/2023,,Oakland (510) 879-8111,No,,,,,,10/12/2023,Conventional,8/29/2023 3:06 PM,$524,1885597.0,8/29/2023,,,02029039,Full Service,Excl Right,Market Listing,Front Rail,,,4.0,No,,,Owner,9/13/2023,,,,,,,41037479,,"$799,000",,9/13/2023,,,,60,Yes,No,,"$799,000","$952,888",10/12/2023,$625.25,510-761-9536,,No,,"10626 Sheldon st is an immaculate sunny home in the Grass Valley neighborhood of the Oakland hills.  This lovely home boasts 3 beds, 2 baths, with an updated kitchen/dining room, a large living room/family room with a wood burning fireplace. Easy access to the private rear patio & low maintenance backyard/garden from the main living space is ideal for relaxing, entertaining, gardening & the ideal California lifestyle that we all dream of! Expansive panoramic bay views from many areas of the property. Upgrades include: updated kitchen, bathrooms, hardwood floors, dual pane windows, fresh paint, HVAC with AC. This home offers a split level plan that could be great as a house hack rental, Airbnb, or inlaw unit. 2 car garage with interior access/additional storage space. Minutes to the newly expanded Oakland Zoo, Oakland airport, Lake Chabot golf course, & the 3,300 acre Anthony Chabot Regional Park with 70 miles of hiking & riding trails. This turnkey home offers a remarkable blend of views, peace & tranquility!",,5.0,$625,LA & BA different company/franchise,119.0,119.0,For Sale,,Text agent to show prior,,$625.25,Other,,CA,10/12/2023,Split Level,,,Yes,48-5663-14-1,,4.0,,,,10/13/2023,Yes,Yes,Yes,Yes,,10626.0,,Sheldon St,94605,
41048732,SLD,7,33 Oak Hill Cir,,OAKLAND,9999,"$1,250,000","$1,250,000",DE,2470.0,5.0,3.0,,Y,2.0,1962.0,0.150000,"6,600",,,"Terry L Morris - Fax: 510-544-4937 - This beautiful family home is located on a cul-de-sac in the must-see desirable Oakland Hills Sequoyah Heights. Upon entering, you will see a large living room and formal dining room. The remodeled eat in kitchen has tile floors, built in cabinets and new black and stainless-steel appliances. Adjacent to the kitchen is a laundry room with washer, dryer hook ups and a stainless-steel deep sink. Main level also features two large bedrooms and an updated full bathroom. Upstairs level has three large bedrooms and two remodeled full bathrooms. Master bath includes a soaking tub. Gorgeous original hardwood floors throughout the house. Front yard has brick walkway, and the large backyard has massive tile and wood deck which is perfect for barbecues and year-round entertaining. The property is near Sequoyah Country Club, Knowland Park, Oakland Zoo, Bishop O'Dowd High School, and other private schools.  Easy access to 580 freeway.",,,,,,,,,,,,,No,62.0,No,,No,43A-4675-032-02,0,,Bridge AOR,,,,02146289,2022092.0,,Yes,RESIDENTIAL,,2/22/2024,,,,,,,"Vacant, lockbox on gas meter, just go show. Please leave your business card and make sure all doors are locked. Sewer Lateral done; certificate available. Sidewalk ordinance will be done at close of escrow. Pre-escrow opened at Old Republic Title with Russell Watts rwatts@ortc.com 510.339.2020. Please send all offers to: terryluvelmorris@gmail.com. Any questions? Call Terry Morris at 510-872-1223.  ",Alameda,Oak Hill Road,7,7,7,Golf Links Road to Oak Hill Road to Oak Hill Cir,,SEQUOYAH HEIGHTS,,,,,,,,6001.0,1.0,,,,2/6/2024,,,No,,,,,,2/22/2024,Conventional,1/30/2024 1:02 PM,$506,1464105,1/30/2024,,,01465105,Full Service,Excl Right,Market Listing,,,,1.0,No,,,Vacant,2/6/2024,,0,,,,,41048732,,"$1,250,000",,2/6/2024,,,,44,Yes,No,,"$1,250,000","$1,250,000",1/30/2024,$506.07,,,No,,"This beautiful family home is located on a cul-de-sac in the must-see desirable Oakland Hills Sequoyah Heights. Upon entering, you will see a large living room and formal dining room. The remodeled eat in kitchen has tile floors, built in cabinets and new black and stainless-steel appliances. Adjacent to the kitchen is a laundry room with washer, dryer hook ups and a stainless-steel deep sink. Main level also features two large bedrooms and an updated full bathroom. Upstairs level has three large bedrooms and two remodeled full bathrooms. Master bath includes a soaking tub. Gorgeous original hardwood floors throughout the house. Front yard has brick walkway, and the large backyard has massive tile and wood deck which is perfect for barbecues and year-round entertaining. The property is near Sequoyah Country Club, Knowland Park, Oakland Zoo, Bishop O'Dowd High School, and other private schools.  Easy access to 580 freeway.",,8.0,$506,,100.0,100.0,For Sale,,,,$506.07,Assessor Auto-Fill,,CA,2/22/2024,Two Story,,,Yes,,,,,,,2/23/2024,Yes,Yes,Yes,Yes,,33.0,,Oak Hill Cir,94605,
41015135,SLD,19,10520 Stella St,,OAKLAND,9999,"$819,000","$839,000",DE,1410.0,3.0,2.0,0.0,N,0.0,1920.0,0.140000,"6,171",,,"Richard Boulet - 510-926-0195 - Tucked away in a private little corner of a tranquil little street is this wonderful oasis in the Broadmoor Terrace neighborhood of Oakland.  Enjoy morning or evening beverages on the enclosed porch. Garden, play or just let your pets roam free on the over 6000 square foot, low maintenance lot. Three bedrooms, two bathrooms and plenty of room to spread out. The primary suite offers privacy from the rest of the house and opens to the yard. The yard provides direct access to the entrance of the Oakland Zoo!  Conveniently located near Hwy 580 for commuting, and the trails of Knowland Park.",,,,,,,,,,,,,No,103.0,,,,48-5666-40,0,,Bridge AOR,https://www.redoakrealty.com/Stellastreethideaway,,,01926412,01926412,,Yes,RESIDENTIAL,,1/11/2023,,,,,,,"Total room, Bedroom and bathroom count, and square footage may differ from public records, buyer to verify. Property qualifies for First Republic Eagle Community loan program. No buyer support letters, please. Please call/text/email Richie with any questions.  Offers as written.",Alameda,Malcolm,19,19,19,580 to 106th to Malcom,,BROADMOOR TERR,,,,,,,,6001.0,0.0,,,,12/21/2022,,,No,,,,,,1/11/2023,Conventional,12/2/2022 8:06 AM,$581,02135269,12/2/2022,,,00619098,Full Service,Excl Right,Market Listing,,,,2.0,Yes,,,Owner,12/21/2022,,,,,,,41015135,,"$845,000",,12/21/2022,,,,45,Yes,No,,"$845,000","$839,000",1/11/2023,$595.04,Richie Boulet,510-926-0195,Yes,,"Tucked away in a private little corner of a tranquil little street is this wonderful oasis in the Broadmoor Terrace neighborhood of Oakland.  Enjoy morning or evening beverages on the enclosed porch. Garden, play or just let your pets roam free on the over 6000 square foot, low maintenance lot. Three bedrooms, two bathrooms and plenty of room to spread out. The primary suite offers privacy from the rest of the house and opens to the yard. The yard provides direct access to the entrance of the Oakland Zoo!  Conveniently located near Hwy 580 for commuting, and the trails of Knowland Park.",,4.0,$595,,102.0,99.0,For Sale,,,,$595.04,Public Records,Offer As Is,CA,1/11/2023,One Story,,,No,48-5666-40,,,,,,1/12/2023,Yes,No,No,Yes,,10520.0,,Stella St,94605,
