41056314,SLD,75,10521 Stella St,,OAKLAND,9999,"$799,000","$800,000",DE,1750.0,3.0,2.0,,Y,2.0,1950.0,0.141400,"6,160",,,"Amish Munshi - 415-573-2468 - Presenting this beautiful residence nestled in the Chabot Park Community of Oakland . 10521 Stella Street is a stunning corner lot property with 3 bedrooms and 2 baths.  With modern renovations, this spacious and inviting home boasts over 1,700 square feet of living space.  The great room is perfect for growing families and entertaining guests. With the large windows throughout, ample natural light shines and highlights the beautiful flooring.  The home features a sleek kitchen with stainless steel appliances and quartz countertops, and modern cabinets.  The large master suite with an elegant ensuite also features access to your backyard deck. Here you can enjoy the California sunshine.  Conveniently located near Oakland Zoo, parks, and shopping and Interstate 880. This home is a must-see for anyone looking to settle in Silicon Valley.",,,,,,,,,,,,,,74.0,Yes,,Yes,,0,,BAY EAST,,,,02133406,01878277,,Yes,RESIDENTIAL,,7/24/2024,,,,,,,,Alameda,Malcolm Stella,160,160,75,Exit Foothill on 580,,CHABOT PARK,,,,,,,,6001.0,1.0,,,,6/30/2024,,,No,,,,,,7/25/2024,Conventional,4/16/2024 6:40 PM,$457,2133406.0,4/16/2024,,,1878277.0,Full Service,Excl Right,Market Listing,,,,2.0,No,,,Vacant,6/30/2024,,2000,,,,,41056314,,"$898,000",,6/30/2024,,,,35,Yes,No,,"$897,000","$800,000",7/25/2024,$457.14,,,Yes,,"Presenting this beautiful residence nestled in the Chabot Park Community of Oakland . 10521 Stella Street is a stunning corner lot property with 3 bedrooms and 2 baths.  With modern renovations, this spacious and inviting home boasts over 1,700 square feet of living space.  The great room is perfect for growing families and entertaining guests. With the large windows throughout, ample natural light shines and highlights the beautiful flooring.  The home features a sleek kitchen with stainless steel appliances and quartz countertops, and modern cabinets.  The large master suite with an elegant ensuite also features access to your backyard deck. Here you can enjoy the California sunshine.  Conveniently located near Oakland Zoo, parks, and shopping and Interstate 880. This home is a must-see for anyone looking to settle in Silicon Valley.",,5.0,$457,LA & BA same office,100.0,89.0,For Sale,,Please schedule your showing directly using Calendly. Use link: https://calendly.com/showings3-prg/10521stellast  Show with Calendly appointment only. Supra is located at the front door.  Call/text Amish 415-573-2468 for any questions. Disclosures and reports available using link: https://app.disclosures.io/link/10521-Stella-Street-xwidwnce.  All offers on CAR contract with proof of funds and pre-approval. Please submit all offers to the Admin Team at clientcare@realestateprg.com.,https://calendly.com/showings3-prg/10521stellast,$457.14,Public Records,,CA,7/25/2024,One Story,,,Yes,,,,,,,7/26/2024,Yes,Yes,Yes,Yes,,10521.0,,Stella St,94605-5325,
SF424039179,SLD,32,3051 Broadmoor View,,OAKLAND,9999,"$998,000","$1,200,000",DE,3993.0,5.0,4.0,0.0,,2.0,2005.0,0.141200,"6,151",,,"Welcome to 3051 Broadmoor View, a newly renovated detached home nestled between Chabot Park and Sequoyah. This light filled 5+ bedrooms and 4+ baths house has all the space you will ever need! Main floor features a living room, outdoor patio with gorgeous bay views, massive dining room, full newly renovated kitchen with custom cabinets, kitchen island and walk in pantry, spacious family room, 2 bedrooms, 1 bathroom, and a laundry room. Access to the backyard flows right out of the family room into a tiled surface. Backyard offers plenty of room for gardening and outdoor activities. Top floor features 4 bedrooms 3 baths with 2 bedrooms with en suite bathrooms. A complete in law unit is located below the main floor with its very own, living room, dining room, newly renovated kitchen with custom cabinets, bathroom, bedroom, laundry and utilities room and its very own entrance. Bottom floor is a two car garage with a large driveway for all your parking needs. San Francisco bay views from three floors will leave you in awe. Located on quiet a cul-de-sac street, and easy access to the 580.",,,,,,,,,,0.00,0,,,19.0,,,,048-5664-029,0,Contact Listing Agent,Datashare San Francisco,,,,01247701,,0.0,,RESIDENTIAL,,7/29/2024,,,,,,,"Offer date TBD. https://app.disclosures.io/link/3051-Broadmoor-View-avc70823 Prospective purchasers are advised to independently verify accuracy & to review any disclosure information before submitting offer. Property is sold AS-IS. Please include 'EMD to be wired within 24 hours of contract ratification. Disclosures to be returned, signed in its entirety, within 48 hours of ratification as a term in the purchase agreement. Buyer to investigate square footage to their own satisfaction. Neither seller nor LA shall guarantee accuracy of sq ft. Call/text Simon at 4158062610 or Kent at 4158287510 if you have any questions or want showing instructions.",Alameda,Malcom,32,33,33,,,,,,,,,,,6001.0,1.0,,,,7/9/2024,,,No,,,,,,8/2/2024,Conventional,6/6/2024 5:00 PM,$249,1888097.0,6/7/2024,,,625769.0,Full Service,Excl Right,Market Listing,,,,0.0,,,,Vacant,7/9/2024,,0,,,,,424039179,,"$1,298,000",,7/9/2024,,,,98,,No,,,"$1,200,000",,$300.53,,,,530791378.0,"Welcome to 3051 Broadmoor View, a newly renovated detached home nestled between Chabot Park and Sequoyah. This light filled 5+ bedrooms and 4+ baths house has all the space you will ever need! Main floor features a living room, outdoor patio with gorgeous bay views, massive dining room, full newly renovated kitchen with custom cabinets, kitchen island and walk in pantry, spacious family room, 2 bedrooms, 1 bathroom, and a laundry room. Access to the backyard flows right out of the family room into a tiled surface. Backyard offers plenty of room for gardening and outdoor activities. Top floor features 4 bedrooms 3 baths with 2 bedrooms with en suite bathrooms. A complete in law unit is located below the main floor with its very own, living room, dining room, newly renovated kitchen with custom cabinets, bathroom, bedroom, laundry and utilities room and its very own entrance. Bottom floor is a two car garage with a large driveway for all your parking needs. San Francisco bay views from three floors will leave you in awe. Located on quiet a cul-de-sac street, and easy access to the 580.",,11.0,$300,,120.0,92.0,For Sale,,Call Showing Contact,,$300.53,Assessor Auto-Fill,,CA,7/29/2024,,,,No,,,2.0,,,,8/3/2024,Yes,Yes,Yes,Yes,,,,,94605,
41027650,SLD,26,3684 Calafia Ave,,OAKLAND,9999,"$799,000","$965,000",DE,1287.0,2.0,2.0,,Y,2.0,1940.0,0.17,"7,446",,,"Simon Black - 510-409-0026 - Built in 1940, this traditional Oakland home has been updated and now has a terraced backyard with a water feature, additional storage shed and so much more.Located in Oakland's Sequoyah Heights neighborhood, this cozy 2 bedroom, 2 bathroom home has a formal living room with fireplace, and updated kitchen.Original details throughout, oak floors, original plaster walls and ceilings with many decorative niches. The updated kitchen features quartz countertops, premium stainless steel appliances with double oven and gas range. The home has seller-owned solar.The backyard has been newly transformed by the sellers to include multiple decks and terraced areas, a pond and fountain, tree house* plus a utility shed they used for multiple purposes*. The house is situated on a cul-de-sac, just minutes from Mills College, Montclair Village, Oakland Zoo, and International Airport. This home is a special jewel ready for new buyers to make their own!*Buyer to verify use of space. Neither seller nor listing agent has investigated or verified the accuracy of any of these sources of information.",,,,,,,,,,,,,No,83.0,,,,43A-4679-14,0,,Bridge AOR,https://www.redoakrealty.com/3684CalafiaAve, https://youtu.be/BWFmh_MHtZg,,01989776,01989776,,Yes,RESIDENTIAL,,7/10/2023,,,,,,,"Sellers spent over $250,000 on the backyard terracing and utility shed.   ",Alameda,Dorisa,26,26,26,ENTER THRU ALLEY behind Calafia OFF DORISA,,SEQUOYAH,Oakland (510) 879-8111,,,,,,,6001.0,1.0,,,,6/13/2023,,Oakland (510) 879-8111,No,,,,,,7/10/2023,Conventional,5/18/2023 6:40 AM,$621,1953847,5/18/2023,,,00619098,Full Service,Excl Right,Market Listing,,,,3.0,No,,,Vacant,6/13/2023,,N,,,,,41027650,,"$849,000",,6/13/2023,,,,60,Yes,No,,"$849,000","$965,000",7/10/2023,$749.81,Simon Black,510 409 0026,No,,"Built in 1940, this traditional Oakland home has been updated and now has a terraced backyard with a water feature, additional storage shed and so much more. Located in Oakland's Sequoyah Heights neighborhood, this cozy 2 bedroom, 2 bathroom home has a formal living room with fireplace, and updated kitchen.  Original details throughout, oak floors, original plaster walls and ceilings with many decorative niches. The updated kitchen features quartz countertops, premium stainless steel appliances with double oven and gas range. The home has seller-owned solar.  The backyard has been newly transformed by the sellers to include multiple decks and terraced areas, a pond and fountain, tree house* plus a utility shed they used for multiple purposes*.   The house is situated on a cul-de-sac, just minutes from Mills College, Montclair Village, Oakland Zoo, and International Airport. This home is a special jewel ready for new buyers to make their own!  *Buyer to verify use of space. Neither seller nor listing agent has investigated or verified the accuracy of any of these sources of information.  ",,5.0,$750,LA & BA different company/franchise,121.0,114.0,For Sale,,,,$749.81,Public Records,,CA,7/10/2023,Two Story,,,No,,,,,,,7/11/2023,Yes,No,No,Yes,,3684.0,,Calafia Ave,94605-4942,
41052174,SLD,12,3693 Dorisa Ave,,OAKLAND,9999,"$989,898","$1,125,000",DE,1888.0,3.0,2.0,0.0,Y,2.0,1952.0,0.15,"6,720",,,"Jasmin Rhodes - 510-388-9920 - Welcome to a stunning blend of modern elegance and functional design. This three-bedroom, two-bathroom home offers 1,888 square feet of living space, perfectly curated for contemporary living. Nestled in a serene location, this residence provides not only luxurious comfort but also partial views of the bay, creating a tranquil retreat you'll love coming home to.  Featuring newly refinished hardwood floors, brand new SS Appliances, fresh new paint inside and out, two fireplaces and newly landscaped front yard that requires low maintenance.  The key can be yours!",,,,,,,,,,,,,No,72.0,No,,No,43A-4679-2,0,,BAY EAST,,,,01388434,2142929.0,,Yes,RESIDENTIAL,,4/19/2024,,,,,,,"   Pre-Escrow with Orange Coast Title, Tisha Morrison (925) 621-8300 #23300363.  It is believed the lots adjacent to 3693 Dorisa Ave is owned by the Catholic Diocese and will not be built on.  This information has not been verified by the Seller nor the Listing or Buyer's Agent.  If interested, Buyer to verify.",Alameda,Calafia Ave,12,12,12,Golf Links To Calafia to Dorisa,,OAK KNOLL,,,,,,,,6001.0,2.0,,,,3/20/2024,,,No,,,,,,4/21/2024,Conventional,3/8/2024 12:17 PM,$524,01030898,3/8/2024,,,01499008,Full Service,Excl Right,Market Listing,Bottom Stair Rail,,,3.0,No,,,Vacant,3/20/2024,,0,,,,,41052174,,"$989,898",,3/20/2024,,,,47,Yes,No,,"$989,898","$1,125,000",4/21/2024,$595.87,CTC LA Jasmin Rhodes,510-388-9920,Yes,,"Welcome to a stunning blend of modern elegance and functional design. This three-bedroom, two-bathroom home offers 1,888 square feet of living space, perfectly curated for contemporary living. Nestled in a serene location, this residence provides not only luxurious comfort but also partial views of the bay, creating a tranquil retreat you'll love coming home to.  Featuring newly refinished hardwood floors, brand new SS Appliances, fresh new paint inside and out, two fireplaces and newly landscaped front yard that requires low maintenance.  The key can be yours!",,6.0,$596,LA & BA different company/franchise,114.0,114.0,For Sale,,Call Jasmin (510) 388-9920 or Teresa (510) 502-4007,,$595.87,Owner,,CA,4/21/2024,Two Story,,,Yes,43A-4679-2,,2.0,https://url.emailprotection.link/?bGFWIxJwEA0kakgwyYhXLyKkkl-dTX9dnschwMBeS4NFd7a42OiwCFHiOknLXmWp8cLZ3E14BZ0boAVJrFn1TwDgXRd8G4SQLaQyRcPNs9crVyBhIIA8TnEWoK-odxk-x,,,4/22/2024,Yes,Yes,Yes,Yes,,3693.0,,Dorisa Ave,94605,
ML81922125,SLD,0,3546 Calandria Avenue,,OAKLAND,9999,"$795,000","$800,000",DE,2145.0,4.0,2.0,,Y,2.0,1952.0,0.138700,"6,042",,,,,,,,,,,,,,,,,71.0,,,,043A-4691-022,0,,Datashare MLSListings,,,,01463406,,,,RESIDENTIAL,,3/30/2023,,,,,,,,Alameda,Granada Ave,0,0,0,,,,Oakland (510) 879-8111,,,,,,3546 Calandria AVE,6001.0,,,,,3/20/2023,,Oakland (510) 879-8111,No,,,,,,3/31/2023,Conventional,3/20/2023 9:49 AM,$370,02006641,3/20/2023,tommyrealestateagent@gmail.com,,,,,Market Listing,,,,,,,,Vacant,3/20/2023,,,,,,,,,"$795,000",,3/20/2023,,,Public,13,,No,,,"$800,000",,$372.96,,,,81922125.0,,,,$372,,,,For Sale,,,,$372.96,,,CA,3/30/2023,One Story,,,,,,,,,,5/5/2023,Yes,Yes,Yes,Yes,,,,,94605,R
41056494,SLD,13,3516 Mirasol,,OAKLAND,9999,"$849,000","$1,143,000",DE,1839.0,3.0,2.0,0.0,Y,2.0,1937.0,0.150000,"6,448",,,"Ya Hsuan Yuan - 510-214-6442 - Discover tranquility at 3516 Mirasol Ave, located in the serene Oak Knoll neighborhood of Oakland. This home checks a lot of home search boxes with 3 spacious bedrooms and 2 beautifully updated bathrooms plus a bonus space on a generous 6448 sqft lot. Adorned with original hardwood floors, the home is flooded with natural light through its updated windows. The modern kitchen features skylights, newer cabinets, and S/S appliances. Take a relaxing dip in the 6-person hot tub that overlooks the expansive, level, and sun-drenched backyard that is perfect for hosting gatherings. With 2-car garage and a long driveway, you’ll never have to worry about parking for you or your guests. The exquisite flex room is a great separation space from the main house. Ideal as a home office, guest retreat, or a future studio expansion. This property presents a rare opportunity to own a well-appointed home in a peaceful neighborhood in a convenient location, close to freeway access, trails, zoo, and parks!",,,,,,,,,,,,,,87.0,No,,No,43A-4687-28,0,,Bridge AOR,,,,02127098,00619098,,Yes,RESIDENTIAL,,5/21/2024,,2133785.0,,,,,"***Offer date 4/30 by 1pm*** Vacant, go and show. Supra is located on the water pipes in front of house. Text Julie or Ernesto for any questions. Sewer lateral compliant. The listed square footage and bath count may differs from public records, buyer to investigate. Home inspection & pest report will be added by next week. Please submit offers via DIO, include pre-approval & POF. Thank you for showing!",Alameda,Mirella,13,13,13,Mirella to Mirasol,,OAK KNOLL,,,,,,,,6001.0,1.0,,,,4/30/2024,,,No,,,,,,5/22/2024,Conventional,4/17/2024 7:37 PM,$462,2095714.0,4/17/2024,,,02095714,Full Service,Excl Right,Market Listing,water pipes,,,4.0,No,,,Vacant,4/30/2024,,Yes,,,,,41056494,,"$849,000",,4/30/2024,,,,52,Yes,No,,"$849,000","$1,143,000",5/22/2024,$621.53,,,Yes,,"Discover tranquility at 3516 Mirasol Ave, located in the serene Oak Knoll neighborhood of Oakland. This home checks a lot of home search boxes with 3 spacious bedrooms and 2 beautifully updated bathrooms plus a bonus space on a generous 6448 sqft lot. Adorned with original hardwood floors, the home is flooded with natural light through its updated windows. The modern kitchen features skylights, newer cabinets, and S/S appliances. Take a relaxing dip in the 6-person hot tub that overlooks the expansive, level, and sun-drenched backyard that is perfect for hosting gatherings. With 2-car garage and a long driveway, you’ll never have to worry about parking for you or your guests. The exquisite flex room is a great separation space from the main house. Ideal as a home office, guest retreat, or a future studio expansion. This property presents a rare opportunity to own a well-appointed home in a peaceful neighborhood in a convenient location, close to freeway access, trails, zoo, and parks!",,7.0,$622,LA & BA different company/franchise,135.0,135.0,For Sale,,Supra on water pipes in front left of the house. Go and show.,,$621.53,Public Records,,CA,5/22/2024,Split Level,,,Yes,43A-4687-28,,,,,,5/22/2024,Yes,Yes,Yes,Yes,,3516.0,,Mirasol,94605,
41038531,SLD,14,3130 Hood St,,OAKLAND,9999,"$849,000","$938,000",DE,2070.0,4.0,3.0,0.0,Y,2.0,1962.0,0.150000,"6,300",,,"Denise M Rizkalla - 510-833-0927 - Nestled in the picturesque Oakland Hills, 3130 Hood St is a stunning 3 bedrooms plus den or bonus bedroom, 3-bathroom residence that offers the perfect blend of comfort, style, and breathtaking water views. This expansive home presents an idyllic living experience, combining modern amenities with the tranquility of its natural surroundings. Upper level features hardwood floors throughout with an open living room, dining room, and kitchen plus and added bedroom/den and full bathroom. The lower level features 3 bedrooms and 2 bathrooms plus added laundry, workspace and added storage spaces. Easy access from 2 car garage to house. There is so much potentail with a large yard that can be a gardener's delight and still plenty of room to add an ADU.Close to Oakland Zoo and hiking trails. Easy access to 580 and 13 freeways.",,,,,,,,,,,,,No,61.0,,,,48-5664-7,0,,Bridge AOR,https://www.zillow.com/view-imx/8bc4a02c-d32e-49c7-91d6-fcf2f2280d1d?setAttribution=mls&wl=true&initialViewType=pano&utm_source=dashboard,https://www.zillow.com/view-imx/8bc4a02c-d32e-49c7-91d6-fcf2f2280d1d?initialViewType=pano&utm_source=dashboard,,02144311,02006681,,Yes,RESIDENTIAL,,10/26/2023,,,,,,,Go and Show. Number of bedrooms and bathrooms differ from public records. Listing agent nor sellers make any guarantees regarding this. House sold As Is. Disclosures-https://app.disclosures.io/link/3130-Hood-Street-6p0slc84 Please send all offers through Disclosures IO.,Alameda,Mark,14,14,14,Malcolm to Mark to Hood,,ALAMEDA COUNTY,,,,,,,,6001.0,0.0,,,,9/22/2023,,,No,,,,,,10/30/2023,Conventional,9/8/2023 11:25 AM,$410,02132877,9/8/2023,,,01902981,Full Service,Excl Right,Market Listing,,,,2.0,No,,,Vacant,9/22/2023,,yes,,,,,41038531,,"$849,000",,9/22/2023,,,,40,Yes,No,,"$849,000","$938,000",10/30/2023,$453.14,Denise Rizkalla,510-833-0927,No,,"Nestled in the picturesque Oakland Hills, 3130 Hood St is a stunning 3 bedrooms plus den or bonus bedroom, 3-bathroom residence that offers the perfect blend of comfort, style, and breathtaking water views. This expansive home presents an idyllic living experience, combining modern amenities with the tranquility of its natural surroundings. Upper level features hardwood floors throughout with an open living room, dining room, and kitchen plus and added bedroom/den and full bathroom. The lower level features 3 bedrooms and 2 bathrooms plus added laundry, workspace and added storage spaces. Easy access from 2 car garage to house. There is so much potentail with a large yard that can be a gardener's delight and still plenty of room to add an ADU. Close to Oakland Zoo and hiking trails. Easy access to 580 and 13 freeways.",,7.0,$453,LA & BA different company/franchise,110.0,110.0,For Sale,,,,$453.14,Assessor Auto-Fill,Successor Trustee Sale,CA,10/30/2023,Two Story,,,Yes,48-5664-7,,4.0,,,,10/31/2023,Yes,Yes,Yes,Yes,,3130.0,,Hood St,94605,
41034129,SLD,85,3875 Fairway Ave,,OAKLAND,9999,"$1,348,888","$1,300,000",DE,2481.0,4.0,3.0,0.0,N,2.0,1960.0,0.130000,"5,800",,,"Hamed Nawabi - 925-303-7525 - Foreverhome presents This Impeccable designed home with open Modern Finishes throughout.Exquisite Architecture.Home is not only visually pleasing,but is also modern contemporary functional! It has a charming exterior with a well-generous size backyard.The interior of the house is warm and inviting, With plenty of windows that allow natural light to flow through the space.The kitchen is a modern spacious that has magazine worthy style and equipped with plenty of counter space and storage. GE fingerprint resistant stainless steel French door fridge and dishwasher, Empava stainless steel gas range, Zline black range Hood.Everything has been remodeled tastefully with perfection including New Sewer lateral.This Amazing home has 3 Bedrooms and 2 bathrooms in the main level and 1 Bedroom and Bathroom in lower level which can be used as an in-law unit or ADU. Amazing opportunity for one lucky buyer! Disclosures Link: https://app.disclosures.io/link/3875-Fairway-Avenue-k18lfc5t",,,,,,,,,,,,,,63.0,,,,43A-4714-16,0,,BAY EAST,,,,01484615,01491373,,Yes,RESIDENTIAL,,10/31/2023,,,,,,,"disclosures and reports are available ,  sewer and side walk compliance. buyer and buyers agent to do their due Diligence in regards to property information, the sqft and bedroom and bathroom counts as its different from the county record . call listing agent for access .  ",Alameda,Sequoyah,85,85,85,gps,,OAK KNOLL AREA,,,,,,,,6001.0,0.0,,,,10/18/2023,,,No,,,,,,10/31/2023,Conventional,7/25/2023 1:09 PM,$544,01335565,7/25/2023,,,01522213,Full Service,Excl Right,Market Listing,railing,,,1.0,No,,,Vacant,10/18/2023,,0,,,,,41034129,,"$1,598,888",,10/18/2023,,,,1,Yes,No,,"$1,398,888","$1,300,000",10/31/2023,$523.98,,,No,,"Foreverhome presents This Impeccable designed home with open Modern Finishes throughout.Exquisite Architecture.Home is not only visually pleasing,but is also modern contemporary functional! It has a charming exterior with a well-generous size backyard.The interior of the house is warm and inviting, With plenty of windows that allow natural light to flow through the space.The kitchen is a modern spacious that has magazine worthy style and equipped with plenty of counter space and storage. GE fingerprint resistant stainless steel French door fridge and dishwasher, Empava stainless steel gas range, Zline black range Hood.Everything has been remodeled tastefully with perfection including New Sewer lateral.This Amazing home has 3 Bedrooms and 2 bathrooms in the main level and 1 Bedroom and Bathroom in lower level which can be used as an in-law unit or ADU. Amazing opportunity for one lucky buyer! Disclosures Link: https://app.disclosures.io/link/3875-Fairway-Avenue-k18lfc5t",,7.0,$524,,96.0,81.0,For Sale,,,,$523.98,Owner,,CA,10/31/2023,Two Story,,,Yes,43A-4714-16,,,,,,11/1/2023,Yes,Yes,Yes,Yes,,3875.0,,Fairway Ave,94605,
