41047447,SLD,16,3375 Kiwanis St,,OAKLAND,9999,"$1,195,000","$1,375,000",DE,1620.0,3.0,2.0,0.0,Y,2.0,1938.0,0.080000,"3,344",,,"Douglas A Lambert - 925-297-7177 - Step into the epitome of modern living in the heart of Redwood Heights! This 3BR marvel is a testament to contemporary design and luxurious upgrades, but what truly sets it apart are the breathtaking views that redefine the meaning of home.As you enter, be embraced by the seamless fusion of comfort and opulence, with sleek hardwood floors enhancing the allure of every room. The kitchen, a culinary masterpiece, boasts quartzite waterfall counters and a professional range, setting the stage for unforgettable meals and gatherings.Yet, it's when you step outside that the true magic unfolds. Expansive decks offer unparalleled panoramic views of the bay, San Francisco, and multiple bridges. Imagine waking up to the Golden Gate Bridge as your daily inspiration or entertaining under a starlit sky with the city lights as your backdrop. Convenience meets luxury in this sought-after neighborhood. Nearby shopping, dining, and the enchanting Jordan Park add to the allure. For nature enthusiasts, the proximity to Joaquin Miller Park & Redwood Park is a dream come true—offering scenic trails & lush greenery just moments away.Don't just imagine it—live it. Immerse yourself in the modern elegance, unmatched comfort, and awe-inspiring views that make this an extraordinary place to call home!",,,,,,,,,,,,,,86.0,No,,No,29-1070-26,0,,Bridge AOR,https://clout-real-estate-marketing.aryeo.com/videos/0eeef1ca-c700-4c6b-b959-9794d2763619,https://my.matterport.com/show/?m=9zQrcb6u1PY&,,01940563,1527235.0,,Yes,RESIDENTIAL,,2/23/2024,,,,,,,"Easy to show - on Supra. Square footage of the home as advertised in the MLS was derived from measurements by a private company and varies from public records. Bedroom count differs from public records. Neither Seller nor Selling Agent has verified the accuracy and buyer should conduct their own investigations. In addition to measured square footage of home, there is a lower level unfinished area that was measured to be 410sf by a private company for possible conversion to additional living space. Lot lines not verified nor guaranteed. Lot size was derived from public records. Buyers are encouraged to check with the City of Oakland to fully understand neighborhood ordinances and regulations, school admission policies, crime statistics, neighboring properties, building permit status, and anything else important to the Buyers. Property is being sold as is and buyer should rely upon their own inspections and seek advice from professionals as necessary  to determine the condition of the property. Disclosure link: https://app.disclosures.io/link/3375-Kiwanis-Street-vkzxdd2w  Offer date to be Wednesday January 31st by 12 noon.",Alameda,Midvale,52,57,21,35th Ave-Victor-Midvale,,REDWOOD HEIGHTS,,,,,,,,6001.0,1.0,,,,2/2/2024,,,No,,,,,,2/24/2024,Conventional,1/12/2024 5:56 PM,$738,01993628,1/17/2024,,,1527235.0,Full Service,Excl Right,Market Listing,RH side on railing,,,7.0,No,,,Vacant,2/2/2024,,,,,,,41047447,,"$1,195,000",,2/2/2024,,,,56,Yes,No,,"$1,195,000","$1,375,000",2/24/2024,$848.77,,,No,,"Step into the epitome of modern living in the heart of Redwood Heights! This 3BR marvel is a testament to contemporary design and luxurious upgrades, but what truly sets it apart are the breathtaking views that redefine the meaning of home. As you enter, be embraced by the seamless fusion of comfort and opulence, with sleek hardwood floors enhancing the allure of every room. The kitchen, a culinary masterpiece, boasts quartzite waterfall counters and a professional range, setting the stage for unforgettable meals and gatherings. Yet, it's when you step outside that the true magic unfolds. Expansive decks offer unparalleled panoramic views of the bay, San Francisco, and multiple bridges. Imagine waking up to the Golden Gate Bridge as your daily inspiration or entertaining under a starlit sky with the city lights as your backdrop.  Convenience meets luxury in this sought-after neighborhood. Nearby shopping, dining, and the enchanting Jordan Park add to the allure. For nature enthusiasts, the proximity to Joaquin Miller Park & Redwood Park is a dream come true—offering scenic trails & lush greenery just moments away. Don't just imagine it—live it. Immerse yourself in the modern elegance, unmatched comfort, and awe-inspiring views that make this an extraordinary place to call home!",,7.0,$849,LA & BA same office,115.0,115.0,For Sale,,Text and show.,,$848.77,Measured,,CA,2/24/2024,Two Story,,,Yes,29-1070-26,,,https://clout-real-estate-marketing.aryeo.com/videos/08c47134-6e0b-4a96-8ba1-0a09b46809f2,https://my.matterport.com/show/?m=9zQrcb6u1PY&brand=0&mls=1&,,2/25/2024,Yes,Yes,Yes,Yes,,3375.0,,Kiwanis St,94602,
41058106,SLD,14,4237 Detroit Ave,,OAKLAND,9999,"$998,000","$1,250,000",DE,1616.0,3.0,2.0,0.0,Y,2.0,1930.0,0.090000,"4,000",,,"Jennie A. Flanigan - Cell: 510-610-3601 - Once upon a time in 1930 a Darling Storybook Home was built in the desirable community of Redwood Heights. Ninety-four years later, this house is waiting for its next family to peek through the arched picture window that watches the quiet street. The hardwood floors carry you beautifully through the rooms. The living room fireplace, with full length windows on either side, is ready to warm your hands by on a winter’s eve. Through the archway, the dining room is space enough to host book club or holiday gatherings. Three steps up, sunlight spills into the two bedrooms (views of the Cities, Bay & Mt. Tam) that are well situated to provide sweet dreams. While its 2 full bathrooms and kitchen have been beautifully updated, the house’s 1930s history is visible in all the delightful details throughout. The downstairs primary bedroom suite is primed to become a family room if desired, with glass door that opens out onto the spacious yard & garage. An al-fresco dinner on the flagstone patio by candlelight will be a bit of twilight magic next to the lawn that is large enough for an enchanting flower garden or playhouse. Stroll to Famous Jordan Park, Rec Center, Peets Coffee and Redwood Heights Elementary! Come be a part of this neighborhood’s story and find your happily ever after.",,,,,,,,,,,,,,94.0,No,,No,30-1873-15,2,,Bridge AOR,https://vimeo.com/941674248,,,02068528,01878277,,Yes,RESIDENTIAL,,6/3/2024,,,,,,,"CHARMING HOUSE w/ VIEWS! Open Homes = SAT & SUN 5/4 & 5, 2-4:30; SUN 5/12. Broker’s Tour: Thurs 5/2 & Mon 5/6, 10-1. OFFER DATE most likely Weds 5/15 by 10am (seller reserves the right to accept early offer). PLEASE call Jennie 510-610-3601.  Floor & Site Plan in Associated Docs link above.  Square footage not verified or guaranteed by seller or listing agent.",Alameda,Atlas & Redwood,14,14,14,Redwood Rd to Detroit,,REDWOOD HEIGHTS,,,,,,,,6001.0,1.0,,,,5/15/2024,,,No,,,,,,6/5/2024,Conventional,5/1/2024 2:43 PM,$618,1371018.0,5/1/2024,,,01486075,Full Service,Excl Right,Market Listing,,,,2.0,No,,,Owner,5/15/2024,,"$50,000 to buy rate down",,,,,41058106,,"$998,000",,5/15/2024,,,,49,Yes,No,,"$998,000","$1,250,000",6/5/2024,$773.51,,,No,,"Once upon a time in 1930 a Darling Storybook Home was built in the desirable community of Redwood Heights. Ninety-four years later, this house is waiting for its next family to peek through the arched picture window that watches the quiet street. The hardwood floors carry you beautifully through the rooms. The living room fireplace, with full length windows on either side, is ready to warm your hands by on a winter’s eve. Through the archway, the dining room is space enough to host book club or holiday gatherings. Three steps up, sunlight spills into the two bedrooms (views of the Cities, Bay & Mt. Tam) that are well situated to provide sweet dreams. While its 2 full bathrooms and kitchen have been beautifully updated, the house’s 1930s history is visible in all the delightful details throughout. The downstairs primary bedroom suite is primed to become a family room if desired, with glass door that opens out onto the spacious yard & garage. An al-fresco dinner on the flagstone patio by candlelight will be a bit of twilight magic next to the lawn that is large enough for an enchanting flower garden or playhouse. Stroll to Famous Jordan Park, Rec Center, Peets Coffee and Redwood Heights Elementary! Come be a part of this neighborhood’s story and find your happily ever after.",,6.0,$774,LA & BA different company/franchise,125.0,125.0,For Sale,,,,$773.51,Public Records,,CA,6/5/2024,Two Story,,,No,30-1873-15,,5.0,https://my.matterport.com/show/?m=DffStaLdc1q,,,6/6/2024,Yes,Yes,Yes,Yes,,4237.0,,Detroit Ave,94619,
41057303,SLD,21,4266 Detroit Ave,,OAKLAND,9999,"$1,195,000","$1,355,000",DE,1712.0,3.0,2.0,0.0,Y,1.0,1928.0,0.090000,"4,000",,,"Jennie A. Flanigan - Cell: 510-610-3601 - Sunny East Bay indoor-outdoor living - 1928 Redwood Heights Tudor with easy commutes, nearby amenities, curbside charm. Green lawn, fresh landscaping, brick porch, arched door with speakeasy peephole. Or enter through garage under house (2nd family room, laundry, workspace, plethora of storage, stairs up). Storybook details: h/w floors, real plaster, archways, built-in nooks, stained glass. Foyer to inviting, light-filled living room with arched picture window (peek-o’Bay view), tall plaster fireplace with niche, archway to stunning formal dining room. What everyone wants: Open-flow layout for entertaining or family fun in open airy kitchen flooded with light: chef’s desk, white stone counters, s/s sink & apps, pantry; opens to office & family room that opens through gorgeous wood doors to huge deck/yard. Dine, entertain, relax on level deck among planting beds with space for a lawn or bocce court! Hall & stairs to bedroom wing: Main level: hall closet, bedroom & remodeled full bath. Upstairs: charming two bedrooms w/skylights, big closets, Hills view, reading nook, & Jack n’ Jill bath! Stroll to Famous Jordan Park, Redwood Hts Rec Center, Lincoln Square w/ Peets Coffee and wonderful Redwood Heights Elementary!",,,,,,,,,,,,,,96.0,No,,No,30-1872-27,3,,Bridge AOR,https://vimeo.com/939178882,,,02052826,02014153,,Yes,RESIDENTIAL,,6/5/2024,,,,,,,"GREAT IN/OUTDOOR FLOW: KITCHEN to FAMILY ROOM to HUGE DECK/YARD! Open Homes = Sun 5/12, 2-4:30pm;  Square footage not verified or guaranteed by seller or listing agent.",Alameda,Redwood & Atlas,21,21,21,Redwood Road to Detroit,,REDWOOD HEIGHTS,,,,,,,,6001.0,1.0,,,,5/15/2024,,,No,,,,,,6/6/2024,Conventional,4/24/2024 3:50 PM,$698,1371018.0,4/24/2024,,,1486075.0,Full Service,Excl Right,Market Listing,,,,2.0,No,,,Owner,5/15/2024,,none,,,,,41057303,,"$1,195,000",,5/15/2024,,,,52,Yes,No,,"$1,195,000","$1,355,000",6/6/2024,$791.47,,,No,,"Sunny East Bay indoor-outdoor living - 1928 Redwood Heights Tudor with easy commutes, nearby amenities, curbside charm. Green lawn, fresh landscaping, brick porch, arched door with speakeasy peephole. Or enter through garage under house (2nd family room, laundry, workspace, plethora of storage, stairs up). Storybook details: h/w floors, real plaster, archways, built-in nooks, stained glass. Foyer to inviting, light-filled living room with arched picture window (peek-o’Bay view), tall plaster fireplace with niche, archway to stunning formal dining room. What everyone wants: Open-flow layout for entertaining or family fun in open airy kitchen flooded with light: chef’s desk, white stone counters, s/s sink & apps, pantry; opens to office & family room that opens through gorgeous wood doors to huge deck/yard. Dine, entertain, relax on level deck among planting beds with space for a lawn or bocce court! Hall & stairs to bedroom wing: Main level: hall closet, bedroom & remodeled full bath. Upstairs: charming two bedrooms w/skylights, big closets, Hills view, reading nook, & Jack n’ Jill bath! Stroll to Famous Jordan Park, Redwood Hts Rec Center, Lincoln Square w/ Peets Coffee and wonderful Redwood Heights Elementary!",,8.0,$791,LA & BA different company/franchise,113.0,113.0,For Sale,,,,$791.47,Public Records,,CA,6/6/2024,Two Story,,,No,30-1872-27,,2.0,https://my.matterport.com/show/?m=W8XKx1xFVF1,,,6/7/2024,Yes,Yes,No,Yes,,4266.0,,Detroit Ave,94619,
41053633,SLD,12,3952 Patterson Ave,,OAKLAND,9999,"$750,000","$810,000",DE,1011.0,2.0,1.0,0.0,Y,1.0,1924.0,0.090000,"3,959",,,"Darrell Hoh - Agt: 510-295-3541 - Nestled in Oakland's sought-after Laurel District, this charming 1924 bungalow presents a perfect blend of classic architecture and modern comfort. Step inside to find gleaming refinished hardwood floors that adorn the spacious living areas, exuding warmth and character. Boasting 2+ bedrooms and 1 bath, including a versatile bonus room off the back bedroom, this home offers flexibility for your lifestyle needs, whether it's a home office, studio, or cozy reading nook. Embrace outdoor living on the deck off the kitchen, ideal for hosting gatherings or simply enjoying your morning coffee in the fresh air. The interior has been freshly painted, enhancing the home's inviting ambiance and providing a blank canvas for your personal touch. Additional storage space is found in the lower level basement, ensuring ample room for all your belongings. Enjoy the convenience of easy access to Highway 13, connecting you to Berkeley, North Oakland, and San Francisco, making commuting a breeze. Don't miss out on this opportunity to own a piece of Oakland's history in one of its most desirable neighborhoods. Schedule your showing today and make this charming bungalow your new home! Sewer & sidewalk done!",,,,,,,,,,,,,,100.0,No,,No,30-1923-25,0,,Bridge AOR,https://3952pattersonave.com/#!/,,,02020609,2014153.0,,Yes,RESIDENTIAL,,4/24/2024,,,,,,,"Sewer lateral and sidewalk certification completed. Offer date: Monday, April 1st by 2:00 p.m. via Disclosures.io. Pre-sale escrow with Old Republic Title, Berkeley branch, Lori Endo, #1112039290. As-is sale.",Alameda,Wisconsin,12,12,12,35th to Wisconsin to Patterson,,LAUREL DISTRICT,Oakland (510) 879-8111,,,,,,,6001.0,1.0,,,,4/3/2024,,Oakland (510) 879-8111,No,,,,,,4/24/2024,Conventional,3/22/2024 11:47 AM,$742,00981094,3/22/2024,,,01527235,Full Service,Excl Right,Market Listing,gas meter,,,4.0,No,,,Vacant,4/3/2024,,none. sewer & sidewalk in compliance,,,,,41053633,,"$750,000",,4/3/2024,,,,33,Yes,No,,"$750,000","$810,000",4/24/2024,$801.19,,,No,,"Nestled in Oakland's sought-after Laurel District, this charming 1924 bungalow presents a perfect blend of classic architecture and modern comfort. Step inside to find gleaming refinished hardwood floors that adorn the spacious living areas, exuding warmth and character. Boasting 2+ bedrooms and 1 bath, including a versatile bonus room off the back bedroom, this home offers flexibility for your lifestyle needs, whether it's a home office, studio, or cozy reading nook. Embrace outdoor living on the deck off the kitchen, ideal for hosting gatherings or simply enjoying your morning coffee in the fresh air. The interior has been freshly painted, enhancing the home's inviting ambiance and providing a blank canvas for your personal touch. Additional storage space is found in the lower level basement, ensuring ample room for all your belongings. Enjoy the convenience of easy access to Highway 13, connecting you to Berkeley, North Oakland, and San Francisco, making commuting a breeze. Don't miss out on this opportunity to own a piece of Oakland's history in one of its most desirable neighborhoods. Schedule your showing today and make this charming bungalow your new home! Sewer & sidewalk done!",,6.0,$801,LA & BA different company/franchise,108.0,108.0,For Sale,,Text agent at 510-295-3541 with a photo of business card and go.,,$801.19,Public Records,,CA,4/24/2024,One Story,,,Yes,30-1923-25,,4.0,,,,4/25/2024,Yes,Yes,Yes,Yes,,3952.0,,Patterson Ave,94619,
41050394,SLD,16,4272 Detroit Ave,,OAKLAND,9999,"$1,195,000","$1,560,000",DE,3124.0,3.0,1.0,1.0,Y,2.0,1935.0,0.09,"4,000",,,"Tia Hunnicutt - 510-499-9249 - Welcome home to this stylish four bedroom, two bath Mediterranean in Oakland’s hottest neighborhood. Surrounded by lovely greenery creating a private oasis, this home features an abundant natural light, beamed ceilings, outstanding views and a separate entrance for a potential second unit. The updated kitchen boasts a stainless steel sink and appliances, marble counters, custom cabinets, radiant heat tile floor, and an adjacent breakfast room with hutch. The three upstairs bedrooms feature garden views and surround a recently remodeled bath with a step-in shower, dresser vanity, and linen shelves. Treat yourself to the full spa treatment with a soak in the luxurious tub in the downstairs suite which also features another living room/family room, bedroom, and full bath room. Save on your energy bills with SOLAR!! Fully sewer compliant. Commuting is a breeze with interior garage access, proximity to all major freeways, and to major transit lines. A stone’s throw from all the restaurants, shopping, and services available in the Laurel and Dimond districts, Lincoln Square, and Montclair Village. Near Redwood Elementary, playgrounds, regional parks, and multiple trails. Open Saturday and Sunday, 1pm to 4pm!",,,,,,,,,,,,,,89.0,No,,No,30-1872-28,0,,Bridge AOR,https://my.matterport.com/show/?m=LfgckVyoJQX,https://4272-detroit-ave.proximarealtygroup.com/,,02166349,1527235.0,,Yes,RESIDENTIAL,,4/18/2024,,,,,,,"OFFERS Wednesday by 2pm, text Tia with questions 510-499-9249",Alameda,Redwood,16,45,45,Redwood to Detroit,,REDWOOD HEIGHTS,,,,,,,,6001.0,1.0,,,,4/4/2024,,,No,,,,,,4/19/2024,Conventional,2/19/2024 7:02 PM,$383,01840070,3/19/2024,,,02014153,Full Service,Excl Right,Market Listing,,,,5.0,No,,,Vacant,4/4/2024,,none,,,,,41050394,,"$1,195,000",,4/4/2024,,,,55,Yes,No,,"$1,195,000","$1,560,000",4/19/2024,$499.36,,,Yes,,"Welcome home to this stylish four bedroom, two bath Mediterranean in Oakland’s hottest neighborhood. Surrounded by lovely greenery creating a private oasis, this home features an abundant natural light, beamed ceilings, outstanding views and a separate entrance for a potential second unit. The updated kitchen boasts a stainless steel sink and appliances, marble counters, custom cabinets, radiant heat tile floor, and an adjacent breakfast room with hutch. The three upstairs bedrooms feature garden views and surround a recently remodeled bath with a step-in shower, dresser vanity, and linen shelves. Treat yourself to the full spa treatment with a soak in the luxurious tub in the downstairs suite which also features another living room/family room, bedroom, and full bath room. Save on your energy bills with SOLAR!! Fully sewer compliant. Commuting is a breeze with interior garage access, proximity to all major freeways, and to major transit lines. A stone’s throw from all the restaurants, shopping, and services available in the Laurel and Dimond districts, Lincoln Square, and Montclair Village. Near Redwood Elementary, playgrounds, regional parks, and multiple trails.  Open Saturday and Sunday, 1pm to 4pm! ",,8.0,$499,LA & BA different company/franchise,131.0,131.0,For Sale,,text Tia for info 510-499-9249,,$499.36,Measured,,CA,4/19/2024,Split Level,,,Yes,30-1872-28,,,https://my.matterport.com/show/?m=LfgckVyoJQX&brand=0,,,4/20/2024,Yes,Yes,Yes,Yes,,4272.0,,Detroit Ave,94619,
41042377,SLD,6,3154 Wisconsin St,,OAKLAND,9999,"$879,000","$1,100,000",DE,1104.0,2.0,1.0,0.0,Y,1.0,1926.0,0.080000,"3,600",,,"Cheryl D Berger - Agt: 415-595-3448 - Situated on a quiet tree lined street, you will find the charming 3154 Wisconsin Street. This quaint, 2 plus bedroom, 1 bathroom bungalow shines with fresh paint and loads of upgrades. The large, light-filled living room boasts an original wood-burning brick fireplace, refinished hardwood floors and oversized windows. The formal dining room is enchanting with its huge built-in buffet, large windows and modern light fixture. The newly remodeled kitchen offers Quartz countertops, subway tile backsplash and new stainless steel appliances. Ample storage can be found in the upgraded cabinetry and bonus space off the kitchen. The perfect space for a home office or workout area. Spacious and light-filled, the bedrooms boast hardwood floors, large closets and multiple windows. They have also been brightened up with fresh paint and new light fixtures with ceiling fans. The bathroom has been remodeled with modern light fixtures, stylish basin, spa shower head and a lovely soaking tub. Stroll into the beautifully landscaped backyard with citrus trees, flowering plants and greenery. This serene backyard is the perfect place to enjoy a meal with family and friends. There is off-street parking, a garage and additional storage. Stroll to local schools, grocery stores, restaurants and shopping.",,,,,,,,,,,,,No,97.0,,,,29-1083-25,0,,Bridge AOR,https://vimeo.com/875351505,,,02011388,1527235.0,,Yes,RESIDENTIAL,,11/9/2023,,,,,,,"OH 10/21 and 10/22 from 2-4:30pm, BT 10/23 10:30am-1pm , Alarm is off. Link to website is: www.3154wisconsin.com  Square footage not verified or guaranteed by seller or listing agent. Pre-escrow opened with Semiko Prim at Chicago Title Company. Contact listing agent with questions.",Alameda,Maple,6,6,6,Maple to Wisconsin,,UPPER DIMOND,,,,,,,,6001.0,1.0,,,,10/25/2023,,,No,,,,,,11/9/2023,Conventional,10/19/2023 11:13 AM,$796,01844879,10/19/2023,,,01527235,Full Service,Excl Right,Market Listing,,,,1.0,No,,,Vacant,10/25/2023,,No,,,,,41042377,,"$879,000",,10/25/2023,,,,40,Yes,No,,"$879,000","$1,100,000",11/9/2023,$996.38,,,Yes,,"Situated on a quiet tree lined street, you will find the charming 3154 Wisconsin Street. This quaint, 2 plus bedroom, 1 bathroom bungalow shines with fresh paint and loads of upgrades. The large, light-filled living room boasts an original wood-burning brick fireplace, refinished hardwood floors and oversized windows. The formal dining room is enchanting with its huge built-in buffet, large windows and modern light fixture. The newly remodeled kitchen offers Quartz countertops, subway tile backsplash and new stainless steel appliances. Ample storage can be found in the upgraded cabinetry and bonus space off the kitchen. The perfect space for a home office or workout area. Spacious and light-filled, the bedrooms boast hardwood floors, large closets and multiple windows. They have also been brightened up with fresh paint and new light fixtures with ceiling fans. The bathroom has been remodeled with modern light fixtures, stylish basin, spa shower head and a lovely soaking tub. Stroll into the beautifully landscaped backyard with citrus trees, flowering plants and greenery. This serene backyard is the perfect place to enjoy a meal with family and friends. There is off-street parking, a garage and additional storage. Stroll to local schools, grocery stores, restaurants and shopping.",,5.0,$996,LA & BA same company different office,125.0,125.0,For Sale,,,,$996.38,Public Records,,CA,11/9/2023,One Story,,,Yes,29-1083-25,,,https://vimeo.com/875351484,,,11/10/2023,Yes,Yes,Yes,Yes,,3154.0,,Wisconsin St,94602,
SF423913672,SLD,13,4421 Bennett Place,,OAKLAND,9999,"$1,149,000","$1,560,000",DE,2202.0,4.0,3.0,0.0,,0.0,1948.0,0.096000,"4,182",,,"Welcome to this Mediterranean home in charming Redwood Heights. The spacious, updated home has it all. Great curb appeal with a welcoming front porch. The main level consists of kitchen, living room and dining room, plus 3 bedrooms, 2 baths and laundry closet. Lower level has an office, full bathroom, storage room, garage access, plus 4th bedroom/family room. Large deck off kitchen makes for perfect outdoor entertaining. Raised beds in the sunny backyard are great for growing vegetables. Avenue Terrace Park is one block away. Easy access to 580 freeway and highway 13.",,,,,,,,,,0.00,0,,,75.0,,,,029-1064-010,3,Show,Datashare San Francisco,,,,02026585,625769.0,0.00,,RESIDENTIAL,,11/6/2023,,,,,,,"Go and show! Large updated home with tons of storage and good light. Number of bedrooms differs from the public records. Escrow opened with Ina Dunlap at Old Republic Title in Montclair. Seller reserves right to entertain early offers. Open houses 2-5pm on 10/8, 10/14, 10/15. Broker's open 10/9. Disclosures link: https://app.disclosures.io/link/4421-Bennett-Place-jk5jjmkp Offers due Friday by 3pm.",Alameda,Guido,13,14,14,,,,,,,,,,,6001.0,1.0,,,,10/19/2023,,,No,,,,,,11/27/2023,,10/5/2023 5:00 PM,$521,01486039,10/6/2023,,,01486039,Full Service,Excl Right,Market Listing,On right side of fro,,,0.0,,,,Vacant,10/19/2023,,0,,,,,423913672,,"$1,149,000",,10/19/2023,,,,42,,No,,,"$1,560,000",,$708.45,Jan McCune,510-842-3886,,530689094.0,"Welcome to this Mediterranean home in charming Redwood Heights. The spacious, updated home has it all. Great curb appeal with a welcoming front porch. The main level consists of kitchen, living room and dining room, plus 3 bedrooms, 2 baths and laundry closet. Lower level has an office, full bathroom, storage room, garage access, plus 4th bedroom/family room. Large deck off kitchen makes for perfect outdoor entertaining. Raised beds in the sunny backyard are great for growing vegetables. Avenue Terrace Park is one block away. Easy access to 580 freeway and highway 13.",,8.0,$708,,135.0,135.0,For Sale,,Go Directly,,$708.45,Assessor Auto-Fill,,CA,11/6/2023,,,,Yes,,,1.0,,,,11/27/2023,Yes,No,No,Yes,,,,,94602,
