MLS No,Status,DOM,Address,Unit,City,Area,LP,SP,BT,SqFt,BR,Bth,PB,Gar,GarSp,YrBlt,Acres,Lot SqFt,HOA Fee,Freq,3rd Party Synd. Remarks,ADU Baths Full,ADU Baths Partial,ADU Bedrooms,ADU Building Type,ADU Description,ADU Kitchen,ADU Main Entry Floor,ADU Meter,ADU Occupied,ADU Rents For,ADU Sq. Ft.,ADU SqFt Source,ADU Y/N,Age,Agent Has Ownership,Agent Hit Count,Agent Related to Principal,Assessors Parcel No,Associated Document Count,Available to Show,Board ID,Branded Media Link,Branded Media Link 2,Builder/Architect,Buyer Agent DRE Num.,Buyer Broker DRE Number,Census Tract,City Transfer Tax,Class,Client Hit Count,Closing Date,Co Buy Agent DRE Num.,Co List Agent DRE Num.,Co-List Agent email,Co-List Agent Fax,Complex Name,Concessions at COE,Confidential Remarks,County,Cross Street,Cumulative DOM,Cumulative DOMLS,Days On MLS,Directions to Property,Disclosures Link,Dist/Nbrhood/Sub,Elementary School Distric,Entry Agent First Name,Entry Agent ID,Entry Agent Last Name,Entry Agent License ID,Expire Date,Filtered Address,FIPS Code,Fireplaces,Floor Unit is on,Foreclosure Status,Gate Code,General Date,Geocode Quality,High School District,HOA,HOA Management Companies,HOA Name,HOA Name (Other),HOA Phone,Homesnap Appt. Scheduling,Hotsheet Date,How Sold,Input Date,List $/SqFt,List Agent DRE Num.,List Date,Listing Agt email,Listing Agt Fax,Listing Broker DRE Number,Listing Service,Listing Type,Listing Visibility Type,Lockbox Location,Model,New Subdivision,Number of offers,Occpnt Req 24 Hr Notice,Occupant Name,Occupant Phone,Occupied By,Off Market Date,Old Complex,Old Concessions,Old Elem,Old High,Old HOA Name,Old Middle,Old MLS #,Old Subdivision,Original Price,Ownership Type,Pending Date,Pending Litigation,Percent Owner Occ,Photo Permission,Picture Count,Point of Sale Ordinance,Pool,Preferred Agent Fax,Previous Price,Price,Price Date,Price Per SQFT,Primary Showing Contact,Primary Showing Phone,Printed Neighborhood Rpt,Property ID,Public Remarks,Radar ID,Rooms Total,Sale $/SqFt,Sale COOP,Sale/Last List $,Sale/Original $,Sale/Rent,Sales Office Info Remarks,Showing Instruction,Showing Schedule Link,Sold Price Per SQFT,Source,Special Information,State,Status Date,Stories,Subdivision (Other),Subdivision Profile Rmks,Supra Box?,Tax ID,TIC % Owner Offered,Total # of Garage and Parking Spaces,Unbranded Media Link,Unbranded Media Link 2,Units in Complex,Update Date,VOW Address,VOW AVM,VOW Comment,VOW Include,WiFi Last,ZIDX Only House #,ZIDX Only Street Dir,ZIDX Only Street Name,Zip,Zoning
41052734,SLD,13,3500 Willis Ct,,OAKLAND,9999,"$899,000","$1,160,000",DE,1633.0,3.0,2.0,,Y,2.0,1948.0,0.090000,"3,807",,,"Jennie A. Flanigan - Cell: 510-610-3601 - Mid-Century with 21st C Italian updated bath & kitchen, open-flow indoor-outdoor living. Nestled into level lot on a cul-de-sac in convenient Redwood Heights; 2-car garage, storage & parking. Brick steps rise through lush, landscaped garden (blooming magnolia, graceful birches) to front porch, glass door. Entry hall (exposed brick, h/w floors) welcomes guests (coat closet) opens to expansive living-dining: floods of light thru picture and floor to ceiling windows & glass door to stunning walled garden: deck/patio/gardens. Gather by cozy brick & wood fireplace before dining in (FDR) or outside on deck/patio: benches, yard space for beds, maple tree. Updated chef’s kitchen: generous walk-thru layout, nook w/breakfast table, stunning upscale Scavolini cabinets, s/s appliances, black slate counters, dramatic copper sink; short hall past full bath/laundry to back door to garden, interior stairs down to garage, storage. Retire to private bedroom wing: 3 hall closets, huge primary bedroom & 2nd w/corner windows, 3rd w/picture window, all wall-width closets. Stunning modern bath: free-standing oval tub, open glass-wall shower, raised basin lav over wood vanity.  Stroll to famous Jordan Park, Rec Center, Laurel restaurants/coffee, Redwood Heights Elementary!",,,,,,,,,,,,,,76.0,No,,No,30-1875-19-2,2,,Bridge AOR,https://vimeo.com/923778291?share=copy,,,01988053,01527235,,Yes,RESIDENTIAL,,4/8/2024,,,,,,,"FABULOUS MID-CENTURY! GREAT WALLED GARDEN! STROLLABLE TO SCHOOL, PARKS, COFFEE! Open Homes = Sat 3/16 & Sun 3/17, 2-4:30pm & 3/24, 2-4:30pm.  Broker’s Tour: Thursday 3/14. 11-1 & Monday 3/18, 10-1. OFFER DATE - Wednesday 3/27 by 10am  Square footage not verified or guaranteed by seller or listing agent.",Alameda,Redwood Road,13,13,13,Redwood Road to Willis Court,,REDWOOD HEIGHTS,,,,,,,,6001.0,1.0,,,,3/27/2024,,,No,,,,,,4/10/2024,Cash,3/14/2024 9:08 AM,$551,01371018,3/14/2024,,,1486075.0,Full Service,Excl Right,Market Listing,,,,5.0,No,,,Owner,3/27/2024,,none,,,,,41052734,,"$899,000",,3/27/2024,,,,46,Yes,No,,"$899,000","$1,160,000",4/10/2024,$710.35,,,No,,"Mid-Century with 21st C Italian updated bath & kitchen, open-flow indoor-outdoor living. Nestled into level lot on a cul-de-sac in convenient Redwood Heights; 2-car garage, storage & parking. Brick steps rise through lush, landscaped garden (blooming magnolia, graceful birches) to front porch, glass door. Entry hall (exposed brick, h/w floors) welcomes guests (coat closet) opens to expansive living-dining: floods of light thru picture and floor to ceiling windows & glass door to stunning walled garden: deck/patio/gardens. Gather by cozy brick & wood fireplace before dining in (FDR) or outside on deck/patio: benches, yard space for beds, maple tree. Updated chef’s kitchen: generous walk-thru layout, nook w/breakfast table, stunning upscale Scavolini cabinets, s/s appliances, black slate counters, dramatic copper sink; short hall past full bath/laundry to back door to garden, interior stairs down to garage, storage. Retire to private bedroom wing: 3 hall closets, huge primary bedroom & 2nd w/corner windows, 3rd w/picture window, all wall-width closets. Stunning modern bath: free-standing oval tub, open glass-wall shower, raised basin lav over wood vanity.  Stroll to famous Jordan Park, Rec Center, Laurel restaurants/coffee, Redwood Heights Elementary!",,6.0,$710,LA & BA different company/franchise,129.0,129.0,For Sale,,,,$710.35,Public Records,,CA,4/10/2024,One Story,,,No,30-1875-19-2,,4.0,https://my.matterport.com/show/?m=HgRQKqGZAYB,,,4/11/2024,Yes,No,No,Yes,,3500.0,,Willis Ct,94619,
41016986,SLD,12,3287 Arizona St,,OAKLAND,9999,"$787,000","$960,000",DE,936.0,2.0,1.0,0.0,N,0.0,1924.0,0.090000,"3,800",,,"Liat Bostick - 510-325-2505 - Beautiful two-bedroom, one bath bungalow, meticulously maintained, and nestled on a tree-lined cul-de-sac street in the Laurel district! The home features an updated kitchen with stainless st appliances, plenty of cabinets and a view and access to a deck with view of the Bay, the perfect place to admire the magical back yard.  There are hardwood floors in the bedrooms, dining and living rooms, wood shutters in the living and dining rooms & fireplace in the living room.  The bathroom has a shower over a tub, tiled floors and wainscoting.The front yard is landscaped in a Mediterranean style using plants that are very adaptable to this area with landscape lighting that automatically illuminates pathways after dark.  The Strawberry tree is a favorite of the resident Anna's hummingbird, and the orange-flowering Bulbine is frequented by native bees. The landscaped backyard has a lovely rain pond, vegetable bed and a compost structure.There is a designated driveway for the home. Some of the improvements include solar panels, foundation improvements, back deck &  new roof was installed in 2020.  The interior recently painted.Near great restaurants & café’s, shopping, public transportation, and easy freeway access.",,,,,,,,,,,,,No,99.0,,,,28-973-9,0,,Bridge AOR,https://www.3287arizona.com/,https://vimeo.com/789032101,,01981522,619098.0,,Yes,RESIDENTIAL,,2/21/2023,,,,,,," Open homes: 1/14, 1/15, 1/21 & 1/22 1-4pm. Brokers tour: 1/16/23 9-11:30am Offers any, on 1/25/23 by 9am There is a designated driveway for the home.  Sq ft and lot size not verified or guaranteed by the Seller or Listing Agent.   ",Alameda,Laurel,12,12,12,Laurel to Arizona,,LAUREL,Oakland (510) 879-8111,,,,,,,6001.0,1.0,,,,1/25/2023,,Oakland (510) 879-8111,No,,,,,,2/21/2023,Other,1/13/2023 10:29 AM,$841,01327956,1/13/2023,,,1170009.0,Full Service,Excl Right,Market Listing,,,,8.0,Yes,,,Owner,1/25/2023,,none,,,,,41016986,,"$787,000",,1/25/2023,,,,40,Yes,No,,"$787,000","$960,000",2/21/2023,"$1,025.64",Liat,,Yes,,"Beautiful two-bedroom, one bath bungalow, meticulously maintained, and nestled on a tree-lined cul-de-sac street in the Laurel district! The home features an updated kitchen with stainless st appliances, plenty of cabinets and a view and access to a deck with view of the Bay, the perfect place to admire the magical back yard.  There are hardwood floors in the bedrooms, dining and living rooms, wood shutters in the living and dining rooms & fireplace in the living room.  The bathroom has a shower over a tub, tiled floors and wainscoting. The front yard is landscaped in a Mediterranean style using plants that are very adaptable to this area with landscape lighting that automatically illuminates pathways after dark.  The Strawberry tree is a favorite of the resident Anna's hummingbird, and the orange-flowering Bulbine is frequented by native bees.  The landscaped backyard has a lovely rain pond, vegetable bed and a compost structure. There is a designated driveway for the home.  Some of the improvements include solar panels, foundation improvements, back deck &  new roof was installed in 2020.  The interior recently painted.  Near great restaurants & café’s, shopping, public transportation, and easy freeway access.",,5.0,"$1,026",LA & BA different company/franchise,122.0,122.0,For Sale,,No showings,,"$1,025.64",Public Records,,CA,2/21/2023,One Story,,,No,28-973-9,,1.0,https://www.3287arizona.com/mls,https://vimeo.com/789032086,,2/22/2023,Yes,Yes,No,Yes,,3287.0,,Arizona St,94602,
ML81920392,SLD,13,3685 Virden Avenue,,OAKLAND,9999,"$1,150,000","$1,485,000",DE,2988.0,4.0,2.0,1.0,Y,2.0,2006.0,0.0763,"3,325",,,,,,,,,,,,,,,,,17.0,,,,030-1878-050,0,,Datashare MLSListings,http://www.3685virdenave.com,,,01328566,,,Yes,RESIDENTIAL,,4/10/2023,,,,,,,www.3685VirdenAve.com - Disclosures: https://app.glide.com/share/jSV15DvYrK9x0wpNkPVfM/ OFFER DEADLINE - MONDAY 3/13 by 3:00PM - Seller reserves the right to accept preemptive offers. Why sell your clients a 100 yr old house half the size for the same price! This house is an architectural genius layout that allows for so very much! Perfect for the sophisticated tech minded that loves space and incredible views!,Alameda,35th,13,13,13,,,,Oakland (510) 879-8111,,,,,,3685 Virden AVE,6001.0,2.0,,,,3/15/2023,,Oakland (510) 879-8111,No,,,,,,4/13/2023,Conventional,3/2/2023 5:36 AM,$384,70010060,3/2/2023,hughetthomes@gmail.com,,,Full Service,Excl Right,Market Listing,,,,,,,,Vacant,3/15/2023,,,,,,,,,"$1,150,000",,3/15/2023,,,Public,69,No,No,,,"$1,485,000",,$496.99,,,,81920392.0,"WOW! No worries living in this 17 year young home with 3000sf of living space and VIEWS! Enjoy captivating panoramic San Francisco Bay views perched atop the rolling hills of Redwood Heights in a contemporary 4 bed, 2.5 bath home with 1500sf viewing decks, abundant natural light and vaulted ceilings. Wake up to expansive bay views in the primary bedroom and en suite bathroom while enjoying modern amenities like a private loft, multi-media room with surround sound, a yoga/hobby room, attached two car garage and a great-room style living space. The thoughtful floorplan allows natural light to pour in all day from every level. Recent upgrades include kitchen remodel, new carpet, paint, appliances, vanities, fixtures, garage doors and newer on demand hot water, A/C and furnace! Makes for easy no-worries living. Easy access to HWY 580/13 and minutes away from East Bay trails - WELCOME HOME!",,,$496,,,,For Sale,,Lots of keys and doors so get there early and sunsets are amazing.,,$496.99,,,CA,4/13/2023,,,,,,,,http://www.3685virdenave.com/mls/93557051,,,5/6/2023,Yes,Yes,Yes,Yes,,,,,94619,Resi
41016910,SLD,50,4260 Detroit Ave,,OAKLAND,9999,"$1,600,000","$1,605,000",DE,2456.0,5.0,3.0,0.0,Y,1.0,1928.0,0.09,"4,000",,,"Robert Jones - Agt: 510-917-2895 - Preservation meets renovation in Redwood Heights. Expanded with reverence for its 1920’s roots to five bedrooms, three bathrooms with revitalized dine-in kitchen and infrastructure. All-new family room, luxe primary suite, and fitness room. Opens to multifaceted outdoor-living space with level lawn, deck, and border garden. Great proximity to high-performing Redwood Heights Elementary, neighborhood shops, cafes, parks, and highways.",,,,,,,,,,,,,,95.0,,,,30-1872-26,1,,CONTRA COSTA,https://vimeo.com/792915212,https://vimeo.com/792947114,,02043773,01033733,,Yes,RESIDENTIAL,,4/10/2023,,,,,,,"Call Robert with questions, 510-917-2895.",Alameda,Redwood Road,50,64,64,Redwood Rd > Detroit Ave,,REDWOOD HEIGHTS,,,,,,,,6001.0,0.0,,,,3/17/2023,,,No,,,,,,4/11/2023,Conventional,1/12/2023 6:42 AM,$651,01889386,1/26/2023,,,02029039,Full Service,Excl Right,Market Listing,Stairs left handrail,,,2.0,No,,,Vacant,3/17/2023,,No concessions,,,,,41016910,,"$1,489,000",,3/17/2023,,,,60,Yes,No,,"$1,750,000","$1,605,000",4/11/2023,$653.50,Robert Jones,510-917-2895,Yes,,"Preservation meets renovation in Redwood Heights. Expanded with reverence for its 1920’s roots to five bedrooms, three bathrooms with revitalized dine-in kitchen and infrastructure. All-new family room, luxe primary suite, and fitness room. Opens to multifaceted outdoor-living space with level lawn, deck, and border garden. Great proximity to high-performing Redwood Heights Elementary, neighborhood shops, cafes, parks, and highways.",,9.0,$654,LA & BA different company/franchise,100.0,108.0,For Sale,,"Vacant, go and show. Supra is on left handrail on stairs leading to porch.",,$653.50,Public Records,,CA,4/11/2023,Split Level,,,Yes,30-1872-26,,1.0,https://vimeo.com/792915196,,,4/12/2023,Yes,Yes,Yes,Yes,,4260.0,,Detroit Ave,94619,
41024014,SLD,6,3632 Loma Vista Ave,,OAKLAND,9999,"$765,000","$975,000",DE,1360.0,3.0,2.0,0.0,N,0.0,1921.0,0.100000,"4,200",,,"Derik Landry - 415-810-1110 - Heart of the Laurel! This airy 1921 cottage exudes Craftsman charm inside and out. Currently used as 2 bedroom but very flexible floorplan with generous office. New flooring, fresh paint, updated open concept kitchen with attached laundry and access to backyard. The spacious primary bedroom retreat sits just above neighboring homes for loads of natural light plus privacy. A multi-purpose art studio provides for hobby or work space. The fully fenced backyard has decks, a BBQ area, fruit & citrus trees and an outdoor shower! Airstream negotiable!!! The Laurel District's vibrant commercial zone is a foodie's paradise. Savor breakfast at Sequoia Diner, lunch at friendly Communite Table, feast at Michelin rated Jo's Modern, and then work it all off at Planet Fitness! Come enjoy the comforts and convenience (90 walk score) of 3632 Loma Vista Ave.",,,,,,,,,,,,,No,102.0,,,,30-1907-22,0,,BAY EAST,https://hd.pics/916913,https://my.matterport.com/show/?m=LkRk6gHZRuW&mls=1,,01969298,02014153,,Yes,RESIDENTIAL,,5/8/2023,,,,,,,Home and lot size will not be guaranteed by Broker or Seller. On public record as a 3/2 - Seller bought in current 2/2 configuration. Potential 3rd bedroom used as an office - Buyer to investigate. Solar lease balance to be paid-off at COE.  Airstream trailer negotiable - please discuss with LA prior to writing. Seller has been using it as guest quarters as well as Airbnb. PSL complaint and sidewalk work will be completed by Seller. OFFERS REQUESTED BY 1PM WEDNESDAY APRIL 19th.,Alameda,MacArthur,6,6,6,MacArthur to Loma Vista,,LAUREL,,,,,,,,6001.0,1.0,,,,4/19/2023,,,No,,,,,No,5/8/2023,Conventional,4/13/2023 12:19 AM,$563,1942214.0,4/13/2023,,,01948440,Full Service,Excl Right,Market Listing,Front Door,,,9.0,No,,,Vacant,4/19/2023,,,,,,,41024014,,"$765,000",,4/19/2023,,,,52,Yes,No,,"$765,000","$975,000",5/8/2023,$716.91,,,Yes,,"Heart of the Laurel! This airy 1921 cottage exudes Craftsman charm inside and out. Currently used as 2 bedroom but very flexible floorplan with generous office. New flooring, fresh paint, updated open concept kitchen with attached laundry and access to backyard. The spacious primary bedroom retreat sits just above neighboring homes for loads of natural light plus privacy. A multi-purpose art studio provides for hobby or work space. The fully fenced backyard has decks, a BBQ area, fruit & citrus trees and an outdoor shower! Airstream negotiable!!! The Laurel District's vibrant commercial zone is a foodie's paradise. Savor breakfast at Sequoia Diner, lunch at friendly Communite Table, feast at Michelin rated Jo's Modern, and then work it all off at Planet Fitness! Come enjoy the comforts and convenience (90 walk score) of 3632 Loma Vista Ave.",,6.0,$717,LA & BA different company/franchise,127.0,127.0,For Sale,,Go direct & thank you for showing!,,$716.91,Public Records,,CA,5/8/2023,One Story,,,Yes,30-1907-22,,,https://hd.pics/x916913,https://my.matterport.com/show/?m=LkRk6gHZRuW&mls=1,,5/9/2023,Yes,Yes,Yes,Yes,,3632,,Loma Vista Ave,94619,
ML81918990,SLD,44,3618 Macarthur Boulevard,,OAKLAND,9999,"$798,000","$732,000",DE,1769.0,4.0,3.0,,,0.0,1923.0,0.091600,"3,990",,,,,,,,,,,,,,,,,100.0,,,,030-1903-014,0,,Datashare MLSListings,https://my.matterport.com/show/?m=gQTmWjqJn2i&,,,01838364,,,,RESIDENTIAL,,6/12/2023,,,,,,,The adu was approved and done in 1991 according to seller's document provided in the disclosure package. Buyer to verify sqft. The MLS sqft is sourced from interior 3D scan. Buyer to complete sewer lateral.,Alameda,35th ave,44,44,44,,,,Oakland (510) 879-8111,,,,,,3618 Macarthur BLVD,6001.0,,,,,3/31/2023,,Oakland (510) 879-8111,No,,,,,,6/15/2023,,2/15/2023 9:36 AM,$451,2049392,2/15/2023,realtorserena1988@gmail.com,,,,Excl Right,Market Listing,,,,,,,,Owner,3/31/2023,,,,,,,,,"$898,000",,3/31/2023,,,Public,65,,,,,"$732,000",,$413.79,,,,81918990.0,"Two houses two entries on one lot! 3bed 2bath in the front and 1bed 1 bath adu in the back. Rent one out to cover your mortgage! Well maintained open and flexible floor plan flooded with light. The spacious living room with windows on each side allows for maximum of light and remarkable vaulted ceiling. Large dining area is ready for casual entertaining or formal ambiance. New flooring and new paint throughout. New roof ! Walk to Ghost Town Brewing, Food Mill, and take your pick between Laurel and Dimond for shopping and dining, and so much more. Public Transportation and Both HWY 13/580 are nearby. Zoned for mix use, the house can be used for commercial or residential. Lots of potential!",,,$413,,,,For Sale,,,,$413.79,,,CA,6/15/2023,One Story,,,,,,,,,,6/17/2023,Yes,Yes,Yes,Yes,,,,,94619,C40
41046350,SLD,0,3533 Victor Ave,,OAKLAND,9999,"$1,000,000","$1,000,000",DE,1883.0,3.0,2.0,0.0,N,1.0,1956.0,0.080000,"3,379",,,Matthew C Borden - Agt: 925-785-9892 - For Comps Only,,,,,,,,,,,,,,67.0,,,,30-1878-5,0,,CONTRA COSTA,,,,01190671,01142036,,Yes,RESIDENTIAL,,12/23/2023,,,,,,,For Comps Only,Alameda,35th,0,0,0,GPS,,REDWOOD HEIGHTS,,,,,,,,6001.0,1.0,,,,12/23/2023,,,No,,,,,,12/23/2023,Other,12/23/2023 10:06 AM,$531,01190671,12/23/2023,,,1522885.0,Limited Service,Excl Right,Market Listing,,,,1.0,No,,,Vacant,12/23/2023,,0,,,,,41046350,,"$1,000,000",,12/23/2023,,,,1,Yes,No,,"$1,000,000","$1,000,000",12/23/2023,$531.07,,,No,,For Comps Only,,6.0,$531,,100.0,100.0,For Sale,,For Comps Only,,$531.07,Public Records,,CA,12/23/2023,Two Story,,,No,30-1878-5,,,,,,1/2/2024,Yes,Yes,Yes,Yes,,3533.0,,Victor Ave,94619,
41034962,SLD,21,4026 35Th Ave,,OAKLAND,9999,"$699,000","$740,000",DE,1323.0,2.0,2.0,0.0,Y,1.0,1918.0,0.100000,"4,370",,,"Carlos Ramirez - 415-828-1743 - BACK ON MARKET! Welcome to your dream home in Oakland's UPPER LAUREL district! This is a charming home! The main house has 2-bedrooms, 1-bath and is move in ready. Step inside to discover the delightful interior, featuring brand-new floors, sleek counters, and freshly painted walls creating an inviting ambiance. The property boasts a long 4-car driveway and a detached 1-car garage with potential for an ADU conversion, offering endless possibilities for customization. The full basement with 2 additional bedrooms, a cozy living room, and a full bathroom presents versatile options for a home office, guest retreat, or recreation space. Highly sought after location in the UPPER LAUREL, this house is just a stone's throw away from parks, schools, shopping, and dining, making it the perfect place to call home. Don't miss this opportunity! OPEN SAT-SUN 2-4PM",,,,,,,,,,,,,,105.0,,,,30-1901-16,0,,Bridge AOR,,,,02049110,1527235.0,,Yes,RESIDENTIAL,,9/14/2023,,1899394.0,,,,,"BOMKT. BUYER GOT COLD FEET. TRANSPARENTLY PRICED. Showing Info:  Vacant Go Show. No key for the front door gate. Must enter thru the back door. Call listing agent with any questions. Disclosures: https://app.disclosures.io/link/4026-35th-Avenue-7y01dsns   Submit all offers thru Homelight. Sqft not guaranteed by seller or listing agent, buyer and buyers agent to verify. Pre escrow open with Chicago Title Oakland w/ Lien Lam. OH: SAT-SUN 2-4PM",Alameda,Wisconsin St,21,21,21, MACARTHUR>35TH,,UPPER LAUREL,,,,,,,,6001.0,0.0,,,,8/28/2023,,,No,,,,,,9/14/2023,Conventional,8/3/2023 11:27 AM,$528,01781308,8/3/2023,,,01781308,Full Service,Excl Right,Market Listing,driveway metal gate,,,6.0,No,,,Vacant,8/28/2023,,3%,,,,,41034962,,"$599,000",,8/28/2023,,,,36,Yes,No,,"$599,000","$740,000",9/14/2023,$559.33,Carlos,415-828-1743,Yes,,"BACK ON MARKET! Welcome to your dream home in Oakland's UPPER LAUREL district! This is a charming home! The main house has 2-bedrooms, 1-bath and is move in ready. Step inside to discover the delightful interior, featuring brand-new floors, sleek counters, and freshly painted walls creating an inviting ambiance. The property boasts a long 4-car driveway and a detached 1-car garage with potential for an ADU conversion, offering endless possibilities for customization. The full basement with 2 additional bedrooms, a cozy living room, and a full bathroom presents versatile options for a home office, guest retreat, or recreation space. Highly sought after location in the UPPER LAUREL, this house is just a stone's throw away from parks, schools, shopping, and dining, making it the perfect place to call home. Don't miss this opportunity! OPEN SAT-SUN 2-4PM",,5.0,$559,"LA & BA same franchise, different office",106.0,124.0,For Sale,,"Go in thru the back door, front door key is missing and will be replaced soon.",,$559.33,Public Records,,CA,9/14/2023,One Story,,,Yes,,,4.0,,,,9/15/2023,Yes,Yes,Yes,Yes,,4026.0,,35Th Ave,94619,
