41033766,SLD,21,3350 Kiwanis St,,OAKLAND,9999,"$1,095,000","$1,300,000",DE,1865.0,3.0,2.0,0.0,Y,2.0,1939.0,0.100000,"4,160",,,"Douglas A Lambert - 925-297-7177 - Immerse yourself in the awe-inspiring Bay and San Francisco skyline views from this meticulously maintained Traditional home. Offering a harmonious blend of elegance and functionality, this stunning residence is sure to captivate your senses.Step inside and be greeted by the modern Chef's Kitchen, meticulously designed to cater to your culinary aspirations. The sleek cabinetry, complemented by quartz countertops, creates an atmosphere of contemporary sophistication. Equipped with high-end appliances and a pantry, this kitchen is a culinary enthusiast's dream come true.The home features designer updated bathrooms that showcase impeccable taste and attention to detail. Dual paned windows invite an abundance of natural light, creating a bright and inviting ambiance throughout. Hardwood floors add a touch of warmth and elegance to the living spaces.Outside, discover a serene patio and side yard where you can relax and unwind while soaking in the tranquility of your surroundings. Whether you seek solitude or desire to entertain guests, this enchanting outdoor space offers endless possibilities.With its magical views and exceptional features, this home presents a unique opportunity to experience the epitome of Bay Area living. Don't miss your chance!",,,,,,,,,,,,,,84.0,,,,29-1071-1,0,,Bridge AOR,https://vimeo.com/850865413,https://vimeo.com/850865450,,01059256,1527235.0,,Yes,RESIDENTIAL,,9/15/2023,,,,,,,"Property is staged and ready to show. Supra located at bottom of front railing.  Square footage and bed bath count of home differ from public records. Square footage is derived from measurements done by an appraiser. Listing agent or seller has not verified square footage or lot lines.  Sellers will provide PSL certification prior to COE.   Offers, if any, Wednesday August 23rd by 3pm.",Alameda,Midvale,21,34,34,Redwood Rd-Victor-Midvale-Kiwanis,,REDWOOD HEIGHTS,,,,,,,,6001.0,1.0,,,,8/23/2023,,,No,,,,,,9/15/2023,Conventional,7/20/2023 6:08 PM,$587,01993628,8/2/2023,,,01527235,Full Service,Excl Right,Market Listing,,,,4.0,No,,,Vacant,8/23/2023,,none,,,,,41033766,,"$1,095,000",,8/23/2023,,,,60,Yes,No,,"$1,095,000","$1,300,000",9/15/2023,$697.05,Listing agent,,No,,"Immerse yourself in the awe-inspiring Bay and San Francisco skyline views from this meticulously maintained Traditional home. Offering a harmonious blend of elegance and functionality, this stunning residence is sure to captivate your senses.  Step inside and be greeted by the modern Chef's Kitchen, meticulously designed to cater to your culinary aspirations. The sleek cabinetry, complemented by quartz countertops, creates an atmosphere of contemporary sophistication. Equipped with high-end appliances and a pantry, this kitchen is a culinary enthusiast's dream come true.  The home features designer updated bathrooms that showcase impeccable taste and attention to detail. Dual paned windows invite an abundance of natural light, creating a bright and inviting ambiance throughout. Hardwood floors add a touch of warmth and elegance to the living spaces.  Outside, discover a serene patio and side yard where you can relax and unwind while soaking in the tranquility of your surroundings. Whether you seek solitude or desire to entertain guests, this enchanting outdoor space offers endless possibilities.  With its magical views and exceptional features, this home presents a unique opportunity to experience the epitome of Bay Area living. Don't miss your chance!",,6.0,$697,LA & BA same company different office,119.0,119.0,For Sale,,"Lockbox on bottom of front railing. Text, go and show.",,$697.05,Appraisal,,CA,9/15/2023,Two Story,,,Yes,29-1071-1,,,https://vimeo.com/850865431,,,9/16/2023,Yes,Yes,Yes,Yes,,3350.0,,Kiwanis St,94602,
41043685,SLD,11,4279 Detroit Ave,,OAKLAND,9999,"$1,095,000","$1,350,000",DE,2203.0,3.0,1.0,1.0,Y,1.0,1925.0,0.100000,"4,200",,,"Theresa Hope Broderick - 510-967-2294 - Welcome to this stunning Mediterranean home located on one of Redwood Heights most sought-after streets! As you enter through the breezeway, you'll be greeted by charming period arches, beautiful tile work, and elegant iron rails.The main level of the home boasts a spacious living room with a cozy fireplace and newer windows, allowing for an abundance of natural light. The custom kitchen is a chef's dream, featuring high-end appliances, a dining area, a banquet, and peninsula, and exquisite Caesarstone countertops. French doors from the kitchen open up to a sunny deck, complete with a built-in gas fireplace, creating the perfect setting for entertaining guests or enjoying meals under the stars.The deck also provides access to the main garden, which offers a tree-house, planting beds, and a level area for play. The main level also includes two bedrooms, both thoughtfully designed and well-appointed. An updated bathroom with new tile & fixtures and offers ample storage. Downstairs, you'll find an expansive lower level that includes a rumpus room, perfect for a home theater or game room. Additionally, there is a room that can be used as a guest room, office, or gym, and 1/2 bath. Home is equipped w/ a 200 amp solar ready electric panel. Please come see the beautiful home!",,,,,,,,,,,,,,98.0,,,,30-1873-8,0,,Bridge AOR,http://4279detroit.com,,Charming,01917810,1527235.0,,Yes,RESIDENTIAL,,12/18/2023,,02189531,,,,,"Offers, if any 11/14 @1PM Square footage was measured. It is different than public records.",Alameda,Redwood,11,11,11,Redwood Rd. to Detroit,,REDWOOD HEIGHTS,Oakland (510) 879-8111,,,,,,,6001.0,1.0,,,,11/14/2023,,Oakland (510) 879-8111,No,,,,,,12/20/2023,Conventional,11/3/2023 1:52 PM,$497,1298281.0,11/3/2023,,,01904054,Full Service,Excl Right,Market Listing,front door,Mediterranean,,5.0,No,,,Owner,11/14/2023,,none,,,,,41043685,,"$1,095,000",,11/14/2023,,,,49,Yes,No,,"$1,095,000","$1,350,000",12/20/2023,$612.80,,,Yes,,"Welcome to this stunning Mediterranean home located on one of Redwood Heights most sought-after streets! As you enter through the breezeway, you'll be greeted by charming period arches, beautiful tile work, and elegant iron rails. The main level of the home boasts a spacious living room with a cozy fireplace and newer windows, allowing for an abundance of natural light. The custom kitchen is a chef's dream, featuring high-end appliances, a dining area, a banquet, and peninsula, and exquisite Caesarstone countertops. French doors from the kitchen open up to a sunny deck, complete with a built-in gas fireplace, creating the perfect setting for entertaining guests or enjoying meals under the stars.The deck also provides access to the main garden, which offers a tree-house, planting beds, and a level area for play. The main level also includes two bedrooms, both thoughtfully designed and well-appointed. An updated bathroom with new tile & fixtures and offers ample storage. Downstairs, you'll find an expansive lower level that includes a rumpus room, perfect for a home theater or game room. Additionally, there is a room that can be used as a guest room, office, or gym, and 1/2 bath. Home is equipped w/ a 200 amp solar ready electric panel. Please come see the beautiful home!",,8.0,$613,LA & BA different company/franchise,123.0,123.0,For Sale,,"Just Go!  SOH 11/5 2-4:30pm, BOH 11/6 10-1pm.",,$612.80,Measured,,CA,12/20/2023,Two Story,,,Yes,30-1873-8,,3.0,http://4279detroit.com/mls,,,12/21/2023,Yes,Yes,No,Yes,,4279.0,,Detroit Ave,94619,
41059138,SLD,17,3720 Wisconsin St,,OAKLAND,9999,"$649,000","$600,000",DE,1800.0,2.0,2.0,,N,0.0,1960.0,0.100000,"4,300",,,"Vicky Faulk - Agt: 510-468-3335 - Attention Contractors and Renovators! Here's your next lucrative project awaiting transformation in the popular Laurel neighborhood. While the current exterior may not turn heads with its plain and lackluster appearance, don't let that deter you. Step inside to discover the potential hidden within. The main level greets you with a spacious living area and a stepped-up dining space, showcasing rich wood floors and a lofty ceiling. The bedroom and bathroom on this level need your expertise to brighten or possibly expand. Ascend to the upper floor, where an expansive open space awaits your creative vision. With a walk-in closet, bathroom, and extra space at the back, the possibilities are endless. A sliding door leads to a long front balcony deck, offering a glimpse of the Bay—a potential selling point for future buyers. With no backyard to speak of, the super-sized front yard becomes paramount. Transform it into an inviting outdoor oasis by fencing and landscaping. Don't miss out on the chance to turn this fixer-upper into a profitable investment.",,,,,,,,,,,,,No,64.0,No,,No,30-1910-14,0,,Bridge AOR,https://www.cbhometour.com/3720-Wisconsin-Street-Oakland-CA-94619/index.html,,,01933577,01527235,,Yes,RESIDENTIAL,,6/25/2024,,,,,,,"See General Offer Info in disc packet before writing offer. Provide signed cover sheet and all signed disclosures with offer.   Please allow 3 days for seller response. Escrow open at Old Republic Title in Montclair, Escrow # 1116040743 but buyer’s choice. Bedroom count differs from public record. Sq ft from public record, not verified & may be incorrect.  Stove is included.",Alameda,Loma Vista,17,17,17,35th Ave to Wisconsin,,LAUREL,,,,,,,,6001.0,1.0,,,,6/4/2024,,,No,,,,,,6/25/2024,Cash,5/9/2024 2:08 PM,$361,00974458,5/9/2024,,,01908304,Full Service,Excl Right,Market Listing,Front gas meter,,,7.0,No,,,Vacant,6/4/2024,,0,,,,,41059138,,"$649,000",,6/4/2024,,,,38,Yes,No,,"$649,000","$600,000",6/25/2024,$333.33,,,No,,"Attention Contractors and Renovators! Here's your next lucrative project awaiting transformation in the popular Laurel neighborhood. While the current exterior may not turn heads with its plain and lackluster appearance, don't let that deter you. Step inside to discover the potential hidden within. The main level greets you with a spacious living area and a stepped-up dining space, showcasing rich wood floors and a lofty ceiling. The bedroom and bathroom on this level need your expertise to brighten or possibly expand. Ascend to the upper floor, where an expansive open space awaits your creative vision. With a walk-in closet, bathroom, and extra space at the back, the possibilities are endless. A sliding door leads to a long front balcony deck, offering a glimpse of the Bay—a potential selling point for future buyers. With no backyard to speak of, the super-sized front yard becomes paramount. Transform it into an inviting outdoor oasis by fencing and landscaping. Don't miss out on the chance to turn this fixer-upper into a profitable investment.",,5.0,$333,LA & BA different company/franchise,92.0,92.0,For Sale,,,,$333.33,Public Records,,CA,6/25/2024,Two Story,,,Yes,,,,https://www.cbhometour.com/3720-Wisconsin-Street-Oakland-CA-94619/mlsindex.html,,,6/26/2024,Yes,No,No,Yes,,3720.0,,Wisconsin St,94619,
41061350,SLD,14,3744 Patterson Ave,,OAKLAND,9999,"$679,000","$850,000",DE,1004.0,2.0,1.0,0.0,N,0.0,1922.0,0.090000,"3,800",,,"Carrie McAlister - Cell: 510-292-7838 - Located in the vibrant Laurel District, this charming house is the perfect blend of classic character with a simple, clean aesthetic. As you step inside, you’re greeted by a bright living room with large windows that let in plenty of natural light while hardwood floors add a touch of warmth. The kitchen has an efficient galley layout featuring stainless steel appliances, stone countertops, and a cozy eat-in breakfast area. There is a versatile bonus space adjacent to the back garden that can be used as a home office, playroom, or guest room. The lovely gardens are perfect for relaxing or entertaining guests with a brick patio area surrounded by mature fruit trees such as Mariposa and Santa Rosa plum, Pakistani mulberry, Meyer lemon, apple, and cherry. Jerusalem sage, lettuce, and herb planter boxes round out this gardener’s delight. The front yard includes apple and Fuyu persimmon trees, plus Autumn Gold raspberries. This mini-orchard brought tremendous delight to the sellers, and they hope the new owners will enjoy and care for it as they have. There is a long driveway with an EV outlet and plenty of room for off-street parking. Near shops, cafes, and transportation.",,,,,,,,,,,,,No,102.0,No,,No,30-1918-27,0,,Bridge AOR,,,,01703944,2014153.0,,Yes,RESIDENTIAL,,7/5/2024,2084131.0,2078526.0,,,,,"Square footage, parcel, and bed/bath count per public record. Go direct. OH June 9th. Offers, if any, are due on Wednesday, 6/12, by noon. Call Jennifer with questions at 415-713-9881.",Alameda,Kansas,14,14,14,35th to Kansas to Patterson,,LAUREL,,,,,,,,6001.0,0.0,,,,6/12/2024,,,No,,,,,,7/8/2024,Conventional,5/29/2024 3:45 PM,$676,1464959,5/29/2024,,,2029039.0,Full Service,Excl Right,Market Listing,,,,3.0,No,,,Vacant,6/12/2024,,,,,,,41061350,,"$679,000",,6/12/2024,,,,26,Yes,No,,"$679,000","$850,000",7/8/2024,$846.61,Jennifer Jones,415-713-9881,Yes,,"Located in the vibrant Laurel District, this charming house is the perfect blend of classic character with a simple, clean aesthetic. As you step inside, you’re greeted by a bright living room with large windows that let in plenty of natural light while hardwood floors add a touch of warmth. The kitchen has an efficient galley layout featuring stainless steel appliances, stone countertops, and a cozy eat-in breakfast area. There is a versatile bonus space adjacent to the back garden that can be used as a home office, playroom, or guest room. The lovely gardens are perfect for relaxing or entertaining guests with a brick patio area surrounded by mature fruit trees such as Mariposa and Santa Rosa plum, Pakistani mulberry, Meyer lemon, apple, and cherry. Jerusalem sage, lettuce, and herb planter boxes round out this gardener’s delight. The front yard includes apple and Fuyu persimmon trees, plus Autumn Gold raspberries. This mini-orchard brought tremendous delight to the sellers, and they hope the new owners will enjoy and care for it as they have. There is a long driveway with an EV outlet and plenty of room for off-street parking. Near shops, cafes, and transportation.",,4.0,$847,LA & BA different company/franchise,125.0,125.0,For Sale,,,,$846.61,Public Records,,CA,7/8/2024,One Story,,,Yes,30-1918-27,,,,,,7/9/2024,Yes,No,No,Yes,,3744.0,,Patterson Ave,94619,
41061494,SLD,13,3355 California St,,OAKLAND,9999,"$899,000","$1,250,000",DE,1156.0,2.0,2.0,0.0,N,0.0,1930.0,0.07,"3,240",,,"Dana C Brook - 510-384-5591 - Nearly every inch of this immaculate property has been updated with stylish, upscale upgrades. A dream for those looking to entertain or recoup and relax on their own. The open floor plan allows for light to stream through the windows on all sides, bringing a glow to the golden oak floors. The kitchen was designed by and for a working chef and features Heath tile backsplash, stainless steel counters, and a bevy of professional grade appliances. The large primary suite includes a beautifully designed bathroom with a walk-in shower, a large organized closet, and a second closet that was used as an office. If the chef's kitchen isn't enough for you, then enjoy some BBQ on the patio, which is plumed for a gas grill. Stay warm all year long with the patio's outdoor heater. In the evenings, relax in the cedar sauna, then cool off a bit next to the cozy fire pit, and enjoy the gorgeously landscaped garden. Just imagine your life here... Walk Score® rated Very Walkable (87), Good Transit (51), Bikeable (62)",,,,,,,,,,,,,No,94.0,No,,No,28-942-37-1,0,,Bridge AOR,https://vimeo.com/951725748/e30e31123c,http://www.LaurelRetreat.com,,01351797,1170009.0,,Yes,RESIDENTIAL,,7/1/2024,,,,,,,"Clear pest, sidewalk and sewer lateral are done! Go and show! Email the listing agent to ensure that you are made aware of all updates. For more home and neighborhood info, photos, video, 3D tour, etc available at www.LaurelRetreat.com",Alameda,Silverwood Ave,13,13,13,"35th Ave, turn North West on California St",,LAUREL,Oakland (510) 879-8111,,,,,,,6001.0,0.0,,,,6/12/2024,,Oakland (510) 879-8111,No,,,,,,7/9/2024,Conventional,5/30/2024 3:12 PM,$778,1964082,5/30/2024,,,619098.0,Full Service,Excl Right,Market Listing,Front door,,,2.0,No,,,Vacant,6/12/2024,,0,,,,,41061494,,"$899,000",,6/12/2024,,,,55,Yes,No,,"$899,000","$1,250,000",7/9/2024,"$1,081.31",Dana Brook,510-384-5591,No,,"Nearly every inch of this immaculate property has been updated with stylish, upscale upgrades. A dream for those looking to entertain or recoup and relax on their own. The open floor plan allows for light to stream through the windows on all sides, bringing a glow to the golden oak floors. The kitchen was designed by and for a working chef and features Heath tile backsplash, stainless steel counters, and a bevy of professional grade appliances. The large primary suite includes a beautifully designed bathroom with a walk-in shower, a large organized closet, and a second closet that was used as an office. If the chef's kitchen isn't enough for you, then enjoy some BBQ on the patio, which is plumed for a gas grill. Stay warm all year long with the patio's outdoor heater. In the evenings, relax in the cedar sauna, then cool off a bit next to the cozy fire pit, and enjoy the gorgeously landscaped garden. Just imagine your life here... Walk Score® rated Very Walkable (87), Good Transit (51), Bikeable (62)",,5.0,"$1,081",,139.0,139.0,For Sale,,,,"$1,081.31",Public Records,,CA,7/9/2024,One Story,,,Yes,28-942-37-1,,2.0,https://my.matterport.com/show/?m=Qv2x8qUfZY2&mls=1,https://vimeo.com/951725769/2a0cd0b676,,7/10/2024,Yes,No,No,Yes,,3355.0,,California St,94602,
41039833,SLD,12,3637 Victor Ave,,OAKLAND,9999,"$1,100,000","$1,260,000",DE,2094.0,4.0,2.0,0.0,Y,1.0,1945.0,0.090000,"3,838",,,"Julia Temple - 510-759-3677 - 3637 Victor Avenue, nestled on a serene, tree-lined street, offers timeless elegance in a 1945 tudor-style residence with captivating bay and bridge views. Classic molding frames the gracious living room, enhanced by the fireplace and picture window. Harmonizing with the dining room and the inviting kitchen that leads to a deck where warm summer nights whisper secrets in the breeze.The main level boasts three generously sized bedrooms with large closets and one perfectly appointed bathroom––period hardwood floors kissed by the sun that comes through the double-paned windows. The lower level includes a primary suite, family room, attached garage, laundry room. The possibilities are endless with a separate entrance. Enjoy the shade of a beautiful avocado tree on the broad lower-level deck and garden area and the bay views with ample space to create your dream yard! Embraced by a vibrant neighborhood, 3637 Victor Avenue is a sonnet of convenience, experience convenience with parks, a community center, and the Laurel shopping district nearby. Explore local treasures like Ghost Town Brewery, Sequoia Diner, Be Well Natural Healing, The Source Chiropractor, and more, or venture into the East Bay Regional Parks for outdoor adventures.",,,,,,,,,,,,,,78.0,,,,30-1877-5,0,,Bridge AOR,https://www.3637victor.com,https://vimeo.com/864133351,,01323364,01323364,,Yes,RESIDENTIAL,,10/17/2023,,,,,,,The website is worth showing your clients. :-) https://www.3637victor.com/,Alameda,35th,12,12,12,35th to Victor,,REDWOOD HEIGHTS,,,,,,,,6001.0,1.0,,,,10/3/2023,,,No,,,,,,10/17/2023,Conventional,9/21/2023 2:26 PM,$525,1429857.0,9/21/2023,,,1527235.0,Full Service,Excl Right,Market Listing,Front stairs,,,2.0,No,,,Vacant,10/3/2023,,0,,,,,41039833,,"$1,100,000",,10/3/2023,,,,60,Yes,No,,"$1,100,000","$1,260,000",10/17/2023,$601.72,,,Yes,,"3637 Victor Avenue, nestled on a serene, tree-lined street, offers timeless elegance in a 1945 tudor-style residence with captivating bay and bridge views. Classic molding frames the gracious living room, enhanced by the fireplace and picture window. Harmonizing with the dining room and the inviting kitchen that leads to a deck where warm summer nights whisper secrets in the breeze.The main level boasts three generously sized bedrooms with large closets and one perfectly appointed bathroom––period hardwood floors kissed by the sun that comes through the double-paned windows. The lower level includes a primary suite, family room, attached garage, laundry room. The possibilities are endless with a separate entrance. Enjoy the shade of a beautiful avocado tree on the broad lower-level deck and garden area and the bay views with ample space to create your dream yard! Embraced by a vibrant neighborhood, 3637 Victor Avenue is a sonnet of convenience, experience convenience with parks, a community center, and the Laurel shopping district nearby. Explore local treasures like Ghost Town Brewery, Sequoia Diner, Be Well Natural Healing, The Source Chiropractor, and more, or venture into the East Bay Regional Parks for outdoor adventures.",,8.0,$602,LA & BA different company/franchise,115.0,115.0,For Sale,,"Go and show starting Saturday, Friday September 22nd at 3pm.",,$601.72,Public Records,,CA,10/17/2023,Two Story,,,Yes,30-1877-5,,,https://www.3637victor.com/mls,https://vimeo.com/864133362,,10/20/2023,Yes,Yes,Yes,Yes,,3637.0,,Victor Ave,94619,
